subreddit,post_id,title,selftext_snippet,url,score,num_comments,author,created_date,search_term,category
americanairlines,1s87ett,AA is saying I flew on a plane I never boarded,"Booked via Qantas for an international flight out of the US. First leg was Qantas operated by AA. The AA flight was delayed 18 hours and I contacted Qantas who immediately offered a full refund. Left the airport.

Qantas has had “complications” processing my refund because AA is saying I boarded and",https://www.reddit.com/r/americanairlines/comments/1s87ett/aa_is_saying_i_flew_on_a_plane_i_never_boarded/,3,5,vivaldisfiveseasons,2026-03-30,delayed hours,LEVEL_1_AWARE
TravelHacks,1sezznl,Airplane Headphone Recommendations!,"Hi all! My husband and I travel a ton and I'm looking for airplane headphone recommendations.   
  
I unfortunately found out that my airpods were NOT as noise canceling as I thought they were when I had a baby screaming/crying next to me for an hour and a half, and still couldn't hear the movie on ",https://www.reddit.com/r/TravelHacks/comments/1sezznl/airplane_headphone_recommendations/,46,119,smacncheese1022,2026-04-07,flight canceled,LEVEL_1_AWARE
TravelHacks,1srixo7,Do you start your travel insurance straight after booking flights (in case the flight gets cancelled) or wait til the start of your trip?,Also is there open-ended travel insurance that I can extend month by month should I decide to be away longer? Thanks ,https://www.reddit.com/r/TravelHacks/comments/1srixo7/do_you_start_your_travel_insurance_straight_after/,30,77,afox1984,2026-04-21,flight canceled,LEVEL_1_AWARE
TravelHacks,1sdxv8i,Sleeping with headphones on,"I find it harder to fall asleep without listening to something it helps my brain disconnect. when at home I can just use the speakers but when traveling I use noise canceling headphone.

I have been looking at getting a Travel Neck Pillow therefore enabling me to sleep on my side with the headphone ",https://www.reddit.com/r/TravelHacks/comments/1sdxv8i/sleeping_with_headphones_on/,14,31,StandOutrageous1911,2026-04-06,flight canceled,LEVEL_1_AWARE
TravelHacks,1sqggm7,Return ticket refund,"Hi everyone, this might be a dumb question but I’ve never flown by myself before. 

I’m traveling outside of the country soon. I booked a one way ticket. I don’t know when I’ll be coming back, but I think it would be smart to book a return ticket as proof that I won’t be staying in the country. 

My",https://www.reddit.com/r/TravelHacks/comments/1sqggm7/return_ticket_refund/,9,12,Fun_Dish_4572,2026-04-20,flight canceled,LEVEL_1_AWARE
TravelHacks,1slj2n1,Advice on changing first leg of a flight,"I'm assuming that what I'm asking for won't work, but I wanted to see if there was any way to figure this out. 

I'm trying to fly business class one way from JFK to Singapore on June 25th on Qatar Airways. As a one way flight, I am getting a rate of $6447. However, if I change it to roundtrip from ",https://www.reddit.com/r/TravelHacks/comments/1slj2n1/advice_on_changing_first_leg_of_a_flight/,1,6,Secure_Pangolin3286,2026-04-14,flight canceled,LEVEL_1_AWARE
TravelHacks,1s95acg,Kayak / Underpricer  warning do not use,"I recently had to book a fairly last minute trip to Australia, my friend was paying for the ticket so I had a decent sized a budget so I went to kayak to compare prices.

I found Qantas comfort+ and booked it. 

immediately started receiving random WhatsApp messages from a company called underpricer",https://www.reddit.com/r/TravelHacks/comments/1s95acg/kayak_underpricer_warning_do_not_use/,26,15,meatsmoothie82,2026-03-31,missed connection,LEVEL_1_AWARE
TravelHacks,1sux9ip,Missed my connecting flight due to original flight being delayed.,"So my Cathay Pacific flight from Mumbai was delayed, due to which I missed my connecting flight to Phu Quoc. 

The airline just apologised and put us on the next flight which is like \~8 hours later. They also gave us lunge access which I don’t care about much as I already had it via my credit card.",https://www.reddit.com/r/TravelHacks/comments/1sux9ip/missed_my_connecting_flight_due_to_original/,0,10,AntiSapein,2026-04-24,missed connection,LEVEL_1_AWARE
