subreddit,post_id,title,selftext_snippet,url,score,num_comments,author,created_date,search_term,category
americanairlines,1scqa0c,Gate closed as walking up,Was in Cancun with my wife for anniversary. Our initial flight on American was delayed coming back and customs took forever. We were close to making it to our last flight and legit the lady saw me sprinting as it said final boarding. As I’m about 10 feet away she said no and closed it. Like holy hel,https://www.reddit.com/r/americanairlines/comments/1scqa0c/gate_closed_as_walking_up/,121,92,Gaijingamer12,2026-04-04,customer service hell,LEVEL_2_STRUGGLING
americanairlines,1szna1g,Saw someone kicked off a flight for the first time,"And what a doozy. We were already running behind with the plane being an hour late, and during that time the guy actually bought me a beer at the bar in Fresno!

I had my headphones on and was already doing emails when it all kicked off, but once I realized what was going on he was already near the ",https://www.reddit.com/r/americanairlines/comments/1szna1g/saw_someone_kicked_off_a_flight_for_the_first_time/,199,52,Jobwastes,2026-04-30,delayed hours,LEVEL_1_AWARE
americanairlines,1sngc9k,SUPER PROPS to the pilot and GA here in Little Rock,"Flight 3113 from Little Rock to DFW delayed two hours due to late incoming plane from DFW.  The Pilot - tag teaming with the gate attendant but taking the lead - made a great announcement…

Explained why we were late. Explained why he didn’t know all the details himself.  And then clearly stated tha",https://www.reddit.com/r/americanairlines/comments/1sngc9k/super_props_to_the_pilot_and_ga_here_in_little/,26,3,NYerInTex,2026-04-16,delayed hours,LEVEL_1_AWARE
americanairlines,1sz68oe,Another positive experience,"Last week I posted how pleased I was with my AA flight from MCI to PHL.

I just returned yesterday and want to commend all the crews involved:  The incoming CRJ900 from ATL was delayed over an hour (mechanical?) but the Philly ground crew turned the plane quickly, and the pilots made up time in the ",https://www.reddit.com/r/americanairlines/comments/1sz68oe/another_positive_experience/,21,5,Original-Track-4828,2026-04-29,delayed hours,LEVEL_1_AWARE
americanairlines,1sfw743,Should I stop flying out of regional airport (GSP) and start driving two hours to CLT? Or is this just recency bias?,My last 3 to 4 flights out of GSP have been an absolute nightmare. Multiple 15+ hour delays when the Embraer 175s (or in one case an airbus) has a maintenance issue and there are no parts or available mechanics in GSP. I flew twice a month last year out of GSP with very few issues but now I am gun s,https://www.reddit.com/r/americanairlines/comments/1sfw743/should_i_stop_flying_out_of_regional_airport_gsp/,9,33,MJE0409,2026-04-08,delayed hours,LEVEL_1_AWARE
americanairlines,1sg0du0,Ridiculous AA policy re travel credit reinstatement,"I just got trapped by a ridiculous AA policy I want to share.  I wonder if this practice is unique to AA.

I used a large travel credit, plus cash, to buy an expensive overseas ticket. I then cancelled within the 24-hour window because the dates didn't work for various reasons. I immediately receive",https://www.reddit.com/r/americanairlines/comments/1sg0du0/ridiculous_aa_policy_re_travel_credit/,7,7,Jealous-Ability-5410,2026-04-08,delayed hours,LEVEL_1_AWARE
americanairlines,1spwedx,[LHR][ORD] Catering-related delay.,"AA91 is currently at the gate after a late-arriving flight from LAX that delayed departure by an hour. Now, we are just preparing to pull away after an additional 30 minute catering-related delay that had the staff on the phone complaining to the vendor as we were boarding. ",https://www.reddit.com/r/americanairlines/comments/1spwedx/lhrord_cateringrelated_delay/,4,4,dkiesow,2026-04-19,delayed hours,LEVEL_1_AWARE
TravelHacks,1t1t048,"Found a mistake fare to Palau, nervous about planning for it in case of cancellation","We saw a mistake fare to Palau from LAX a few weeks ago for \~$650 USD per person. It's an insane deal and I booked it. 

We have to fly to LA before we'd be able to get on this flight. 

We purchased through Philippine Airlines. They sent us an e-ticket for the booking already. We're nervous about ",https://www.reddit.com/r/TravelHacks/comments/1t1t048/found_a_mistake_fare_to_palau_nervous_about/,57,36,Adorablegriffin,2026-05-02,flight canceled,LEVEL_1_AWARE
TravelHacks,1sezznl,Airplane Headphone Recommendations!,"Hi all! My husband and I travel a ton and I'm looking for airplane headphone recommendations.   
  
I unfortunately found out that my airpods were NOT as noise canceling as I thought they were when I had a baby screaming/crying next to me for an hour and a half, and still couldn't hear the movie on ",https://www.reddit.com/r/TravelHacks/comments/1sezznl/airplane_headphone_recommendations/,48,114,smacncheese1022,2026-04-07,flight canceled,LEVEL_1_AWARE
TravelHacks,1srixo7,Do you start your travel insurance straight after booking flights (in case the flight gets cancelled) or wait til the start of your trip?,Also is there open-ended travel insurance that I can extend month by month should I decide to be away longer? Thanks ,https://www.reddit.com/r/TravelHacks/comments/1srixo7/do_you_start_your_travel_insurance_straight_after/,30,77,afox1984,2026-04-21,flight canceled,LEVEL_1_AWARE
TravelHacks,1sdxv8i,Sleeping with headphones on,"I find it harder to fall asleep without listening to something it helps my brain disconnect. when at home I can just use the speakers but when traveling I use noise canceling headphone.

I have been looking at getting a Travel Neck Pillow therefore enabling me to sleep on my side with the headphone ",https://www.reddit.com/r/TravelHacks/comments/1sdxv8i/sleeping_with_headphones_on/,15,31,StandOutrageous1911,2026-04-06,flight canceled,LEVEL_1_AWARE
TravelHacks,1slj2n1,Advice on changing first leg of a flight,"I'm assuming that what I'm asking for won't work, but I wanted to see if there was any way to figure this out. 

I'm trying to fly business class one way from JFK to Singapore on June 25th on Qatar Airways. As a one way flight, I am getting a rate of $6447. However, if I change it to roundtrip from ",https://www.reddit.com/r/TravelHacks/comments/1slj2n1/advice_on_changing_first_leg_of_a_flight/,1,8,Secure_Pangolin3286,2026-04-14,flight canceled,LEVEL_1_AWARE
TravelHacks,1sxzwpj,Always bring a hardcopy of your confirmed flight and accommodation bookings.,"These days with everything digital, online or in an App on your phone, few people carry hard copies of tickets or their confirmed travel/accommodation bookings. Not doing so might be a disadvantage if you need to show original information, as all online/digital information will show the latest and p",https://www.reddit.com/r/TravelHacks/comments/1sxzwpj/always_bring_a_hardcopy_of_your_confirmed_flight/,230,221,EasyPacer,2026-04-28,missed connection,LEVEL_1_AWARE
TravelHacks,1sux9ip,Missed my connecting flight due to original flight being delayed.,"So my Cathay Pacific flight from Mumbai was delayed, due to which I missed my connecting flight to Phu Quoc. 

The airline just apologised and put us on the next flight which is like \~8 hours later. They also gave us lunge access which I don’t care about much as I already had it via my credit card.",https://www.reddit.com/r/TravelHacks/comments/1sux9ip/missed_my_connecting_flight_due_to_original/,0,13,AntiSapein,2026-04-24,missed connection,LEVEL_1_AWARE
