subreddit,post_id,title,selftext_snippet,url,score,num_comments,author,created_date,search_term,category
travel,1sq0p2m,A cancelled flight changed my mind about Istanbul,"A year and a half ago, I was on my way to Jordan for work when my flight got cancelled. I ended up stuck in Istanbul for 24 hours, sleeping in the city, taking random buses and taxis. I remember chatting with a guy on the bus who had been there a few months before with his wife. He just told me it w",https://www.reddit.com/r/travel/comments/1sq0p2m/a_cancelled_flight_changed_my_mind_about_istanbul/,4045,304,BenShutterbug,2026-04-19,flight canceled,LEVEL_1_AWARE
travel,1sm5the,Taiwan blew me away! (Trip Report and Images),"So, finally made a trip to Taipei from India. My 9th foreign country and a really beautiful one. I hope this report is of good use to anyone who wants to explore this island.



Some common pointers:

* Food, I am a vegetarian. Nothing to worry, lot of options. Taiwan is far too kind to vegetarians ",https://www.reddit.com/r/travel/comments/1sm5the/taiwan_blew_me_away_trip_report_and_images/,1146,38,sreeram_1610,2026-04-15,flight canceled,LEVEL_1_AWARE
travel,1siesc4,Jordan Travel,Just wanted to post my experience being a tourist in Jordan during the middle of east conflict. The first day I landed - not gonna lie but the sirens and sounds of rockets throughout the day was very jarring and scary for me. But the locals were pretty calm about it as they’d been used to it for abo,https://www.reddit.com/r/travel/comments/1siesc4/jordan_travel/,601,17,Far_Mathematician304,2026-04-11,flight canceled,LEVEL_1_AWARE
travel,1sskqgm,Norse Airways has announced it is canceling all flights out of LAX due to rising fuel costs.,"Any other airlines?  At least it did the honorable thing by announcing it.  I flew Norse quite a few times to different locations, hope it can weather the storm.",https://www.reddit.com/r/travel/comments/1sskqgm/norse_airways_has_announced_it_is_canceling_all/,591,122,teva98125,2026-04-22,flight canceled,LEVEL_1_AWARE
travel,1sfri3g,Trip to Georgia cancelled last minute and I don't know what to do,"I was supposed to fly this Sunday for a week-long trip to Georgia and meet my family there. They were flying in from Thailand and we planned a hiking trip + nature trip together.

Unfortunately, their flights got cancelled because of the situation in the Middle East. They were able to get a refund, ",https://www.reddit.com/r/travel/comments/1sfri3g/trip_to_georgia_cancelled_last_minute_and_i_dont/,105,93,Duskymoonlight,2026-04-08,flight canceled,LEVEL_1_AWARE
travel,1smxqy7,"Flight to Japan cancelled, no refund yet. rebook now or risk price increases?","Hello everyone,

Before the conflicts began, I booked a flight through Booking from Frankfurt to Tokyo with Emirates.  
My partner and I are planning to spend two weeks in Japan, and I’d like to propose to her there.

The problem is that our flight, which included a layover in Dubai, was cancelled b",https://www.reddit.com/r/travel/comments/1smxqy7/flight_to_japan_cancelled_no_refund_yet_rebook/,96,34,artchebelumIsa,2026-04-16,flight canceled,LEVEL_2_STRUGGLING
travel,1sgpzh9,What should I do? Condor threatening to send me to collections for a flight I've already paid for (and accounting department customer service hanging up on me when I try to resolve),"In January of this year I booked a Condor flight for travel from Seattle to Frankfurt this summer. They double charged me. Condor claimed they did not double charge me. My credit card cancelled one of the charges and the other payment went through.

In February they sent me an email saying I owed th",https://www.reddit.com/r/travel/comments/1sgpzh9/what_should_i_do_condor_threatening_to_send_me_to/,86,18,bitterrazor,2026-04-09,flight canceled,LEVEL_1_AWARE
travel,1somzvm,Island hopping in the Caribbean,"Recently I spent almost 2 months island hopping in the Caribbean, mostly in the smaller Leeward Antilles. My route was: **Puerto Rico - Dominica - Guadeloupe - Curaçao - Trinidad &amp; Tobago - Barbados - St. Vincent and the Grenadines - Grenada.**

It wasn't my first time there. I visited almost al",https://www.reddit.com/r/travel/comments/1somzvm/island_hopping_in_the_caribbean/,34,8,anca1001,2026-04-18,flight canceled,LEVEL_1_AWARE
travel,1sp7gt5,Is there any way to protect myself against flight cancellations due to possible fuel shortages? No insurance seems to cover.,"I have a trip mid-june to mid-july.  My research says no travel insurance would cover cancellations due to fuel shortages...because its due to and ""act of war"".

Is there really no way to protect myself?",https://www.reddit.com/r/travel/comments/1sp7gt5/is_there_any_way_to_protect_myself_against_flight/,26,120,AlaskanSnowDragon,2026-04-18,flight canceled,LEVEL_1_AWARE
travel,1sg9ddh,Personal rule when booking connecting flights,"With short and long haul, budget and major carrier flights being regularly cancelled and/or delayed, what personal rules do you now follow when booking flights that require connections? Minimum 5 hours in major airports? No same day connections? Never fly certain airlines? BTW it’s assuming you fly ",https://www.reddit.com/r/travel/comments/1sg9ddh/personal_rule_when_booking_connecting_flights/,31,75,KevinGBurk,2026-04-08,flight canceled,LEVEL_1_AWARE
travel,1svowx7,My Honest Review of Norse Airways: Not as Bad as They say!,"I’m a U.S. citizen residing in a major airline market (NYC). I usually fly B6 and AA domestically, and UA for international. This should give you an idea of what my baseline is for dealing with nonsense while travelling.

I had the opportunity to fly Norse JFK-FCO in January with both their premium ",https://www.reddit.com/r/travel/comments/1svowx7/my_honest_review_of_norse_airways_not_as_bad_as/,123,31,YackyJacky,2026-04-25,stranded airport,LEVEL_2_STRUGGLING
travel,1s62bve,For those of you who are missing your luggage and the airline has no idea.,"If you had any meaningful identifiers in your luggage, including the luggage tags attached to the bag, consider contacting FedEx and UPS to check with them. Sometimes luggage and bags get sent to their warehouses on accident the same way someones luggage ends up on the wrong flight: bad luck, the ba",https://www.reddit.com/r/travel/comments/1s62bve/for_those_of_you_who_are_missing_your_luggage_and/,9,0,LuluTopSionMid,2026-03-28,lost luggage,LEVEL_2_STRUGGLING
travel,1snln07,Lost Luggage,"I recently flew on Air Canada from Narita to Vancouver and then from Vancouver to Denver. My luggage was missing when I got to DIA. The agent who assisted us told us there is no way that no one stole it- I'm just nervous because when I looked at the tracking history, it was the same as the person wh",https://www.reddit.com/r/travel/comments/1snln07/lost_luggage/,7,1,JayBlezT,2026-04-16,lost luggage,LEVEL_2_STRUGGLING
travel,1si95mc,Aegean Airlines vs Sky Express (Greece),"I’ll be flying from Corfu to Athens this June. From what I’ve seen my only options are Aegean Airlines and Sky Express. The price is basically the same once I include 1 checked bag, and the flight times are pretty much the same too (only a 5-minute difference).

I’ve seen some pretty bad reviews of ",https://www.reddit.com/r/travel/comments/1si95mc/aegean_airlines_vs_sky_express_greece/,2,6,madgreek17,2026-04-11,lost luggage,LEVEL_2_STRUGGLING
travel,1sk48u6,Dubai Travel Insurance,"I have flights booked early May for a few nights in Dubai. Obviously aware of the regional issues at the moment. I am curious about Travel Insurance. I've taken a look and policies are still available but the small print is pretty vague - I'm presuming anything ""war"" related wouldn't be covered i.e ",https://www.reddit.com/r/travel/comments/1sk48u6/dubai_travel_insurance/,2,6,Vast-Path-2558,2026-04-13,lost luggage,LEVEL_1_AWARE
travel,1sj6wby,Help! Lost luggage at DCA,"My husband and I were getting in an uber tonight after a flight back to DC, and were frantically trying to get our infant car seat installed and we left my bag on the sidewalk. Any ideas on how I might be able to get it back? ",https://www.reddit.com/r/travel/comments/1sj6wby/help_lost_luggage_at_dca/,2,3,bigblaster7077,2026-04-12,lost luggage,LEVEL_2_STRUGGLING
travel,1sm8mcb,Lost luggage help 🥲Air France/CDG,"Hi, my bag has been lost by air france since 2 weeks with no updates at all - i assume it is in Paris CDG where i had a layover (I was flying from Berlin to Casablanca). I was told by one person from air france customer service that I (or someone on my behalf) could go to check for the luggage in pe",https://www.reddit.com/r/travel/comments/1sm8mcb/lost_luggage_help_air_francecdg/,0,4,Ok-Custard5966,2026-04-15,lost luggage,LEVEL_2_STRUGGLING
travel,1sbhfmx,Airline lost luggage - what can I expect to claim?,"so in short:  airline lost 1 of 2 checked luggages. delivered it next afternoon. 

in general, all our holiday plan for day 1 was ruined as lost luggage had all swimsuits and part of our clothes., including underwear. 

so Instead of full beach day, after 24 hrs of travel, we had to go gor shopping ",https://www.reddit.com/r/travel/comments/1sbhfmx/airline_lost_luggage_what_can_i_expect_to_claim/,0,6,yessuz,2026-04-03,lost luggage,LEVEL_2_STRUGGLING
travel,1sg7udw,CDG Security Question re: liquids,"Thanks in advance for your help!

I travel for 6 weeks at a time, and I do not check bags. 

Next month I'll fly from EWR to CDG on Air France in Business class. I have a 6-hour cxn at CDG before my flight to HEL, also on AF (1 ticket--arriving Terminal 2E, departing 2F). I then will wander through ",https://www.reddit.com/r/travel/comments/1sg7udw/cdg_security_question_re_liquids/,0,21,BothOceans,2026-04-08,lost luggage,LEVEL_2_STRUGGLING
travel,1shaoh8,"Helped By Local Japanese While Get Lost, Is It Wise?","Hi,

so we just lost in Japan, second time here but in a completely new area, we're lost because somehow the maps on airbnb seems like error and the pin location offset by around 750m. we arrived at the wrong location [here](https://maps.app.goo.gl/m7enCijbh5bigp4X9), 20 minute we stand on here for ",https://www.reddit.com/r/travel/comments/1shaoh8/helped_by_local_japanese_while_get_lost_is_it_wise/,0,14,Abzrrr,2026-04-09,lost luggage,LEVEL_1_AWARE
travel,1stnjt4,"Postcards from the best trip of our lives... so far! (Vietnam, Cambodia and China)","My wife and I have just returned home from a 3-week journey across **Vietnam**, **Cambodia** and a very short 1-day connection in **Shenzhen**.

We can both safely say it was the best trip of our lives. Everything was perfect: the people, food, weather, scenery, affordability, etc. and we couldn't b",https://www.reddit.com/r/travel/comments/1stnjt4/postcards_from_the_best_trip_of_our_lives_so_far/,1133,39,DundieAwardsWinner,2026-04-23,missed connection,LEVEL_1_AWARE
travel,1slc3sk,"Just back from Uzbekistan and wanted to post some logistics, ideas, thoughts and opinions","I recently finished a trip through Uzbekistan (semi-guided via Global Connect). They handled the flights, hotels, and drivers. Overall, they were decent—the hotels were okay, but their recovery game was strong; when they missed a pickup, they sent someone to the station specifically to fast-track us",https://www.reddit.com/r/travel/comments/1slc3sk/just_back_from_uzbekistan_and_wanted_to_post_some/,188,33,Mention_Patient,2026-04-14,missed connection,LEVEL_1_AWARE
travel,1swzh8g,Frankfurt Airport / Lufthansa,"Heads up to non-EU citizens traveling to EU at least for Frankfurt, your 1 hour layover will NOT be enough time. You will be blamed for missing your flight since they introduced a 2 step passport identification process. You have to wait in line for a kiosk then a 40+ minute wait to talk to a customs",https://www.reddit.com/r/travel/comments/1swzh8g/frankfurt_airport_lufthansa/,139,79,thatoneplutonian,2026-04-27,missed connection,LEVEL_1_AWARE
travel,1sdtzlm,Trip to Turkmenistan (March 2026),"For TM we chose Saada Travel as our agency. Communication before the trip started was great, very responsive. The LoI which is needed to get your visum on arrival was sent out asap.

**Day 1:** We took a TK-flight to Ashgabat and arrived at 03:00. Queue for the visa-counter was short, but the proces",https://www.reddit.com/r/travel/comments/1sdtzlm/trip_to_turkmenistan_march_2026/,39,1,theakamu,2026-04-06,missed connection,LEVEL_1_AWARE
travel,1sm0jw7,SCAT Airlines reliability for an October flight to Seoul?,"Hi everyone,

I’m planning to book a flight in October from Budapest to Seoul operated entirely by [SCAT Airlines](chatgpt://generic-entity?number=0), with a 1h40 layover in Kazakhstan (same ticket / same booking).

I have some questions:

1. Is SCAT generally reliable? (in terms of delays, cancella",https://www.reddit.com/r/travel/comments/1sm0jw7/scat_airlines_reliability_for_an_october_flight/,5,8,Minute_Peach9807,2026-04-15,missed connection,LEVEL_1_AWARE
travel,1sjs9oq,"20M first solo trip to Colombia (June, ~3 weeks) — Medellín vs Cartagena vs other spots? + tips for meeting people","What’s up everyone,

I’m 20M and this is going to be my first time solo traveling. I’m planning a trip to Colombia around mid-June for about 2–3 weeks.

I’m mainly looking at Medellín, Cartagena, and maybe some other spots, but I’m open to anything.

I had a few questions:

\- Anyone else going arou",https://www.reddit.com/r/travel/comments/1sjs9oq/20m_first_solo_trip_to_colombia_june_3_weeks/,3,2,Affectionate-Item386,2026-04-12,missed connection,LEVEL_1_AWARE
travel,1sjt10n,Meandering through new cities,"I love traveling to new places and getting to the hotel, dropping my stuff and just walking around.  Typically, I will put in a podcast about the city or place to start feeling connected and to get the local insights.  As much as I love this method, I feel like I miss the information of the places t",https://www.reddit.com/r/travel/comments/1sjt10n/meandering_through_new_cities/,2,7,Hot-Impression-6368,2026-04-12,missed connection,LEVEL_1_AWARE
travel,1s6jc11,"Passing through Indonesian immigration and catching a domestic connecting flight, how much is enough time?","After seeing a few posts complaining about immigration scams and wait time in Indonesia (specifically Bali) I have a few questions for those that might have experience on the matter and hopefully saving myself a missed flight. 

  
I will be flying into Surabaya from Singapore later this year in ord",https://www.reddit.com/r/travel/comments/1s6jc11/passing_through_indonesian_immigration_and/,1,7,michelle_mybelle,2026-03-28,missed connection,LEVEL_1_AWARE
travel,1shnuzm,Faye Travel Insurance Experience,"Hi! Just wanted to add a data point for those researching Faye. I purchased their coverage for a 10-day trip (2 people) that included a flight to Puerto Rico, and then a cruise to multiple islands. We had the misfortune of traveling during the TSA madness and peak spring break travel.

Our initial f",https://www.reddit.com/r/travel/comments/1shnuzm/faye_travel_insurance_experience/,1,0,munkigg,2026-04-10,missed connection,LEVEL_2_STRUGGLING
travel,1sl2zmi,Juneyao Airlines communication &amp; rules,"

I have an issue with Juneyao Airlines - I had a single ticket booked from Nagoya to Beijing with connection in Shanghai. Nagoya-Shanghai flight at 1pm was canceled and they re-booked a later flight for me in the evening. However, due to the late first leg flight, I miss my connection in Shanghai.
",https://www.reddit.com/r/travel/comments/1sl2zmi/juneyao_airlines_communication_rules/,1,1,BigIndependent618,2026-04-14,missed connection,LEVEL_1_AWARE
travel,1si064a,Is arajet the biggest scam in aviation?,"I’ve had my fair share of travel headaches, but my recent experience with Arajet takes the cake. Honestly, is Arajet the biggest scam in aviation right now? Here’s the story of how a simple flight turned into a total nightmare.

Before the trip, I made sure everything was booked: my ticket, a checke",https://www.reddit.com/r/travel/comments/1si064a/is_arajet_the_biggest_scam_in_aviation/,7,5,drlalas,2026-04-10,airline nightmare,LEVEL_1_AWARE
travel,1sm4wfo,PSA: Do NOT fly American,"Hey all!

Frequent traveler for work and I've noticed a trend recently where American Airlines overbooks and then involuntarily bumps 8-10 people off the flight. Happened three times in the last month, it was a nightmare. People were understandably upset when they arrived at the airport to find out ",https://www.reddit.com/r/travel/comments/1sm4wfo/psa_do_not_fly_american/,0,14,Terrible-Sir8054,2026-04-15,airline nightmare,LEVEL_1_AWARE
travel,1siu9sq,Denied boarding,"I have been denied boarding two times in a row from Copenhagen to Manchester, the first flight they didn’t let me on as it was overbooked.. they then put me on the next flight 8 hours later with an assigned seat and didn’t let me on again that one due to it overbooked. It was Ryanair, the woman shou",https://www.reddit.com/r/travel/comments/1siu9sq/denied_boarding/,125,33,PromotionFrequent600,2026-04-11,no compensation,LEVEL_1_AWARE
travel,1sg5l7s,My Experience with FlixTrain and EU Rail Passenger Rights,"I want to make a post on my experience with FlixTrain EU Rail Passenger rights, in case this helps anyone stuck in a multi hour delay.

I took a train from Hamburg to Berlin earlier, using FlixTrain. Where unfortueantly my train was delayed for 4+ hours. I would like to say that FlixTrain is mostly ",https://www.reddit.com/r/travel/comments/1sg5l7s/my_experience_with_flixtrain_and_eu_rail/,9,0,Jingtian_Wang,2026-04-08,no compensation,LEVEL_2_STRUGGLING
travel,1swxwzl,Can I claim a refund as well as compensation,"Hi all, I recently had my flight cancelled to Freetown from Brussels. They offered me an alternative flight with a code share airline but they denied me boarding for no reason and could only offer an apology. We ended up ditching the trip and they put us on a flight back to manchester.

I have recei",https://www.reddit.com/r/travel/comments/1swxwzl/can_i_claim_a_refund_as_well_as_compensation/,3,2,MountainRoll1434,2026-04-27,no compensation,LEVEL_1_AWARE
travel,1seqy37,EU Compensation assistance companies for delayed flights,"Hi,

  
I know, everyone will say file the claim directly with the airline, did this, and TAP is stonewalling and saying ""no"".

I also filed with the Portugal authority since the flight was BOS to LIS. Not really sure if they actually get compensation or just add it to their list of complaints..... ",https://www.reddit.com/r/travel/comments/1seqy37/eu_compensation_assistance_companies_for_delayed/,0,8,kiltym,2026-04-07,no compensation,LEVEL_1_AWARE
travel,1s9qgw7,What are the reasons to be re-seated before the flight?,Me and a few family members booked a flight for this month last January and paid the seats in full. Today i got an email that we were re-seated without any reasons as to why and we'll be split in 3 completely different seats instead of the same row next to the window. I'll be calling them later but ,https://www.reddit.com/r/travel/comments/1s9qgw7/what_are_the_reasons_to_be_reseated_before_the/,0,8,G0VERNMENTCHEESE,2026-04-01,no compensation,LEVEL_1_AWARE
travel,1sldkt0,Help getting my money back,"Hope this is a suitable sub to post in as I feel people in here will have been through similar, especially recently.

I was due to fly LHR-CMB return via Sharjah recently with Air Arabia. Total cost circa £1800 for two people. Because of the situation in the middle east they were cancelled and I reb",https://www.reddit.com/r/travel/comments/1sldkt0/help_getting_my_money_back/,0,3,PersonalityLittle845,2026-04-14,no compensation,LEVEL_1_AWARE
travel,1sb9f06,Oman Air missed Paris flight,"So me and my wife (Indians) try to travel abroad at least once a year. We tend to plan and book everything ourself. This summer we had a europe trip planned. PARIS- Brussels- amsterdam - switzerland and back. I love qatar airways. Always have had a great experience with them, among all the regional ",https://www.reddit.com/r/travel/comments/1sb9f06/oman_air_missed_paris_flight/,0,10,Nomadic4rlife,2026-04-03,no compensation,LEVEL_2_STRUGGLING
travel,1su7xbm,"From Zurich to Titlis heights, then down to Geneva 🇨🇭","Just got back from a short Switzerland trip and honestly… worth every cent.

I flew out early morning from Split with KLM via Amsterdam to Zurich. Everything was smooth until the Amsterdam-Zurich leg got delayed by about an hour, which kind of killed my original day plan (FIFA Museum + Lindt). In th",https://www.reddit.com/r/travel/comments/1su7xbm/from_zurich_to_titlis_heights_then_down_to_geneva/,370,9,paskatulas,2026-04-24,delayed hours,LEVEL_1_AWARE
travel,1sk5g1j,Inoffensive Air India experience - Apr '26,"TLDR: Generally positive experience, albeit on an almost empty flight from LHR to DEL

Despite my reluctance, booked an itinerary on Air India between LHR and CCU (with a connection at DEL). Initially, i had a booking on Qatar Airlines. However, when the (newest) war in the Middle East started, I de",https://www.reddit.com/r/travel/comments/1sk5g1j/inoffensive_air_india_experience_apr_26/,27,11,Yesberry,2026-04-13,delayed hours,LEVEL_1_AWARE
travel,1spc7sc,Crete car rental tip: strict parking rules can cost you days of your trip,"I'm posting this because I wish someone had warned me clearly before I went.

I've just come back from a six-day trip to Crete that was meant to be a birthday trip for my partner. We ended up losing 3 of those 6 days to a parking mistake and a badly handled rental car situation.

In Chania, I unknow",https://www.reddit.com/r/travel/comments/1spc7sc/crete_car_rental_tip_strict_parking_rules_can/,21,16,alex889990,2026-04-18,delayed hours,LEVEL_1_AWARE
travel,1snjm3p,Munich Airport Arrivals,"Hi Everyone,

Has anyone arrived into MUC from the US recently? What was the passport control wait time like? I’ve read that the new EES system is causing multi-hour delays. I’m wondering if it is worth purchasing a Fast Track Arrival service. I am scheduled to arrive in Munich this Sunday, 19/4. Th",https://www.reddit.com/r/travel/comments/1snjm3p/munich_airport_arrivals/,6,7,Real-Tower8037,2026-04-16,delayed hours,LEVEL_1_AWARE
travel,1seic62,portugal trip recap,Here’s my travel recap of my trip to Portugal with my mom from 3/27-4/5 using a single check in luggage and backpacks. We are pretty fast paced travelers who like to eat and see major landmarks but don’t necessarily care about going inside all of them. Hope this is helpful and feel free to ask any q,https://www.reddit.com/r/travel/comments/1seic62/portugal_trip_recap/,5,3,Cloaked4,2026-04-06,delayed hours,LEVEL_1_AWARE
travel,1sfistf,Which flight itinerary would you choose? Jeju Island to Xian on May 18th,"One checked bag. I'm considering Option 1 because it gets me to Xi'an several hours earlier than the other options. I'm just not sure how trustworthy Spring is, especially with delays and one checked bag. The 6hr layover seems long enough based on what I've read?

For Option 2, would 3.5hrs be enoug",https://www.reddit.com/r/travel/comments/1sfistf/which_flight_itinerary_would_you_choose_jeju/,3,4,Ming-Tzu,2026-04-08,delayed hours,LEVEL_1_AWARE
travel,1s50x0u,Tips for getting through Chicago O'Hare,"I have terrible experience with this airport, but to be fair in large part due to lack of sleep heightening the stress. I have a 1.5 hour layover here, arriving internationally in terminal 5, with 2 bags checked through to destination.

Tips for getting through in time with all my luggage? I have to",https://www.reddit.com/r/travel/comments/1s50x0u/tips_for_getting_through_chicago_ohare/,3,7,Used_Land3016,2026-03-27,delayed hours,LEVEL_1_AWARE
flights,1sm8iy2,Norse Airlines Cancelled my Flight Months in Advance,"Hi everyone! So a little over a month ago I booked a round trip with Norse from LAX to LGW for end of June/early July. It is my first time flying overseas, and my first time flying with Norse. Needless to say, I am excited to visit London as it has been a long time dream and goal.

Unfortunately, th",https://www.reddit.com/r/Flights/comments/1sm8iy2/norse_airlines_cancelled_my_flight_months_in/,480,273,Existing-Button7327,2026-04-15,flight canceled,LEVEL_2_STRUGGLING
flights,1sn39v0,My flight was canceled .. and wow!,"Small airport, my AirBaltic flight was canceled (due to fog).  It was hilarious- they came over the speaker and said- “your flight is canceled, now leave the airport.”  (Palanga airport) 

Within minutes I had a voucher (link emailed to me for a hotel), I picked an apartment a couple kms from the ai",https://www.reddit.com/r/Flights/comments/1sn39v0/my_flight_was_canceled_and_wow/,422,52,catpurrrrfect,2026-04-16,flight canceled,LEVEL_2_STRUGGLING
flights,1spzy9q,"Urgent, Help! Stuck in Reno -- They said we never boarded our flight here and canceled our return flight. What do we do?","My wife and daughter spent this last weekend at a volleyball tournament in Reno. They flew on Southwest Airlines from Burbank but had to connect through Las Vegas (ridiculous but it allowed us to use points). 

Today when they tried to check in, it said they never boarded their connecting flight fro",https://www.reddit.com/r/Flights/comments/1spzy9q/urgent_help_stuck_in_reno_they_said_we_never/,149,73,Either_Net_8408,2026-04-19,flight canceled,LEVEL_2_STRUGGLING
flights,1s9eb40,China Eastern Cancelled Flight,Just received this message from what appears to be China Eastern’s Airline - does anyone have any experience with this airline and know whether this message is real or not? I haven’t received any email confirmation and my online booking on the portal has not changed. ,https://www.reddit.com/r/Flights/comments/1s9eb40/china_eastern_cancelled_flight/,90,52,AnalystOk692,2026-04-01,flight canceled,LEVEL_1_AWARE
