subreddit,post_id,title,selftext_snippet,url,score,num_comments,author,created_date,search_term,category
delta,1soelsv,Delta should control the entire US airline industry,"It’s becoming increasingly clear that all other US airlines should just be consolidated into Delta.  Doing this would kill two birds with one stone: no longer would the US industry be dinged for being less premium than its EU/Asian counterparts, and no longer would flyers have to deal with the opera",https://www.reddit.com/r/delta/comments/1soelsv/delta_should_control_the_entire_us_airline/,0,8,inakajin,2026-04-17,airline nightmare,LEVEL_1_AWARE
delta,1t14nvt,"I have never posted here, just read....but sitting in SkyClub at LAX and starting to think about ending my 20 year relationship with Delta.",This is the third trip of the last five where one of my flights was cancelled due to staff shortage...this time the pilots. I missed my event scheduled for today and now will be landing in San Jose instead of SFO in order to get to the bay area tonight instead of tomorrow night.  My compensation for,https://www.reddit.com/r/delta/comments/1t14nvt/i_have_never_posted_here_just_readbut_sitting_in/,433,232,KansasEagle,2026-05-01,no compensation,LEVEL_2_STRUGGLING
delta,1socnut,"AITA for expecting Delta to honor the $2,500 offer they confirmed… then took back 2 hours later?","Throwaway profile as the issue is still ongoing...

I need a sanity check because this whole situation feels shockingly obvious, yet Delta has been steadfast with their denial position. Heres the story.. 

I was on an oversold flight where the airline started asking for volunteers. The offer hit $2,",https://www.reddit.com/r/delta/comments/1socnut/aita_for_expecting_delta_to_honor_the_2500_offer/,377,161,Impressive_Still8823,2026-04-17,no compensation,LEVEL_1_AWARE
delta,1smiyoq,Pre-Departure Drink Service,"Today going from JFK to DEN there was no FC PDB service. I asked the FA and she said that the flight leader had decided not to do it. This omission keeps happening, yet customer service says that the PDB in FC is supposed to be provided except under extenuating circumstances. 

I pay for my FC ticke",https://www.reddit.com/r/delta/comments/1smiyoq/predeparture_drink_service/,312,151,IBWT1,2026-04-15,no compensation,LEVEL_1_AWARE
delta,1stnup2,Delta starting to lose it?,"Diamond medallion + Amex reserve for relevancy. Last week I had a work trip Mon-Fri round trip from DTW-FLL and back. Took my golf clubs down with me and the zipper got frizzed and I couldn’t re-zip the bag. Didn’t notice it until I got to my hotel. Called Delta, and they said there’s nothing they c",https://www.reddit.com/r/delta/comments/1stnup2/delta_starting_to_lose_it/,0,8,RollingTightPercys18,2026-04-23,no compensation,LEVEL_1_AWARE
delta,1t13tjg,Looking for help finding the right Delta contact for an urgent escalation,"Hi everyone — I’m hoping someone here might know the best person, department, or email address at Delta to contact for a serious customer care escalation.

I recently had a deeply upsetting experience on Delta flight 5375 from Atlanta to Montgomery on April 24. I had booked a last-minute flight from",https://www.reddit.com/r/delta/comments/1t13tjg/looking_for_help_finding_the_right_delta_contact/,0,11,blackdahl23,2026-05-01,no compensation,LEVEL_1_AWARE
delta,1ssvxmr,"Delta automatically cancels ticketed flights for fraud, and then charges more when the customer realizes they have to rebook","What kind of scam is Delta running? My mother in law purchased a ticket in advance, in the app all the way up to departure it looks like shes on track to depart. Come to find out, Delta refunded the flight on the credit card and didn’t offer any other notification the flight was no longer valid for ",https://www.reddit.com/r/delta/comments/1ssvxmr/delta_automatically_cancels_ticketed_flights_for/,0,9,rnd765,2026-04-22,no compensation,LEVEL_1_AWARE
delta,1sehdod,Delta-,"TLDR: pictures are from a local Facebook Group and tell the story. 

This is not a good look. Regional carrier Sky West’s CEO tells pilot wait for his daughter to board plane. Delaying the flight and everyone on it from getting to their destination on time. 

Yes, it was the last flight of the night",https://www.reddit.com/r/delta/comments/1sehdod/delta/,2097,272,Sun-lounger-14,2026-04-06,delayed hours,LEVEL_1_AWARE
delta,1sfykzi,Paid Comfort Class seats given away this morning,"I’ve been watching this subreddit for the last few weeks with some trepidation as I had a flight coming up today. I’m a lowly Platinum card holder but I guess that I did expect that for $350 a year I’d get something.

Well it happened to us today. I had booked myself and my husband about 2 months ag",https://www.reddit.com/r/delta/comments/1sfykzi/paid_comfort_class_seats_given_away_this_morning/,1074,212,Flicker-pip,2026-04-08,delayed hours,LEVEL_1_AWARE
delta,1sbffuq,Goody bag from flight attendant,"I had a pretty awful flight experience yesterday… my original flight from my origin airport was delayed for 15 hours due to a mechanical issue forcing me to switch to an alternative flight, and then my flight from my layover airport was also delayed due to a mechanical issue (this time for only an h",https://www.reddit.com/r/delta/comments/1sbffuq/goody_bag_from_flight_attendant/,229,6,sparksflying5,2026-04-03,delayed hours,LEVEL_1_AWARE
delta,1sf9ahb,Passenger Log - Hour 7 in the Sky Club,"12:15 flight with my daughter to surprise her for spring break. Trip to Disney, but fast, only 4 days. All started well, no wait at bag check or security. Took her to Sky Club for the first time using my precious pleb sky club passes. Enjoyed some breakfast food and conversation with the employees. ",https://www.reddit.com/r/delta/comments/1sf9ahb/passenger_log_hour_7_in_the_sky_club/,137,43,hot_momma17,2026-04-07,delayed hours,LEVEL_1_AWARE
delta,1smjpqy,Delta policy in this situation?,"My on time flight was just delayed over half an hour by one woman who created a commotion because she put an AirTag in her luggage and could see that it apparently wasn’t on the plane. Instead of telling her she could get off if she wants and carrying on, the crew put up with her for half an hour an",https://www.reddit.com/r/delta/comments/1smjpqy/delta_policy_in_this_situation/,96,35,lickthepixies,2026-04-15,delayed hours,LEVEL_1_AWARE
delta,1sndwz5,Weird behavior ATL to BOS,"Delayed 36 min (not the weird part), the gate agents were checking IDs and spot searching through carryon bags during boarding. I have never seen that for a domestic flight. Then halfway through boarding group 4 (I was 5) they announced all rollaways would be checked. Weird, but ok I guess. Checked ",https://www.reddit.com/r/delta/comments/1sndwz5/weird_behavior_atl_to_bos/,95,42,KSA_Dunes,2026-04-16,delayed hours,LEVEL_1_AWARE
delta,1swqn0e,Come on Delta - Update the Boarding Time!,"Flight was delayed hours ago - I first got the text at 8:18. I get to the airport and it's still showing boarding time of 6:29. So I figure maybe they're going to try to pull the flight in. So I hightail it to the gate - it's 6:20. No aircraft, no GA.   Head to the sky club, ask what's up. Oh - the ",https://www.reddit.com/r/delta/comments/1swqn0e/come_on_delta_update_the_boarding_time/,63,28,Ok_Basil_1036,2026-04-26,delayed hours,LEVEL_1_AWARE
delta,1sthrny,"30 min layover at DTW, how cooked am I","I will be needing to get from A29 to B4 and factoring in maybe 10+ mins to get off the plane and the gates close 15 mins before the flight apparently.  🫠  


UPDATE: I am no longer cooked, the incoming plane got delayed but I managed to snag the last seat on the flight thats 2 hours later.  ",https://www.reddit.com/r/delta/comments/1sthrny/30_min_layover_at_dtw_how_cooked_am_i/,39,75,beelzeybob,2026-04-23,delayed hours,LEVEL_1_AWARE
americanairlines,1stwapc,Help me understand why an American Airlines representative would tell me I need to pay when we were deplaned due to equipment issues and the flight was cancelled,"I was flying AA domestically with an economy ticket yesterday. After taxiing to the runway my flight returned to the gate due to equipment issues. We were deplaned and the flight was cancelled. Back at the gate, gate attendants gave us cards with instructions to call a number to be rebooked.

Note: ",https://www.reddit.com/r/americanairlines/comments/1stwapc/help_me_understand_why_an_american_airlines/,251,37,Significant_Sky4635,2026-04-23,flight canceled,LEVEL_1_AWARE
americanairlines,1sy9cfw,American cancelling flights out of DFW tonight,"Colleagues are getting notifications that flights are being cancelled due to air traffic control this evening.

Any other flights getting notifications right now?

Edit: made it out about an hour late. Good luck everyone!",https://www.reddit.com/r/americanairlines/comments/1sy9cfw/american_cancelling_flights_out_of_dfw_tonight/,45,60,Randusnuder,2026-04-28,flight canceled,LEVEL_1_AWARE
americanairlines,1sd3aje,Use Finnair more for Asia,I was scheduled yesterday from central Illinois to DFW then to ICN.  Woke up early flight delayed and was going to miss connection.  Get on a phone with AA to look at options.  Her solution was to try again tomorrow so I was like let’s think outside the box.  Can can’t to ORD by 11 so what are optio,https://www.reddit.com/r/americanairlines/comments/1sd3aje/use_finnair_more_for_asia/,38,26,Iflysims,2026-04-05,flight canceled,LEVEL_1_AWARE
americanairlines,1sqxl6q,Compensation for Reservation Agent Error,Booked a OneWorld Round the World business class trip ticketed by American Airlines 6 months prior to departure to celebrate milestone events (40 year anniversary and 70 year birthday). Called to make change to itinerary 3 days before departure due to war in the Middle East. A few hours later we dis,https://www.reddit.com/r/americanairlines/comments/1sqxl6q/compensation_for_reservation_agent_error/,32,51,Severe-Psychology388,2026-04-20,flight canceled,LEVEL_1_AWARE
americanairlines,1syhb19,The curious and frustrating world of SWU waiting lists (and expert flyer's new tool stinks?),"Hello. Does anyone know how Systemwide Upgrade waitlists are actually processed? I have a ton of experience making use of SWU's but almost never via the waiting list.

My wife recently requested one for her flight to Japan tomorrow. I randomly logged into [AA.com](http://AA.com) this afternoon and s",https://www.reddit.com/r/americanairlines/comments/1syhb19/the_curious_and_frustrating_world_of_swu_waiting/,13,21,Sagnew,2026-04-28,flight canceled,LEVEL_1_AWARE
americanairlines,1t3dyha,International travel canceled,"Hi everyone,  
I had booked a flight from **Chicago ORD to Karachi, Pakistan** through **American Airlines** for **May 10**, operated by **Qatar Airways**. I recently confirmed with American Airlines that this flight has been canceled because they are no longer operating/offering this route on that ",https://www.reddit.com/r/americanairlines/comments/1t3dyha/international_travel_canceled/,12,9,TemporaryBend6518,2026-05-04,flight canceled,LEVEL_1_AWARE
americanairlines,1sqp8o8,"Wifi differences between paid and ""free""","Hi,

I have been paying for the 2 device monthly Wifi plan for $59.95/month. Now that most flights offer free wifi, is there any benefit to keeping this plan? I expense it, so am not that worried about the cost if there is actually a benefit. Thank.

  
EDIT: Thanks all. Have sent my request to canc",https://www.reddit.com/r/americanairlines/comments/1sqp8o8/wifi_differences_between_paid_and_free/,11,29,playasnake,2026-04-20,flight canceled,LEVEL_1_AWARE
americanairlines,1sgdd81,Can anyone check the reason AA 953 was delayed 12 hours today?,Can anyone tell why AA 953 from JFK-EZE was delayed 12 hours?  It sounds like there was a delayed aircraft but at the same time the app is showing the incoming aircraft arrived at JFK already.  At least the flight wasn't cancelled (please knock on wood for me) ,https://www.reddit.com/r/americanairlines/comments/1sgdd81/can_anyone_check_the_reason_aa_953_was_delayed_12/,10,36,RyanAirhead,2026-04-08,flight canceled,LEVEL_1_AWARE
americanairlines,1shr9mq,Why are upgrade offers frequently much more expensive than changing or rebooking your ticket to First or Business? In,"In this example of a flight I recently booked with points the upgrade offer would cost 173,000 miles but to change the ticket from MC to F is 38,500???  The cost differential between upgrade and change is about the same for paying cash.  About $1,700 vs $400.

This is a pretty extreme example with t",https://www.reddit.com/r/americanairlines/comments/1shr9mq/why_are_upgrade_offers_frequently_much_more/,7,17,NumbDumbLuck,2026-04-10,flight canceled,LEVEL_1_AWARE
americanairlines,1sh2vef,Catering Issue at JFK,"My direct flight from JFK to HND was canceled this morning due to a catering issue. Both the gate agent and the agent who rebooked me mentioned that the airline recently switched to a new catering company that wasn’t prepared to handle the volume of flights.

As a result of the cancellation, I was m",https://www.reddit.com/r/americanairlines/comments/1sh2vef/catering_issue_at_jfk/,7,13,kbugs14,2026-04-09,flight canceled,LEVEL_1_AWARE
americanairlines,1snkbgh,Wife and kids stranded because staff unfamiliar with UK evisa,"\*\*American Airlines staff couldn't process my wife's UK eVisa — she has now missed her flight home, stranded with our two children\*\*

My wife is a US citizen with Indefinite Leave to Remain (ILR) in the UK. She was trying to fly back home today. AA's check-in staff were unable to process her bec",https://www.reddit.com/r/americanairlines/comments/1snkbgh/wife_and_kids_stranded_because_staff_unfamiliar/,151,95,Available-Theory-808,2026-04-16,stranded airport,LEVEL_2_STRUGGLING
americanairlines,1svcooi,"I don't like to complain, but...","I don’t like to complain and usually give businesses grace when things go wrong. But people should know about this experience.

I bought a round-trip ticket to Norway through American Airlines. My flight there was smooth. While in Norway, I was on a cruise with limited internet and didn’t check emai",https://www.reddit.com/r/americanairlines/comments/1svcooi/i_dont_like_to_complain_but/,0,12,Alternative-Vast6865,2026-04-25,stranded airport,LEVEL_2_STRUGGLING
americanairlines,1sybkz7,"[Help] American Airlines left me stranded at the airport, told me they’d reimburse me for my uber, then went back on their words and gaslit me that they never said that.","A flight delay for an American Airlines flight caused me to miss the last shuttle back home from the Airport and left me stranded at the airport for 5 hours. Other than an Uber, the shuttle was the only way back home for me.

I would’ve waited 5 hours if American Airlines support had not told me tha",https://www.reddit.com/r/americanairlines/comments/1sybkz7/help_american_airlines_left_me_stranded_at_the/,0,44,Even-Ad-3980,2026-04-28,stranded airport,LEVEL_2_STRUGGLING
americanairlines,1sxbzbi,American Airlines Globe Card - Travel Protections and Companion Certificate,"I am thinking about signing up for an American Airlines Globe Card and I can't seem to find detailed information about the card's Travel Protection/Insurance Benefits. The information directly from both Citi's and American Airlines sites are very vague. Also, I can't find a downloadable .pdf that ex",https://www.reddit.com/r/americanairlines/comments/1sxbzbi/american_airlines_globe_card_travel_protections/,1,13,spiritualmater,2026-04-27,lost luggage,LEVEL_1_AWARE
americanairlines,1sd81v8,Delayed/Lost Baggage FYI,If anyone has a lost luggage/delayed bag FYI make sure your case is remains open until the delivery is complete. Flew AA from to Frankfurt and had to get on an earlier flight to make my connecting flight to DFW. Bag never made it on the flight that I was on and arrived the next morning. AA says they,https://www.reddit.com/r/americanairlines/comments/1sd81v8/delayedlost_baggage_fyi/,1,3,cdw23chance,2026-04-05,lost luggage,LEVEL_2_STRUGGLING
americanairlines,1sxc587,Upsetting Beginning to Honeymoon,My now husband and I got married Saturday April 25th with a honeymoon booked to Greece. the first part of the trip was through American Airlines. The flight was delayed which would cause us to miss both our connecting flights. We were rebooked and that flight was delayed again. We are devastated… Wh,https://www.reddit.com/r/americanairlines/comments/1sxc587/upsetting_beginning_to_honeymoon/,0,14,Big_Track_2501,2026-04-27,lost luggage,LEVEL_2_STRUGGLING
americanairlines,1syw9ay,American Airlines Rebuilt Its Dallas Hub — Missed Connections Are Down 50%,"I know a lot of people are going to scoff at this with the storms that have rolled through DFW the past few days, but I am curious is the frequent DFW travelers who can see past that are noticing improvements since the beginning of April as well. This sub seems less crazy when storms roll through, a",https://www.reddit.com/r/americanairlines/comments/1syw9ay/american_airlines_rebuilt_its_dallas_hub_missed/,437,93,Financial-Public-336,2026-04-29,missed connection,LEVEL_2_STRUGGLING
americanairlines,1t3dk9q,People who rush up the isle when the plane lands are the worst,"Just landed, and for whatever reason the number of people who sprinted to the front once the plane landed was an all time high, and gosh does it irk me. It just exudes main character energy and I find it so rude.

I get it if the flight is delayed and you’re at risk of missing the connection. But ou",https://www.reddit.com/r/americanairlines/comments/1t3dk9q/people_who_rush_up_the_isle_when_the_plane_lands/,158,113,kittycatluvrrrr,2026-05-04,missed connection,LEVEL_1_AWARE
americanairlines,1t049yz,What happens if I don’t make my connecting flight?,"Hi everyone! I’m kinda freaking out and need advice! I am 18 and flying alone for the first time. My flight got delayed by an hour due to the crew’s rest period. Thing is, my flight gets to the Philadelphia airport at 10:01 and my connecting flight leaves at 10:40. I’m not entirely sure if this coun",https://www.reddit.com/r/americanairlines/comments/1t049yz/what_happens_if_i_dont_make_my_connecting_flight/,95,110,YuleBunny,2026-04-30,missed connection,LEVEL_1_AWARE
americanairlines,1su1i1j,Can’t Unlock Account after Fraud Notice,"At a loss with AA customer service, first of all I was on a flight a few weeks ago from DFW to HND that took off then about 3 hours in returned to DFW for maintenance and was subsequently delayed 33 hours with no available alternatives for days. Once I finally arrived in Tokyo and missed my connecti",https://www.reddit.com/r/americanairlines/comments/1su1i1j/cant_unlock_account_after_fraud_notice/,11,5,GigemAg18,2026-04-23,missed connection,LEVEL_2_STRUGGLING
americanairlines,1syojce,Missing luggage,"\*UPDATE- I went to the airport to pick up my luggage, long irrelevant story about waiting for it to be delivered, and nothing appears to be missing and no notice from customs that it had been inspected.  
Best guess is someone grabbed it accidentally?  
Will be getting AirTags for my next travels 
",https://www.reddit.com/r/americanairlines/comments/1syojce/missing_luggage/,8,12,lovemissed07,2026-04-29,missed connection,LEVEL_1_AWARE
americanairlines,1swfoit,1hr or 6hr layover in Philly - what would you do?,"Hi! I am booking a flight from Austin - Philly - Zurich this fall on American Airlines. My options are a 1 hr 15 min connection or a 6-hour connection. 

Traveling will be me (32F), my husband (35M), and our child (2F). We are seasoned travellers, but going back and forth on which layover to pick. 
",https://www.reddit.com/r/americanairlines/comments/1swfoit/1hr_or_6hr_layover_in_philly_what_would_you_do/,4,86,Ladylurker_,2026-04-26,missed connection,LEVEL_1_AWARE
americanairlines,1t1hgqy,How long does delayed luggage usually take to be delivered?,"
I had to take different flights today from Atlanta (supposed to go through Charlotte to Illinois but the flight was delayed by two hours for mechanical reasons as soon as they started boarding and I’d have missed connected flight home-last for the night). I was grateful the gate agent was able to f",https://www.reddit.com/r/americanairlines/comments/1t1hgqy/how_long_does_delayed_luggage_usually_take_to_be/,2,10,LankyAstronomer4802,2026-05-02,missed connection,LEVEL_1_AWARE
americanairlines,1sjrrm6,MCO &gt; PHL &gt; DUB – 24hr Delay + Reroute via LHR. Is 7.5k miles a fair 'goodwill' offer?,"

 Hi everyone, Help Needed. I’m looking for some perspective on a recent disruption with AA and whether I should push for a better settlement.

**The Details:**

·        **Route:** Orlando (MCO) -&gt; Philadelphia (PHL) -&gt; Dublin (DUB).

·        **The Issue:** First leg (MCO-PHL) was delayed d",https://www.reddit.com/r/americanairlines/comments/1sjrrm6/mco_phl_dub_24hr_delay_reroute_via_lhr_is_75k/,2,4,Horror_Zucchini2886,2026-04-12,missed connection,LEVEL_1_AWARE
americanairlines,1slko1n,I booked hotel with miles and the hotel charged me a hotel fee??,I booked one night stay at the Ambassador in Chicago with miles and what was supposed to be a free stay for the night turned into a nightmare. I was not told about the $123 hotel resort fee ahead of time and it was so late in the night that by the time I got there that I had no choice to pay. The de,https://www.reddit.com/r/americanairlines/comments/1slko1n/i_booked_hotel_with_miles_and_the_hotel_charged/,0,26,Ok-Water-7110,2026-04-14,airline nightmare,LEVEL_1_AWARE
americanairlines,1sru74r,worst airline experience ever,"I was scheduled to fly on American Airlines from Sydney to Los Angeles on Monday, April 6, 2026 at 9:10 AM. In order to make this flight I was flying from Melbourne, which is where I was vacationing, to Sydney on Qantas on April 5 at 6:30 PM and spending the night at a hotel at the airport. Both of ",https://www.reddit.com/r/americanairlines/comments/1sru74r/worst_airline_experience_ever/,0,12,Entire-Case-6669,2026-04-21,airline nightmare,LEVEL_2_STRUGGLING
americanairlines,1sbas7t,Award flight compensation for broken TV.,"I was told at the gate that the tv set in my seat was broken and they couldn’t reseat me as there were no seats available in the same class (first). Since it’s a 10 hour flight, I am kinda bummed out. Do I get any kind of compensation, if I booked my flight with miles and how do I do that? Thanks. ",https://www.reddit.com/r/americanairlines/comments/1sbas7t/award_flight_compensation_for_broken_tv/,12,49,henrybios,2026-04-03,no compensation,LEVEL_1_AWARE
americanairlines,1sl83kt,"Power outage in Business Premium, options?","My mom was on an American Airlines flight from DFW to Frankfurt recently, flying in the business class Flagship seats, and the experience was pretty disappointing.

Apparently the entire cabin had no power for the whole flight. The seats wouldn’t recline at all, no controls worked, nothing. So she e",https://www.reddit.com/r/americanairlines/comments/1sl83kt/power_outage_in_business_premium_options/,13,21,Blade4804,2026-04-14,no compensation,LEVEL_1_AWARE
americanairlines,1sbr5gq,Have you had any success getting flight credits when a flight has been delayed 16hr (overnight flight)?,"We finally got reboarded and the couple in another row mentioned they were paid $1200/each (family of 3) to move their flights. They had no pressing time commitment so scored a nice boost to their travels. Happy for them. 

Has anyone had luck getting flight compensation for long delays? I ask becau",https://www.reddit.com/r/americanairlines/comments/1sbr5gq/have_you_had_any_success_getting_flight_credits/,4,13,MysteriousHeron5726,2026-04-03,no compensation,LEVEL_1_AWARE
americanairlines,1syh6le,"Awarded compensation, but three months later, no check. Help?","On January 29, my father died. And what was already a long day got longer: my flight home was delayed by more than 3 hours. Because I was flying into Toronto, I was eligible for compensation (Canadian consumer protections FTW). Since I booked an emergency same day flight for myself and my husband, t",https://www.reddit.com/r/americanairlines/comments/1syh6le/awarded_compensation_but_three_months_later_no/,3,3,griffithgreene,2026-04-28,no compensation,LEVEL_1_AWARE
americanairlines,1skottx,AA204 - April 11th,"Our flight was supposed to leave 4/11 at 6pm. We actually took off, but then had engine trouble and had to circle for \~20 minutes before landing. Annoying, but fine—stuff happens, right?

Then we’re told the next flight isn’t for 22 hours. They give us a hotel voucher (for a pretty sketchy place) a",https://www.reddit.com/r/americanairlines/comments/1skottx/aa204_april_11th/,1,5,mysticalbuti,2026-04-13,no compensation,LEVEL_2_STRUGGLING
americanairlines,1syn8ej,International flight from US to EU heavily delayed (&gt;10h) and no compensation,"International flight from US to EU heavily delayed (&gt;10h) and no compensation

Hi All,

Last week, I had a terrible experience flying from USA to Europe, basically my flight was delayed by 10h, as a result they rebooked me in another flight and end arriving with 19h of delay to my destination. He",https://www.reddit.com/r/americanairlines/comments/1syn8ej/international_flight_from_us_to_eu_heavily/,0,7,Competitive-Dot-1678,2026-04-28,no compensation,LEVEL_2_STRUGGLING
americanairlines,1srdgpl,Almost 90 minutes since landing…,And no sign of our bags at LAX. What’s the chance of compensation of some sort…,https://www.reddit.com/r/americanairlines/comments/1srdgpl/almost_90_minutes_since_landing/,0,15,Hairy-Strategy-5027,2026-04-21,no compensation,LEVEL_1_AWARE
