subreddit,post_id,title,selftext_snippet,url,score,num_comments,author,created_date,search_term,category
flights,1t2823y,Spirit airlines shut down,"So I flew on spirit Thursday 4/30 from Atlantic City, NJ and landed around 9 am in Orlando, FL. as I was exiting my flight 2409 I realized I left behind my running belt that had my ID  and cards in it (first time traveling with my toddler so I was overwhelmed). I went to get it and was told I wasn’t",https://www.reddit.com/r/Flights/comments/1t2823y/spirit_airlines_shut_down/,57,9,demnutzbespicy,2026-05-02,flight canceled,LEVEL_1_AWARE
flights,1sr6v85,Flight cancellations out of control,I've been stuck in Cancun after two Frontier flights cancelled two days in a row. Now I need to wait another day for tomorrows flight. I need to get home!!,https://www.reddit.com/r/Flights/comments/1sr6v85/flight_cancellations_out_of_control/,53,31,mrstring,2026-04-20,flight canceled,LEVEL_1_AWARE
flights,1suh4ya,Denied Boarding - Help Please,"Hello,

A few weeks ago, we were denied boarding for our flight with Eurowings due to the incorrect spelling of our names. But we have checked, and we input all of our information correctly when the tickets were booked.

We have the receipt and the travelling documents from the GoToGate website as p",https://www.reddit.com/r/Flights/comments/1suh4ya/denied_boarding_help_please/,25,42,HedgehogMuch3459,2026-04-24,flight canceled,LEVEL_1_AWARE
flights,1t1nmjq,Rebooking a cancelled Spirit Flight,"Wanted to let people know that United is offering capped rates on flight ($199 - $299) based on route distance for most cancelled Spirit flights.  
For me this even worked trying to get home from FLL on F1 race day   
Just go to https://www.united.com/specialfares and enter your confirmation number ",https://www.reddit.com/r/Flights/comments/1t1nmjq/rebooking_a_cancelled_spirit_flight/,14,0,skiing-bear,2026-05-02,flight canceled,LEVEL_1_AWARE
flights,1smb95q,Norse Cancellation Refund or Rebook free of charge?,"Hi, Norse have cancelled my flight to LA. They offered this new route free of charge via trip.com. Should I refund or risk it with the tight layovers? A refund will be + 400 pounds…",https://www.reddit.com/r/Flights/comments/1smb95q/norse_cancellation_refund_or_rebook_free_of_charge/,13,11,Lewis1316,2026-04-15,flight canceled,LEVEL_1_AWARE
flights,1sgxak7,Flight landed in the wrong country - help!,"Hi, this is my first time on this sub, but could really use some advice from some frequent flyers!

  
Last week me and my girlfriend went on holiday with easyJet, flying Manchester to Dubrovnik. We'd sorted our own transport in the country to then head to Montenegro a couple days later, then flying",https://www.reddit.com/r/Flights/comments/1sgxak7/flight_landed_in_the_wrong_country_help/,396,111,Rickabeast,2026-04-09,stranded airport,LEVEL_2_STRUGGLING
flights,1sz3zpa,Why are Airlines making me take a flight while they know I will miss the connection?,"Hey,

I have experienced the following issue already multiple times, and I don't understand why airlines do business like that.

I have booked a flight with 2 stops. The first of the flights is so much delayed that it makes it impossible for me to catch my connecting flight, unless the airplane find",https://www.reddit.com/r/Flights/comments/1sz3zpa/why_are_airlines_making_me_take_a_flight_while/,0,24,NickChecksOut,2026-04-29,stranded airport,LEVEL_2_STRUGGLING
flights,1si9301,Aegean Airlines vs Sky Express,"I’ll be flying from Corfu to Athens this June. From what I’ve seen my only options are Aegean Airlines and Sky Express. The price is basically the same once I include 1 checked bag, and the flight times are pretty much the same too (only a 5-minute difference).

I’ve seen some pretty bad reviews of ",https://www.reddit.com/r/Flights/comments/1si9301/aegean_airlines_vs_sky_express/,0,3,madgreek17,2026-04-11,lost luggage,LEVEL_2_STRUGGLING
flights,1ses6hm,Luggage lost by Air France,"Hi! I arrived to Netherlands last week, It's has been 8 days and my suitcase still doesn't appear. I can't contact AriFrance to know the status of the searching... and the web page... it leads to nothing. Have you ever been in this situation? I want to know if is time to declare my suitcase is lost ",https://www.reddit.com/r/Flights/comments/1ses6hm/luggage_lost_by_air_france/,0,2,nieveagua,2026-04-07,lost luggage,LEVEL_1_AWARE
flights,1scdffg,Is this doable?,"Flying from AUH -&gt; FCO -&gt; BEG with a 45 minute transit in FCO.

What have your transit experiences in FCO been like?

Its a single ticket with code share but this flight is the last one to BEG on that day.

Trying to contact the airline to enquire about their procedure if connection flight is ",https://www.reddit.com/r/Flights/comments/1scdffg/is_this_doable/,12,21,Embarrassed_Way2779,2026-04-04,missed connection,LEVEL_1_AWARE
flights,1szambn,Transit in Ashgabat (just 1 Hour),"Hi everyone,

I’m considering booking a flight with Turkmenistan Airlines from Seoul to Istanbul with a connection in Ashgabat, and I’m a bit unsure about the return connection.

On the way back, I’d only have **1 hour transit time in Ashgabat (ASB)**. The whole itinerary would be on one ticket with",https://www.reddit.com/r/Flights/comments/1szambn/transit_in_ashgabat_just_1_hour/,10,15,Physical_Sell_3116,2026-04-29,missed connection,LEVEL_1_AWARE
flights,1syvpby,Name mistake on flight ticket (Qatar Airways),"Hi, I have a trip to Japan(Tokio) from Spain with some friends and, when making the reservation with Qatar Airways, I made a mistake in one of their names and a surname.

For example, I wrote “Manuel” instead of “Manel” for the first name, and “Gtierrez” instead of “Gutierrez” for the second surname",https://www.reddit.com/r/Flights/comments/1syvpby/name_mistake_on_flight_ticket_qatar_airways/,9,47,Big-Animal-4243,2026-04-29,missed connection,LEVEL_1_AWARE
flights,1spglqx,Question about short layovers and missed connections,"I have a RT flight coming up with Asiana going from JFK to BKK in May with a short 1 hr layover in ICN and a 1.5hr layover coming back in November. 

What happens if for some reason the first leg flight is delayed and the connection is missed? Is Asiana responsible for rebooking me on the next avail",https://www.reddit.com/r/Flights/comments/1spglqx/question_about_short_layovers_and_missed/,4,9,rycelover,2026-04-18,missed connection,LEVEL_2_STRUGGLING
flights,1t0x0gk,"SAS flight cancelled, trying to rebook on alternative airline","First time posting here and looking for some advice from experienced flyers on a rerouting situation with SAS.  
  
I was booked on the following itinerary on 17 May:  
SK2548 MAN–ARN (08:40–11:55)  
SK163 ARN–GOT (13:40–14:55)  
  
This flight has now been cancelled.  
  
SAS has offered a reroute ",https://www.reddit.com/r/Flights/comments/1t0x0gk/sas_flight_cancelled_trying_to_rebook_on/,4,4,No_Lingonberry_4420,2026-05-01,missed connection,LEVEL_1_AWARE
flights,1sm4391,SCAT Airlines reliability for an October flight to Seoul?,"Hi everyone,

I'm planning to book a flight in October from Budapest to Seoul operated entirely by SCAT Airlines, with a 1h40 layover in Kazakhstan (same ticket / same booking).

I have some questions:

1. Is SCAT generally reliable? (in terms of delays, cancellation)

2. Is 1h40 enough for a connec",https://www.reddit.com/r/Flights/comments/1sm4391/scat_airlines_reliability_for_an_october_flight/,1,5,Minute_Peach9807,2026-04-15,missed connection,LEVEL_1_AWARE
flights,1sknpjs,Is 50 mins in Amsterdam (AMS) enough? DFW -&gt; MSP -&gt; AMS -&gt; HYD (Single Ticket),"Hi everyone,

I’m looking for some ""boots on the ground"" advice regarding a tight connection at Schiphol. I’ve booked a single ticket through Air France for a trip from Dallas to Hyderabad, and one of the legs has me sweating a bit.

**The Itinerary:**

* **DFW -&gt; MSP:** (Delta)
* **MSP -&gt; AMS",https://www.reddit.com/r/Flights/comments/1sknpjs/is_50_mins_in_amsterdam_ams_enough_dfw_msp_ams/,1,14,6LunchVodka9,2026-04-13,missed connection,LEVEL_1_AWARE
flights,1sqtuqx,Eu261 / Turkish Airlines missed connection,"Hi everyone, I’d like to share my experience with Turkish Airlines and get some opinions from people who have dealt with EU261 compensation or missed connections.

Flights on April 2–3, single booking with Turkish Airlines: Milano Malpensa → Istanbul → Samarkand.

The first flight (TK1900 MXP–IST) a",https://www.reddit.com/r/Flights/comments/1sqtuqx/eu261_turkish_airlines_missed_connection/,0,3,Bruslaf,2026-04-20,missed connection,LEVEL_2_STRUGGLING
flights,1sqqnmv,How late can you apply for a refund of delayed/cancelled flights?,"My short haul flight was delayed, so missed my connecting long haul flight (same airline/ticket) When I messaged at the time of the event, they said I need to message them in 6 weeks to process refunds etc. Thus happened twice on customer service, they said they couldn't do it then. How late can I a",https://www.reddit.com/r/Flights/comments/1sqqnmv/how_late_can_you_apply_for_a_refund_of/,0,11,Justpeachyhey,2026-04-20,missed connection,LEVEL_2_STRUGGLING
flights,1suqdhe,multi-airline connecting flight,"(excuse the weird title, i have no idea how to phrase this) 

I don’t know if this is a stupid question but I just booked a flight through Saudia that goes from Riyadh to Rome then a connecting flight on ITA from Rome to Milan with a 90 minute layover. I did it all under one booking with Saudia. 

I",https://www.reddit.com/r/Flights/comments/1suqdhe/multiairline_connecting_flight/,0,5,ahahaaiii,2026-04-24,missed connection,LEVEL_1_AWARE
flights,1sd9urn,Missing luggage,"Hoping someone can help me and/or let me know if there’s anything else I can do here:

We had a flight from Medina to Istanbul with saudia and then a scheduled flight from Istanbul to JFK with Turkish.

We checked our luggage in Medina with saudia airlines. That flight had to land in Cairo for a few",https://www.reddit.com/r/Flights/comments/1sd9urn/missing_luggage/,0,4,theprimaryprincess,2026-04-05,airline nightmare,LEVEL_1_AWARE
flights,1sxc9aj,"Is the Trip.com ""100% Cancellation Guarantee"" legit? AC Flex is £225 more.","On the official Air Canada website, the Economy Standard fare is roughly the same price as the third-party sites, but the problem is that it is essentially non-refundable for cash. If I need to cancel a Standard ticket, they only offer a refund in the form of an AC Wallet credit for future flights, ",https://www.reddit.com/r/Flights/comments/1sxc9aj/is_the_tripcom_100_cancellation_guarantee_legit/,0,8,quintessentially_a,2026-04-27,airline nightmare,LEVEL_1_AWARE
flights,1sci2o4,T’way airlines or worst experience ever,"I flew yesterday with T’way airlines from Seoul to Paris and I couldn’t believe how bad it was. 

I know it’s a low cost carrier but for a 15h flight I expect that at least the basic human needs are provided. 

So I’m making this post for people to be aware before booking their flights with this com",https://www.reddit.com/r/Flights/comments/1sci2o4/tway_airlines_or_worst_experience_ever/,0,16,SentenceNo9428,2026-04-04,airline nightmare,LEVEL_1_AWARE
flights,1spp0t3,Involuntarily Bumped from Aukland to LAX - I Never Knew This Was a Thing!,"Hello all, first time posting! Just looking for some much appreciated advice - I'm a little lost.

My wife and I were involuntarily bumped off of a flight from New Zealand to Los Angeles a few weeks ago. 

Long story short, at the desk, we were told they don't have seats for us due to overbooking an",https://www.reddit.com/r/Flights/comments/1spp0t3/involuntarily_bumped_from_aukland_to_lax_i_never/,75,44,Worried-Walrus-2601,2026-04-19,no compensation,LEVEL_1_AWARE
flights,1syva2w,China Eastern SGN-NGB (Lishe) canceled,"While returning to Europe from Vietnam (Saigon), we had a flight with China Eastern. On the day of departure, when we went to check in, we were informed that our flight had been canceled several days earlier. However, we did not receive any notification by email or SMS. In a way, we feel fortunate b",https://www.reddit.com/r/Flights/comments/1syva2w/china_eastern_sgnngb_lishe_canceled/,5,9,magoratt,2026-04-29,no compensation,LEVEL_1_AWARE
flights,1sq6xps,What are my rights? (Flight booking),"I’m UK based. Recently bought a flight from the UK to Thailand via Saudia airlines. I bought this ticket through a travel agent (a gamble I know!!)

Less than 2 weeks to departure I receive an email saying that my flight schedule has been amended. This has resulted in what should be around a 2 hour ",https://www.reddit.com/r/Flights/comments/1sq6xps/what_are_my_rights_flight_booking/,3,8,onionskin1234,2026-04-19,no compensation,LEVEL_1_AWARE
flights,1soglo9,Business Class ; Downgrade not allowed,"Booked a once in a life time ,business flight on Malaysian for June.    2 Int / 2 Dom (1 hr ) sectors.

The 8.00 Dom flight has been cancelled and replaced by 13.00 flight which does not suit as have made prior arrangements requiring to be at destination before 12.00.

Investigated and found MH LLC ",https://www.reddit.com/r/Flights/comments/1soglo9/business_class_downgrade_not_allowed/,2,7,Safe_Application_465,2026-04-17,no compensation,LEVEL_1_AWARE
flights,1srxu0c,JFK-LAX 3-hour tarmac delay...what did American Airlines actually deliver to you?,"recently had a frustrating experience and attempting to determine whether this is normal or not.

flight was American Airlines AA123 (JFK to LAX), which was booked on the AA site. this was in the month of march 2026.

we were on time at jfk but spent more than 3 hours on the tarmac before takeoff, w",https://www.reddit.com/r/Flights/comments/1srxu0c/jfklax_3hour_tarmac_delaywhat_did_american/,1,8,DrewJohn22323,2026-04-21,no compensation,LEVEL_1_AWARE
flights,1sl0but,EU216 applicability for same-day rerouting,"Visitors from Italy who were supposed to fly back on a direct ITA Airways flight SFO to FCO had their return flight cancelled less than 36hrs before departure without explanation (and there's no strike, no weather issues), and were offered a same-day but 1 stop flight SFO-London Heathrow-FCO (UA 948",https://www.reddit.com/r/Flights/comments/1sl0but/eu216_applicability_for_sameday_rerouting/,1,5,Aggravating-Pin4262,2026-04-14,no compensation,LEVEL_1_AWARE
flights,1sm9gdy,china southern airline - damaged luggage and no response.,"Hey guys, I flew with china southern airline to London from guangzhou a few months ago.

My checked luggage was damaged and I'm trying to get compensation for that (or at least damaged luggage pip).

I've tried any email i could find online (lonreservation@csair.com and csair.heathrowairport@hotmail",https://www.reddit.com/r/Flights/comments/1sm9gdy/china_southern_airline_damaged_luggage_and_no/,0,9,JebacBiede2137,2026-04-15,no compensation,LEVEL_1_AWARE
flights,1srigky,Help with EU compensation Lufthansa strike,"I had a flight from BKK-MUC-IAD operated by Thai Airways and Lufthansa. The Lufthansa leg MUC-IAD was cancelled less than 24 hours before the scheduled flight due to the Lufthansa strike. 

I had to rebook and was put on a flight with a connection that departed more than 4 hours sooner. 

Would this",https://www.reddit.com/r/Flights/comments/1srigky/help_with_eu_compensation_lufthansa_strike/,0,5,Soggymilk95,2026-04-21,no compensation,LEVEL_1_AWARE
flights,1sohslc,lost baggage malaysia airlines,i was on a flight from south korea to australia with a transfer at kuala lumpur and when i arrived my bag was nowhere to be found. i got help and they said it had been sent to sri lanka 😭😭. it’s been three days and they've “located” the bag but it still hasn’t arrived which is so weird cause there’s,https://www.reddit.com/r/Flights/comments/1sohslc/lost_baggage_malaysia_airlines/,0,5,bells_0720,2026-04-17,no compensation,LEVEL_1_AWARE
flights,1sg55ei,do NOT use TravoDeals.us,"hello everyone!

i don’t post on reddit often so if this is the wrong thread, feel free to delete or move.

i wanted to take a solo one day trip to NYC this weekend to visit my friends and see Whitney Leavitt and Mark Ballas in Chicago. I was trying to find the cheapest round-trip flight possible. I",https://www.reddit.com/r/Flights/comments/1sg55ei/do_not_use_travodealsus/,0,10,slm100602,2026-04-08,customer service hell,LEVEL_2_STRUGGLING
flights,1sp5lsj,Denied boarding on a flight from US to UK. Which compensation rules apply?,"I was involuntarily denied boarding on a flight from the US to the UK. I was given another flight 16 hours later and spent the night in a hotel, which I had to pay for out or pocket. 

The flight was sold by British Airways, operated by American Airlines. Both the UK Civil Aviation Authority and the",https://www.reddit.com/r/Flights/comments/1sp5lsj/denied_boarding_on_a_flight_from_us_to_uk_which/,10,41,willyweewah,2026-04-18,delayed hours,LEVEL_1_AWARE
flights,1srij89,SriLankan Airlines cancelled my connecting flight – need advice,"Flying Mumbai → Colombo → Singapore on 24–25 April. Original plan had me landing in Singapore morning of 25th, with 2 full days there before flying to Bali on 27th (all hotels/activities booked).

Airline cancelled my Colombo → Singapore leg and rebooked me on a flight arriving evening of 26th (24+ ",https://www.reddit.com/r/Flights/comments/1srij89/srilankan_airlines_cancelled_my_connecting_flight/,3,3,thisisit99pt99,2026-04-21,delayed hours,LEVEL_1_AWARE
flights,1spndc4,Brussels Passport Control,"Just home from an overseas trip and a genuine question for the experts:

Flying BRU-PEK-KIX, stayed at the airport night before, arrived at check in 3hr 15 mins before departure.

Checked in after 30 mins, then straight to border control.

Flying on a UK passport so, thanks to Brexit (/s) - in the """,https://www.reddit.com/r/Flights/comments/1spndc4/brussels_passport_control/,3,23,scruffybadger19,2026-04-19,delayed hours,LEVEL_1_AWARE
flights,1su4u6d,What do you think of this flight choice? From Canada to China $875 with 2 stopovers,"Hi guys, I am planning to fly from Canada to China. Here is a flight I found on Air Canada official website. What do you guys think? Good price? Good airlines?

My main questions are: a) if I should wait out for a lower price even the website states the tickets are selling out; b) if I overlooked an",https://www.reddit.com/r/Flights/comments/1su4u6d/what_do_you_think_of_this_flight_choice_from/,3,20,lisagg9,2026-04-23,delayed hours,LEVEL_1_AWARE
flights,1sraik3,American vs. Delta vs. United: Which Airline Out Of The Big Three Has The Best Domestic First Class?,I rarely fly Delta and I never even flown Delta first class ever in my life until this one trip where I found Delta Airlines First Class cheaper than Spirit Airlines with all the extra add-ons for the big front seat. Below you will find which airline wins in every single category. (I flew on A321s f,https://www.reddit.com/r/Flights/comments/1sraik3/american_vs_delta_vs_united_which_airline_out_of/,2,9,The_Traveller1,2026-04-20,delayed hours,LEVEL_1_AWARE
flights,1srz9cm,Is this common?,"On an Alaska Air flight from DCA to PDX, the flight attendant was giving the announcements for preparing the cabin for landing. They added at the end to 'leave your belongings behind in the event of an evacuation' which I didn't think was customarily part of the pre-landing script, but is always at ",https://www.reddit.com/r/Flights/comments/1srz9cm/is_this_common/,1,13,catsfromjapan,2026-04-21,delayed hours,LEVEL_1_AWARE
delta,1swoag3,Nightmare on Delta,"Throwaway account, since the internet is scary good at stalking people with minimal info. 

UPDATE (in lieu of responding to 380 comments): We were eventually able to board when the new pilots finally arrived from NYC, but then we experienced another lengthy delay on the tarmac because of Delta's mi",https://www.reddit.com/r/delta/comments/1swoag3/nightmare_on_delta/,1470,394,TAway_Extreme_Drama,2026-04-26,stranded airport,LEVEL_2_STRUGGLING
delta,1srab6b,Checked luggage mishandled,"Today I was on DL175 from MXP to ATL, and I checked my bag because I didn’t want to deal with the liquid rules in Europe. When I got to the gate almost an hour before boarding, the gate agent was offering 2000 euros to anyone willing to take the later flight to JFK instead. She was still offering wh",https://www.reddit.com/r/delta/comments/1srab6b/checked_luggage_mishandled/,11,23,goaliegirl4evr,2026-04-20,lost luggage,LEVEL_1_AWARE
delta,1sr06be,Something’s up with bags going through AMS,"Delta/KLM lost my bags on both legs of my round trip flight with connections in AMS (traveling Seattle to Manchester UK via Amsterdam Schiphol). On my outbound trip, I assumed it was because I had a shorter layover of 90 minutes in AMS, even though my flight had arrived early. 

On the way back home",https://www.reddit.com/r/delta/comments/1sr06be/somethings_up_with_bags_going_through_ams/,2,2,jxmpiers,2026-04-20,lost luggage,LEVEL_2_STRUGGLING
delta,1sbdrcw,Damaged bag,"We moved (military family) from Japan to the states and checked multiple bags. They lost one and damaged another two. When I reached out about one of them (a dog crate, they paid for it to be replaced no questions asked), the other one they sent me a link to get one of their bags from a website. I l",https://www.reddit.com/r/delta/comments/1sbdrcw/damaged_bag/,0,1,butterginger,2026-04-03,lost luggage,LEVEL_1_AWARE
delta,1sxhcqj,Predeparture Potty Break,The other day I had to book a last minute flight and of course the flight was completely full and I got a wonderful seat at the very back of the plane.  I boarded with my assigned group and made my way to the back of the plane.  As I sat in my seat I noticed passenger after passenger make their way ,https://www.reddit.com/r/delta/comments/1sxhcqj/predeparture_potty_break/,333,253,roadwarrior2026,2026-04-27,missed connection,LEVEL_1_AWARE
delta,1sej5ea,Apparently embellished by Facebook but fact checked as true,,https://www.reddit.com/r/delta/comments/1sej5ea/apparently_embellished_by_facebook_but_fact/,251,37,BostonNU,2026-04-06,missed connection,LEVEL_1_AWARE
delta,1sv9fok,Delta’s system silently cancelled my return flights with ZERO notification — agent admitted it in writing — still no refund,"Looking for advice from anyone who’s dealt with something similar.

I had a round-trip ticket PHL→DTW→PVG, with return flights on May 30 (DL 388 PVG→DTW, DL 1391 DTW→PHL). In March, my first flight was delayed due to what Delta called ‘an unexpected interruption,’ causing me to miss my connection. D",https://www.reddit.com/r/delta/comments/1sv9fok/deltas_system_silently_cancelled_my_return/,93,56,bubblemichico,2026-04-25,missed connection,LEVEL_2_STRUGGLING
delta,1sh4y95,Thank you Delta,"I booked a flight for myself &amp; my 2 teenage boys to Germany a couple months ago. Delta changed the flight schedule, which meant I had 50 minutes from my connection (CAE) in ATL from landing time to departing time. A little tight for missing an 9 hour flight to Europe.  
  
Delta has at least hal",https://www.reddit.com/r/delta/comments/1sh4y95/thank_you_delta/,42,11,jtr8178,2026-04-09,missed connection,LEVEL_1_AWARE
delta,1srw2mf,"BOS, JFK, or CDG for transfer LIS&gt;SEA?",I have three options for getting home to SEA from LIS in September.   I'm used to non-stop flights SEA&gt;CDG or SEA &gt;AMS and the uncertainty of immigration waits and re-checking bags at the first US stop always makes me a little nervous.  I see a lot of tears at SEA international arrivals from p,https://www.reddit.com/r/delta/comments/1srw2mf/bos_jfk_or_cdg_for_transfer_lissea/,2,21,Francoisepremiere,2026-04-21,missed connection,LEVEL_2_STRUGGLING
delta,1sss5c0,Planning in advance: What to do if flight operating by partner airline got rescheduled?,"Hi all,

I booked Delta for YVR-LAX, LAX-LIM with first leg flying WestJet and second leg flying LATAM. Both flights on one booking, with a long 9hr layover in LAX. Being a person who always overthink, in case my YVR-LAX leg got cancelled/rescheduled to another time that causes me to miss my connect",https://www.reddit.com/r/delta/comments/1sss5c0/planning_in_advance_what_to_do_if_flight/,1,2,WheelOk1130,2026-04-22,missed connection,LEVEL_1_AWARE
delta,1syy7r0,Changing international flight - do I need to talk with an agent?,"(tl;dr at the end, a lot of background/context here)

I booked an international vacation for the family for this summer. The return flight connects through ATL. When I booked, the connection was 2:50, which I felt was about perfect for an international-domestic transfer. Plenty of time to get throug",https://www.reddit.com/r/delta/comments/1syy7r0/changing_international_flight_do_i_need_to_talk/,1,15,DaveSauce0,2026-04-29,missed connection,LEVEL_2_STRUGGLING
delta,1syln4h,Confused about seat assignments,"Help me think this through. I booked main cabin as a platinum and got the immediate C+ upgrade. Later, we added my wife to the trip on a separate reservation. No status but has her own purple card. Our first flight was delayed by weather, causing us to miss our connection. Rebooked on the next fligh",https://www.reddit.com/r/delta/comments/1syln4h/confused_about_seat_assignments/,1,3,bradpmo,2026-04-28,missed connection,LEVEL_1_AWARE
delta,1slfbme,Overlapping layover?,This hasn't ever happened to me before and I don't usually fly delta so wondering for some help. I have a flight from Boston to Minneapolis tomorrow that lands at 10:27 and my flight boards from Minneapolis to Palm Springs at 10:20? Doubting that's really enough time for me to get from one flight to,https://www.reddit.com/r/delta/comments/1slfbme/overlapping_layover/,1,17,Immediate_Shine1403,2026-04-14,missed connection,LEVEL_1_AWARE
