subreddit,post_id,title,selftext_snippet,url,score,num_comments,author,created_date,search_term,category
flights,1sqjt16,Kiwi.com loses collective lawsuit- will refund millions.,"The Austrian Chamber of Labor has won a significant legal victory against the Kiwi.com platform. The court has found 31 violations.  For example  forced ""Kiwi credits"" instead of money refunds, even when the carrier cancelled the flight.  Charging for luggage after showing an airline tariff where lu",https://www.reddit.com/r/Flights/comments/1sqjt16/kiwicom_loses_collective_lawsuit_will_refund/,59,12,ReasonableSecond2565,2026-04-20,flight canceled,LEVEL_1_AWARE
flights,1sr6v85,Flight cancellations out of control,I've been stuck in Cancun after two Frontier flights cancelled two days in a row. Now I need to wait another day for tomorrows flight. I need to get home!!,https://www.reddit.com/r/Flights/comments/1sr6v85/flight_cancellations_out_of_control/,55,31,mrstring,2026-04-20,flight canceled,LEVEL_1_AWARE
flights,1suh4ya,Denied Boarding - Help Please,"Hello,

A few weeks ago, we were denied boarding for our flight with Eurowings due to the incorrect spelling of our names. But we have checked, and we input all of our information correctly when the tickets were booked.

We have the receipt and the travelling documents from the GoToGate website as p",https://www.reddit.com/r/Flights/comments/1suh4ya/denied_boarding_help_please/,23,40,HedgehogMuch3459,2026-04-24,flight canceled,LEVEL_1_AWARE
flights,1s9pqgq,"Breeze airways demanding more money after confirmed flight purchase, or pay cancellation fee","My parents booked a flight on breeze airways (domestic, U.S.) next month. Now, they received an email that said “there’s been a change” but not what the change was. After calling, they said that the fare has now rose $250 a person (so $500) because of fuel costs, or, my parents had to pay a cancella",https://www.reddit.com/r/Flights/comments/1s9pqgq/breeze_airways_demanding_more_money_after/,21,13,Dry-Author4891,2026-04-01,flight canceled,LEVEL_1_AWARE
flights,1s9l286,My flight got cancelled which new flight should I pick, Which flight should I pick? ,https://www.reddit.com/r/Flights/comments/1s9l286/my_flight_got_cancelled_which_new_flight_should_i/,17,66,Annual-Grass-8347,2026-04-01,flight canceled,LEVEL_1_AWARE
flights,1smb95q,Norse Cancellation Refund or Rebook free of charge?,"Hi, Norse have cancelled my flight to LA. They offered this new route free of charge via trip.com. Should I refund or risk it with the tight layovers? A refund will be + 400 pounds…",https://www.reddit.com/r/Flights/comments/1smb95q/norse_cancellation_refund_or_rebook_free_of_charge/,12,11,Lewis1316,2026-04-15,flight canceled,LEVEL_1_AWARE
flights,1sgxak7,Flight landed in the wrong country - help!,"Hi, this is my first time on this sub, but could really use some advice from some frequent flyers!

  
Last week me and my girlfriend went on holiday with easyJet, flying Manchester to Dubrovnik. We'd sorted our own transport in the country to then head to Montenegro a couple days later, then flying",https://www.reddit.com/r/Flights/comments/1sgxak7/flight_landed_in_the_wrong_country_help/,400,111,Rickabeast,2026-04-09,stranded airport,LEVEL_2_STRUGGLING
flights,1s720wv,"Air India cancelled my flight after boarding 27hr delay, no support. Am I right to claim £520 compensation per person?","Had a pretty shocking experience with Air India and wanted to sanity check + get advice.

Flight AI114 (Birmingham → Delhi) on 28 March 2026:

	•	Scheduled: 20:45

	•	Delayed to: 23:55

	•	Then cancelled AFTER boarding

	•	We were made to get off the plane and leave the airport

	•	No staff availabl",https://www.reddit.com/r/Flights/comments/1s720wv/air_india_cancelled_my_flight_after_boarding_27hr/,0,15,Ramoheet,2026-03-29,stranded airport,LEVEL_2_STRUGGLING
americanairlines,1stwapc,Help me understand why an American Airlines representative would tell me I need to pay when we were deplaned due to equipment issues and the flight was cancelled,"I was flying AA domestically with an economy ticket yesterday. After taxiing to the runway my flight returned to the gate due to equipment issues. We were deplaned and the flight was cancelled. Back at the gate, gate attendants gave us cards with instructions to call a number to be rebooked.

Note: ",https://www.reddit.com/r/americanairlines/comments/1stwapc/help_me_understand_why_an_american_airlines/,243,36,Significant_Sky4635,2026-04-23,flight canceled,LEVEL_1_AWARE
americanairlines,1sd3aje,Use Finnair more for Asia,I was scheduled yesterday from central Illinois to DFW then to ICN.  Woke up early flight delayed and was going to miss connection.  Get on a phone with AA to look at options.  Her solution was to try again tomorrow so I was like let’s think outside the box.  Can can’t to ORD by 11 so what are optio,https://www.reddit.com/r/americanairlines/comments/1sd3aje/use_finnair_more_for_asia/,37,26,Iflysims,2026-04-05,flight canceled,LEVEL_1_AWARE
americanairlines,1saagig,AA bumped me involuntarily and didn’t refund me at all,"Some freak IT accident happened. I arrived to boarding and they said my ticket’s been cancelled. The gate agent didn’t explain anything to me and she said she didn’t know why. No explanation. I complained to AA and they didn’t refund me at all.

Edit: I didn’t show up when the gate was closed, nor t",https://www.reddit.com/r/americanairlines/comments/1saagig/aa_bumped_me_involuntarily_and_didnt_refund_me_at/,37,64,englishmeninnewyork,2026-04-02,flight canceled,LEVEL_2_STRUGGLING
americanairlines,1sqxl6q,Compensation for Reservation Agent Error,Booked a OneWorld Round the World business class trip ticketed by American Airlines 6 months prior to departure to celebrate milestone events (40 year anniversary and 70 year birthday). Called to make change to itinerary 3 days before departure due to war in the Middle East. A few hours later we dis,https://www.reddit.com/r/americanairlines/comments/1sqxl6q/compensation_for_reservation_agent_error/,31,51,Severe-Psychology388,2026-04-20,flight canceled,LEVEL_1_AWARE
americanairlines,1sqp8o8,"Wifi differences between paid and ""free""","Hi,

I have been paying for the 2 device monthly Wifi plan for $59.95/month. Now that most flights offer free wifi, is there any benefit to keeping this plan? I expense it, so am not that worried about the cost if there is actually a benefit. Thank.

  
EDIT: Thanks all. Have sent my request to canc",https://www.reddit.com/r/americanairlines/comments/1sqp8o8/wifi_differences_between_paid_and_free/,11,29,playasnake,2026-04-20,flight canceled,LEVEL_1_AWARE
americanairlines,1sgdd81,Can anyone check the reason AA 953 was delayed 12 hours today?,Can anyone tell why AA 953 from JFK-EZE was delayed 12 hours?  It sounds like there was a delayed aircraft but at the same time the app is showing the incoming aircraft arrived at JFK already.  At least the flight wasn't cancelled (please knock on wood for me) ,https://www.reddit.com/r/americanairlines/comments/1sgdd81/can_anyone_check_the_reason_aa_953_was_delayed_12/,10,36,RyanAirhead,2026-04-08,flight canceled,LEVEL_1_AWARE
americanairlines,1s7n4c4,Flight not showing up in FlightAware…ghost flight?,"My family is on this flight this AM and I’m trying to track it in FlightAware, but it doesn’t show up. About 2 days ago their flight was “cancelled” and they were rebooked (exact same time/destination but diff aircraft and different regional carrier). Tried looking it up by both AA and the regional ",https://www.reddit.com/r/americanairlines/comments/1s7n4c4/flight_not_showing_up_in_flightawareghost_flight/,9,9,og_kylometers,2026-03-30,flight canceled,LEVEL_1_AWARE
americanairlines,1shr9mq,Why are upgrade offers frequently much more expensive than changing or rebooking your ticket to First or Business? In,"In this example of a flight I recently booked with points the upgrade offer would cost 173,000 miles but to change the ticket from MC to F is 38,500???  The cost differential between upgrade and change is about the same for paying cash.  About $1,700 vs $400.

This is a pretty extreme example with t",https://www.reddit.com/r/americanairlines/comments/1shr9mq/why_are_upgrade_offers_frequently_much_more/,9,17,NumbDumbLuck,2026-04-10,flight canceled,LEVEL_1_AWARE
americanairlines,1sh2vef,Catering Issue at JFK,"My direct flight from JFK to HND was canceled this morning due to a catering issue. Both the gate agent and the agent who rebooked me mentioned that the airline recently switched to a new catering company that wasn’t prepared to handle the volume of flights.

As a result of the cancellation, I was m",https://www.reddit.com/r/americanairlines/comments/1sh2vef/catering_issue_at_jfk/,6,13,kbugs14,2026-04-09,flight canceled,LEVEL_1_AWARE
americanairlines,1s55moc,Reclaiming air miles for cancelling a future trip,"UPDATE:  I just cancelled, airmiles were instantly returned.  Thanks u/flyingron 

I recently used air miles to book a flight.   Now I plan to cancel that trip and plan to rebook it via another flight.

Do my airmiles used for the future flight, get immediately added back to my account, so that, I c",https://www.reddit.com/r/americanairlines/comments/1s55moc/reclaiming_air_miles_for_cancelling_a_future_trip/,6,4,gantte,2026-03-27,flight canceled,LEVEL_1_AWARE
americanairlines,1snkbgh,Wife and kids stranded because staff unfamiliar with UK evisa,"\*\*American Airlines staff couldn't process my wife's UK eVisa — she has now missed her flight home, stranded with our two children\*\*

My wife is a US citizen with Indefinite Leave to Remain (ILR) in the UK. She was trying to fly back home today. AA's check-in staff were unable to process her bec",https://www.reddit.com/r/americanairlines/comments/1snkbgh/wife_and_kids_stranded_because_staff_unfamiliar/,151,95,Available-Theory-808,2026-04-16,stranded airport,LEVEL_2_STRUGGLING
americanairlines,1svcooi,"I don't like to complain, but...","I don’t like to complain and usually give businesses grace when things go wrong. But people should know about this experience.

I bought a round-trip ticket to Norway through American Airlines. My flight there was smooth. While in Norway, I was on a cruise with limited internet and didn’t check emai",https://www.reddit.com/r/americanairlines/comments/1svcooi/i_dont_like_to_complain_but/,0,12,Alternative-Vast6865,2026-04-25,stranded airport,LEVEL_2_STRUGGLING
americanairlines,1s6lpxn,Lost carry on at ORD Terminal 3 on March 26th — any advice on recovering through AA lost and found?,"Hi, I landed at ORD from LGA at around 3 PM on March 26th 2026 and lost my carry on suitcase somewhere between gate K5 of Terminal 3 and the Sky Train. The suitcase is a dark petrol blue Samsonite hard shell carry on. There was nothing financially valuable inside, just personal belongings and clothe",https://www.reddit.com/r/americanairlines/comments/1s6lpxn/lost_carry_on_at_ord_terminal_3_on_march_26th_any/,13,14,tbm1999,2026-03-29,lost luggage,LEVEL_1_AWARE
americanairlines,1sd81v8,Delayed/Lost Baggage FYI,If anyone has a lost luggage/delayed bag FYI make sure your case is remains open until the delivery is complete. Flew AA from to Frankfurt and had to get on an earlier flight to make my connecting flight to DFW. Bag never made it on the flight that I was on and arrived the next morning. AA says they,https://www.reddit.com/r/americanairlines/comments/1sd81v8/delayedlost_baggage_fyi/,1,3,cdw23chance,2026-04-05,lost luggage,LEVEL_2_STRUGGLING
americanairlines,1svz6n1,I'm done with American airlines,"Wondering if anybody is sharing my same experience. My recent experience is close to one out of every four fights is severely delayed or canceled, lost luggage at about the same rate.  They've never been on the same level as Delta but it's getting to the point now where I cannot risk flying on Ameri",https://www.reddit.com/r/americanairlines/comments/1svz6n1/im_done_with_american_airlines/,0,12,Disastrous-Garage-71,2026-04-26,lost luggage,LEVEL_2_STRUGGLING
americanairlines,1s86aif,American is ruining their business,"In the last week American Airlines has lost my luggage between getting it off my plane and getting it to the carousel, messed up my itinerary and then not let me on my flight, and delayed my flights by a total of 9 hours. 

There was no inclement weather. Their problems were all terrible customer se",https://www.reddit.com/r/americanairlines/comments/1s86aif/american_is_ruining_their_business/,0,4,NoiseBorn638,2026-03-30,lost luggage,LEVEL_2_STRUGGLING
americanairlines,1s93y0v,Thanks. Tracking my bags in this situation really helps.,,https://www.reddit.com/r/americanairlines/comments/1s93y0v/thanks_tracking_my_bags_in_this_situation_really/,37,5,DougieMcElroy,2026-03-31,missed connection,LEVEL_1_AWARE
americanairlines,1su1i1j,Can’t Unlock Account after Fraud Notice,"At a loss with AA customer service, first of all I was on a flight a few weeks ago from DFW to HND that took off then about 3 hours in returned to DFW for maintenance and was subsequently delayed 33 hours with no available alternatives for days. Once I finally arrived in Tokyo and missed my connecti",https://www.reddit.com/r/americanairlines/comments/1su1i1j/cant_unlock_account_after_fraud_notice/,11,5,GigemAg18,2026-04-23,missed connection,LEVEL_2_STRUGGLING
americanairlines,1swfoit,1hr or 6hr layover in Philly - what would you do?,"Hi! I am booking a flight from Austin - Philly - Zurich this fall on American Airlines. My options are a 1 hr 15 min connection or a 6-hour connection. 

Traveling will be me (32F), my husband (35M), and our child (2F). We are seasoned travellers, but going back and forth on which layover to pick. 
",https://www.reddit.com/r/americanairlines/comments/1swfoit/1hr_or_6hr_layover_in_philly_what_would_you_do/,3,64,Ladylurker_,2026-04-26,missed connection,LEVEL_1_AWARE
americanairlines,1sjrrm6,MCO &gt; PHL &gt; DUB – 24hr Delay + Reroute via LHR. Is 7.5k miles a fair 'goodwill' offer?,"

 Hi everyone, Help Needed. I’m looking for some perspective on a recent disruption with AA and whether I should push for a better settlement.

**The Details:**

·        **Route:** Orlando (MCO) -&gt; Philadelphia (PHL) -&gt; Dublin (DUB).

·        **The Issue:** First leg (MCO-PHL) was delayed d",https://www.reddit.com/r/americanairlines/comments/1sjrrm6/mco_phl_dub_24hr_delay_reroute_via_lhr_is_75k/,2,4,Horror_Zucchini2886,2026-04-12,missed connection,LEVEL_1_AWARE
americanairlines,1skapyg,Short Connection at PHX on American Airlines Award Ticket – Can I Cancel If I Miss It?,"Hi,

I’m planning to book a short connection using AAdvantage miles on the American Airlines website. My international business class flight arrives at PHX at 5:40 PM, and my connecting flight home departs at 6:50 PM. I also have Global Entry.

Since there are no later flights the same day and I nee",https://www.reddit.com/r/americanairlines/comments/1skapyg/short_connection_at_phx_on_american_airlines/,0,7,RevolutionarySouth60,2026-04-13,missed connection,LEVEL_1_AWARE
americanairlines,1sokam2,Missing Seat Map,"Any idea why the seat map would be missing for only one leg of my flight? I have a flight from PHL to Jackson, WY in September connecting in Chicago both ways and for 3/4 of the legs I was able to select my seat, but it wouldn’t allow me to do so on the Chicago to JAC leg.  It is operated by AA and ",https://www.reddit.com/r/americanairlines/comments/1sokam2/missing_seat_map/,0,13,Agreeable_Ad9959,2026-04-17,missed connection,LEVEL_1_AWARE
americanairlines,1svrbcb,Difficulty in Reaching American Airlines Refund Service or Customer Service by Phone,"I was originally booked on PBI-ORD-SPI on 4/20/2026.  That flight was rebooked by AA because I would miss my connection to SPI from ORD due to the delay in leaving from PBI.  Now I was to leave the next day, 4/21/2026 from PBI.  That flight too was delayed as a result of which I missed my connection",https://www.reddit.com/r/americanairlines/comments/1svrbcb/difficulty_in_reaching_american_airlines_refund/,0,10,Scared_Astronomer245,2026-04-25,missed connection,LEVEL_2_STRUGGLING
americanairlines,1swaa2q,DFW Connection Time - Feasible?,"Hi! I am looking to travel JFK - MEX. AA is offering a connection through DFW but its looking tight. **Flight 1 is scheduled to arrive at 930am and the flight to MEX departs at 1021am. For those familiar, can I actually make this connection?** There are three more flights later in the day so hopeful",https://www.reddit.com/r/americanairlines/comments/1swaa2q/dfw_connection_time_feasible/,0,16,maverick4002,2026-04-26,missed connection,LEVEL_1_AWARE
americanairlines,1sa1ikt,AA- First Class Upgrade Issue,"I’m booked round trip PHX to ALB in June. I booked economy and now want to upgrade. I upgraded the outbound flights at a reasonable price in app that aligned with the published fare. However, on the return, AA is quoting me over $1200 to upgrade while the published price is only $869. I should only ",https://www.reddit.com/r/americanairlines/comments/1sa1ikt/aa_first_class_upgrade_issue/,0,14,Gaybors,2026-04-01,airline nightmare,LEVEL_1_AWARE
americanairlines,1slko1n,I booked hotel with miles and the hotel charged me a hotel fee??,I booked one night stay at the Ambassador in Chicago with miles and what was supposed to be a free stay for the night turned into a nightmare. I was not told about the $123 hotel resort fee ahead of time and it was so late in the night that by the time I got there that I had no choice to pay. The de,https://www.reddit.com/r/americanairlines/comments/1slko1n/i_booked_hotel_with_miles_and_the_hotel_charged/,0,26,Ok-Water-7110,2026-04-14,airline nightmare,LEVEL_1_AWARE
americanairlines,1sru74r,worst airline experience ever,"I was scheduled to fly on American Airlines from Sydney to Los Angeles on Monday, April 6, 2026 at 9:10 AM. In order to make this flight I was flying from Melbourne, which is where I was vacationing, to Sydney on Qantas on April 5 at 6:30 PM and spending the night at a hotel at the airport. Both of ",https://www.reddit.com/r/americanairlines/comments/1sru74r/worst_airline_experience_ever/,0,12,Entire-Case-6669,2026-04-21,airline nightmare,LEVEL_2_STRUGGLING
americanairlines,1s5ke36,Done with this airline,"A couple of weeks ago I took my wife and my 2 daughters on a trip to visit family.  When I bought the tickets, first class tickets were not that much more than economy plus so I splurged for the first time in my life on first class.

Day of our travel to my family, we get to the airport and are told",https://www.reddit.com/r/americanairlines/comments/1s5ke36/done_with_this_airline/,0,15,Dull_Lavishness7701,2026-03-27,airline nightmare,LEVEL_2_STRUGGLING
americanairlines,1sbas7t,Award flight compensation for broken TV.,"I was told at the gate that the tv set in my seat was broken and they couldn’t reseat me as there were no seats available in the same class (first). Since it’s a 10 hour flight, I am kinda bummed out. Do I get any kind of compensation, if I booked my flight with miles and how do I do that? Thanks. ",https://www.reddit.com/r/americanairlines/comments/1sbas7t/award_flight_compensation_for_broken_tv/,12,49,henrybios,2026-04-03,no compensation,LEVEL_1_AWARE
americanairlines,1sl83kt,"Power outage in Business Premium, options?","My mom was on an American Airlines flight from DFW to Frankfurt recently, flying in the business class Flagship seats, and the experience was pretty disappointing.

Apparently the entire cabin had no power for the whole flight. The seats wouldn’t recline at all, no controls worked, nothing. So she e",https://www.reddit.com/r/americanairlines/comments/1sl83kt/power_outage_in_business_premium_options/,10,21,Blade4804,2026-04-14,no compensation,LEVEL_1_AWARE
americanairlines,1sbr5gq,Have you had any success getting flight credits when a flight has been delayed 16hr (overnight flight)?,"We finally got reboarded and the couple in another row mentioned they were paid $1200/each (family of 3) to move their flights. They had no pressing time commitment so scored a nice boost to their travels. Happy for them. 

Has anyone had luck getting flight compensation for long delays? I ask becau",https://www.reddit.com/r/americanairlines/comments/1sbr5gq/have_you_had_any_success_getting_flight_credits/,5,13,MysteriousHeron5726,2026-04-03,no compensation,LEVEL_1_AWARE
americanairlines,1skottx,AA204 - April 11th,"Our flight was supposed to leave 4/11 at 6pm. We actually took off, but then had engine trouble and had to circle for \~20 minutes before landing. Annoying, but fine—stuff happens, right?

Then we’re told the next flight isn’t for 22 hours. They give us a hotel voucher (for a pretty sketchy place) a",https://www.reddit.com/r/americanairlines/comments/1skottx/aa204_april_11th/,1,5,mysticalbuti,2026-04-13,no compensation,LEVEL_2_STRUGGLING
americanairlines,1sapta2,How to get compensated for unexpected cancellation with no notice,"Hello! my family and I just went on a trip to the DR, and while we were there we noticed our flight disappeared from our booking app and i had not received any sort of email or notification that it had gotten cancelled. just missing from the app. when we contacted our third party booking app they to",https://www.reddit.com/r/americanairlines/comments/1sapta2/how_to_get_compensated_for_unexpected/,0,8,elkevonmerck,2026-04-02,no compensation,LEVEL_1_AWARE
americanairlines,1srdgpl,Almost 90 minutes since landing…,And no sign of our bags at LAX. What’s the chance of compensation of some sort…,https://www.reddit.com/r/americanairlines/comments/1srdgpl/almost_90_minutes_since_landing/,0,15,Hairy-Strategy-5027,2026-04-21,no compensation,LEVEL_1_AWARE
americanairlines,1scqa0c,Gate closed as walking up,Was in Cancun with my wife for anniversary. Our initial flight on American was delayed coming back and customs took forever. We were close to making it to our last flight and legit the lady saw me sprinting as it said final boarding. As I’m about 10 feet away she said no and closed it. Like holy hel,https://www.reddit.com/r/americanairlines/comments/1scqa0c/gate_closed_as_walking_up/,123,92,Gaijingamer12,2026-04-04,customer service hell,LEVEL_2_STRUGGLING
americanairlines,1sngc9k,SUPER PROPS to the pilot and GA here in Little Rock,"Flight 3113 from Little Rock to DFW delayed two hours due to late incoming plane from DFW.  The Pilot - tag teaming with the gate attendant but taking the lead - made a great announcement…

Explained why we were late. Explained why he didn’t know all the details himself.  And then clearly stated tha",https://www.reddit.com/r/americanairlines/comments/1sngc9k/super_props_to_the_pilot_and_ga_here_in_little/,23,3,NYerInTex,2026-04-16,delayed hours,LEVEL_1_AWARE
americanairlines,1sfw743,Should I stop flying out of regional airport (GSP) and start driving two hours to CLT? Or is this just recency bias?,My last 3 to 4 flights out of GSP have been an absolute nightmare. Multiple 15+ hour delays when the Embraer 175s (or in one case an airbus) has a maintenance issue and there are no parts or available mechanics in GSP. I flew twice a month last year out of GSP with very few issues but now I am gun s,https://www.reddit.com/r/americanairlines/comments/1sfw743/should_i_stop_flying_out_of_regional_airport_gsp/,10,33,MJE0409,2026-04-08,delayed hours,LEVEL_1_AWARE
americanairlines,1sa7hkm,Shout out to the Toronto Admirals Lounge staff!!!,"I wanted to give a shout out to the lovely staff in the Toronto Admirals Lounge. I’m not sure if I have been to a smaller lounge, but the staff were so nice and helpful this afternoon! (April 1) Due to a delay I was hanging out for 4.5+ hours.  I watched people come and go, it got especially crowded",https://www.reddit.com/r/americanairlines/comments/1sa7hkm/shout_out_to_the_toronto_admirals_lounge_staff/,8,6,wilgey22,2026-04-02,delayed hours,LEVEL_1_AWARE
americanairlines,1s5kr8j,“The catering is still 10 minutes away”,"JFK to LHR kept being delayed from 11:20 a.m. departure, for maintenance reasons, then it was bumped to 7:50 p.m. departure, no boarding began at 7:00, AA claiming catering putting food on plane then promptly hid. 

42 minutes later- AA announces that the catering is actually still “10 minutes away”",https://www.reddit.com/r/americanairlines/comments/1s5kr8j/the_catering_is_still_10_minutes_away/,6,4,YourMothersButtox,2026-03-27,delayed hours,LEVEL_1_AWARE
americanairlines,1sg0du0,Ridiculous AA policy re travel credit reinstatement,"I just got trapped by a ridiculous AA policy I want to share.  I wonder if this practice is unique to AA.

I used a large travel credit, plus cash, to buy an expensive overseas ticket. I then cancelled within the 24-hour window because the dates didn't work for various reasons. I immediately receive",https://www.reddit.com/r/americanairlines/comments/1sg0du0/ridiculous_aa_policy_re_travel_credit/,6,7,Jealous-Ability-5410,2026-04-08,delayed hours,LEVEL_1_AWARE
americanairlines,1spwedx,[LHR][ORD] Catering-related delay.,"AA91 is currently at the gate after a late-arriving flight from LAX that delayed departure by an hour. Now, we are just preparing to pull away after an additional 30 minute catering-related delay that had the staff on the phone complaining to the vendor as we were boarding. ",https://www.reddit.com/r/americanairlines/comments/1spwedx/lhrord_cateringrelated_delay/,5,4,dkiesow,2026-04-19,delayed hours,LEVEL_1_AWARE
