subreddit,post_id,title,selftext_snippet,url,score,num_comments,author,created_date,search_term,category
dating,1svp5ld,Reviewed old conversations with ex. I WAS the asshole,"I feel like trash how I behaved. We were argueing a lot, and we decided to break up after 18 months (15 too many). Boy, was I the asshole...

She was direct with what she wants, and I kept ignoring her. I really was passive aggressive. I did things I won't confess to, but it'd be 200% justified to c",https://www.reddit.com/r/dating/comments/1svp5ld/reviewed_old_conversations_with_ex_i_was_the/,24,5,redve-dev,2026-04-25,mental health dating,LEVEL_1_AWARE
dating,1sf85jc,Went on a date after months! And I think I ruined it or maybe I caught it too early. I tried and I think I need to work on myself but what if it was never my fault?,"Got back into dating seriously after months, had one promising date, now I’m confused if I’m being too cautious or just seeing red flags clearly

After months of pushing myself to get back into dating, I finally started using apps seriously instead of just as a distraction. I met a guy recently afte",https://www.reddit.com/r/dating/comments/1sf85jc/went_on_a_date_after_months_and_i_think_i_ruined/,9,26,Longjumping_05_,2026-04-07,mental health dating,LEVEL_1_AWARE
dating,1syaj3y,I can’t seem to maintain a relationship,"26M, my last partner and I just recently broke up because she’s been dealing with some personal issues and wasn’t able to focus on the relationship. We started dating December 26th, 2025 and ended things a few days ago.

Before her, I was seeing someone LDR from August to September more like a situa",https://www.reddit.com/r/dating/comments/1syaj3y/i_cant_seem_to_maintain_a_relationship/,6,9,itsDivine-,2026-04-28,mental health dating,LEVEL_1_AWARE
dating_advice,1suanax,How I cracked the dating app algorithm (A strategy for average guys),"Update: After an overwhelming response to this post, I decided to turn this into a book, which can be found here - [https://www.amazon.com/dp/B0GXGJLBVT](https://www.amazon.com/dp/B0GXGJLBVT)

Update 2: new post on the book available here: https://www.reddit.com/r/dating\_advice/s/CMFoaAVsMR

The bo",https://www.reddit.com/r/dating_advice/comments/1suanax/how_i_cracked_the_dating_app_algorithm_a_strategy/,1791,209,Big_Albatross9176,2026-04-24,dating app burnout,LEVEL_1_AWARE
dating_advice,1seya03,The dog park meta is real and I think more people need to hear this,"Some context first. I'm 25M and was with my fiancée for 6 years, 4 dating and 2 engaged. She ended things a few months ago and I had genuinely never been single as an adult so I had no idea what I was doing when I decided to start putting myself out there.

I downloaded the apps like everyone does. ",https://www.reddit.com/r/dating_advice/comments/1seya03/the_dog_park_meta_is_real_and_i_think_more_people/,1023,153,Alert-Seaweed-3862,2026-04-07,dating app burnout,LEVEL_1_AWARE
dating_advice,1sc01k0,Where do I find guys who like anime and video games....but are also normal?,"I am 30 years old

A woman 

And 70% of the time I come across a guy who shares my interests in anime and gaming like me on the dating apps....they come across as fetishistic. Like they only seem to be interested in the idea of having a girlfriend who wont be upset with the fact that they're into ga",https://www.reddit.com/r/dating_advice/comments/1sc01k0/where_do_i_find_guys_who_like_anime_and_video/,722,160,Groundbreaking-Sun68,2026-04-04,dating app burnout,LEVEL_1_AWARE
dating_advice,1sndjqh,Dating apps are just validation slots for girls and a CASINO for boys.,"I’m just going to be blunt here, we’ve stopped actually ""dating"" and started playing a GAME that nobody is winning.

From a guy's perspective, the psychological gap is becoming INSANE. We’re essentially operating in two different worlds:

The Validation: For a guy, a match is a CHANCE at a conversat",https://www.reddit.com/r/dating_advice/comments/1sndjqh/dating_apps_are_just_validation_slots_for_girls/,545,246,Beginning_Barber3042,2026-04-16,dating app burnout,LEVEL_1_AWARE
dating_advice,1stjszn,I spent over an hour getting ready for our date and he showed up in a stained t-shirt,I am a 27 year old female and I just went on a second date with this guy I met on an app. For context I work in a professional engineering firm so I am used to putting effort into my appearance and I generally like to look put together when I am out in public. For this date we agreed to meet at a ni,https://www.reddit.com/r/dating_advice/comments/1stjszn/i_spent_over_an_hour_getting_ready_for_our_date/,387,416,Nova2_Astrolabe,2026-04-23,dating app burnout,LEVEL_1_AWARE
dating_advice,1sl9c3p,"If you are good looking as a guy, you might just have it hard enough as well.","I know this is going to sound like the ultimate humblebrag, and I’m fully prepared to get roasted in the comments, but hear me out.

I’ve noticed a really frustrating pattern, and I'm genuinely curious if anyone else has experienced this. When you are a conventionally attractive guy, people tend to ",https://www.reddit.com/r/dating_advice/comments/1sl9c3p/if_you_are_good_looking_as_a_guy_you_might_just/,318,328,Annual_Word5240,2026-04-14,dating app burnout,LEVEL_1_AWARE
dating_advice,1sbhtsa,Men wanting sex early and a long term relationship.,"
I (26F) got out of a long term relationship a couple months ago and since then I met a guy from Hinge and have been on 5 dates with him over the past month. I’ve only been in 2 long term relationships before and those are the only guys I’ve slept with, so I’m not totally sure what’s most common. I’",https://www.reddit.com/r/dating_advice/comments/1sbhtsa/men_wanting_sex_early_and_a_long_term_relationship/,245,232,Anxious_Artichoke761,2026-04-03,dating app burnout,LEVEL_1_AWARE
dating_advice,1ssmwql,Is this it for average/below average dudes on dating apps?,"I see a girl and think shes pretty, cool lets see her prompts:

I see she mentions a couple of cool things I'm also into. Awesome, lets send a like with a message. Nothing crazy I'm not shakespeare or anything. Maybe a comment/something funny + a question to get the conversation going. Boom sent. 

",https://www.reddit.com/r/dating_advice/comments/1ssmwql/is_this_it_for_averagebelow_average_dudes_on/,193,206,JasonDFisherr,2026-04-22,dating app burnout,LEVEL_2_STRUGGLING
dating_advice,1t1pp15,Why do people say only very good-looking men do well on dating apps but that's not what it looks like irl?,"Not just on apps but in dating in general\*

Where I live, most men I see with pretty women are below average to average looking. I almost never see an attractive man or at least one that matches the attractiveness of the girl, it's usually worse than her level. The guy may match the girl's aestheti",https://www.reddit.com/r/dating_advice/comments/1t1pp15/why_do_people_say_only_very_goodlooking_men_do/,186,274,Additional-Spray-976,2026-05-02,dating app burnout,LEVEL_1_AWARE
dating_advice,1sk8kvt,How do people actually get into relationships?,"I’m over 30 and I’ve never been in a relationship. At this point, I’m not even embarrassed about it anymore — I’m just genuinely curious how it actually happens.

I’m not against dating. I’ve tried. I’ve used dating apps, talked to people, and even met up a few times. But most of the time, it feels ",https://www.reddit.com/r/dating_advice/comments/1sk8kvt/how_do_people_actually_get_into_relationships/,183,92,Equivalent-Search866,2026-04-13,dating app burnout,LEVEL_1_AWARE
dating_advice,1sq9shq,I (25F) feel guilty for not wanting to go on a second date with a guy (27M) because of his nut allergy,"Yesterday I went on a date with a guy and it went okay. He was nice, but he has a severe nut allergy (all nuts) that can cause life-threatening anaphylaxis.

At brunch, I really wanted a specific pancake dish, but it had nuts, so I couldn’t order it. I got plain pancakes with zero toppings to avoid ",https://www.reddit.com/r/dating_advice/comments/1sq9shq/i_25f_feel_guilty_for_not_wanting_to_go_on_a/,1087,383,Emotional_cute244,2026-04-19,giving up dating apps,LEVEL_1_AWARE
dating_advice,1swo6by,Got rejected by all of my dates (women) this year in the same manner. Looking for insight and feedback.,"I'm a male in 30s. Average height and weight.

Matched 3 online, and 1 in person.

Basically all 4 of them rejected me by telling me something along the lines of ""you are kind and great but I don't feel any connection. Let's be friends instead."" I kid you not. All 4 of them. It literally became a cy",https://www.reddit.com/r/dating_advice/comments/1swo6by/got_rejected_by_all_of_my_dates_women_this_year/,371,455,ForsakenPush8982,2026-04-26,giving up dating apps,LEVEL_1_AWARE
dating_advice,1swo6bx,guys waiting/hoping for women to approach you: it's a trap,"The posts advocating women to approach men consistently get massive upvotes.

To the degree this empowers women and helps with gender inequality/inequity and gives women more confidence in having new tools they feel they can use, this is a very good thing.

However, my fear is a lot of socially anxi",https://www.reddit.com/r/dating_advice/comments/1swo6bx/guys_waitinghoping_for_women_to_approach_you_its/,288,266,purpleamory,2026-04-26,giving up dating apps,LEVEL_1_AWARE
dating_advice,1sq7gus,My friend are jealous of my [M27] girlfriend [F26],"This is a weird situation and I’m not really sure what to do.

I started dating this girl a few weeks back, and the integration into my friend group has caused some… friction.  I’ve known here for 4 years and we were on-again off-again due to distance as she relocated a lot for work and didn’t want ",https://www.reddit.com/r/dating_advice/comments/1sq7gus/my_friend_are_jealous_of_my_m27_girlfriend_f26/,248,58,yes_please17,2026-04-19,giving up dating apps,LEVEL_1_AWARE
dating_advice,1sp2s5o,Done paying for first dates that go nowhere,"I’ve hit a point where this is actually getting to me more than I expected.

I like being generous. When I’m into someone, I genuinely enjoy treating them. It feels good. But lately it’s been the same pattern over and over, and I’m starting to feel a bit used, if I’m being honest.

I’ll go on a firs",https://www.reddit.com/r/dating_advice/comments/1sp2s5o/done_paying_for_first_dates_that_go_nowhere/,394,491,gancheroff,2026-04-18,ghosted again,LEVEL_2_STRUGGLING
dating_advice,1sslx39,what to do with the “nice guy”,"backstory: i (23f) met this guy (26m) on hinge, on his profile he said he was looking for a life partner which is also what i want, he immediately plans a date which goes amazing. even had a woman that worked at one of the spots we went to tell me he’s a great guy. he immediately plans a second date",https://www.reddit.com/r/dating_advice/comments/1sslx39/what_to_do_with_the_nice_guy/,195,98,justsayso_,2026-04-22,ghosted again,LEVEL_1_AWARE
dating_advice,1splye4,75% of Dating App Users in the US are Strange AF,"Jumped on the apps again while traveling. In Latin America the people are very chill and love meeting up via the apps, there's no pressure and ""casual"" doesn't scare people off as they are very mature with regard to dating - they're aware that anything can happen so they just have fun with it. They'",https://www.reddit.com/r/dating_advice/comments/1splye4/75_of_dating_app_users_in_the_us_are_strange_af/,173,99,Ok-Drawing-9971,2026-04-19,ghosted again,LEVEL_1_AWARE
dating_advice,1sx1ids,She invited me over after our third date then suddenly shut down and I am so confused,"I need some perspective on a situation that happened last night because I am honestly lost on how to handle the aftermath without making it weird. I m29 have been seeing this girl f27 for about three weeks. Everything has been going great, the chemistry is definitely there and we have a lot in commo",https://www.reddit.com/r/dating_advice/comments/1sx1ids/she_invited_me_over_after_our_third_date_then/,124,67,5Mirthcoil,2026-04-27,ghosted again,LEVEL_1_AWARE
dating_advice,1ssj1yu,Dating disasters,"25M

Feeling a little down on myself recently. I'm getting a lot of matches and dates with girls, but every time I meet someone it's a disaster. This is a bit of a vent post but I'm also looking for advice.

I drove a girl out to the beach a few days ago, made a special flower for her, paid for food",https://www.reddit.com/r/dating_advice/comments/1ssj1yu/dating_disasters/,18,13,Relatablename123,2026-04-22,ghosted again,LEVEL_2_STRUGGLING
dating_advice,1szz1bn,Becoming worse at handling rejection,"When I was younger, despite suffering from depression/anxiety, I felt like I handled failure and rejection pretty well. I would get sad for a bit and move on. I thought and had internalized “Oh, now I know how they feel, NEXT”. There were times that I felt insecure (about the rejection) but I didn’t",https://www.reddit.com/r/dating_advice/comments/1szz1bn/becoming_worse_at_handling_rejection/,9,10,sakura_grapeflavored,2026-04-30,ghosted again,LEVEL_2_STRUGGLING
dating_advice,1splp6t,Ghosted after talking non stop for 5 days.,"


I went on a date with a girl from Hinge. We really hit it off. We finished our lunch in 40 minutes but continued talking for 4 hours. She even said she really liked me and we compared our previous dating experiences.

We texted and decided to meet again. We were talking on and off for 5 days, sha",https://www.reddit.com/r/dating_advice/comments/1splp6t/ghosted_after_talking_non_stop_for_5_days/,9,32,Potato_Free,2026-04-19,ghosted again,LEVEL_2_STRUGGLING
dating_advice,1ssldoj,I really need to stop over romanticizing everything,"So this is basically a bit of an update to my last post. I met this guy, and we hit it off instantly. We have talked to each other every day since we met, either online or in person. It's my first time falling in love, and honestly, it's overwhelming in a way. I kept thinking and overthinking our in",https://www.reddit.com/r/dating_advice/comments/1ssldoj/i_really_need_to_stop_over_romanticizing/,6,6,Future-Impression-43,2026-04-22,ghosted again,LEVEL_2_STRUGGLING
dating_advice,1sjeq8n,"I used to be confident in dating, now I feel like I’m crumbling under pressure every time I talk to someone","I (19 y/o female) have been talking to a few women over the past 2–3 months, about five in total, and none of those situations have lasted more than a week.

The first girl I met at karaoke told me she was straight so I stopped talking to her. No effort whatsoever, which is unusual comparing it to m",https://www.reddit.com/r/dating_advice/comments/1sjeq8n/i_used_to_be_confident_in_dating_now_i_feel_like/,5,11,CounterFluffy3750,2026-04-12,ghosted again,LEVEL_2_STRUGGLING
dating_advice,1snx2nd,I (24F) went on a great date but he (26M) had a spreadsheet about me. Is this a red flag or just weird?,"Okay so I matched with a guy on Hinge two weeks ago. He seemed normal. Good job, funny texts, no red flags. We finally met up for drinks last Friday. The date was actually amazing. Like we talked for four hours and I forgot to check my phone. He remembered small things Id mentioned in texts (my cats",https://www.reddit.com/r/dating_advice/comments/1snx2nd/i_24f_went_on_a_great_date_but_he_26m_had_a/,713,345,CreosoteCoffee,2026-04-17,no matches,LEVEL_1_AWARE
dating_advice,1sijaa8,Girl On Tinder Told Me That I Was “Chudmaxxing” and That I Was Getting “Frame Mogged”,So I just recently downloaded Tinder after a long dry spell of not talking to any women and wanted to put myself out there more. A couple days in I eventually matched with this girl and she said a few things to me that I was pretty confused about. She told me that I was “Chudmaxxing” and that the fr,https://www.reddit.com/r/dating_advice/comments/1sijaa8/girl_on_tinder_told_me_that_i_was_chudmaxxing_and/,323,132,Ok_Set8396,2026-04-11,no matches,LEVEL_1_AWARE
dating_advice,1sywqen,Dating Tips for Men: How to Level Up,"I'm tired of yall playing around like newbies when your log hours say you should be a legendary.

But today is your lucky day. Let's get crackin'.

So, most of yall are out here running your character around using a lvl 1 fit trying to pick up girls flashing their lvl 150 DLC pack. And I need you to",https://www.reddit.com/r/dating_advice/comments/1sywqen/dating_tips_for_men_how_to_level_up/,305,169,Desperate_Quest,2026-04-29,no matches,LEVEL_1_AWARE
dating_advice,1t0ppzm,Dating apps feel impossible if you’re just normal,"I’m 22M and honestly, dating apps are exhausting.

I’ve tried pretty much all of them, put in decent effort with photos, bios, prompts, the whole thing. But if you’re not insanely good-looking or showing off some flashy lifestyle, it feels like you’re invisible.

Matches are rare. And when you do ge",https://www.reddit.com/r/dating_advice/comments/1t0ppzm/dating_apps_feel_impossible_if_youre_just_normal/,86,71,Abhiram1110,2026-05-01,no matches,LEVEL_1_AWARE
dating_advice,1sbosvb,Is it normal for a guy to have never received any interest from a woman?,"Hey guys, I am a 28 year old guy who has never gone on a date and has no experience with women. Now as a guy, I know and am totally fine with being expected to put in all the effort into dating and getting to know women. But is it normal to have never gotten any interest, or even signs from women at",https://www.reddit.com/r/dating_advice/comments/1sbosvb/is_it_normal_for_a_guy_to_have_never_received_any/,70,127,TuneSoft7119,2026-04-03,no matches,LEVEL_1_AWARE
dating_advice,1sowc4b,Tired of one sided conversations after matching with someone? Do this and discover if they’re genuinely interested.,"&gt;!This only works if you’re not desperate, if you are, good luck carrying a conversation with someone bread crumbing you.!&lt;

Here’s how it works. Over the course of your first 3 exchanges, ask them 3 questions about themselves. Then pay attention to what comes back.

A genuinely interested per",https://www.reddit.com/r/dating_advice/comments/1sowc4b/tired_of_one_sided_conversations_after_matching/,65,14,CCaptainJackSparrow,2026-04-18,no matches,LEVEL_1_AWARE
OnlineDating,1sc4is8,Hinge is the new tinder,"Anyone else think hinge has become a more pretentious tinder? It’s known as the relationship app but so many people on there are clearly looking of casual. Their prompts are silly, they have short term on their profile and some hide their dating intentions.  ",https://www.reddit.com/r/OnlineDating/comments/1sc4is8/hinge_is_the_new_tinder/,237,198,catwoman4ever,2026-04-04,dating app burnout,LEVEL_1_AWARE
OnlineDating,1sjzaqu,Where are all the lazy girls at?,"Sure I like a nice hike once in a while, I like wining and dining on occasion. I appreciate nature and the natural beauty of the world. But let’s be real here, in the long run you’re getting a working man who’s not a world traveler and has no unique hobbies.

It seems that every woman on dating apps",https://www.reddit.com/r/OnlineDating/comments/1sjzaqu/where_are_all_the_lazy_girls_at/,195,111,gyno34,2026-04-12,dating app burnout,LEVEL_1_AWARE
OnlineDating,1sn2b2i,"Outside of the big 3 (Tinder, Hinge, Bumble), what OLD app have you had the most success with for serious dating?",I've tried all 3 at different points in the past with not much luck. Have you had success on a different app?,https://www.reddit.com/r/OnlineDating/comments/1sn2b2i/outside_of_the_big_3_tinder_hinge_bumble_what_old/,67,117,Everythings-tragic14,2026-04-16,dating app burnout,LEVEL_1_AWARE
OnlineDating,1sgb1vm,Have the apps gotten worse?,"I have used hinge, bumble, and tinder once in 2022, dated a girl a while and back on them in 2024. And it was a decent time. I was able to swipe a decent amount of people and got plenty of matches. 

I usually only take around 2 weeks to find someone and I am a week in and feel like the profiles I a",https://www.reddit.com/r/OnlineDating/comments/1sgb1vm/have_the_apps_gotten_worse/,60,60,XgUNp44,2026-04-08,dating app burnout,LEVEL_1_AWARE
OnlineDating,1syy06w,Why aren’t I getting ANY matches on Hinge?!? Can anyone explain the algorithm?,"Genuine question.  I’m a woman in my early 30s, my age filter is broad (29-42).  I’m not a 10 but usually don’t have trouble finding people who are interested.  When I first downloaded the app I got 7 or 8 likes, but now nothing for a full week.  I send the allotted likes/day, usually with a witty o",https://www.reddit.com/r/OnlineDating/comments/1syy06w/why_arent_i_getting_any_matches_on_hinge_can/,56,56,Short_Cap6724,2026-04-29,dating app burnout,LEVEL_1_AWARE
OnlineDating,1stjrkf,What are your first date expectations as a woman?,Man in his early 30s here. Most of my first dates have been pretty good and left me with options to see them again for a second date. This one recent first date told me straight up 30-45 minutes in that I'm not flirting and I ask too many questions about her. I personally need time to get to know so,https://www.reddit.com/r/OnlineDating/comments/1stjrkf/what_are_your_first_date_expectations_as_a_woman/,43,35,PerfectSuggestion428,2026-04-23,dating app burnout,LEVEL_1_AWARE
OnlineDating,1sh4z1z,For those who do not enjoy traveling - have you found success in dating apps?,"I traveled a lot during my teens and twenties. It's not something I ever found particularly exciting or enjoyable and not something I'm looking forward to.

I've noticed this is the most common interest people listin their profiles, or at least in straight women profiles (as a straight man those are",https://www.reddit.com/r/OnlineDating/comments/1sh4z1z/for_those_who_do_not_enjoy_traveling_have_you/,41,33,Altruistic_Society99,2026-04-09,dating app burnout,LEVEL_1_AWARE
OnlineDating,1t261fw,advice on not getting too emotionally attached when in early phase,"been on the apps for a few months now and whenever i match w a guy and start talking to them, if they reciprocate well and we have engaging convos, i tend to become too emotionally invested. like i will overthink if they have texted me back yet or why haven't they asked me out on a date etc. idk how",https://www.reddit.com/r/OnlineDating/comments/1t261fw/advice_on_not_getting_too_emotionally_attached/,34,25,Ok-Type9236,2026-05-02,dating app burnout,LEVEL_1_AWARE
OnlineDating,1sxb78q,Attractive enough to match with but too ugly to put in effort?,"I’ve been using dating apps for a couple weeks now and I get matches here and there but it never lasts for more than a day. Every time I match we start talking but after the first few messages the woman just stops asking me anything. They’ll keep responding to me but they never ask me anything back,",https://www.reddit.com/r/OnlineDating/comments/1sxb78q/attractive_enough_to_match_with_but_too_ugly_to/,31,47,Happy-Case7394,2026-04-27,dating app burnout,LEVEL_1_AWARE
OnlineDating,1sqk3tz,How do you actually move from chatting to meeting on dating apps?,"Lately I keep running into the same thing on dating apps.

You match with someone, chat for a bit… and then it just slowly dies.  

No one actually suggests meeting, and it turns into this weird pen-pal situation.

I’m starting to wonder if endless chatting is part of the problem.

Do you think conv",https://www.reddit.com/r/OnlineDating/comments/1sqk3tz/how_do_you_actually_move_from_chatting_to_meeting/,22,58,Hungry_Patience_5284,2026-04-20,dating app burnout,LEVEL_1_AWARE
OnlineDating,1skrqe6,I'm not attracting my type,"idk what the heck is wrong with me but no matter how hard I try I can't seem to attract my type of guy which isn't asking too much. I prefer college educated, athletic or slim build, dresses well in fitted clothing but nothing fancy, and not covered in a bunch of tattoos or piercings or in oversized",https://www.reddit.com/r/OnlineDating/comments/1skrqe6/im_not_attracting_my_type/,41,108,Auburn_lipstick,2026-04-13,giving up dating apps,LEVEL_2_STRUGGLING
OnlineDating,1sthpsy,Is this normal for online dating?,"Both on hinge and on bumble- the men send 1 opening message, I reply (usually something witty with an opening) and then they just disappear. This is so confusing and tiring- like, why match and send a message in the first place? This low key makes me want to give up on the apps.",https://www.reddit.com/r/OnlineDating/comments/1sthpsy/is_this_normal_for_online_dating/,20,21,TraditionalCover100,2026-04-23,giving up dating apps,LEVEL_1_AWARE
OnlineDating,1szaahx,"Hi! I'm Magdalene Taylor, Senior Editor at Playboy covering sex and culture. AMA about meeting people IRL at 7PM ET","**Ask her anything at April 29th, 7 pm ET. Get your questions in early!**

Despite the dating apps and the general isolation and awkwardness that plagues social life, a fundamental reality remains true: Somewhere, deep down, men and women still have the urge to pair up. Even if just for one night. B",https://www.reddit.com/r/OnlineDating/comments/1szaahx/hi_im_magdalene_taylor_senior_editor_at_playboy/,18,36,playboy,2026-04-29,giving up dating apps,LEVEL_1_AWARE
OnlineDating,1sfmcex,6 Year Old Photos?,"I matched with this guy about a month ago on Facebook dating. There are 3 photos on his profile. In 2, he's very attractive. The 3rd photo is incredibly unflattering. We finally scheduled a date for this Saturday. My curiosity got the best of me, and I ended up doing an image search on his photos an",https://www.reddit.com/r/OnlineDating/comments/1sfmcex/6_year_old_photos/,19,43,Mobile-Cellist6413,2026-04-08,giving up dating apps,LEVEL_1_AWARE
