subreddit,post_id,title,selftext_snippet,url,score,num_comments,author,created_date,search_term,category
Tinder,1sj6f8b,"Profile review, using dating apps for the first time in my life. Any helpful tips or pointers would be appreciated",,https://www.reddit.com/r/Tinder/comments/1sj6f8b/profile_review_using_dating_apps_for_the_first/,82,74,Mad-Maximilian,2026-04-12,dating app burnout,LEVEL_1_AWARE
Tinder,1sh3oud,Haven’t used dating apps in forever. Wondering what I can improve with my profile.,,https://www.reddit.com/r/Tinder/comments/1sh3oud/havent_used_dating_apps_in_forever_wondering_what/,66,42,Jokes-on-youu,2026-04-09,dating app burnout,LEVEL_1_AWARE
Tinder,1sz5bfv,If you hate dating app culture so much why are you using them? I get that it sucks but damn,,https://www.reddit.com/r/Tinder/comments/1sz5bfv/if_you_hate_dating_app_culture_so_much_why_are/,25,39,Key-Click-7636,2026-04-29,dating app burnout,LEVEL_1_AWARE
Tinder,1sdogxh,Can you see a profile that is hidden? I haven’t swiped this guy and my profile has been hidden for roughly 3 weeks. Also don’t have my instagram username attached to my account so I’m not sure how he found me.,,https://www.reddit.com/r/Tinder/comments/1sdogxh/can_you_see_a_profile_that_is_hidden_i_havent/,28,12,x_Little_Wolf_x,2026-04-06,dating app burnout,LEVEL_1_AWARE
Tinder,1skwf8d,"Hi everyone, I have a question: how much texting is reasonable before the first date? I'm asking because I don't like texting.",,https://www.reddit.com/r/Tinder/comments/1skwf8d/hi_everyone_i_have_a_question_how_much_texting_is/,11,19,ABBCP,2026-04-13,dating app burnout,LEVEL_1_AWARE
Tinder,1smfbcg,"Profile review. Just got out of 4 year relationship, first time on dating apps",,https://www.reddit.com/r/Tinder/comments/1smfbcg/profile_review_just_got_out_of_4_year/,0,5,Random-Russian-Guy,2026-04-15,dating app burnout,LEVEL_1_AWARE
Tinder,1sx3iqp,"28m mostly getting scam liked anything I need to do to fix this? Is my profile good or bad what should I fix, I just got back on dating apps after 1-2 years break cause its all bs. Looking for feedback please",,https://www.reddit.com/r/Tinder/comments/1sx3iqp/28m_mostly_getting_scam_liked_anything_i_need_to/,0,22,Puzzleheaded-Mind735,2026-04-27,dating app burnout,LEVEL_1_AWARE
Tinder,1soapgu,Do I look older then 22😭 I have other dating apps and women 25-38 constantly are matching with me I’m just curious,,https://www.reddit.com/r/Tinder/comments/1soapgu/do_i_look_older_then_22_i_have_other_dating_apps/,0,39,Tdi941,2026-04-17,dating app burnout,LEVEL_1_AWARE
Tinder,1sdg0lc,M22 I need a legit review? Do I just not qualify to be on dating apps I’m struggling bad?,,https://www.reddit.com/r/Tinder/comments/1sdg0lc/m22_i_need_a_legit_review_do_i_just_not_qualify/,0,34,xxcloudyplayzz,2026-04-05,dating app burnout,LEVEL_1_AWARE
Tinder,1sw6blx,New to dating apps just need advice,,https://www.reddit.com/r/Tinder/comments/1sw6blx/new_to_dating_apps_just_need_advice/,0,71,Big-Tumbleweed-2091,2026-04-26,dating app burnout,LEVEL_1_AWARE
Tinder,1shnfr5,Excuse me lol,,https://www.reddit.com/r/Tinder/comments/1shnfr5/excuse_me_lol/,6800,450,Careful-Show8065,2026-04-10,no matches,LEVEL_1_AWARE
Tinder,1sntzws,How does this even make sense 😭,,https://www.reddit.com/r/Tinder/comments/1sntzws/how_does_this_even_make_sense/,76,36,Critical-Plankton-28,2026-04-17,no matches,LEVEL_1_AWARE
Tinder,1t1zhhr,"No likes or matches in months, am I (28m) too ugly for online dating? (Yes, I know this is hinge).",,https://www.reddit.com/r/Tinder/comments/1t1zhhr/no_likes_or_matches_in_months_am_i_28m_too_ugly/,34,76,DescriptionFuture851,2026-05-02,no matches,LEVEL_1_AWARE
Tinder,1t39ysl,"Tinder acting strangely. Messages are “sent” on my end, but disappear next day. Through text, I found out from matches that my profile no longer appears to them. I can’t update profile w/out redirecting me to the pay page. New profiles to swipe aren’t showing up-stays in loading mode.",,https://www.reddit.com/r/Tinder/comments/1t39ysl/tinder_acting_strangely_messages_are_sent_on_my/,6,1,New-Fan-4632,2026-05-04,no matches,LEVEL_1_AWARE
Tinder,1sqcrmy,Have updated my profile a couple times after feedback but still no matches,,https://www.reddit.com/r/Tinder/comments/1sqcrmy/have_updated_my_profile_a_couple_times_after/,3,15,Vadien_,2026-04-19,no matches,LEVEL_2_STRUGGLING
Tinder,1sg1zt8,"Is premium worth it? I got like 50 people I can’t see, and I get basically no matches even when I just swipe everyone",,https://www.reddit.com/r/Tinder/comments/1sg1zt8/is_premium_worth_it_i_got_like_50_people_i_cant/,0,39,Final_Bluejay986,2026-04-08,no matches,LEVEL_2_STRUGGLING
Tinder,1t1qy8d,"Ok folks, need a profile rating please. Hows this for a 24 year old. Please be honest because I'm 3 weeks in and no matches lol",,https://www.reddit.com/r/Tinder/comments/1t1qy8d/ok_folks_need_a_profile_rating_please_hows_this/,0,23,Piggynatorgaming,2026-05-02,no matches,LEVEL_2_STRUGGLING
Tinder,1sy4wga,"No matches for a long time, dunno what's wrong",,https://www.reddit.com/r/Tinder/comments/1sy4wga/no_matches_for_a_long_time_dunno_whats_wrong/,0,17,CuckiMan_45,2026-04-28,no matches,LEVEL_2_STRUGGLING
Tinder,1slw33f,Any ideas for improvements? Essentially no likes/matches,,https://www.reddit.com/r/Tinder/comments/1slw33f/any_ideas_for_improvements_essentially_no/,0,58,RHArtwork,2026-04-15,no matches,LEVEL_1_AWARE
Tinder,1se9xkf,Updated my photos but still no matches. Any suggestions?,,https://www.reddit.com/r/Tinder/comments/1se9xkf/updated_my_photos_but_still_no_matches_any/,0,39,theguywhotriedtorock,2026-04-06,no matches,LEVEL_2_STRUGGLING
Tinder,1swfq09,"Profile review, please! 0 matches in the last 2 weeks!!",,https://www.reddit.com/r/Tinder/comments/1swfq09/profile_review_please_0_matches_in_the_last_2/,6,23,Presch,2026-04-26,mental health dating,LEVEL_1_AWARE
Tinder,1sd4phb,Profile review - newly back on the apps after taking some time for my health. The quality of the chats is severely lacking! 🤦‍♀️ wondering if I shouldn't bother... I'm already quite selective in who I match with 😅,,https://www.reddit.com/r/Tinder/comments/1sd4phb/profile_review_newly_back_on_the_apps_after/,85,100,SquanderedPotential2,2026-04-05,quit dating apps,LEVEL_1_AWARE
dating,1spb0ev,"Your person is so close, I promise you. This is your sign not to give up on love.","Last year, I met this guy that checked all of my boxes (which I thought), we met organically and clicked from the very start. After growing so close together, after a short trip with my family I felt he was getting distant. He blamed it on a sickness in the family making him distant. I eventually fo",https://www.reddit.com/r/dating/comments/1spb0ev/your_person_is_so_close_i_promise_you_this_is/,1089,282,ratinmyhat,2026-04-18,dating app burnout,LEVEL_1_AWARE
dating,1seab7q,My experience as a woman on dating apps,"This is mainly for men who are curious and don't know what it's like for (many) women on dating apps. I've read in a few threads that men don't get swiped right a lot? For many women, the opposite is true. But that doesn't make it more fun. Here's my experience with every app I've been on.

I make a",https://www.reddit.com/r/dating/comments/1seab7q/my_experience_as_a_woman_on_dating_apps/,691,275,SakuraFalls12,2026-04-06,dating app burnout,LEVEL_1_AWARE
dating,1t2pxpy,"Tired of the unrealistic ""spark"" expectations of dating.","&amp;#x200B;

After yet another dating fail where, despite a lovely conversation and a date that spanned hours, I got the ""I think you're amazing, but I didn't feel any spark"" text, and I am genuinely amused, and perhaps a bit concerned, by the unrealistic expectations that have become normalized th",https://www.reddit.com/r/dating/comments/1t2pxpy/tired_of_the_unrealistic_spark_expectations_of/,377,135,NamuhNoserp,2026-05-03,dating app burnout,LEVEL_2_STRUGGLING
dating,1sg1lq4,Do guys intentionally delay sex when they want something serious?,"Hi everyone, I’m (F late 30s) trying to figure out a guy’s perspective on ""the wait.""

I recently met someone I really like. On our first date, he asked how I was doing on the apps, and I was honest: I told him I’m tired of younger guys just looking for hookups. I’m looking for something serious.

A",https://www.reddit.com/r/dating/comments/1sg1lq4/do_guys_intentionally_delay_sex_when_they_want/,271,176,Inner-Schedule-2075,2026-04-08,dating app burnout,LEVEL_2_STRUGGLING
dating,1skgqgs,Too many guys lying about their height on their dating profiles,"Recently I(F) went on dates with 3 different people(M) and it didn’t take me too long to realize the height they put on their profiles are not accurate. I am 5’8 and I tend to date with people my height or above. 

When this happened I went back to the app to check the height on their profiles and i",https://www.reddit.com/r/dating/comments/1skgqgs/too_many_guys_lying_about_their_height_on_their/,227,236,kawaiisamurai69,2026-04-13,dating app burnout,LEVEL_1_AWARE
dating,1smtbrc,"Dating Isn’t Broken, We Just Don’t Agree on the Rules Anymore","I don’t think dating is messed up because of just men or just women. I think things just changed, and now people don’t agree on how it should work. Before, it was simple men asked girls out and paid, and women decided if they liked them. Now, some people still want that, but others want everything t",https://www.reddit.com/r/dating/comments/1smtbrc/dating_isnt_broken_we_just_dont_agree_on_the/,207,80,AffectionateDuck5079,2026-04-16,dating app burnout,LEVEL_1_AWARE
dating,1sf3opv,"24M, just had my first ever date.","How did I do it?

Honestly, I was just at the right place at the right time.

Ive been on dating apps for probably well over a year now around half a year on Hinge, before that on Bumble.

Bumble I only had a singular like ever and on Hinge I had less than a handful matches which all eventually ende",https://www.reddit.com/r/dating/comments/1sf3opv/24m_just_had_my_first_ever_date/,145,21,-Zima_Blue-,2026-04-07,dating app burnout,LEVEL_2_STRUGGLING
dating,1swhht2,"As a guy, is it okay to approach women in public anymore?","I’m a guy in my late 20s living in Orange County, CA, and I’ve mostly relied on dating apps and online spaces to meet women. I haven’t had much success there, so I’ve been thinking about trying to meet people in real life more often.

That said, I’ve always been hesitant to approach women in public ",https://www.reddit.com/r/dating/comments/1swhht2/as_a_guy_is_it_okay_to_approach_women_in_public/,140,267,DriftCore31,2026-04-26,dating app burnout,LEVEL_1_AWARE
dating,1sbmuab,How do women use dating apps?,"Like, I legit wonder this. I know that girls have like an insane number of matches/messages on any given day. Does it seem like too much on the plate that you don't even check the apps that often? Do you just open the app and just go to your matches and just sift and sort through them without swipin",https://www.reddit.com/r/dating/comments/1sbmuab/how_do_women_use_dating_apps/,138,162,rocketsneaker,2026-04-03,dating app burnout,LEVEL_1_AWARE
dating,1sli69c,Any luck for homebody type guys?,"So many of the dating profiles I see always talk about how they love hiking, travelling, etc. Maybe going to parties. Now I'm not saying I just \*only\* want to stay home and do nothing every day. But I am definitely someone who loves staying in and just being cozy. I'd love to find someone who enjo",https://www.reddit.com/r/dating/comments/1sli69c/any_luck_for_homebody_type_guys/,127,60,rocketsneaker,2026-04-14,dating app burnout,LEVEL_1_AWARE
dating,1shvtxx,"Ladies, how do you feel about the ""meeting good men"" paradox?","The paradox being that guys who are usually more socially conscious of women generally tend to respect their boundaries, and might have a tendency to overcorrect, too, and in turn don't really approach women at all. 

Meanwhile, guys who have more of a mano-sphere mentality don't really give a fuck ",https://www.reddit.com/r/dating/comments/1shvtxx/ladies_how_do_you_feel_about_the_meeting_good_men/,405,103,rocketsneaker,2026-04-10,giving up dating apps,LEVEL_1_AWARE
dating,1t0lz6y,"I don’t get it, why can’t men just be honest when they’re not interested?",I don’t understand these men these days. I went out with this guy tonight that was begging for me to hang out. We had never met before and I met up with him at the place. We had a nice conversation and got to know each other a bit. He even offered to give me a ride home. We were getting ready to lea,https://www.reddit.com/r/dating/comments/1t0lz6y/i_dont_get_it_why_cant_men_just_be_honest_when/,273,159,Leading_Ad_6809,2026-05-01,giving up dating apps,LEVEL_2_STRUGGLING
dating,1swtj1v,I can’t get over a guy I only saw 6 times and I feel ridiculous,"I (F) was seeing this guy for about a month and a bit. We only hung out 6 times, but the connection felt insanely intense. This is honestly the first time I’ve ever felt chemistry like this with someone. I was in a 4-year relationship before, and I never even felt this level of connection there, whi",https://www.reddit.com/r/dating/comments/1swtj1v/i_cant_get_over_a_guy_i_only_saw_6_times_and_i/,144,84,Fearless-Hand-638,2026-04-27,giving up dating apps,LEVEL_1_AWARE
dating,1so54hc,Subconsciously given up,"Recently I have noticed I am repulsed to dating. The guys are always nice, not bad looking and decent character but nothing special, still sometimes below the average women regarding looks, character, behavior, emotional intelligence, etc (at least for me). I have given so many a chance, thought I m",https://www.reddit.com/r/dating/comments/1so54hc/subconsciously_given_up/,122,201,QueeieQueenBee,2026-04-17,giving up dating apps,LEVEL_1_AWARE
dating,1sn89xv,"""Too busy/tired"" to date","Take this with as many grains of salt as you like. Thankfully I'm in a happy relationship with a great girl now, but I've seen some shit. Learn from my experience so that you don't have to put up with the BS I did. :)

I've (36M) had enough experience now - both with girls that've been super into me",https://www.reddit.com/r/dating/comments/1sn89xv/too_busytired_to_date/,107,35,mapleflavrd,2026-04-16,giving up dating apps,LEVEL_1_AWARE
dating,1sjzhx6,What if I gave you my number?,"I have a mood disorder that causes me to spiral out of control at the thought of rejection... online dating has been a treat! I was listening to a podcast about dating successfully and the data scientist was talking about how online dating is set up to keep you in an endless spiral of rejection. 

I",https://www.reddit.com/r/dating/comments/1sjzhx6/what_if_i_gave_you_my_number/,99,95,UnsettledGoose,2026-04-12,giving up dating apps,LEVEL_1_AWARE
dating,1t2hsqc,I'm getting soft ghosted,"I don't know if soft ghosted is a term, but, well, it's fitting. This guy and I have been dating for 5 months and it's now impossible to have a conversation with him. He'll send a message then disappear for hours, again and again. My questions are ignored, just small talk one message at a time with ",https://www.reddit.com/r/dating/comments/1t2hsqc/im_getting_soft_ghosted/,79,48,ONLINE-COP,2026-05-03,ghosted again,LEVEL_2_STRUGGLING
dating,1supmx7,Why did you stop dating?,"I'd love to know why some of you may have stopped dating, what reason or story do you have for not wanting to put yourself out there anymore? We all have our reasons, and there's absolutely nothing wrong for not wanting to find love right now. But I'd love to know everyone's story

For me, I was wit",https://www.reddit.com/r/dating/comments/1supmx7/why_did_you_stop_dating/,11,71,JohnMarstonSoldA8th,2026-04-24,ghosted again,LEVEL_2_STRUGGLING
dating,1t1aye9,I decided I don’t want to feel like a product when dating. Is that bad?,"Sorry this is a bit of a rant so thanks if you read it or have something to say.

Ok I realised dating is quite hard and the burn out feeling is real. I was new to dating last year and dated nine men. It started when I dated a guy at work who was interested and then I said let’s get coffee so we did",https://www.reddit.com/r/dating/comments/1t1aye9/i_decided_i_dont_want_to_feel_like_a_product_when/,6,6,blankslate_fullplate,2026-05-01,ghosted again,LEVEL_2_STRUGGLING
dating,1sd8p06,Ghosted/blocked after we planned to meet in her city,"I (31m) met a girl (24f) at a bar in my city, but it turns out she was only visiting for a concert. But we hit it off and she gave me her IG and we talked there for a few weeks. 

I said I had planned to take a vacation in Florida and she said she lived close to my vacation spot and suggested that w",https://www.reddit.com/r/dating/comments/1sd8p06/ghostedblocked_after_we_planned_to_meet_in_her/,5,13,TimNSFWthings,2026-04-05,ghosted again,LEVEL_2_STRUGGLING
dating,1swffmj,"I (32M) am not sure i'm going the right way around meeting someone as a disabled atypical man, could use some opinions as to how to approach dating in my peculiar situation","Hi! I really want to meet someone (F) again, but i think my profile is not the most advantageous and i'm wondering how i should go about it *(I'm in belgium)*

# TL;DR:

Disabled guy, apps are a wash for now and i'm already doing my max outside irl, which is not enough to meet many people  
  
Doing",https://www.reddit.com/r/dating/comments/1swffmj/i_32m_am_not_sure_im_going_the_right_way_around/,3,10,Vertnoir-Weyah,2026-04-26,ghosted again,LEVEL_2_STRUGGLING
dating,1t2wvaq,Any advice for a 21yo?,"Hey guys! 

It's a long story, please sit back and read, else feel free to scroll away. 

I just turned 21, and I've never really considered dating. I was on a dating app named boo for a month, got no matches or dms, so I just never tried again. Lost \~30 pounds in the past 4 months, and I look pret",https://www.reddit.com/r/dating/comments/1t2wvaq/any_advice_for_a_21yo/,2,2,GabiYamato,2026-05-03,ghosted again,LEVEL_2_STRUGGLING
dating,1ss3ss2,"The fellas were right - who should ask ""what are we?""","TLDR: I asked for advice from other men about who should ask for exclusivity, the guy or the girl. The women said the guy should ask. The men said don't do it and wait for her to say something about it/ask. The men were right.

About 6 months ago I (36M) started seeing my now GF (36F). It started ou",https://www.reddit.com/r/dating/comments/1ss3ss2/the_fellas_were_right_who_should_ask_what_are_we/,70,100,mapleflavrd,2026-04-21,no matches,LEVEL_1_AWARE
dating,1sunb6d,How are you supposed to actually meet women??,"It's difficult for me to meet women...like at all.. I've tried to improve myself physically...I run and exercise 5x a week, I groom, I have skin regimes, I dress well, I'm 6'3. I shouldn't have issues at least finding women who would give me a shot. But face isn't good.. Bc of that, I'm usually pret",https://www.reddit.com/r/dating/comments/1sunb6d/how_are_you_supposed_to_actually_meet_women/,63,137,jibofyourcutt,2026-04-24,no matches,LEVEL_2_STRUGGLING
dating,1sue9r3,"What if dating apps filtered people based on how they behave, not just looks?","Imagine this:

* send thoughtful messages and interesting conversations &gt; better matches
* send “hi”, copy-paste, or act rude &gt; less visibility

No visible score. Just who you get access to.

Over time, you mostly match with people at your level.

Less noise. Less burnout.

Would this make dat",https://www.reddit.com/r/dating/comments/1sue9r3/what_if_dating_apps_filtered_people_based_on_how/,55,74,Hungry_Patience_5284,2026-04-24,no matches,LEVEL_1_AWARE
dating,1slec11,Lost attraction to my dating app match after finding out he looks nothing like his photos,"I (30F) matched with a guy (33M) on a dating app. Great chat, real connection, but the phone call changed everything.

His photos showed an average build, nice face, well put together. We had great conversations over text. He’s sweet, consistent, asks thoughtful questions. Ticked a lot of boxes on p",https://www.reddit.com/r/dating/comments/1slec11/lost_attraction_to_my_dating_app_match_after/,59,79,singingdata,2026-04-14,no matches,LEVEL_1_AWARE
dating,1smmld9,Why do people waste their own time with someone if they're not going to see them anyway?,"So I matched with this girl on Bumble a while ago. We were texting pretty consistently, not all day every day, but enough to build a bit of a rapport. The conversations felt really nice, bantery, and she seemed genuinely interested. The only issue was that I couldn’t meet up straight away because I ",https://www.reddit.com/r/dating/comments/1smmld9/why_do_people_waste_their_own_time_with_someone/,48,41,mundaneheaven,2026-04-15,no matches,LEVEL_1_AWARE
dating,1sgg00a,Just ask questions!!!,"I (33F) matched with a guy (29M) on hinge. We spent the entire first night texting and voice chatting and sharing stories. The energy and hype was real and palpable. But during this entire exchange, he NEVER asked me any questions. Our conversation turned into constant exchanges of stories, which wa",https://www.reddit.com/r/dating/comments/1sgg00a/just_ask_questions/,47,27,asparkaflame44,2026-04-09,no matches,LEVEL_1_AWARE
dating,1sdu4up,Men - Is it worth being direct when you pull back after showing interest initially in early dating?,"So I've recently started dating again, not yet on the apps but I went to a singles event in my city to start. I ended up meeting a guy who seemed very obviously interested and attracted to me (he told a friend he was interested and so she introduced us). We got along well. I was going to leave and h",https://www.reddit.com/r/dating/comments/1sdu4up/men_is_it_worth_being_direct_when_you_pull_back/,43,64,momentsnotmilestones,2026-04-06,no matches,LEVEL_1_AWARE
dating,1sjx33j,I'm trying to figure out where women my age are actually meeting their person.,"I'm 36. I run my own clothing store and have some investments. Financially, I'm doing fine. I'm not someone who lets myself go. Got divorced six years ago and just buried myself in work. My social circle is tiny, so I haven't really met many guys. Lately I've been sitting around a lot by myself, and",https://www.reddit.com/r/dating/comments/1sjx33j/im_trying_to_figure_out_where_women_my_age_are/,24,34,Remarkable_Web_7185,2026-04-12,no matches,LEVEL_1_AWARE
dating,1st2lls,Cockblocking: I have a gut feelings his friends influenced him,"I was seeing a guy for about a month. We matched on a dating app. He was looking for a monogamous relationship. From the start, he was very consistent: planning dates, checking in after seeing each other, showing curiosity, and expressing strong attraction. Nothing felt off, and I didn’t sense any h",https://www.reddit.com/r/dating/comments/1st2lls/cockblocking_i_have_a_gut_feelings_his_friends/,22,23,Fit-Celery-7428,2026-04-22,no matches,LEVEL_1_AWARE
dating,1su03ya,Would you give someone a second chance that previously rejected you?,Just curious to know what your guys opinion on this is and btw I don’t mean a previous long term relationship or that the reason was external factors like moving out of town etc. Personally I can’t go back to someone I was speaking to who rejected me because I want to be their “first choice” instead,https://www.reddit.com/r/dating/comments/1su03ya/would_you_give_someone_a_second_chance_that/,15,49,Direct-Aspect643,2026-04-23,no matches,LEVEL_1_AWARE
dating,1sjgt4f,"People like me, but nobody wants to date me","I (23M) did quite a lot to be attractive to people. I have a good job, some achievements, took care of my look and mental health.

I have quite a lot interests, hobbies, some sense of humour. People in general like me and even now I await guests coming for my party. My friends include both men and w",https://www.reddit.com/r/dating/comments/1sjgt4f/people_like_me_but_nobody_wants_to_date_me/,95,68,redve-dev,2026-04-12,mental health dating,LEVEL_1_AWARE
dating,1sqzy0m,"It never gets better, does it? [25M]","Hey guys and gals,

I \[25M\] think I've had enough. Apps, in-person gatherings, events, and nothing. Relentlessly putting myself out there at every opportunity has gotten me nowhere. I've been single since I was 20, and I know for a fact I'm a good candidate. I've only been using Hinge seriously fo",https://www.reddit.com/r/dating/comments/1sqzy0m/it_never_gets_better_does_it_25m/,57,68,JSAcela,2026-04-20,mental health dating,LEVEL_2_STRUGGLING
dating,1t0ofbb,My thoughts as I’ve been single for years,"I’ve (26f) been single 4 years now and there’s periods where I’m okay with being single and where I am so bored of it. I’m fit, attractive and young and sometimes when people ask how long I’ve been single for and I tell them, they always say “that’s a long time!” I mean sure I guess so but they say ",https://www.reddit.com/r/dating/comments/1t0ofbb/my_thoughts_as_ive_been_single_for_years/,56,50,sweet_fiction,2026-05-01,mental health dating,LEVEL_1_AWARE
dating,1sdfars,The cycle begins all over again[33M],"Title given.  I just recently ended a dating situation from Hinge.  She\[28F\] was great, but it just wasn’t a compatible long term match.  I’m really not grieving over it.  But I’m sort of back into that made of just “not caring”.  I’m not exactly sad over being single, but I’m not the most excited",https://www.reddit.com/r/dating/comments/1sdfars/the_cycle_begins_all_over_again33m/,28,20,spicysenpai6,2026-04-05,mental health dating,LEVEL_1_AWARE
