subreddit,post_id,title,selftext_snippet,url,score,num_comments,author,created_date,search_term,category
OnlineDating,1soi0xb,How do you tell the difference between someone losing interest vs just being busy?,"I’ve been using dating apps for a while, and something I run into a lot is this: a conversation starts off well, replies are consistent, and then suddenly the response time slows down a lot.

I can’t always tell if it means they’re losing interest, talking to someone else, or just genuinely busy wit",https://www.reddit.com/r/OnlineDating/comments/1soi0xb/how_do_you_tell_the_difference_between_someone/,13,21,Objective-Trainer622,2026-04-17,giving up dating apps,LEVEL_1_AWARE
OnlineDating,1syvodx,Huge Drop in Hinge Likes After ‘Newbie Boost’,"Feel somewhat deflated. I’ve just come out of a 5 year relationship, so thought I might give the apps a go. After a strong start, my likes have plummeted to the point where it’s as if my account doesn’t exist. This is combined with practically zero matches.

On my first 24 hours of setting up my Hin",https://www.reddit.com/r/OnlineDating/comments/1syvodx/huge_drop_in_hinge_likes_after_newbie_boost/,10,8,Zonec1643,2026-04-29,giving up dating apps,LEVEL_1_AWARE
OnlineDating,1t33tav,I'm slowly losing my patience with this guy,"Met a guy on fb dating about Mid March and we were talking consistently every day, although I could never figure out how to enable notifications on the app so I wasn't getting them and we got fed up and exchanged numbers. Now this guy lives over an hour away from me so it's not a bad distance, the p",https://www.reddit.com/r/OnlineDating/comments/1t33tav/im_slowly_losing_my_patience_with_this_guy/,8,21,JazzyKins18,2026-05-03,giving up dating apps,LEVEL_1_AWARE
OnlineDating,1sy1pd3,advice for re-matching with someone i went out with 4 years ago,"For context I was 20F when I matched with this guy the same age on a dating app. We went on around 5 dates and had a lot in common - but because he didn't initiate anything physical/intimate with me, I felt he wasn't into me and that the chemistry may have been lacking. I called it off on the basis ",https://www.reddit.com/r/OnlineDating/comments/1sy1pd3/advice_for_rematching_with_someone_i_went_out/,8,20,ricerabbit1,2026-04-28,giving up dating apps,LEVEL_1_AWARE
OnlineDating,1sxwuvw,How do you actually convert matches into relationships?,"For context, I'm 25F, grew up with ""no dating"" type of parents, so only got on the apps a couple years ago. I do get matches, but they seem to go nowhere.

I'm open to dating both men and women, but I am asexual so sex is off the table and it is written in my bio.

If I match with a guy - it's just ",https://www.reddit.com/r/OnlineDating/comments/1sxwuvw/how_do_you_actually_convert_matches_into/,0,14,miya-kun,2026-04-28,ghosted again,LEVEL_2_STRUGGLING
OnlineDating,1stjj3h,Did I overreact with my response?,"I’ve been talking to this guy long-distance for over a month, we haven't even met yet. It was super intense, daily talking, and very sexual. Suddenly, he stopped opening my texts for 3 days (sitting on delivered), which is not very normal for him. I was so worried, I thought he had died, or somebody",https://www.reddit.com/r/OnlineDating/comments/1stjj3h/did_i_overreact_with_my_response/,0,15,Greedy_Tip8741,2026-04-23,ghosted again,LEVEL_1_AWARE
OnlineDating,1sjfc2o,Is tinder just well and truly dead?,"I used tinder back when It was in its golden age- Constant matches, lots of hookups, flings, and full blown relationships.

I've used it sporadically but just got out of my longest relationship not too long ago and the app is a ghost of its former self- few matches, many bots or people 3000 miles aw",https://www.reddit.com/r/OnlineDating/comments/1sjfc2o/is_tinder_just_well_and_truly_dead/,120,116,burnerofc123,2026-04-12,no matches,LEVEL_1_AWARE
OnlineDating,1t1x5lg,questioning likability after getting no matches on hinge,"I 23F can't get any matches on hinge. I don't consider myself supermodel attractive, but I dont think im ugly either and my pictures are decently good. I've never been on a hinge date bc all conversations never really got off the ground and I either ghosted them/got ghosted.  However in the past two",https://www.reddit.com/r/OnlineDating/comments/1t1x5lg/questioning_likability_after_getting_no_matches/,10,29,Best-Cress6548,2026-05-02,no matches,LEVEL_2_STRUGGLING
OnlineDating,1sc2uto,Hily is weird,I tried out hily premium for 2 weeks and used the boosts and everything and every like I got and matched with was met with no responses from a message and now that I don't have premium I keep getting likes even though I never got them without boosts. Does hily have bots who like you when you don't h,https://www.reddit.com/r/OnlineDating/comments/1sc2uto/hily_is_weird/,10,13,the_stars_call,2026-04-04,no matches,LEVEL_1_AWARE
OnlineDating,1sdupht,Am I overthinking or is she just not interested anymore?,"Matched with a girl on Bumble (33M/37F)—she liked me first, I liked back, we matched. Talked daily for a week, I asked her out, she said yes (!!) and she gave me her number without me asking.

We’ve been texting for a few weeks since. I brought up going out again and she said yes (!! again), but sai",https://www.reddit.com/r/OnlineDating/comments/1sdupht/am_i_overthinking_or_is_she_just_not_interested/,7,32,SatisfactionOk2567,2026-04-06,no matches,LEVEL_1_AWARE
OnlineDating,1sp859r,"In todays scenario of looks &amp; height hyperinflation, is there any hope for the average guy?","In todays scenario of looks &amp; height hyperinflation, is there any hope for mediocre looking, medium height guys to experience dating, sex, connections, romantic relationships with women?

  
**I am in NYC** which supposedly has a surplus of young single women. They say for men dating here is eas",https://www.reddit.com/r/OnlineDating/comments/1sp859r/in_todays_scenario_of_looks_height_hyperinflation/,7,64,krmaml,2026-04-18,no matches,LEVEL_1_AWARE
OnlineDating,1szl1pw,Matches with no response.,"For context I am a 25/F lesbian. I use multiple dating apps. Some lesbian specific. Some general dating apps. But I’m always having this problem, many people will match with me but never respond to my messages lol. What’s the point of that? 

I always try to do a thoughtful message rather than just ",https://www.reddit.com/r/OnlineDating/comments/1szl1pw/matches_with_no_response/,7,15,FalconWingedSlug,2026-04-29,no matches,LEVEL_1_AWARE
OnlineDating,1sifg0t,Should I reach out to her again?,"The Situation:

I matched with a girl on Hinge in January. We had an amazing, genuine connection (no small talk, just long, engaging texts). We weren't in the same city, but she was open to meeting once I returned from my studies abroad.

She eventually moved to Instagram, but then deactivated it 2 ",https://www.reddit.com/r/OnlineDating/comments/1sifg0t/should_i_reach_out_to_her_again/,7,22,Sher-e-baloch-,2026-04-11,no matches,LEVEL_1_AWARE
OnlineDating,1swndmx,Asking for a selfie?,Is it normal to ask for a selfie? Not a nude or anything inappropriate but just a picture of the person you're talking to. I've matched with people and a few of them will say no which I typically find off putting. Is this the norm?,https://www.reddit.com/r/OnlineDating/comments/1swndmx/asking_for_a_selfie/,4,67,No-Put-6353,2026-04-26,no matches,LEVEL_1_AWARE
OnlineDating,1sdywxk,"Never dated before, what should I put on my profile?","so I'm 27F and I've never dated anyone before due to self esteem / mental health issues. I've only ever been one one date my entire life and that was when I was 18. I downloaded Hinge but I haven't actually made an account yet cause I don't know what to put on it.

I don't take photos of myself (due",https://www.reddit.com/r/OnlineDating/comments/1sdywxk/never_dated_before_what_should_i_put_on_my_profile/,10,18,Jigglypuff_Green,2026-04-06,mental health dating,LEVEL_1_AWARE
OnlineDating,1suihhu,"34m, is dating possible if I’ve never been in a relationship? I have autism and mental illness","My life has been going pretty well, good social life, mental health under control, financially secure, but lately it’s been hitting me that it’s unlikely I can get what I’ve always wanted which is a relationship. There are no attraction signals from women for my entire life, I went through college w",https://www.reddit.com/r/OnlineDating/comments/1suihhu/34m_is_dating_possible_if_ive_never_been_in_a/,9,9,Training_Form2243,2026-04-24,mental health dating,LEVEL_1_AWARE
OnlineDating,1sr9fiw,Guy pulling away after first date - Am I misreading?,"I (F) matched with a guy about 2 weeks ago and our conversations were good. He seemed like a genuine and thoughtful person.

We met recently and spent almost the whole day together. He opened up quite a bit about his life, including some difficult experiences. I could relate in my own way as I also ",https://www.reddit.com/r/OnlineDating/comments/1sr9fiw/guy_pulling_away_after_first_date_am_i_misreading/,45,49,Standard-Agency1648,2026-04-20,quit dating apps,LEVEL_1_AWARE
