subreddit,post_id,title,selftext_snippet,url,score,num_comments,author,created_date,search_term,category
HealthInsurance,1s3o5o6,"Might get stuck with 210k bill, dunno what to do","So my surgeon's office called and got prior authorization.

It was down to the hospital even telling me, a week or so before the surgery, how much my portion of the bill would be after insurance (Like 3k, which is basically my max OOP)

The plan is a PPO and it checked all the codes myself, and the ",https://www.reddit.com/r/HealthInsurance/comments/1s3o5o6/might_get_stuck_with_210k_bill_dunno_what_to_do/,53,46,Impressive-Ebb6498,2026-03-25,claim denied,LEVEL_2_STRUGGLING
HealthInsurance,1s1lcqp,Insurance is making it impossible to file an appeal,"I’ll try to keep this short and to the point. Last spring, my 5-month-old was presenting spasms. Her pediatrician told us to take her to the emergency room immediately for suspected Infantile epileptic spasms syndrome. According to our doctors, standard protocol is to send infants to the ER for susp",https://www.reddit.com/r/HealthInsurance/comments/1s1lcqp/insurance_is_making_it_impossible_to_file_an/,37,37,cheesyblasters101,2026-03-23,claim denied,LEVEL_1_AWARE
HealthInsurance,1skeodk,Insurance denied the claim saying its medically unnecessary,"I’m an international student in the U.S., and I have the insurance recommended by my university, which is accepted at the hospital where I live. I had a helix piercing about 6 years ago, but after coming to the U.S., it started to grow, and I eventually developed a keloid.                           ",https://www.reddit.com/r/HealthInsurance/comments/1skeodk/insurance_denied_the_claim_saying_its_medically/,29,33,CompetitivePie8713,2026-04-13,claim denied,LEVEL_1_AWARE
HealthInsurance,1ryxtzc,"Provider won’t change CPT code, insurance says they can’t fix it","Hi everyone, I’m looking for advice on what my next steps should be in a billing/coding dispute between my provider and my insurance. This is in the state of Minnesota.

I had a visit in January 2026 for a routine pelvic exam with Pap smear screening. The visit documentation states that the purpose ",https://www.reddit.com/r/HealthInsurance/comments/1ryxtzc/provider_wont_change_cpt_code_insurance_says_they/,21,130,ripsaw341,2026-03-20,claim denied,LEVEL_1_AWARE
HealthInsurance,1so9ty7,Health insurance Canceled Me," I am seeking urgent legal assistance regarding a serious issue with my health insurance coverage through the Marketplace and Oscar Health.

I maintained active health insurance coverage throughout 2025 with Oscar Health and paid all monthly premiums on time without any lapse. In May 2025, I also re",https://www.reddit.com/r/HealthInsurance/comments/1so9ty7/health_insurance_canceled_me/,20,15,Personal-Duty-6385,2026-04-17,claim denied,LEVEL_1_AWARE
HealthInsurance,1sf9hcs,My Baby's Hernia Surgery Left Me With a $60K Bill Over a Billing Dispute,"My 2-month-old had hernia surgery at an in-network hospital/surgeon. The surgeon office got outpatient authorization before the procedure. After surgery, they kept him overnight (\~28 hrs) to monitor for apnea risk.

Here's where it gets sort of shady: the hospital quietly also obtained a *second* a",https://www.reddit.com/r/HealthInsurance/comments/1sf9hcs/my_babys_hernia_surgery_left_me_with_a_60k_bill/,15,32,Confident-Singer4347,2026-04-07,claim denied,LEVEL_1_AWARE
HealthInsurance,1seys2a,"Received $7,000 in bills that were already covered","hi all, I am in quite a stressful situation here. this is something I cannot explain in a short paragraph so I appreciate those who read this.

in February of this year, I received bills totaling up to $7,000 from 2025 that my insurance (UHC) already paid and approved, but randomly denied and decide",https://www.reddit.com/r/HealthInsurance/comments/1seys2a/received_7000_in_bills_that_were_already_covered/,11,25,InsertTrendyMemes,2026-04-07,claim denied,LEVEL_2_STRUGGLING
HealthInsurance,1sb4qyh,Insurance denies claim nearly year later,"Hi everyone, I have Humana health insurance. I was having problems of body fatigue related to low testosterone. Called Humana to see what is covered and where to go, recommended to specific local business and I set up the appointment in May of 2025.

I am at the office for a very short time, get my ",https://www.reddit.com/r/HealthInsurance/comments/1sb4qyh/insurance_denies_claim_nearly_year_later/,6,19,gear123456789,2026-04-03,claim denied,LEVEL_1_AWARE
HealthInsurance,1slddyv,Question about best options for someone with major illness,"I am a married empty nester. My husband is older, but in fantastic health. I am healthy, but have multiple autoimmune issues for which I see 2 specialists and my PCP regularly.  I have good control of everything, but I am drowning in medical bills.

Currently, I have UHC thru the marketplace and the",https://www.reddit.com/r/HealthInsurance/comments/1slddyv/question_about_best_options_for_someone_with/,6,17,DaughterofMarilyn,2026-04-14,claim denied,LEVEL_1_AWARE
HealthInsurance,1sbp5rm,Third party contract attempting to collect services already paid under hospital's global bill — insurance denied as 'covered as part of another service,"\*Third party contract attempting to collect services already paid under hospital's global bill — insurance denied as 'covered as part of another service'\*\*

Looking for help understanding if I am handling this correctly (USA).

I had an ER visit at Hospital two years ago. Hospital billed my insur",https://www.reddit.com/r/HealthInsurance/comments/1sbp5rm/third_party_contract_attempting_to_collect/,5,35,Top-Squirrel490,2026-04-03,claim denied,LEVEL_1_AWARE
HealthInsurance,1sci99d,What happens if you cannot afford treatment?,"I pay $800 a month with a $7500 deductible.  What happens if long term treatment is needed and I cannot afford the $17,000 per year for the insurance premium and the treatment?

Do I get treated knowing I can't pay, or tell them thanks, but I can't afford this and let nature take its course?",https://www.reddit.com/r/HealthInsurance/comments/1sci99d/what_happens_if_you_cannot_afford_treatment/,41,81,Cemetery-Bunny,2026-04-04,can't afford treatment,LEVEL_2_STRUGGLING
HealthInsurance,1smpk9y,No in-network cancer treatment within 75 miles - Network Adequacy Exception?,"My husband was diagnosed with stage 3 cancer last month. His oncologists are covered by our plan. However (like so many others on this sub), we discovered that his  infusion/radiation facilities are out-of-network. The nearest cancer treatment facility in-network is 75 miles away (confirmed by insur",https://www.reddit.com/r/HealthInsurance/comments/1smpk9y/no_innetwork_cancer_treatment_within_75_miles/,20,10,the_normal_curve,2026-04-15,can't afford treatment,LEVEL_3_CRISIS
HealthInsurance,1sgtik6,Timeline for retiring/losing benefits and applying for Marketplace or Medicaid?,"My 62 year old father was just diagnosed with heart failure and is basically being forced into retirement because he is a truck driver and can no longer do manual labor. Because he is actively getting treatment and scans for his health problems, he can't afford to lose health coverage right now. At ",https://www.reddit.com/r/HealthInsurance/comments/1sgtik6/timeline_for_retiringlosing_benefits_and_applying/,2,4,fiddleleaffigonacci,2026-04-09,can't afford treatment,LEVEL_2_STRUGGLING
HealthInsurance,1s3ma5g,What to do if doctor refuses to do prior authorizations?,"My doctor recently prescribed me a medication that the pharmacy says requires a prior authorization from the insurance company. Problem is, the doctor/his practice refuses to do prior authorizations. When I talked to the doctor they told me it was going to be up to me to pay full price for the med i",https://www.reddit.com/r/HealthInsurance/comments/1s3ma5g/what_to_do_if_doctor_refuses_to_do_prior/,33,92,Careless-Ad-6328,2026-03-25,prior authorization,LEVEL_2_STRUGGLING
HealthInsurance,1s0aro2,New year exclusion of coverage with prior authorization,"In Nov 2025 I went to orthopedic doc for knee pain, he ordered MRI which my insurance approved and determined gel injections would be best. He got authorization from insurance which came back as “no auth required” which I guess is lingo that they can move forward (they told me it was covered). I cal",https://www.reddit.com/r/HealthInsurance/comments/1s0aro2/new_year_exclusion_of_coverage_with_prior/,16,34,csamay,2026-03-21,prior authorization,LEVEL_2_STRUGGLING
HealthInsurance,1s5n4uk,Prior Auth for generic but not name brand?,"I just learned that my insurance requires a prior authorization for a generic medication ($20) but not for the brand name ($400). This seems backwards to me, not to mention predatory and insane. Their website lists the costs for the two versions but says nothing about needing a PA for the cheaper ge",https://www.reddit.com/r/HealthInsurance/comments/1s5n4uk/prior_auth_for_generic_but_not_name_brand/,7,14,ArcanaNoir,2026-03-27,prior authorization,LEVEL_2_STRUGGLING
HealthInsurance,1sktghu,Pharmacy administrator put conditions on prior authorization after issuing to me and Dr.,"TL;DR: can my insurance issue a prior authorization letter for a medicine to me and my Dr. (I have a copy), let me pick up the medicine at a Walgreens for the first few doses, and now stipulate that I must obtain it in the future through their preferred specialty pharmacy *without* issuing a new PA ",https://www.reddit.com/r/HealthInsurance/comments/1sktghu/pharmacy_administrator_put_conditions_on_prior/,7,10,phdibart,2026-04-13,prior authorization,LEVEL_2_STRUGGLING
HealthInsurance,1s39ebj,Prior auth for future effective date?,"Hi! I am a but lost in a situation 

I am transitioning insurance on 04/01 with the bad luck that I’d need to start a procedure on 04/01. It’s being a huge problem getting prior authorization since the policy is not yet effective and the policy number is not defined until 04/01 (CareFirst).

The cli",https://www.reddit.com/r/HealthInsurance/comments/1s39ebj/prior_auth_for_future_effective_date/,4,13,asturDC,2026-03-25,prior authorization,LEVEL_2_STRUGGLING
HealthInsurance,1ryhqps,Is it normal to need prior approval again on a medication when the dose is increased ??,"I have a Medicare Advantage Plan.

In January my doctor sent an order to my pharmacy for a new medication.

Insurance quickly covered the cost put told me it was a one time thing.

That I would need prior approval for another refill.

I sent my doctor a message letting her know.

In February the med",https://www.reddit.com/r/HealthInsurance/comments/1ryhqps/is_it_normal_to_need_prior_approval_again_on_a/,5,9,SeaworthinessHot2770,2026-03-19,prior authorization,LEVEL_1_AWARE
HealthInsurance,1s5c4zy,How Often Do I Need to Bug my Doctor to Fill Out My Prior Authorization Request Form?,"So I was recently prescribed methylphenidate ER for my ADHD (yay), but I've hit a roadblock with my insurance (Blue Shield of CA). They have stated I need prior authorization before my medication can be sent to the pharmacy for pick-up. I had my appointment with my shrink last Tuesday, and he stated",https://www.reddit.com/r/HealthInsurance/comments/1s5c4zy/how_often_do_i_need_to_bug_my_doctor_to_fill_out/,3,10,IrishGoodbye28,2026-03-27,prior authorization,LEVEL_2_STRUGGLING
HealthInsurance,1s80aqj,EOB Sent after Procedure in 2021,Hello. I have received two different EOB's from my insurance carrier for different procedures from 2021. They are saying prior authorization was never given when it was. It was from my old insurance but was sent from my current insurance office. I am confused. I called my current insurance and they ,https://www.reddit.com/r/HealthInsurance/comments/1s80aqj/eob_sent_after_procedure_in_2021/,3,8,New-Wear5414,2026-03-30,prior authorization,LEVEL_2_STRUGGLING
HealthInsurance,1s8qs32,UHC &amp; New York Presbyterian,"Hi everyone,

I have a surgery scheduled for tomorrow 4/1. I had an appointment with my ENT/Surgeon back on March 24th and got prior authorization for my procedure on March 25th. I confirmed with my insurance at the time and the medical center and doctor were all covered in network. However, today t",https://www.reddit.com/r/HealthInsurance/comments/1s8qs32/uhc_new_york_presbyterian/,3,11,honeytoast88,2026-03-31,prior authorization,LEVEL_2_STRUGGLING
HealthInsurance,1ryj0te,Just cancelled my insurance and will be winging it the remainder of the year. Yay!,Im sharing my experience. I’m just at a loss for words regarding our health insurance costs in this country. I had to switch from mediCal to covered California last year due to a job switch the year previous and make too much to qualify and ended up owing on my tax return this year $800 due to havin,https://www.reddit.com/r/HealthInsurance/comments/1ryj0te/just_cancelled_my_insurance_and_will_be_winging/,75,72,queeniexoxox,2026-03-19,medical debt,LEVEL_1_AWARE
HealthInsurance,1s5fbkv,Help me please,"Hello all. I(29 M) am a welder and make roughly 60k/year before taxes and insurance. I currently get insurance through my employer for myself, my wife, and my two kids. It costs $1200/month. This is our second largest expense besides our Mortgage($1800/month) for reference. With current circumstance",https://www.reddit.com/r/HealthInsurance/comments/1s5fbkv/help_me_please/,14,30,Jay_LVR,2026-03-27,medical debt,LEVEL_3_CRISIS
HealthInsurance,1sg37xi,UHC Claims,"I have UHC and about 6 weeks was hospitalized due to emergent reasons. Well, I went to a hospital that was in network and UNC gave me all discounts on all my physician fees for being in network; however, they wouldn't give me any in network discounts on my hospitalization or ER charges. I now am 25k",https://www.reddit.com/r/HealthInsurance/comments/1sg37xi/uhc_claims/,8,37,PlasticDragonfruit84,2026-04-08,medical debt,LEVEL_3_CRISIS
HealthInsurance,1skh5kt,"Friend is in medical debt, how can I appease it?","I have a friend who was baker acted involuntarily to a medical facility by police and was there for about 3-4 days. He had no insurance at the time of being there. Months passed and he gets a bill for over $30,000. A quick online search found it would’ve been worth a tenth of the amount. I tried to ",https://www.reddit.com/r/HealthInsurance/comments/1skh5kt/friend_is_in_medical_debt_how_can_i_appease_it/,1,6,ResistTerrible2988,2026-04-13,medical debt,LEVEL_3_CRISIS
HealthInsurance,1s4nhr1,Advice needed: Hospital billed me inpatient despite insurance denial and outpatient confirmation (CA),"Hi everyone, I need advice on a hospital billing dispute.

* In 2023, I went to Lakewood Regional Medical Center (now UCI Lakewood) for a blood transfusion in the ER due to anemia. I expected outpatient care.
* At discharge, staff told me my **insurance denied further care**, so they were dischargin",https://www.reddit.com/r/HealthInsurance/comments/1s4nhr1/advice_needed_hospital_billed_me_inpatient/,1,25,Ancient_Remote9252,2026-03-26,medical debt,LEVEL_1_AWARE
HealthInsurance,1s2tm1n,Chose cheap insurance…,"We were both healthy in December during open enrollment. Now my wife is needing a laundry-list of different medical specialists and several family doctors visits. Our plan covers tests and scans for 20% and our deductible is very high, like $28,000 or $45,000 I think. Doesn’t matter, it might as wel",https://www.reddit.com/r/HealthInsurance/comments/1s2tm1n/chose_cheap_insurance/,0,17,keybiller1,2026-03-24,medical debt,LEVEL_1_AWARE
HealthInsurance,1sl2x0z,Medicare Advantage is a Scam: My experience almost a decade in the Healthcare industry,"I was inspired to go into some detail after an AskReddit post about dirty insider truth that most people won't know. I replied that, as a person who who's worked in the medical field for a little over 9 years, saying that Medicare is leagues better than Medicare Advantage and Medicare Advantage is a",https://www.reddit.com/r/HealthInsurance/comments/1sl2x0z/medicare_advantage_is_a_scam_my_experience_almost/,449,235,IMian91,2026-04-14,insurance won't cover,LEVEL_1_AWARE
HealthInsurance,1s4ftfa,Insurance wont cover services on 1st day of service,"Hoping to find some help here. Been fighting insurance for almost 18 months. Long story short(ish), my wife went into hospital on 6/8/24 to give birth to our 3rd child. We started a new insurance on 6/9/24 so we assumed services on that date would be covered. We’ve had hospital send an itemized rece",https://www.reddit.com/r/HealthInsurance/comments/1s4ftfa/insurance_wont_cover_services_on_1st_day_of/,5,45,Gold-Penalty6418,2026-03-26,insurance won't cover,LEVEL_1_AWARE
HealthInsurance,1sq5op3,Moving to USA as dual citizen,"Hi guys,

I'm a dual citizen UK/USA. I've never lived in the USA. I'm moving over in June 16th. First I'll visit my family on the East coast, then my uncle is lending me a car and I'll drive over to the rockies to find somewhere to settle. I'm a climber and will definitely be doing some climbing on ",https://www.reddit.com/r/HealthInsurance/comments/1sq5op3/moving_to_usa_as_dual_citizen/,4,19,Gooseman_retrofit,2026-04-19,insurance won't cover,LEVEL_1_AWARE
HealthInsurance,1s5s5h1,Moving States: Need Advice,"Hello! I hope everyone is well. 

I am currently getting ready to move from South Carolina to Utah in a few months. While the move itself is still a little ways off, I want to be sure that when I move there I have a Healthcare plan set in place that I can either apply for or just get a generalized i",https://www.reddit.com/r/HealthInsurance/comments/1s5s5h1/moving_states_need_advice/,3,7,RooimhArt,2026-03-28,insurance won't cover,LEVEL_1_AWARE
HealthInsurance,1s97qkk,When to cancel Marketplace insurance?,"After being unemployed and receiving ACA subsidized health insurance, husband got a new job a couple weeks ago and was verbally told their health insurance plan started on the first day of his employment.  (I believe it, because the dental insurance started then too, and that company already sent us",https://www.reddit.com/r/HealthInsurance/comments/1s97qkk/when_to_cancel_marketplace_insurance/,3,10,Jellodrome,2026-03-31,insurance won't cover,LEVEL_1_AWARE
HealthInsurance,1s77i0a,Proper course of action for trying to understand my insurance coverage,"So my family has BCBS through my husband's company. I have no idea what division of BCBS (like the state) because the company and the insurance have been super vague and getting info has been hard, they won't send us physical cards because their new coverage only has an app with a virtual card which",https://www.reddit.com/r/HealthInsurance/comments/1s77i0a/proper_course_of_action_for_trying_to_understand/,2,15,thingsarehardsoami,2026-03-29,insurance won't cover,LEVEL_1_AWARE
HealthInsurance,1so6t6j,Pharmacy refusing to process Medi-cal claims properly,"My kids are dual insured with medi-cal and private insurance. Our pharmacy, after a decade of no problems, has started billing \*some\* but not all of my kids Medi-Cal claims incorrectly and refusing to do it properly. Essentially kid As claims are being billed and coverd properly but kids Bs aren't",https://www.reddit.com/r/HealthInsurance/comments/1so6t6j/pharmacy_refusing_to_process_medical_claims/,2,11,123Martha321,2026-04-17,insurance won't cover,LEVEL_1_AWARE
HealthInsurance,1sf6ta0,Private health insurance for dental – am I doing the math wrong or is it a scam?,"looking at extras cover for dental and honestly the numbers aren't making sense to me. Hoping someone here can explain what I'm missing.I need two crowns and probably a root canal, nothing crazy urgent but it needs to happen this year. Got quotes from a few dentists in Canberra totalling around 4k-5",https://www.reddit.com/r/HealthInsurance/comments/1sf6ta0/private_health_insurance_for_dental_am_i_doing/,1,27,dmkraus,2026-04-07,insurance won't cover,LEVEL_1_AWARE
HealthInsurance,1son7om,Wife just had surgery and insurance is denying coverage for medicine given to her during surgery.,"I have BCBS. It says injectable medication is not covered. She had rotator cup surgery. I have to call to get more information, the EOB doesn't give any more details as to what exactly it was. I know she was injected with a nerve block. 

What are my options? Appeal with my health care? Or should I ",https://www.reddit.com/r/HealthInsurance/comments/1son7om/wife_just_had_surgery_and_insurance_is_denying/,29,33,mrmanpgh,2026-04-18,appeal denied,LEVEL_1_AWARE
HealthInsurance,1sg57w9,"$3000 bill for in-network Quest bloodwork with BCBS, appeal denied","Near the end of last year I went in to a in-network rheumatologist that I had been seeing for two years for routine bloodwork that I had received many times before. A month or so later, I received a bill for close to $3000 from Quest and a statement from BCBS saying that all of the charges had been ",https://www.reddit.com/r/HealthInsurance/comments/1sg57w9/3000_bill_for_innetwork_quest_bloodwork_with_bcbs/,21,78,Fragrant-Oil-3562,2026-04-08,appeal denied,LEVEL_2_STRUGGLING
HealthInsurance,1sbabzs,Should My Six Figure EoB Be Easy to Appeal?,"Last month, Mount Sinai sent me a massive bill for a surgery I had in 2025, despite the fact that I had pre-approval deeming the procedure medically necessary, the procedure explicitly being covered by my plan (and all New York insurers actually being required by law to cover it), and both my surgeo",https://www.reddit.com/r/HealthInsurance/comments/1sbabzs/should_my_six_figure_eob_be_easy_to_appeal/,12,16,LunaB35,2026-04-03,appeal denied,LEVEL_1_AWARE
HealthInsurance,1s1vmgy,Labor/Delivery Divert Disaster,"I delivered my son last September. After laboring at home as long as possible, I called my hospital (UCSF Mission Bay) to let them know I was coming in and they diverted me to SFGH, which turned out to be an out of network provider. 

I had an unmedicated, fast delivery, and my bills total almost $1",https://www.reddit.com/r/HealthInsurance/comments/1s1vmgy/labordelivery_divert_disaster/,10,21,lamilllls,2026-03-23,appeal denied,LEVEL_2_STRUGGLING
HealthInsurance,1s7ueje,"Anthem appeal process: admitted to hospital for 2 days, BCBS denied doctor’s request for my stay (but I was already discharged). Now worried about the bill","Update: thank you everyone for the inputs!

I called the billing department. They said it’s common and should not worried yet. I was told to wait at least 30 days before checking especially if I don’t receive either an EOB or another notice with an approval/denial. The hospital gets 2 appeals and th",https://www.reddit.com/r/HealthInsurance/comments/1s7ueje/anthem_appeal_process_admitted_to_hospital_for_2/,7,10,Open-Jump5433,2026-03-30,appeal denied,LEVEL_1_AWARE
HealthInsurance,1s0bqyz,Birthday rule? Newborn's bills,"Hello! I gave birth to my second child in January. I added him to my existing Aetna self + child(ren) employer sponsored plan within a week of giving birth. The initial EOBs by Aetna showed his bills, both hospital and pediatric, as processed, a set amount paid by the plan and the rest as patient re",https://www.reddit.com/r/HealthInsurance/comments/1s0bqyz/birthday_rule_newborns_bills/,6,18,two-story-house,2026-03-21,appeal denied,LEVEL_1_AWARE
HealthInsurance,1s8m9d4,How is it fair that insurance companies are able to “reprocess” claims after years.,"I had to pay for going to the ER because the doctor was apparently out-of-network, despite choosing a hospital that’s in-network. 

It felt unfair because who would even think to ask every doctor that sees you in the ER if they take your insurance. But fine, I let it go.  I thought maybe that was th",https://www.reddit.com/r/HealthInsurance/comments/1s8m9d4/how_is_it_fair_that_insurance_companies_are_able/,52,38,NoValuable8916,2026-03-31,out of network,LEVEL_1_AWARE
HealthInsurance,1s70pz5,Can someone help me understand out of pocket max please?,"Attached is a section of my insurance card.

The way I understand this, if I as a single person, need care at an in network provider, it's going to cost my deductible of $2500 before insurance starts to pay. If I end up needing a bunch of care at an in network provider, the max I am required to pay ",https://www.reddit.com/r/HealthInsurance/comments/1s70pz5/can_someone_help_me_understand_out_of_pocket_max/,44,29,dom9mod,2026-03-29,out of network,LEVEL_1_AWARE
HealthInsurance,1sf8rud,I'm at my wit's end. My doctor AND the Anthem website says my plan is In-Network. Anthem customer service says my doctor is out of network.,"I went on the Anthem website to look for an ENT. Their website said a doctor was in-network. I've had a problem in the past where a doctor wasn't actually in network even if the website said it was...so I called the provider's office. They check my insurance and say they're in network. Great! 

Now ",https://www.reddit.com/r/HealthInsurance/comments/1sf8rud/im_at_my_wits_end_my_doctor_and_the_anthem/,38,52,faceliftkangaroo,2026-04-07,out of network,LEVEL_1_AWARE
HealthInsurance,1s95kah,SOS - Type 1 Diabetic with no access to healthcare coverage,"I have no idea if this would be the right subreddit to post in, but I am at a loss.

For context, I was laid off of my fancy (but toxic and shitty) corporate job in August. The company paid for 6 months of my COBRA coverage, which has now run out and I am fighting with the company to send me a form ",https://www.reddit.com/r/HealthInsurance/comments/1s95kah/sos_type_1_diabetic_with_no_access_to_healthcare/,21,83,MissAtomicBlonde6969,2026-03-31,out of network,LEVEL_1_AWARE
