subreddit,post_id,title,selftext_snippet,url,score,num_comments,author,created_date,search_term,category
HealthInsurance,1slok4v,"Pregnant, called 20+ “in-network” OBs and none accept my plan, what actually works here?","I really need advice from anyone who has dealt with marketplace insurance issues like this.

I recently got laid off and lost my Aetna PPO. I enrolled through HealthCare.gov and now have WellPoint Essential Bronze POS 4500 (covers my husband, toddler, and me).

I’m currently 4 weeks pregnant.

My pr",https://www.reddit.com/r/HealthInsurance/comments/1slok4v/pregnant_called_20_innetwork_obs_and_none_accept/,19,27,MossMallows,2026-04-14,out of network,LEVEL_1_AWARE
HealthInsurance,1rz27hs,Colonoscopy Double billed?,"Can someone help me figure this out? Why is there a $948 charge and a $4753 charge under the same 45378 code? I've even been billed for it separately as you can see if you scroll through. I would love any help in understanding if I can push back. This is my first routine colonoscopy, and I accidenta",https://www.reddit.com/r/HealthInsurance/comments/1rz27hs/colonoscopy_double_billed/,11,30,Elegant_Pipe6624,2026-03-20,out of network,LEVEL_1_AWARE
HealthInsurance,1sfyz87,"In-network doctors,anesthesiologists out-of-network facilities","I am beyond frustrated. 

I called the office where I was referred. I saw a doctor that the front desk verified was in-network. I talked with insurance (cigna) and verified the doctor and anesthesiologist was in-network. I went through a the spine specialist as Cigna to ensure that everything was go",https://www.reddit.com/r/HealthInsurance/comments/1sfyz87/innetwork_doctorsanesthesiologists_outofnetwork/,10,25,Trai-All,2026-04-08,out of network,LEVEL_2_STRUGGLING
HealthInsurance,1slpvh1,How do I get an estimate?!,"My procedure is tomorrow so it’s too late, I’ll probably be slapped with a $3000 bill, but whatever.

I have a high deductible health insurance. I went to get a (women’s health) procedure last month and was quoted $3200 so I cancelled. I started seeing a specialist in a different network who schedul",https://www.reddit.com/r/HealthInsurance/comments/1slpvh1/how_do_i_get_an_estimate/,11,20,cbgirl91,2026-04-14,out of network,LEVEL_2_STRUGGLING
HealthInsurance,1ryx16k,A stop to endless billing?,For quite some time we have been fortunate to not have had too many major health issues with our family - until last year when we experienced an ER visit then surgery for our son then another ER visit for me later in year. Neither resulted in overnight stays. All outpatient. Yet to this day I am sti,https://www.reddit.com/r/HealthInsurance/comments/1ryx16k/a_stop_to_endless_billing/,16,36,Space_Adaline,2026-03-20,surprise bill,LEVEL_1_AWARE
HealthInsurance,1soiojl,Newborn automatically added to insurance?,"My daughter was born almost a year and a half ago, and I added her to my insurance (Cigna) within the first 31 days. They have covered most of her bills, but have repeatedly denied the largest bill from the hospital for her birth. Eventually we figured out they believed she was covered under my husb",https://www.reddit.com/r/HealthInsurance/comments/1soiojl/newborn_automatically_added_to_insurance/,5,5,wistenn,2026-04-17,surprise bill,LEVEL_1_AWARE
HealthInsurance,1sl97ve,In-Network Billing vs Out-of-Network Location (NYU Langone),"Hi everyone, I’m hoping someone here has experience with NYU Langone billing or Aetna because I’m getting really mixed information and it’s stressing me out.

I’m scheduled for a Diagnostic colonoscopy (I am 30 years old) at NYU Langone. The estimate I received lists the billing entity as NYU Langon",https://www.reddit.com/r/HealthInsurance/comments/1sl97ve/innetwork_billing_vs_outofnetwork_location_nyu/,2,3,diunei226,2026-04-14,surprise bill,LEVEL_2_STRUGGLING
HealthInsurance,1s9bwuv,Advice with surprise balance billing,"To make this short, I went in for a preventative procedure. Facility and doctor were in network with insurance. Before procedure they said they may or may not take a biopsy, and I told them if they do to make sure if it's in network. Well they took a biopsy and the lab they used were out of network.",https://www.reddit.com/r/HealthInsurance/comments/1s9bwuv/advice_with_surprise_balance_billing/,2,4,endrop1ne,2026-04-01,surprise bill,LEVEL_2_STRUGGLING
HealthInsurance,1skibpn,Is this a clear cut case of disallowed balance billing for emergency services?,"Context:

* State of Residence: VA
* VA has a state level balance billing protection act (in addition to the federal no surprises act but I read that the federal level doesn't apply? more on that later).
* My wife had met her complete out of pocket for the year prior to this incident. Meaning she sh",https://www.reddit.com/r/HealthInsurance/comments/1skibpn/is_this_a_clear_cut_case_of_disallowed_balance/,1,7,khuldrim,2026-04-13,surprise bill,LEVEL_1_AWARE
HealthInsurance,1s956ij,Kaiser vs UCLA (Anthem PPO) — Looking for REAL experiences after switching,"If you haven’t personally switched between Kaiser and a PPO (especially UCLA/Anthem), this probably isn’t the thread for you — I’m looking for first-hand experience only, not general plan explanations.

Bonus if you’ve dealt with imaging, referrals, or had to chase follow-ups — that’s where I’m seei",https://www.reddit.com/r/HealthInsurance/comments/1s956ij/kaiser_vs_ucla_anthem_ppo_looking_for_real/,1,4,Euphoric-Bad6405,2026-03-31,surprise bill,LEVEL_1_AWARE
HealthInsurance,1sf50o7,Never Received Bills,"My fiancé had a recent stay in the emergency room. My insurance website shows that there were three claims made against the policy that require us to make payment. Two came from the hospital and one came from EPSS, which is the staffing service that provided the physicians. Unfortunately, we've neve",https://www.reddit.com/r/HealthInsurance/comments/1sf50o7/never_received_bills/,1,9,_walkswalks,2026-04-07,surprise bill,LEVEL_3_CRISIS
HealthInsurance,1s3j60t,Surprise medical bill,"In April of last year I had a baby at the hospital and paid close to $2,000 in medical bills within the next month or two. Thought I was done with all that. YESTERDAY I receive a bill from a medical facility that I didn’t even give birth at, saying I owe $408. I’m guessing some provider from there c",https://www.reddit.com/r/HealthInsurance/comments/1s3j60t/surprise_medical_bill/,0,14,Okay-Show-3662,2026-03-25,surprise bill,LEVEL_1_AWARE
HealthInsurance,1skl4nu,got an eob listing lab charges for a papsmear?,"title is a bit brief, but here's what's up. i went to an appointment at my normal clinic with my normal provider on march 11 to get both my physical and my pap out of the way. my insurance lists both as 100% covered preventative care, so i wasn't anticipating any bills. a couple weeks-a week ago, i ",https://www.reddit.com/r/HealthInsurance/comments/1skl4nu/got_an_eob_listing_lab_charges_for_a_papsmear/,1,7,sigilpaw,2026-04-13,surprise bill,LEVEL_1_AWARE
HealthInsurance,1snq7zi,Confused about urgent care (in-network) and uninformed lab bill (out-of-network),"I went to urgent care and did a respiratory panel test, was informed that it would be sent to an independent lab and that was that. I didn’t know it would be sent an out of network lab. 

Fast forward a few months later I get a bill from said lab stating I owe them $90 and my insurance paid them $35",https://www.reddit.com/r/HealthInsurance/comments/1snq7zi/confused_about_urgent_care_innetwork_and/,0,13,ChemistryCheap3562,2026-04-17,surprise bill,LEVEL_1_AWARE
Insurance,1si0dz2,Insurance won't cover accident due to Undisclosed Household Member,"I am the claimant.  Driver who hit me was at fault per accident report. Driver at fault also refused blood/alcohol test. Two weeks later driver was to appear in court for earlier DUI. Driver was charged with DUI and reckless driving.

I filed claim against driver's insurance.  I only had liability s",https://www.reddit.com/r/Insurance/comments/1si0dz2/insurance_wont_cover_accident_due_to_undisclosed/,369,357,Minimum-Courage-3331,2026-04-10,claim denied,LEVEL_2_STRUGGLING
Insurance,1sq80b5,subrogation: injured badly at a friends house,about 6 months ago I was at a friends house and slipped and fell on his deck stairs.  it ended up being pretty awful.  I broke 2 ribs and punctured a lung.  I was in the hospital for 3 days as one of my lungs had collapsed.  i'm not going to sue my friend but my my health insurance is requesting inf,https://www.reddit.com/r/Insurance/comments/1sq80b5/subrogation_injured_badly_at_a_friends_house/,37,63,mecausasui,2026-04-19,claim denied,LEVEL_1_AWARE
Insurance,1sdcqxg,Virginia insurance laws are actually insane?? (contributory negligence),"just venting but also kinda need a reality check here. got rear ended in richmond last week at a really weird yield sign setup. The other guys geico adjuster called me today and said because I ""hesitated"" before pulling out, I share like 10% of the blame.  
  
And because of that, they are denying l",https://www.reddit.com/r/Insurance/comments/1sdcqxg/virginia_insurance_laws_are_actually_insane/,18,19,proposal_in_wind,2026-04-05,claim denied,LEVEL_1_AWARE
Insurance,1sktla3,Tree crashed into our garage during a snowstorm. Insurance has done almost nothing for 2 months.,"I've never had to deal with such a lagging and unresponsive insurance company in my life. My area (Northern California) has one or two major snowstorms during the winter. When this happens, hundreds of trees fall. It turns our town into a disaster area, with downed trees everywhere knocking out powe",https://www.reddit.com/r/Insurance/comments/1sktla3/tree_crashed_into_our_garage_during_a_snowstorm/,10,16,oCUBBYo,2026-04-13,claim denied,LEVEL_1_AWARE
Insurance,1s10rbs,Lemonade pet insurance - anything unusual to expect when filing a claim?,"Our dog got a hold of a piece of corn cob from the trash and ate it, and since dogs can’t digest corn, we had to take her to the ER. They said they believe they’ll be able to get it out with an endoscopy, which they’re working on now. But the bill will be several thousand, so we plan to file a claim",https://www.reddit.com/r/Insurance/comments/1s10rbs/lemonade_pet_insurance_anything_unusual_to_expect/,9,9,Cold-Priority-2729,2026-03-22,claim denied,LEVEL_1_AWARE
Insurance,1skpnfw,Driver in disputed liability crash threatening to sue me,I was recently in a crash where I was going straight through an intersection and hit a driver turning right into my lane. We both claim the right of way and don’t have a police report or witness statements dash cam etc (many lessons learned). I had automatically assumed I was at fault because I hit ,https://www.reddit.com/r/Insurance/comments/1skpnfw/driver_in_disputed_liability_crash_threatening_to/,7,18,geogirl1997,2026-04-13,claim denied,LEVEL_1_AWARE
Insurance,1sbbrvz,Need advice on liability for this situation,My in-laws passed and they still have a mortgage.  They left their estate to my wife and her brother.  Both are listed as executors on the will.  My brother-in-law had been living there for years while his parents were still alive and plans to stay in the house and continue to pay the mortgage.  My ,https://www.reddit.com/r/Insurance/comments/1sbbrvz/need_advice_on_liability_for_this_situation/,7,20,Friendly-Bake-829,2026-04-03,claim denied,LEVEL_1_AWARE
Insurance,1sh6n40,"[CA] Tenant hit home with car - Car insurance accepted, then denied claim","Hello all, 

I'm trying to grasp who do i call focus my attention on because i feel like i'm getting the run around right now.   
  
My tenant was backing into her parking spot 2 months ago, when she backed up too far and tapped the house. A single facade break fell off and she apologized. Then a we",https://www.reddit.com/r/Insurance/comments/1sh6n40/ca_tenant_hit_home_with_car_car_insurance/,6,10,Hitoak,2026-04-09,claim denied,LEVEL_1_AWARE
Insurance,1s3boyu,Higher mileage than what is on my policy document -- agent says don't worry about it,"Allstate. Indiana. Regular old comprehensive auto insurance for a financed 8 month old car.

I noticed that the policy document states 12,000. The car has driven 22,000 in eight months. My recollection was that I had put something like 30,000 or 35,000 down on a form at the outset, but there's the 1",https://www.reddit.com/r/Insurance/comments/1s3boyu/higher_mileage_than_what_is_on_my_policy_document/,6,32,Worth-Novel-2044,2026-03-25,claim denied,LEVEL_1_AWARE
Insurance,1sadmr8,"Health insurance rescinded, how to get new coverage?","Washington state, USA

Health insurance as a dependent

Dealing with a real annoying issue of a rescinded health insurance policy. Apparently, I wasn't an eligible dependent to be on my partner's plan. Fine. However, I recieved zero paperwork, phone calls, warning, etc. and had to find out on my own",https://www.reddit.com/r/Insurance/comments/1sadmr8/health_insurance_rescinded_how_to_get_new_coverage/,7,7,hisokagirlboy,2026-04-02,claim denied,LEVEL_1_AWARE
Insurance,1sbsj3r,Lab work costing over 1000 dollars?,"I just got diagnosed with alopecia areata and my dermatologist ordered a big blood work panel with 12 different things to test for. It's going to be done at Lab Quest which is in network with my insurance, but my insurance will only cover it if it's preventative. Since I went to the derm it's no lon",https://www.reddit.com/r/Insurance/comments/1sbsj3r/lab_work_costing_over_1000_dollars/,1,2,IndicationInner7023,2026-04-03,can't afford treatment,LEVEL_2_STRUGGLING
Insurance,1rymuwl,"Is it really possible to find out if ""X"" requires prior authorization at the time of service?","I've always wondered: **Is it possible to find out at a health visit if ""X"" requires prior authorization?**

Example:

Individual on HMO plan. Gets referral to specialist from PCP which is approved. Go to specialist (say it's an orthopaedic for example). Get there for new pt visit and they want to d",https://www.reddit.com/r/Insurance/comments/1rymuwl/is_it_really_possible_to_find_out_if_x_requires/,2,3,Marvel5123,2026-03-20,prior authorization,LEVEL_2_STRUGGLING
Insurance,1rysa4w,Aetna denied Zepbound (plan exclusion) – trying to help a friend with BMI 45 + OSA + prediabetes get Ozempic/Mounjaro approved,"Posting on behalf of a friend who’s dealing with Aetna/CVS Caremark and trying to figure out what’s actually realistic.

Zepbound (FDA approved for sleep Apnea) was prescribed for him, but it’s a hard plan exclusion, so that route is dead.

**Here’s his situation:**

	•	BMI \~43–45 (morbid obesity)
",https://www.reddit.com/r/Insurance/comments/1rysa4w/aetna_denied_zepbound_plan_exclusion_trying_to/,1,50,Few-Plantain-1414,2026-03-20,prior authorization,LEVEL_2_STRUGGLING
Insurance,1s0aoaf,New year exclusions gel injections with prior authorization,"In Nov 2025 I went to orthopedic doc for knee pain, he ordered MRI which my insurance approved and determined gel injections would be best. He got authorization from insurance which came back as “no auth required” which I guess is lingo that they can move forward (they told me it was covered). I cal",https://www.reddit.com/r/Insurance/comments/1s0aoaf/new_year_exclusions_gel_injections_with_prior/,1,1,csamay,2026-03-21,prior authorization,LEVEL_2_STRUGGLING
Insurance,1snajsp,Question about Generali rental coverage Exclusion,"Hello! I recently set up a jeep rental through Expedia and opted for insurance. Upon reading my policy, I see the exclusions as follows:

&gt;Exclusions In addition to the General Exclusions, the following exclusions apply to this coverage. No benefits will be paid for any loss for, caused by, or re",https://www.reddit.com/r/Insurance/comments/1snajsp/question_about_generali_rental_coverage_exclusion/,4,4,Consistent_You9300,2026-04-16,insurance won't cover,LEVEL_1_AWARE
Insurance,1shtfgq,"Paid $1000 for a crown after a root canal but never received it. Years later, insurance won’t cover it, citing that I've already received it","I got a root canal three years ago and was given a temporary crown, with plans to return for a permanent one. At the time, my insurance benefits were maxed out (they didn't tell me until after I was given the crown), so I was told I’d need to pay $1,000 out of pocket—but I couldn’t afford it as a st",https://www.reddit.com/r/Insurance/comments/1shtfgq/paid_1000_for_a_crown_after_a_root_canal_but/,4,5,sleetfeet1,2026-04-10,insurance won't cover,LEVEL_2_STRUGGLING
Insurance,1slji1i,Do I need homeowner's or landlord/rental insurance?,I currently have a homeowner's insurance policy for a house which is my father's and my residence. However I will soon be going into the military and will not be spending any time physically at the house but it will still technically be my primary residence. My question is would my father's personal,https://www.reddit.com/r/Insurance/comments/1slji1i/do_i_need_homeowners_or_landlordrental_insurance/,3,3,masterthomas2222,2026-04-14,insurance won't cover,LEVEL_1_AWARE
Insurance,1rzed3m,"Telehealth limits based on provider location not patient's? (CA, USA)","My longtime therapist moved out of state and we switched to telehealth sessions for continuity. My health insurance is reimbursing my telehealth sessions (POS Code 10 - in patient's home) using limits based on the customary rates of the provider's location, not my location. This doesn't seem to make",https://www.reddit.com/r/Insurance/comments/1rzed3m/telehealth_limits_based_on_provider_location_not/,2,4,dackasaurus,2026-03-20,insurance won't cover,LEVEL_1_AWARE
Insurance,1sg5yea,Leak from upstairs apartment - my insurance won't cover,"Hi All – hoping I can gather your help as this is my first time working with homeowner’s insurance.

I own a condo and was undergoing a bathroom renovation. During the renovation, our contractor noticed a leak coming from the condo upstairs. The property manager came and assessed that there was an i",https://www.reddit.com/r/Insurance/comments/1sg5yea/leak_from_upstairs_apartment_my_insurance_wont/,2,7,Junior_Impression722,2026-04-08,insurance won't cover,LEVEL_2_STRUGGLING
Insurance,1s5dugo,"Trying to get cost of homeowners insurance down, currently at $4,996/year for an 1860 colonial in very good condition/well-maintained","As title says, I live in an 1860's-built Victorian Italianate Colonial. Bought just before COVID at a much lower price but value then skyrocketed.

Used to have Liberty Mutual bundled with auto, but unfortunately wife spun out on an icy patch and did juuuuust enough damage to get the truck totaled a",https://www.reddit.com/r/Insurance/comments/1s5dugo/trying_to_get_cost_of_homeowners_insurance_down/,2,21,NotACommunistBurner,2026-03-27,insurance won't cover,LEVEL_1_AWARE
Insurance,1s2hh98,Need help finding renters insurance for a mobile home,We live in Missouri we are renting a mobile home. we don't own the land we don't own the mobile home. we are just renting. I am needing coverage for my things. I cannot get coverage anywhere I don't know why because every time it comes up they say they won't cover a mobile home. I'm not looking into,https://www.reddit.com/r/Insurance/comments/1s2hh98/need_help_finding_renters_insurance_for_a_mobile/,1,4,TruthLibertyK9,2026-03-24,insurance won't cover,LEVEL_2_STRUGGLING
Insurance,1s47dl2,Oscar insurance won't cover Vyvanse,,https://www.reddit.com/r/Insurance/comments/1s47dl2/oscar_insurance_wont_cover_vyvanse/,0,1,TransitionProper5126,2026-03-26,insurance won't cover,LEVEL_2_STRUGGLING
Insurance,1s8y4v8,Insurance Denying over “Untimely Filing” Despite my not Receiving the Ambulance Bill until Too Late,"In February 2025, I was transported to a hospital from my university after Houston EMS being contacted by my university’s EMS. Two friends were with me at the pickup time and went with me to the hospital. We waited for two hours in the waiting room, at which point I was feeling better (I was being t",https://www.reddit.com/r/Insurance/comments/1s8y4v8/insurance_denying_over_untimely_filing_despite_my/,3,2,Agitated-Image2905,2026-03-31,appeal denied,LEVEL_1_AWARE
Insurance,1s1h91k,Aetna Appeal Denied...Again,"I'm not sure if I'm coming here for advice or just to rant (or both). I'm just feeling defeat      

  
Very long story short, I had a MoDi twin pregnancy that needed to be highly monitored due to the possibility of TTTS. I had weekly ultrasounds to monitor this, and most of them just required a $70",https://www.reddit.com/r/Insurance/comments/1s1h91k/aetna_appeal_deniedagain/,2,8,anull8123,2026-03-23,appeal denied,LEVEL_2_STRUGGLING
Insurance,1s6v8wi,Aflac parental leave claim,"hey im a new parent and new to the insurance/leave process, i didnt have the right paperwork submitted and my claim was  denied, had to wait 21 days in order for it to get appealed. My claim didn't get approved until almost the end of my leave and I'm not going to start getting paid until next month",https://www.reddit.com/r/Insurance/comments/1s6v8wi/aflac_parental_leave_claim/,1,0,AdisappointingsalaDD,2026-03-29,appeal denied,LEVEL_1_AWARE
Insurance,1skq5z5,Advice for Appeal Process with AAA,"I'm looking for some insight on a situation I have regarding the mishandling of my car on behalf of a tow truck driver sent by AAA. Let me explain the story to the best of my ability.

I live in Western NY and hit a pothole (no surprise there) on Feb 19th and the axle snapped on my driver side front",https://www.reddit.com/r/Insurance/comments/1skq5z5/advice_for_appeal_process_with_aaa/,1,10,ThatCidGuy,2026-04-13,appeal denied,LEVEL_1_AWARE
Insurance,1s1sb4x,"Stuck in external appeal limbo: hospital says wait, but deadline is near","Hey everyone, I’m in the external appeal period right now after my insurance denied a claim and my internal appeal was also denied.

The hospital said they’d submit the external appeal for me, but they haven’t done anything yet. I want to submit it myself, but when I asked for the doctor letter / do",https://www.reddit.com/r/Insurance/comments/1s1sb4x/stuck_in_external_appeal_limbo_hospital_says_wait/,1,1,Dry-Bluebird5392,2026-03-23,appeal denied,LEVEL_1_AWARE
Insurance,1sg91o2,MetLife Short Term Disability Denial,"Hi! I submitted my claim for short-term disability to take leave from February 23 to March 27. Unfortunately, that leave started six days before my MetLife coverage began on March 1. MetLife denied the claim due to lack of coverage for those six days and I’m now looking into the appeal process. 

I ",https://www.reddit.com/r/Insurance/comments/1sg91o2/metlife_short_term_disability_denial/,0,2,J3nny_,2026-04-08,appeal denied,LEVEL_1_AWARE
Insurance,1slpe9u,State Farm denied my water damage claim due to “mold exclusion” – but leak came from upstairs unit (WA). Do I have a case?,"Hi all, I’m in Washington State and dealing with a denied insurance claim from State Farm. I’d really appreciate any insight from people familiar with insurance claims or WA law.

Here’s the situation:

•	I own a condo unit
•	There was a water leak originating from the unit above (shower plumbing is",https://www.reddit.com/r/Insurance/comments/1slpe9u/state_farm_denied_my_water_damage_claim_due_to/,0,2,Oh_mocha,2026-04-14,appeal denied,LEVEL_1_AWARE
Insurance,1sfen68,Denied STD claim - Aflac - Seeking for advice,"Hi,

My STD claim (filed by my OB) was denied because Aflac says mental health claims require a therapist to complete a behavioral health statement.

My therapist refuses to fill out paperwork (because insurance doesn’t pay them to do that), and they’re the only one I’ve seen during my leave, so I d",https://www.reddit.com/r/Insurance/comments/1sfen68/denied_std_claim_aflac_seeking_for_advice/,0,10,Able_Impress299,2026-04-07,appeal denied,LEVEL_1_AWARE
Insurance,1so33pc,Mom's Homeowner Claim - dishwasher leak,"Looking for advice/opinions on why the adjuster is so fixated on the beginning date of Mom's trip. Mom came from Kansas to Oklahoma to visit me for three weeks, came home to find water damage in her living room, kitchen and dining room from a dishwasher leak. State farm is trying to deny her claim i",https://www.reddit.com/r/Insurance/comments/1so33pc/moms_homeowner_claim_dishwasher_leak/,0,32,FunFantastic1997,2026-04-17,appeal denied,LEVEL_2_STRUGGLING
Insurance,1scs195,AAA not wanting to pay out,"I purchased a vehicle Feb 14 and right aeay my other half (policy holder) called our local agent to add the new vehicle to the policy. he didn't answer so she left a detailed VM explaining we got a new car and need to add it to the policy. She tried calling a few more times but couldn't get anyone.
",https://www.reddit.com/r/Insurance/comments/1scs195/aaa_not_wanting_to_pay_out/,0,33,Old_Acadia_5902,2026-04-04,appeal denied,LEVEL_1_AWARE
Insurance,1s63zrk,"Should I sign up for Freedom Life Insurance, United Choice Plus Network？","So I missed my employers open enrollment this year, I’m currently looking into getting a private insurance until I can get my employers insurance next year.

I filled out the info on the healthcare market place and almost immediately started getting calls from insurance brokers trying to sell me thi",https://www.reddit.com/r/Insurance/comments/1s63zrk/should_i_sign_up_for_freedom_life_insurance/,4,11,Pure-Improvement232,2026-03-28,out of network,LEVEL_1_AWARE
