subreddit,post_id,title,selftext_snippet,url,score,num_comments,author,created_date,search_term,category
Insurance,1s97nh6,"Claims department gave me incorrect information and now I'm $2,000 in debt","Late last year, I went for a doctor's appointment with a specialist and was charged almost $1,000 for my appointment. Long story short, I called my insurance and they told me it's bc the money applied to my deductible. 

I was so scared after this and my insurance provider changed for 2026, so I cal",https://www.reddit.com/r/Insurance/comments/1s97nh6/claims_department_gave_me_incorrect_information/,5,5,Far-Wedding-7291,2026-03-31,out of network,LEVEL_1_AWARE
Insurance,1sagiwq,Aggregator options for small independent agency,"Former P&amp;C agency owner here, considering re-entering the space after a non-compete expires in a couple years.

I previously operated under an aggregator model and have looked at groups like SIAA/SAN, Renaissance, Smart Choice, etc. Trying to get a realistic sense of what’s out there now from pe",https://www.reddit.com/r/Insurance/comments/1sagiwq/aggregator_options_for_small_independent_agency/,3,1,nhctborn,2026-04-02,out of network,LEVEL_1_AWARE
Insurance,1scl1ug,Big mistake,hello I work as an insurance coordinator for a dental office. I’ve been doing this for quite some time now. Im someone who does all the verifications.I’m very meticulous and very careful while getting all the necessary info to avoid no payments. especially if we are Out of network. we accept Medicai,https://www.reddit.com/r/Insurance/comments/1scl1ug/big_mistake/,3,12,Traditional-Crab1128,2026-04-04,out of network,LEVEL_2_STRUGGLING
Insurance,1shabp0,Delta dental denied claim - “Attending Practitioner not known”,"Hello! Hoping someone here has insight or recommendation on next steps.

Last year my tooth broke off. I went to an emergency dentist (out of network) and had it extracted. Delta denied the claim stating: “attending practitioner not known”. I have submitted a physical claim twice. I double checked t",https://www.reddit.com/r/Insurance/comments/1shabp0/delta_dental_denied_claim_attending_practitioner/,2,0,RequirementKey2106,2026-04-09,out of network,LEVEL_2_STRUGGLING
Insurance,1sbr4mc,No doctors in network treat ADHD,"is insurance required to pay for an out of service provider if no one in network provides treatment? 

thanks! ",https://www.reddit.com/r/Insurance/comments/1sbr4mc/no_doctors_in_network_treat_adhd/,2,2,tastyjams77,2026-04-03,out of network,LEVEL_1_AWARE
Insurance,1sp2gsf,No Surprises Act,"So I was in a car accident last year, and ended up receiving a seperate physicians bill that is ""out of network"" despite the hospital I went to being in network. It's my understanding that this is exactly what the act is meant to protect against. Can someone confirm that, but also tell me who to con",https://www.reddit.com/r/Insurance/comments/1sp2gsf/no_surprises_act/,2,3,No-Leek-5321,2026-04-18,out of network,LEVEL_1_AWARE
Insurance,1sfxoeu,"Insurance telling me one thing, Provider telling me another","Hello Reddit,  
Its taking a lot to write this out any and all advice would be appreciated.

We my partner and I are trying to start a family, and we have been having issues after trying for a while, so we decided to get medical assistance in the terms of a fertility clinic after  OBGYN recommended.",https://www.reddit.com/r/Insurance/comments/1sfxoeu/insurance_telling_me_one_thing_provider_telling/,1,9,BangPC,2026-04-08,out of network,LEVEL_1_AWARE
Insurance,1s96ggg,What to expect,"Hi all,

Got in my first accident about 6 weeks ago now and not sure how settlement goes and what I should be asking about so any help is appreciated! Was in an accident with an uninsured motorist in CA, luckily I have UM on my policy (50k limit). I was rushed to the ER after the accident and the to",https://www.reddit.com/r/Insurance/comments/1s96ggg/what_to_expect/,0,4,TSRoad34,2026-03-31,out of network,LEVEL_1_AWARE
Insurance,1smohev,How does the insurance claim payout work if I hire my own contractor for repairs?,"I have received the approved estimate, but I have not signed it yet. The insurer has agreed with me that there are errors in the adjuster’s estimate, so I understand that revisions will be made.

Based on the current estimate, the ACV payment is approximately 6/7 of the total amount, while the remai",https://www.reddit.com/r/Insurance/comments/1smohev/how_does_the_insurance_claim_payout_work_if_i/,0,5,VAer1,2026-04-15,out of network,LEVEL_1_AWARE
Insurance,1sh76fs,Trying to understand how much I should actually settle for.  Billed for services I didn't receive and was provided misinformation by company.,"Hello All,

So I went into a therapy program that offered a group and individual component.  I would attend the group sessions, but I never was offered an individual session. The person assigned to me said on more than one occasion that I slipped through the cracks. The one time we did speak he said",https://www.reddit.com/r/Insurance/comments/1sh76fs/trying_to_understand_how_much_i_should_actually/,1,0,survivoropoly007,2026-04-09,surprise bill,LEVEL_1_AWARE
povertyfinance,1sabvwe,Save Our Ship (advice appreciated),"TW: suicidal ideation (by another) with intention discussed

I don’t know what to do.  My mother and I are looking at having to sell our home.  My mother was diagnosed with Von Wallenbrand’s Disease previously but has had two fairly close together strokes at the end of last year.  She had some amoun",https://www.reddit.com/r/povertyfinance/comments/1sabvwe/save_our_ship_advice_appreciated/,3,5,KingDaddyEden,2026-04-02,claim denied,LEVEL_1_AWARE
povertyfinance,1sgr2gc,What would you do?,"My step mom took care of my dad for several years financially. She recently passed away.

My dad - 57 years old and disabled but was denied disability. Can hardly get around anymore. Has literally $0 income. He’s moving out of their apartment in Pennsylvania and in with family for a few months until",https://www.reddit.com/r/povertyfinance/comments/1sgr2gc/what_would_you_do/,1,9,cowboys_oconnor,2026-04-09,claim denied,LEVEL_1_AWARE
povertyfinance,1s214qw,Some poverty finance tips for pet owners for being able to afford the vet.,"I have been in the veterinary field for over 10 years, and as a current very broke vet student, I'm also a long time lurker of this sub.  I'm very passionate about accessible vet care, and so I thought I'd share a few tips

First, know that we get it. We know that finances are tight, and that money ",https://www.reddit.com/r/povertyfinance/comments/1s214qw/some_poverty_finance_tips_for_pet_owners_for/,214,52,Ihavsunitato,2026-03-23,can't afford treatment,LEVEL_2_STRUGGLING
povertyfinance,1sf664r,3k in debt to aspen dental and all I got was pain when I eat,I went to aspen dental (my first time going to a dentist alone as an adult) and they gave me five fillings and a deep cleaning (which I didn't know was a treatment for periodontal disease which I do not have) and now I can't eat without sharp pain in the bottom teeth where they did the fillings. I'v,https://www.reddit.com/r/povertyfinance/comments/1sf664r/3k_in_debt_to_aspen_dental_and_all_i_got_was_pain/,8,7,ricecrippy,2026-04-07,can't afford treatment,LEVEL_2_STRUGGLING
povertyfinance,1skmvh7,Help finding care for tooth infection,"As the title says, I have a rather mild (but still excruciatingly painful) tooth infection that needs treatment that I just straight-up can't afford. Does anyone know any good telehealth services for Michigan that are actually reliable? For context, I don't have a car- I do have a bike, but the only",https://www.reddit.com/r/povertyfinance/comments/1skmvh7/help_finding_care_for_tooth_infection/,5,14,sorrygottathrowaway6,2026-04-13,can't afford treatment,LEVEL_2_STRUGGLING
povertyfinance,1snbb2v,How do people do this???,I just got a new job after moving into my first apartment as a fully solo independent adult (no roommates). It pays $22 an hour. I sat down and priced out a monthly budget for the bare minimum of what I would need to live comfortably in my tiny shoebox of a studio apartment. I have roughly $400 left,https://www.reddit.com/r/povertyfinance/comments/1snbb2v/how_do_people_do_this/,449,146,rising--dawn,2026-04-16,medical debt,LEVEL_1_AWARE
povertyfinance,1s3r8n8,I feel like I ruined my life,"I got sick and lost my job. I lived off credit cards for as long as I could, but the only thing that got me was insane debt that I can’t pay off. 

As I am, I’m unemployed (taking odd jobs where possible) and staying with relatives. 

I decided to just file for bankruptcy since I’m seeing no end in ",https://www.reddit.com/r/povertyfinance/comments/1s3r8n8/i_feel_like_i_ruined_my_life/,375,92,melancholymarshmallo,2026-03-25,medical debt,LEVEL_3_CRISIS
povertyfinance,1sclguw,I inherited 15k what now?,"I inherited 15k from family. im broke and working in gig economy until I can start the career i studied for, but I dont know nothing about what to do with the money. I do have an IRA Roth account but its very small, since im making 33k a year. I am also in a bit of debt due to w4 mismanagement, auto",https://www.reddit.com/r/povertyfinance/comments/1sclguw/i_inherited_15k_what_now/,129,75,Inside-Telephone-423,2026-04-04,medical debt,LEVEL_1_AWARE
povertyfinance,1sp8knt,I never thought I'd be here again,"I grew up in a trailer park and watched my parents fight for every single thing we had. At night they'd go through my piggy bank for spare change just to keep the lights on.

Now Im 27 and married. I've vowed that I'd do everything in my power to keep myself out of debt and on top of finances.

But ",https://www.reddit.com/r/povertyfinance/comments/1sp8knt/i_never_thought_id_be_here_again/,124,21,ImprovementDue3838,2026-04-18,medical debt,LEVEL_1_AWARE
povertyfinance,1sitdhx,I went from making 35k a year to over 100k a year with one job changed I have 89k in debt from student loans and medical bills I couldn’t pay in the past.,"Can someone please help me budget this? I accidentally fell into lifestyle inflation and got a motorcycle. 

For those that will ask I used to work for a food truck: I work in large scale commercial (TRAVELING) construction so most of my income comes from per diem. I do not want to end up in the dog",https://www.reddit.com/r/povertyfinance/comments/1sitdhx/i_went_from_making_35k_a_year_to_over_100k_a_year/,114,66,vodkachugger420,2026-04-11,medical debt,LEVEL_1_AWARE
povertyfinance,1s4nbdc,Can't afford my medicine,"My seizure medication has a $60 co-pay and my inhaler has a $20 co-pay, I already am on state insurance and TANF (Temporary assistance for needy families) because where I live it's a 30 minute drive to the closest Walmart, 20 minutes just to hit any neighborhood at all (it's a Reservation) and so th",https://www.reddit.com/r/povertyfinance/comments/1s4nbdc/cant_afford_my_medicine/,82,51,Adardeeboop,2026-03-26,medical debt,LEVEL_2_STRUGGLING
povertyfinance,1s044r7,Burnt and broke...advice?,"I'm using a sort-of throw-away account because I'd be really recognizable on my main.

I'm a teacher, a single mom of 2, in a vHCOL area.

I currently work as a high school teacher making $54k, and teach GED at night to make up another $10k.

I've tried to take on side work through Upwork. I have on",https://www.reddit.com/r/povertyfinance/comments/1s044r7/burnt_and_brokeadvice/,24,64,Limp-Improvement-608,2026-03-21,medical debt,LEVEL_1_AWARE
povertyfinance,1sf7azs,just feeing so discouraged &amp; beaten down lately,"just needed to vent how incredibly, hopelessly, inescapably low &amp; demoralized I feel trying to stay afloat while getting hit with more expenses &amp; drowning in debt. it feels like every time I start to see a glimmer of light above my head, something grabs ahold of me and just plunges me even d",https://www.reddit.com/r/povertyfinance/comments/1sf7azs/just_feeing_so_discouraged_beaten_down_lately/,23,17,obviousanon1,2026-04-07,medical debt,LEVEL_1_AWARE
povertyfinance,1sopa7u,"Offer of help, Oh, wait, no nevermind","For some background, this past summer my (46F) husband (46M) had a massive hemorrhagic stroke. That instantly spelled the end of his 15-year career and racked up $15,000 in medical bills before we met our deductible and insurance kicked in, (U.S. obviously). I spent the next three months living in h",https://www.reddit.com/r/povertyfinance/comments/1sopa7u/offer_of_help_oh_wait_no_nevermind/,464,108,ClothosWhorl,2026-04-18,insurance won't cover,LEVEL_1_AWARE
povertyfinance,1sky5du,60K Truck Is a Money Pit and I'm Drowning,I bought a 65K Ford Truck back in 2021 with the hopes to start a business. That business failed. Add to that a health issue that landed me in the hospital for a few days and I went in a financial downward spiral. I missed wages for a few months as I recovered physically and from feeling really depre,https://www.reddit.com/r/povertyfinance/comments/1sky5du/60k_truck_is_a_money_pit_and_im_drowning/,430,150,Mean-Payment5020,2026-04-14,insurance won't cover,LEVEL_1_AWARE
povertyfinance,1s31hsp,Still Unemployed,I am 42 and moved back in with my parents 5 months ago. They blast fox news all the time and are pushing me to drive lyft. That doesn't make sense because I have a lease. I apply to jobs everyday. They have been helping me clean up the bills from out of work time- its a long-term loan with a payback,https://www.reddit.com/r/povertyfinance/comments/1s31hsp/still_unemployed/,405,92,OkSubject1730,2026-03-25,insurance won't cover,LEVEL_2_STRUGGLING
povertyfinance,1soagf9,22 with way too much debt,"I am 22F.

i went into a crazy just life/job rant first (and also hardly described my debt lol) so scroll towards the bottom for “TLDR” summary of debt.

I’ve never really been great with money. during covid i was 16 and got all that unemployment money and blew it all except $3000 to put towards my ",https://www.reddit.com/r/povertyfinance/comments/1soagf9/22_with_way_too_much_debt/,0,37,GhostAmongTheMoss,2026-04-17,insurance won't cover,LEVEL_1_AWARE
povertyfinance,1sg6lrc,Disabled with a Master's degree,"I got a Master's degree in MH counseling a year ago. I did my internship at a fully remote, awesome job that was very accommodating. My disability got worse working there and never got better. I've gotten dramatically worse. 

My disability is triggered by exertion, so any amount of effort is sorely",https://www.reddit.com/r/povertyfinance/comments/1sg6lrc/disabled_with_a_masters_degree/,4,12,leave_me_outta_this,2026-04-08,appeal denied,LEVEL_1_AWARE
povertyfinance,1sfk5iq,I (37m) may be losing my job soon. I’m trying to rebudget,"•Mortgage (incl. taxes/insurance): $2,800\~

•Truck payment: $730 (27k left, work paid for it, but now it’s my only vehicle and will now begin paying out of my own pocket)

•PG&amp;E (includes gas): $100\~+ annual trueup for solar

•AC financing: $113 (had to get a new unit last year 8k loan)

•Inte",https://www.reddit.com/r/povertyfinance/comments/1sfk5iq/i_37m_may_be_losing_my_job_soon_im_trying_to/,73,74,ArcOperator,2026-04-08,out of network,LEVEL_1_AWARE
povertyfinance,1sfvhia,Pushing back against medical bills?,"I got a $395 bill from an appointment I had back in November, apparently my doctor sent my swabs to an out of network lab. I just paid my taxes and truly don’t have an extra $400 lying around for this. Does anyone have suggestions on how to push back on this? I can ask for an itemized bill, but anyt",https://www.reddit.com/r/povertyfinance/comments/1sfvhia/pushing_back_against_medical_bills/,2,14,Spare_Trust_6298,2026-04-08,out of network,LEVEL_1_AWARE
povertyfinance,1sbevwl,Washing dishes by hand cut my utility bill more than I expected and I only switched because my dishwasher broke,"So my dishwasher died back in February and I kept telling myself I'd get it fixed or find a used one on Facebook Marketplace but I just never got around to it. Been hand washing everything since then, kind of annoyed about it honestly. Then my electric bill came and it was like $34 lower  than the s",https://www.reddit.com/r/povertyfinance/comments/1sbevwl/washing_dishes_by_hand_cut_my_utility_bill_more/,539,177,Glyph_42Drift,2026-04-03,surprise bill,LEVEL_1_AWARE
povertyfinance,1s12f50,From a child of poverty,People that are currently living in immense poverty please do not have children yet alone 5 like my parents did. I’m currently 21 years old and am in college and I’m honestly still surprised that I’m still alive (do not worry I no longer feel like dying). I’m  back home for Spring Break and immediat,https://www.reddit.com/r/povertyfinance/comments/1s12f50/from_a_child_of_poverty/,91,6,Alternative_Fill2089,2026-03-22,surprise bill,LEVEL_1_AWARE
povertyfinance,1sgb8d4,Wellcare merger Quietly cuts untility assistance,"Warning: If you have Medicaid in North Carolina and had WellCare, which just merged with Carolina Complete, and you used the utility assistance through WellCare, you might be surprised to learn that you are about to lose hundreds or thousands in energy assistance on your utility bill. Personally, I ",https://www.reddit.com/r/povertyfinance/comments/1sgb8d4/wellcare_merger_quietly_cuts_untility_assistance/,6,6,RefuseInevitable,2026-04-08,surprise bill,LEVEL_1_AWARE
ChronicIllness,1shyb23,My partner (33M) living with chronic illness avoids talks about moving in together.,"I love my partner very much and he’s going through a lot. We’ve been dating about two years now. He is undiagnosed at the moment and is going through testing, but it seems like they’re leaning towards diagnosing him with MS or another disorder.  He has chronic pain and still works. With all the unce",https://www.reddit.com/r/ChronicIllness/comments/1shyb23/my_partner_33m_living_with_chronic_illness_avoids/,5,12,atummyachesurvivor,2026-04-10,claim denied,LEVEL_1_AWARE
ChronicIllness,1sq73wn,Would VR be good for me? and I have questions about it,"Im 17, I dont need job training but I have a 1.8 gpa so it's my only hope to get into college, and most people see me as ""lazy"" due to my illness and thats another reason why I might have to do it, will it help me move out of state, im in kansas and the climate here makes my illness worse due to fla",https://www.reddit.com/r/ChronicIllness/comments/1sq73wn/would_vr_be_good_for_me_and_i_have_questions/,0,4,Critical-Concept-933,2026-04-19,claim denied,LEVEL_1_AWARE
ChronicIllness,1s2u545,"“People with cancer go back to work, you can’t just sit around and wait”","That’s what my doctor told me today when I asked her to fill out my medical leave paperwork and said I didn’t know when I’d feel well enough to go back to work. 

\*Disclaimer: I’m in no way trying to compare my struggles to that of someone that has cancer or say that I have it better or worse. I kn",https://www.reddit.com/r/ChronicIllness/comments/1s2u545/people_with_cancer_go_back_to_work_you_cant_just/,95,17,spacealligators,2026-03-24,can't afford treatment,LEVEL_1_AWARE
ChronicIllness,1sjnmov,Nobody sees the work it takes to be sick,"I spent 4 hours on the phone with insurance yesterday over a prior authorization that got denied. Again. By the time I was done, I didn't have the energy to make dinner, which was the whole reason I needed the medication in the first place.

That's the part nobody talks about. It's not just being si",https://www.reddit.com/r/ChronicIllness/comments/1sjnmov/nobody_sees_the_work_it_takes_to_be_sick/,412,52,HopeLKnight,2026-04-12,prior authorization,LEVEL_2_STRUGGLING
ChronicIllness,1sojhid,Staff Interference in Your Care,"More and more I am encountering staff that are detrimentally interfering in my care to the point of outright harm. 

Not giving doctors messages including when another doctor is calling them. 

Not doing prior authorizations and then lying and saying the insurance denied it when no attempt was made.",https://www.reddit.com/r/ChronicIllness/comments/1sojhid/staff_interference_in_your_care/,9,8,Extreme-Wasabi8759,2026-04-17,prior authorization,LEVEL_2_STRUGGLING
ChronicIllness,1sh4j69,Being chronically ill is crazy.,yesterday I was on Reddit posting but my situation trying to hold off on going to the emergency room cuz of the PTSD and trying to get advice. very thankful that you guys were very honest with me and we're like yo. what are you doing? you need to go to the emergency room like why are you making this,https://www.reddit.com/r/ChronicIllness/comments/1sh4j69/being_chronically_ill_is_crazy/,9,4,Getpeaceogo,2026-04-09,medical debt,LEVEL_3_CRISIS
ChronicIllness,1spjk1b,My Dental Implant Hell Rant,I swear if I get told by one more person that their friend or distant relative got MediCal to pay for their dental implants I'm going to rip their teeth out and make them fucking eat em! This is more of a therapeutic rant more than anything but real advice would be great. But it boils down to insura,https://www.reddit.com/r/ChronicIllness/comments/1spjk1b/my_dental_implant_hell_rant/,7,2,Drakonera,2026-04-19,medical debt,LEVEL_1_AWARE
ChronicIllness,1sn0t5z,Im so burnt out,I’ve been dealing with several chronic health issues from my entire life to the last two years. But the last two years things have gotten significantly worse. I went from a once a month flare up where I’d be out a few days to constant chronic pain. I can’t walk much because of an MVA which apparentl,https://www.reddit.com/r/ChronicIllness/comments/1sn0t5z/im_so_burnt_out/,4,3,Realistic-Mongoose83,2026-04-16,medical debt,LEVEL_1_AWARE
ChronicIllness,1siweuy,Feeling Ashamed,"I've started to develop some kind of condition that I cannot get a formal diagnosis or even a specialist for until next year once I have insurance. My symptoms have become debilitating and I can barely walk, even sitting down causes me pain. I went to an Urgent Care after falling and being physicall",https://www.reddit.com/r/ChronicIllness/comments/1siweuy/feeling_ashamed/,0,6,wrenby_exe,2026-04-11,medical debt,LEVEL_1_AWARE
ChronicIllness,1rz4xgp,Tests that help figure out what’s wrong,"2021 I just had a baby, I was in a mentally abusive relationship, got the Covid vaccine in oct and nov. 2022 I got Covid in January, then strep throat after. Then I started getting this rash all over my body, like dots. Not itchy not raised. Me and my boyfriend laughed about it. He had it fist, then",https://www.reddit.com/r/ChronicIllness/comments/1rz4xgp/tests_that_help_figure_out_whats_wrong/,2,1,Suspicious-Repeat147,2026-03-20,medical debt,LEVEL_1_AWARE
ChronicIllness,1sd5m0n,"Budgeting, working part time. ( advice/support )","Budgeting question (Disabled and work part time)

I’m 20m and professionally diagnosed with level 2 autism and struggle a lot, with work especially. For my financial situation I have income based/subsidized housing so that is low. I just started working at cold stone, started me at 10 an hour plus p",https://www.reddit.com/r/ChronicIllness/comments/1sd5m0n/budgeting_working_part_time_advicesupport/,0,1,StormOk911,2026-04-05,medical debt,LEVEL_1_AWARE
ChronicIllness,1sqers7,I'm having a pretty rough time on my own,"NO Politics related comments please 

context 

my fiance is currently at boot camp for the navy he finishes at the end of next month. we won't immediately be living together again but we will at least be able to talk over the phone and FaceTime after that. hopefully I'll be able to go to Illinois f",https://www.reddit.com/r/ChronicIllness/comments/1sqers7/im_having_a_pretty_rough_time_on_my_own/,2,0,thepastelprince,2026-04-20,insurance won't cover,LEVEL_3_CRISIS
ChronicIllness,1saq8eb,I’m exhausted from being the only bridge between my mom’s specialists.,"My parents are sick, and I am tired.

My mom sees a several specialists and they are all in the same network. And yet, for some reason, they might as well be on different planets for how much they actually talk to each other.

Last year, her rheumatologist adjusted her meds. Three months later, her ",https://www.reddit.com/r/ChronicIllness/comments/1saq8eb/im_exhausted_from_being_the_only_bridge_between/,10,13,jmush16,2026-04-02,out of network,LEVEL_1_AWARE
ChronicIllness,1s6zxr6,Returning to my hometown? Go somewhere new? Try something new here? Who made a BIG change after getting sick?,I've hit a point of medical burnout and I guess isolation from managing my condition alone since my relationship ended 1.5 years ago and fighting for care and diagnosis since. I wasn't sick before we met. well I had managed Endo back then. Now I have nerve damage that's looking like crps and ADHD an,https://www.reddit.com/r/ChronicIllness/comments/1s6zxr6/returning_to_my_hometown_go_somewhere_new_try/,2,6,CV2nm,2026-03-29,out of network,LEVEL_1_AWARE
ChronicIllness,1sinnez,Frustrated vents about self diagnosis,"There's someone I know that has self diagnosed the Self Diagnosis Holy Trinity: MCAS, POTS, and EDS. This has always annoyed me, especially seeing how obviously they don't have any of them. I wish I could tell stories, but this person is probably in here, tbh. Mind you, they've explicitly told me bo",https://www.reddit.com/r/ChronicIllness/comments/1sinnez/frustrated_vents_about_self_diagnosis/,0,18,burningmanonacid,2026-04-11,out of network,LEVEL_1_AWARE
diabetes,1sgfnxq,I'm newly diagnosed and very sad.,"I was diagnosed about 2 weeks ago. I feel so depressed :( All the food I love I can't eat. Everyday I wanna cry. I live with my mother who is extremely judgmental and controls the groceries. We're also Hispanic so it feels like every single meal has rice with it, which im terrified to eat now. I can",https://www.reddit.com/r/diabetes/comments/1sgfnxq/im_newly_diagnosed_and_very_sad/,28,34,HolyZorroBatamm,2026-04-09,can't afford treatment,LEVEL_2_STRUGGLING
