subreddit,post_id,title,selftext_snippet,url,score,num_comments,author,created_date,search_term,category
diabetes,1s2bmj4,Prior Authorization,"Seen all those ads for athletes saying that a glucose sensor helps them monitor their performance and work at their peak?

Yeeeeeah, I need a prior authorization for my sensors now, too. 🙃

If popularizing medical devices made them more accessible, that would be great... but it feels like people jus",https://www.reddit.com/r/diabetes/comments/1s2bmj4/prior_authorization/,18,16,twirlandswirl,2026-03-24,prior authorization,LEVEL_2_STRUGGLING
diabetes,1s8w516,Complications with getting prior authorization on Ozempic,"Hi, this is a throw away account, and well, I have been taking Ozempic for quite some time, and I uped the dosage recently to 2mg.  My primary care doctor prescribed me Ozempic, and I have been taking it weekly.  However, my doctor was trying to give 90 day supply, however, my old job lied to me, an",https://www.reddit.com/r/diabetes/comments/1s8w516/complications_with_getting_prior_authorization_on/,0,2,diabeticuser4444,2026-03-31,prior authorization,LEVEL_2_STRUGGLING
diabetes,1sokesb,Is this really the cost of G6 sensors???,"I recently did my first dexcom refill of the year and I was floored when I got my invoice! According to this claim, Adapt Health is charging my insurance $6750.00 for 3 boxes of G6 sensors...just the sensors, not the transmitter. I know it's the beginning of the year and I haven't met my deductible,",https://www.reddit.com/r/diabetes/comments/1sokesb/is_this_really_the_cost_of_g6_sensors/,10,16,Comprehensive_Gap778,2026-04-17,insurance won't cover,LEVEL_2_STRUGGLING
diabetes,1sq3tef,Is a CGM still recommended if not on insulin?,"Hi all,

I just got diagnosed with type 2 about a month and a half ago. My endo said I don't require insulin and that I am actually managing very well with my diet and normal routine and could potentially go into remission, so he put me on a glp-1 and prescribed a libre 3 CGM. However, my insurance ",https://www.reddit.com/r/diabetes/comments/1sq3tef/is_a_cgm_still_recommended_if_not_on_insulin/,11,31,cultivatedheaven,2026-04-19,insurance won't cover,LEVEL_2_STRUGGLING
diabetes,1sb0mtw,Pump billing and coding,"Hey all,

Does anyone have any experience with billing and coding for insulin pumps?  

I recently ordered a new tandem tslim through my DME supplier.  Per my insurance plan (which I triple checked prior to ordering) my insulin pump is covered at 100%.  Cue my surprise when I received a bill from my",https://www.reddit.com/r/diabetes/comments/1sb0mtw/pump_billing_and_coding/,1,2,Chipster28,2026-04-02,insurance won't cover,LEVEL_1_AWARE
diabetes,1s9rr5w,LADA rediagnosis,"Sharing this experience, particularly in case there are any other Type 2s who feel weird, in case this might apply to them. I know I search the r/diabetes archive when I'm trying to figure out my own situation

I was diagnosed as Type 2 a year ago, A1c 10.4%. My doctor had me do antibody screenings ",https://www.reddit.com/r/diabetes/comments/1s9rr5w/lada_rediagnosis/,32,1,Ladder-Necessary,2026-04-01,out of network,LEVEL_1_AWARE
diabetes,1sosnro,"Advice, please 🙏","I am in a bit of pickle and could use some advice if you’ve ever had the experience or know what I could do to get out of this.

To make a very long story short, I was diagnosed with an eating disorder shortly after graduating with my first bachelors degree in 2020, Anorexia Nervosa to be exact. I w",https://www.reddit.com/r/diabetes/comments/1sosnro/advice_please/,3,1,Only_Bison_4279,2026-04-18,out of network,LEVEL_2_STRUGGLING
cancer,1skuemj,Preexisting Condition?,"So my wife had her normal screening MRI on. November 7th, which is normally every 6 months due to her family history.  She went full-time at the hospital where we work on November 16th and the biopsy on December 1st, which is the same day the long-term disability kicked in.

They are claiming that t",https://www.reddit.com/r/cancer/comments/1skuemj/preexisting_condition/,3,5,Serzyn,2026-04-13,claim denied,LEVEL_1_AWARE
cancer,1shdycr,18 years 2 different Cancers...3 reoccurring and metastasized but still here,I have had several bouts with Renal Cell/Clear cell (Kidney Cancer) where part of my left kidney was burned (Radio Freq ablation) and then Frozen (Cryoablation). It moved to the inner skin track of my intestinal lining but was frozen at that part. I then got Colorectal cancer out of the blue. Had my,https://www.reddit.com/r/cancer/comments/1shdycr/18_years_2_different_cancers3_reoccurring_and/,7,2,EmploymentHorror8526,2026-04-10,medical debt,LEVEL_1_AWARE
cancer,1slcz5p,Husband gets rejected from potential jobs,"He is just 29. He is 8 months out of SCT for T cell ALL, high risk. He had so many opportunities prior to his diagnosis a year ago. He was about to finish his Mcs in applied physics from a prestigious university, he had friends in his industry, and he was about to start his professional life out of ",https://www.reddit.com/r/cancer/comments/1slcz5p/husband_gets_rejected_from_potential_jobs/,23,19,In_A_Jar12,2026-04-14,insurance won't cover,LEVEL_1_AWARE
cancer,1s0jby7,Has anyone switched doctors/cancer care centers mid-chemo,"*Technically, I am thinking of going back to my OG Gyne-Onco a.k.a. the one operated and first diagnosed me.

Hello, I'm 40, from the Philippines, and currently have Stage IIB Ovarian Cancer.

I initially switched doctors and went somewhere where the services were cheaper. Since I will also have a p",https://www.reddit.com/r/cancer/comments/1s0jby7/has_anyone_switched_doctorscancer_care_centers/,9,6,Impossible_Room_6646,2026-03-22,out of network,LEVEL_1_AWARE
