subreddit,post_id,title,selftext_snippet,url,score,num_comments,author,created_date,search_term,category
FirstTimeHomeBuyer,1ssce6x,"I did it!! Texas, 210k, 5.5% conventional","2006 home on my teacher salary at 27! Super happy with it, it was honestly the best home I saw in my price range with NO big issues or replacements needed, so I jumped on it way sooner than I expected to buy. Bought out my apartment's early termination clause and moved.

Highly recommend the bank of",https://www.reddit.com/r/FirstTimeHomeBuyer/comments/1ssce6x/i_did_it_texas_210k_55_conventional/,367,11,ithinkedit,2026-04-22,can't afford house,LEVEL_2_STRUGGLING
FirstTimeHomeBuyer,1slegeh,First Home Anxieties,"About to close on my first house this month. I did all my due diligence, I know I can afford it, I know it aligns with current goals but I STILL feel so insecure about this decision! I think perhaps it's the permanency of it, it just seems like a huge decision and even though everything aligns I sti",https://www.reddit.com/r/FirstTimeHomeBuyer/comments/1slegeh/first_home_anxieties/,59,48,Thick_Analysis_6745,2026-04-14,can't afford house,LEVEL_2_STRUGGLING
FirstTimeHomeBuyer,1sltodx,Am I Being Overly Cautious?,"Would be first time home buyers F(30) M(34),   but feel very nervous about the prospect of buying. Our stats are:

* Household income: $217k pretax
* 401k at $190k, 70k
* ROTH IRA $15.5k
* Investments \~$40k
* HYSA at $80k (to keep an emergency fund, would only consider $60k liquid)

We have no debt",https://www.reddit.com/r/FirstTimeHomeBuyer/comments/1sltodx/am_i_being_overly_cautious/,9,25,avoidedreddittilnow,2026-04-14,can't afford house,LEVEL_2_STRUGGLING
FirstTimeHomeBuyer,1sbmyed,Terrified about home buying,"My husband and I are buying our first home and for whatever reason I feel terrified. We were pre-approved for 500K and are under contract for a house that's 445K. The only debt we have is student loans, which are only about $600/ month. We do have an infant in childcare, which sucks, but we cant get",https://www.reddit.com/r/FirstTimeHomeBuyer/comments/1sbmyed/terrified_about_home_buying/,9,19,Happy-Plan231,2026-04-03,can't afford house,LEVEL_1_AWARE
FirstTimeHomeBuyer,1skbtt1,Can't stop second guessing buying our first house,Me and my girlfriend (both 23 at the time) bought our first house last winter. We went for a fancier house in a cheaper neighbourhood. We didn't want a renovation project for our first home and that's the best we could afford within our budget and standard. It was time to stop renting and we knew wh,https://www.reddit.com/r/FirstTimeHomeBuyer/comments/1skbtt1/cant_stop_second_guessing_buying_our_first_house/,5,49,EventBulky6841,2026-04-13,can't afford house,LEVEL_1_AWARE
FirstTimeHomeBuyer,1sseazn,"Any Definitive Way to Tell If Home is Manufactured from Just Pictures/Are All Homes with the ""Office Ceilings"" Manufactured? + General Confusion/Impromptu Rant","My main question that I originally came here to ask, because I can't find anything but conflicting information online, is pretty much just the title. Essentially, I want to avoid getting one of those manufactured homes. I live in the midwest, and have only heard bad things about them, especially sin",https://www.reddit.com/r/FirstTimeHomeBuyer/comments/1sseazn/any_definitive_way_to_tell_if_home_is/,2,11,Geode890,2026-04-22,can't afford house,LEVEL_1_AWARE
FirstTimeHomeBuyer,1sh7hlh,Job Offer Letter/ VOI for a pre-approval? - Moving to a new State.,"We are in the process of trying to get pre-approved for our first home. We are looking out of state as that is what we can afford. (I am being softly kicked out by my family without a high paying job.)

We are trying to take advantage of a first time homebuyer program, and before we even get pre app",https://www.reddit.com/r/FirstTimeHomeBuyer/comments/1sh7hlh/job_offer_letter_voi_for_a_preapproval_moving_to/,2,5,Hydieho,2026-04-09,can't afford house,LEVEL_3_CRISIS
FirstTimeHomeBuyer,1swm50w,Advice on my current situation,"This is long but I need a new perspective. We’re confused on what to do.

$0 debt as of this mo. Owe family $2800 so would like to pay that asap. One income about $3200/mo. Bills about $2k. Stable job. $0 savings. Credit score about 820. Another person just started working but cant count on that for",https://www.reddit.com/r/FirstTimeHomeBuyer/comments/1swm50w/advice_on_my_current_situation/,2,9,bkbk03,2026-04-26,can't afford house,LEVEL_1_AWARE
FirstTimeHomeBuyer,1s66v5r,Yet another post about painting before vs after moving in,"**TLDR: indecisive about whether to paint before vs after moving in, especially since I plan to hire professionals and find myself having a hard time choosing colours. Would love to hear opinions based on such circumstances.**

As I get closer to my closing date, I am struggling with the decision of",https://www.reddit.com/r/FirstTimeHomeBuyer/comments/1s66v5r/yet_another_post_about_painting_before_vs_after/,2,9,ACoderGirl,2026-03-28,can't afford house,LEVEL_1_AWARE
FirstTimeHomeBuyer,1scin8a,Can I afford a 400k to 450k house,"to preface this  im bringing in net of about 7200 a month.

im 24 just moved to utah and work in Salt Lake and I feel like im doing really well for my age . alot of houses here are 400k up unless your buying a town house which I have considered. I got pre approved for 600k va loan what ive seen inte",https://www.reddit.com/r/FirstTimeHomeBuyer/comments/1scin8a/can_i_afford_a_400k_to_450k_house/,0,65,TheTacticalHedgehog,2026-04-04,can't afford house,LEVEL_1_AWARE
FirstTimeHomeBuyer,1spy1fa,Mortgage broker shared our confidential financial info with the seller and admitted it in writing — we are still considering buying. What are our options?,"Background:

My fiancé and I have been renting our home in Northern California for several years, paying a significant amount in rent total. The seller/landlord is a licensed California real estate agent. When we expressed interest in purchasing the home, she recommended we use her mortgage broker, ",https://www.reddit.com/r/FirstTimeHomeBuyer/comments/1spy1fa/mortgage_broker_shared_our_confidential_financial/,61,99,Frosty_Permit_4807,2026-04-19,rent increase,LEVEL_2_STRUGGLING
FirstTimeHomeBuyer,1s7ksez,Waiting with anxiety.,"We’re currently renting atm, but the home owner wants to sell the house this year, so we’ve been actively looking to buy for a while now.

We already placed a bid on one house, we were the highest bidders at first. Then they suddenly decided to open another round of bidding with one other party that",https://www.reddit.com/r/FirstTimeHomeBuyer/comments/1s7ksez/waiting_with_anxiety/,46,5,Tonar_The_Dwarf,2026-03-30,rent increase,LEVEL_1_AWARE
FirstTimeHomeBuyer,1swqdaj,First Time Home Buyer Mortgage Options Help,"For a 410,000 home, which is the better option for a first time home buyer with earnest money: $10,000:

FHA Fixed Rate: 3.99, Down payment: **16,100 + 4000** (fees), **monthly: $3,150**

FHA 5 Year fixed ARM: 3.25: Down payment: **16,100 + 4000** (fees), **monthly: $2,960,** Capped at 5% points inc",https://www.reddit.com/r/FirstTimeHomeBuyer/comments/1swqdaj/first_time_home_buyer_mortgage_options_help/,10,9,jj1296,2026-04-26,rent increase,LEVEL_1_AWARE
FirstTimeHomeBuyer,1suxi7n,26F feeling stuck and spiraling about my house purchase. Need advice (mental + financial),"Hi there! I’m 26F and I’ve been struggling with daily anxiety spirals about my house and could really use some advice, both mentally and financially.

I bought my house right after I turned 24. I was in a big transition period, trying to get out of a toxic relationship, and I’ve always been someone ",https://www.reddit.com/r/FirstTimeHomeBuyer/comments/1suxi7n/26f_feeling_stuck_and_spiraling_about_my_house/,4,17,Aggravating_Paper_50,2026-04-24,rent increase,LEVEL_1_AWARE
FirstTimeHomeBuyer,1suuphb,Need Advice,"Hi everyone, just wanted to ask for some advice.

We’re currently in underwriting for our home purchase with an expected closing date of May 19.  We have home inspection on April 28th and We also have our new home orientation scheduled for May 5. 

Its a New Build Community - The builder is Starligh",https://www.reddit.com/r/FirstTimeHomeBuyer/comments/1suuphb/need_advice/,3,5,fatcarrot28,2026-04-24,rent increase,LEVEL_1_AWARE
FirstTimeHomeBuyer,1sv5s6y,Is it worth it to buy a place just to live in it 4-5 years?,"I live in a HCL city and I’ve saved enough money for a downpayment of a 1bedroom apt. I’m currently deciding whether I should continue to rent or if I should buy a place. My issue is that I know I will most likely outgrow this place in the next 5 years.

I plugged some numbers in to see if it’s wort",https://www.reddit.com/r/FirstTimeHomeBuyer/comments/1sv5s6y/is_it_worth_it_to_buy_a_place_just_to_live_in_it/,3,29,Aotsu,2026-04-25,rent increase,LEVEL_1_AWARE
FirstTimeHomeBuyer,1s96eer,Would you buy a condo in 24 hours?,I’ve been living in my city for 5 years and don’t want to keep renting my apartment when my lease ends next year. I don’t see myself moving to a new city and I love my current current neighborhood. My rent is pretty cheap for the area \~$1700 but will continue to increase. I’ve been offered a great ,https://www.reddit.com/r/FirstTimeHomeBuyer/comments/1s96eer/would_you_buy_a_condo_in_24_hours/,3,24,CommercialExam1098,2026-03-31,rent increase,LEVEL_1_AWARE
FirstTimeHomeBuyer,1skyh5t,Renting $1000 or buying $1900...50% more? Houston,Update: I feel for a single income I can't increase my living cost 100% compared to what I'm paying lol. I feel it would be too tight. I am eligible for a few down payment programs and everything but I feel that if something comes up I might be in trouble. I'm going to hunker down at least another y,https://www.reddit.com/r/FirstTimeHomeBuyer/comments/1skyh5t/renting_1000_or_buying_190050_more_houston/,3,31,SultryWordsmith,2026-04-14,rent increase,LEVEL_2_STRUGGLING
FirstTimeHomeBuyer,1sq2ma1,"First home purchase ever, do my numbers make sense? [SF][35][Rate:1.5M/5.5]",I’m looking for a sanity check on a potential home purchase in San Francisco. I’m transitioning into a white collar job and want to see if these numbers are as sustainable as they look on paper. I grew up in section 8 housing/apartments and never lived in a home so home ownership is very new to me. ,https://www.reddit.com/r/FirstTimeHomeBuyer/comments/1sq2ma1/first_home_purchase_ever_do_my_numbers_make_sense/,3,16,Kaipirinhas,2026-04-19,rent increase,LEVEL_1_AWARE
FirstTimeHomeBuyer,1spq8po,Need a sanity check on buying an affordable housing studio,"For context I live on Oahu. I currently make $87k/year with a promotion to $97k coming up, and additional step increases. It's an amazing job with very good job security and benefits so I'm pretty set on staying on Oahu. Single, no kids, don't plan on dating.

There's a newer condo that has a studio",https://www.reddit.com/r/FirstTimeHomeBuyer/comments/1spq8po/need_a_sanity_check_on_buying_an_affordable/,2,5,algelon,2026-04-19,rent increase,LEVEL_1_AWARE
FirstTimeHomeBuyer,1sa4m2v,I fear I may have a squatter,"So my husband and I I closed on our first house on March 3rd. In the contract we agreed to give the seller 30 days to get everything out and moved because he’s a bit of a hoarder and has an insane amount of stuff inside, outside and in the garages. Our possession date is April 1st. And he hasn’t lef",https://www.reddit.com/r/FirstTimeHomeBuyer/comments/1sa4m2v/i_fear_i_may_have_a_squatter/,1613,353,No-Salad-887,2026-04-01,eviction,LEVEL_1_AWARE
FirstTimeHomeBuyer,1ss9qae,Out Bid on Dream Home,"Two weeks ago, we put in an offer on a house and were outbid by $5K. Since then, I’ve been holding onto the hope that the deal might fall through and we’d get another shot. Today, my realtor called to say the house was back on the market—I couldn’t believe it. I was genuinely excited, thinking this ",https://www.reddit.com/r/FirstTimeHomeBuyer/comments/1ss9qae/out_bid_on_dream_home/,12,34,radicual1818,2026-04-21,outbid again,LEVEL_1_AWARE
FirstTimeHomeBuyer,1sug2q3,On the fence...,"First, let me preface by saying that I suffer from paralysis by analysis. BIG time. I've heard that you need to be 100% confident when looking to buy your first home, and I've also heard it's okay to compromise, and it doesn't need to be perfect. Either way, I don't think I'll ever be 100% confident",https://www.reddit.com/r/FirstTimeHomeBuyer/comments/1sug2q3/on_the_fence/,3,13,ProbWithMyDog,2026-04-24,outbid again,LEVEL_1_AWARE
FirstTimeHomeBuyer,1si6c8q,"About to sign the P&amp;S, but I'm feeling so anxious","I need advice. I'm buying my first house, and I have been looking for about four months in a very competitive market in a small city in Massachusetts. Everyone knows we are in an inventory crisis nationally, but in Massachusetts it's amplified. So there were not a lot of places coming on the market ",https://www.reddit.com/r/FirstTimeHomeBuyer/comments/1si6c8q/about_to_sign_the_ps_but_im_feeling_so_anxious/,3,13,manintransition,2026-04-10,housing crisis,LEVEL_2_STRUGGLING
FirstTimeHomeBuyer,1so76el,Why is this house “cheap” near LA,"Hi, I am trying to find a house in my budget around San Fernando Valley and LA area and came across this house in Santa Clarita. I was wondering why you think it might be priced less than other houses also in SFV?

It’s at 269,000 which seems like a great deal for 3 rooms. I wonder if the HOA is exp",https://www.reddit.com/r/FirstTimeHomeBuyer/comments/1so76el/why_is_this_house_cheap_near_la/,2295,193,amart2022,2026-04-17,priced out,LEVEL_1_AWARE
FirstTimeHomeBuyer,1s5odk5,Came to the realization that I don’t need to buy a house…,"Got a significant raise at work. Decided ima buy a house. Found a house I liked, very nice but they were asking for too much. Found a second house, LOVED it. Good price, comfortably in my budget. Went to visit, decided I wanna put an offer in. Offer got countered by seller, no biggie, let pivot, put",https://www.reddit.com/r/FirstTimeHomeBuyer/comments/1s5odk5/came_to_the_realization_that_i_dont_need_to_buy_a/,1506,212,Sure_Armadillo_4365,2026-03-27,priced out,LEVEL_1_AWARE
FirstTimeHomeBuyer,1ss4mkh,Bait and switch?,"Put an offer on a house listed at **$345/sqft, \~2300 sqft**.

It felt overpriced, so we offered **5% below asking**.

On Friday, the seller’s agent said there *might* be another offer coming in. Nothing came that night.

On Saturday, our agent was told the seller wouldn’t look at offers until Sunda",https://www.reddit.com/r/FirstTimeHomeBuyer/comments/1ss4mkh/bait_and_switch/,1126,61,BackgroundPrevious15,2026-04-21,priced out,LEVEL_1_AWARE
FirstTimeHomeBuyer,1skt386,It makes me want to cry when I see how much prices have increased since COVID,"I was 25 when COVID hit and 2 years into my career. I had a good salary but almost no savings and I had just aggressively paid off my student loans. Though I also had great credit, and was debt free. I rented an apartment and was really tempted to put almost nothing down on a single family house but",https://www.reddit.com/r/FirstTimeHomeBuyer/comments/1skt386/it_makes_me_want_to_cry_when_i_see_how_much/,1030,145,Formal_Problem9939,2026-04-13,priced out,LEVEL_1_AWARE
FirstTimeHomeBuyer,1seuxhz,We got the keys! Swfl-325k-4.9%,"My husband and I have been together 19 years. The market in Southwest Florida has always been desirable but in the last 10 years people from up north have come down and changed the market pushing our home buying dreams further and further out. 15 years ago, we looked at building a home with the home",https://www.reddit.com/r/FirstTimeHomeBuyer/comments/1seuxhz/we_got_the_keys_swfl325k49/,980,60,Beecuh4251,2026-04-07,priced out,LEVEL_1_AWARE
FirstTimeHomeBuyer,1su9k0m,Sellers countering higher than listing,"So I saw a listing for $600k reduced from $615, on market 30 days. Called my agent, went to see the property same day. Everything looked as advertised and decided to make a offer. Offer was current asking price $600k + 10k credits. Submitted same day. 

8 days later they counter at original list pri",https://www.reddit.com/r/FirstTimeHomeBuyer/comments/1su9k0m/sellers_countering_higher_than_listing/,416,179,ogbootylicker69,2026-04-24,priced out,LEVEL_1_AWARE
FirstTimeHomeBuyer,1sb1iar,sellers agent lying,"Yesterday we put an offer in on a house that had been sitting on the market for over 30 days, all the houses in the neighborhood have been sitting for 30 days at least. They told us that it had had no interest and no showings and we were the first. We only asked for $5000 in seller concessions and a",https://www.reddit.com/r/FirstTimeHomeBuyer/comments/1sb1iar/sellers_agent_lying/,282,74,nottheonlyjuan_,2026-04-02,priced out,LEVEL_1_AWARE
FirstTimeHomeBuyer,1sqpnd4,House has sold many times,"Found a house that checks a lot of boxes, but looking at records and such, it's showing as being sold 8 times since 2000. The most recent sale being 2 years ago, and listed at the same price it is today. 

I've noticed the same thing with the seller giving money towards closing costs as well. The ho",https://www.reddit.com/r/FirstTimeHomeBuyer/comments/1sqpnd4/house_has_sold_many_times/,278,213,Alicenwondr,2026-04-20,priced out,LEVEL_1_AWARE
FirstTimeHomeBuyer,1skj3ul,it’s just a correction they said while houses sit for 90+ days,"just saw a 3/2 in my area relisted for the 4th time. started at $550k in june, now at $490k and they’re offering a free pizza party at the open house instead of a real price cut. the level of delusion from sellers who think it’s still 2021 is actually insane. nobody is buying ur shitty flip at 7.5% ",https://www.reddit.com/r/FirstTimeHomeBuyer/comments/1skj3ul/its_just_a_correction_they_said_while_houses_sit/,266,133,MajorTear1306,2026-04-13,priced out,LEVEL_1_AWARE
RealEstate,1s6eudg,Does every new mortgage payment increase 10-20% in year 2 due to escrow balance adjustments?,The last two mortgage payments I’ve had have gone up anywhere from 10-20% due to escrow adjustments. Seems like a scam to me. We have declared homestead for each home. We’re currently renting while we look for our next home but have a tighter budget this time so any increases in mortgage payment due,https://www.reddit.com/r/RealEstate/comments/1s6eudg/does_every_new_mortgage_payment_increase_1020_in/,54,97,MassholeForLife,2026-03-28,rent increase,LEVEL_1_AWARE
RealEstate,1swq1y3,Tenant wants to sign 6 year lease with option to buy,Northern VA area. Homes appreciate about 3 percent YOY. Tenants been there for 3 years and I know him personally- honest truth worthy etc... he gave me an offer today- long term lease with option to buy- he will sign a 4.5 year lease (increasing rent 1.5 percent every 18 months - he pays $3600 a mon,https://www.reddit.com/r/RealEstate/comments/1swq1y3/tenant_wants_to_sign_6_year_lease_with_option_to/,29,86,ComprehensiveDay423,2026-04-26,rent increase,LEVEL_1_AWARE
RealEstate,1sx2lad,Are HOAs worth it?,"Hi everyone,

I’m personally a first time buyer. My husband and I have been renting (a one bedroom apartment) for about 5 or so years now. We have another kiddo on the way to make us a family of four so we definitely need to upgrade. With that being said, grandmother is helping my family put a down ",https://www.reddit.com/r/RealEstate/comments/1sx2lad/are_hoas_worth_it/,0,25,DuckSwimmer,2026-04-27,rent increase,LEVEL_1_AWARE
RealEstate,1sj7au8,"Bay Area buy decision: ~$2M budget, Sunnyvale commute (2–3x/week), top schools vs renovation strategy?","Looking for some perspective from folks who’ve bought in high-cost markets, especially the Bay Area.

I’m currently renting in Sunnyvale and expect to commute \~2–3 days per week going forward. My partner is fully remote, so we have some flexibility on location. We have one child (starting elementar",https://www.reddit.com/r/RealEstate/comments/1sj7au8/bay_area_buy_decision_2m_budget_sunnyvale_commute/,0,29,name_nt_important,2026-04-12,rent increase,LEVEL_1_AWARE
RealEstate,1sh4z78,How do you go about selling a home with tenants occupying it? Weird situation I was just in as a renter.,"I'm not mad about this in the slightest, it worked out in my favor. I just thought it was interesting.

I was told the place I rented was being sold by the landlord and that I needed to be out in the next few months. Totally reasonable.

I find a new home, sign the lease - The current landlord (Not ",https://www.reddit.com/r/RealEstate/comments/1sh4z78/how_do_you_go_about_selling_a_home_with_tenants/,0,14,No_Departure7494,2026-04-09,rent increase,LEVEL_1_AWARE
RealEstate,1scb7i5,Foreclosure questions - junior and senior mortgages,"My house was sold at foreclosure sale in Sept. 2025 and the winning bid was the junior mortgage bank, for exactly the amount I owed them. They are listed in county records as holding the deed. The redemption period was 6 months and ended a few weeks ago. 

I just got out of the hospital after suffer",https://www.reddit.com/r/RealEstate/comments/1scb7i5/foreclosure_questions_junior_and_senior_mortgages/,16,42,Spaghetti-Rblade-51,2026-04-04,eviction,LEVEL_1_AWARE
RealEstate,1st5gwe,What is a good percentage for managing services,"Starting to invest in new market at Midwest. I’m starting to invest small in a class C duplex with a low gross income of \~$2000/month.

Don’t have the bandwidth to manage. Found a manager willing to take 10% per month. Plus 1 month rent per new contract. And $100-300 per renew lease. In addition ma",https://www.reddit.com/r/RealEstate/comments/1st5gwe/what_is_a_good_percentage_for_managing_services/,0,16,Gladiolur,2026-04-22,eviction,LEVEL_1_AWARE
RealEstate,1s4u8os,Why would a potential buyer act like this?,"I listed a property for sale in fall of 2024. Despite a price drop, zero offers. I took it off the market in January 2025 and offered it for rent through a property manager who told me that the renter she selected had wanted to buy it. But the renter never made an offer. Months go by with the tenant",https://www.reddit.com/r/RealEstate/comments/1s4u8os/why_would_a_potential_buyer_act_like_this/,470,89,AnagnorisisForMe,2026-03-27,priced out,LEVEL_1_AWARE
RealEstate,1s5nyda,Buyer wants price adjustment after closing paperwork has been signed?,"\*\*UPDATE\*\* - after days of multiple people trying to get this figured out, the buyer decided to jump ship and bail on the whole thing. Their actions were so nutty that apparently the realtor and lawyers office have blacklisted them from any future dealings 🤣. 

Sucks to have to start the whole p",https://www.reddit.com/r/RealEstate/comments/1s5nyda/buyer_wants_price_adjustment_after_closing/,391,247,KennyLagerins,2026-03-27,priced out,LEVEL_1_AWARE
RealEstate,1sm83ti,The Market is not Better,"We bought our first house in the summer of 2021 in Massachusetts. Our budget was roughly 300,000. The house was listed at 295,000 and we asked what they needed to cancel the open house. We bought at 310,000 (what they said they were looking for) and got a response back within hours of submitting the",https://www.reddit.com/r/RealEstate/comments/1sm83ti/the_market_is_not_better/,355,572,TheSmallestSloth,2026-04-15,priced out,LEVEL_1_AWARE
RealEstate,1sqr50q,Anyone else getting discouraged as a “move up” buyer?,"Just wanted to start off by saying first time homebuyers definitely have it worse, between the rapid appreciation of the past five years and interest rates that are significantly higher than they were.

My wife and I are currently in a 1,000 sf starter home in a nice area with a garage and finished ",https://www.reddit.com/r/RealEstate/comments/1sqr50q/anyone_else_getting_discouraged_as_a_move_up_buyer/,152,168,midwestern2afault,2026-04-20,priced out,LEVEL_1_AWARE
RealEstate,1sbodw3,"With a combined income of $100k, what’s a realistic home price?","We were originally looking at rentals in the Outer Banks area but the rent prices are INSANE. $2,000-$3,000 a month is not in our budget. I saw a house the other day for $275k and the estimated mortgage payment was around $1,500 so that made me think, we might as well buy a house. Obviously we’re no",https://www.reddit.com/r/RealEstate/comments/1sbodw3/with_a_combined_income_of_100k_whats_a_realistic/,146,308,marigoldjune,2026-04-03,priced out,LEVEL_1_AWARE
RealEstate,1swoqm4,Neighbors Came on Market at 40k Less Than Our Active Listing,"Our single family home went on market two weeks ago with only 10 showings (weekend 1). Our realtor wanted to start at a high number (500,000), but we've had no offers or showings this past week. We lowered price 15k to see if market would respond, still no offers.

Plot twist, our neighbors across t",https://www.reddit.com/r/RealEstate/comments/1swoqm4/neighbors_came_on_market_at_40k_less_than_our/,135,255,joe7L,2026-04-26,priced out,LEVEL_1_AWARE
RealEstate,1s6cihi,(MD) How the hell is everyone managing these interest rates?,"Seriously. A 60bps increase in a month? Wtf?

We were right in the middle of getting a pre-approval and it's completely flipped our math and assumptions upside down. Affordability wise, it's basically knocked us out of competition for the price/tier of home we had been targeting. 

On lender we spok",https://www.reddit.com/r/RealEstate/comments/1s6cihi/md_how_the_hell_is_everyone_managing_these/,112,274,Shakawakahn,2026-03-28,priced out,LEVEL_1_AWARE
