subreddit,post_id,title,selftext_snippet,url,score,num_comments,author,created_date,search_term,category
personalfinance,1sd2wu6,Need Advice Do I Sell or Rent,"Need advice. I bought my home 10 years ago in Texas. I owe 157k. Value is 350k. 2.9% interest rate. Have recently replaced roof and AC units (they only last 10 years here due to extreme weather).

I have an elderly parent with recent severe health issues that require better medical care and to be cl",https://www.reddit.com/r/personalfinance/comments/1sd2wu6/need_advice_do_i_sell_or_rent/,14,33,Dry_Studio_2114,2026-04-05,priced out,LEVEL_1_AWARE
Renters,1skoiel,Move-out invoice questions/complaints (IN),"I mostly want to rant for sympathies here. We moved out of a house a couple months ago. We lived there \~5 years, and in that time our rent check was late maybe twice, for which we did pay the late fee. In short, we are a boring couple with a lazy dog and no kids... good tenants. 

We even patched u",https://www.reddit.com/r/Renters/comments/1skoiel/moveout_invoice_questionscomplaints_in/,7,13,Open-Product-3824,2026-04-13,can't afford house,LEVEL_2_STRUGGLING
Renters,1s64qo3,[MA] Breaking Lease Advice,"I think I may need to break my lease due to health concerns and how I've been treated by the other roommates but I want to ask for legal advice first.

For context: I have dreamed about going back to school to get my masters degree so I moved out from California all the way to Massachusetts (drove o",https://www.reddit.com/r/Renters/comments/1s64qo3/ma_breaking_lease_advice/,2,31,ProbablyCIA,2026-03-28,can't afford house,LEVEL_2_STRUGGLING
Renters,1svjbfm,Is this legal?? (UT),I received this email this morning and I'm at a loss. We can barely afford the rent raises they've put us through so far. We've lived here six years and have only been late once on the rent. We're good tenants and keep the place in good condition. I've rented my whole life and have never been asked ,https://www.reddit.com/r/Renters/comments/1svjbfm/is_this_legal_ut/,248,122,deepthought42-0,2026-04-25,rent increase,LEVEL_1_AWARE
Renters,1scdv85,"(Orlando, FL) My apartment manager is bribing us with reduced rent.","Our apartment complex recently gave us our renewal letter with over a 15% increase in rent. We told them there’s no way we’re going to pay that, and that there are nicer apartments in the area we would move to for that same rent. 

They came back to us a week later and said they would reduce it to a",https://www.reddit.com/r/Renters/comments/1scdv85/orlando_fl_my_apartment_manager_is_bribing_us/,97,44,Sleexic,2026-04-04,rent increase,LEVEL_1_AWARE
Renters,1snedmm,Rent increases outpace LA seniors’ social security checks in affordable housing [CA],"Chinatown residents Jiaming Luk, who goes by Mr. Luk, and his wife said they’re forgoing haircuts and eating out to make rent. Their neighbor Anh Mac said she and her neighbors only have about $70 dollars left over after paying for rent, utilities and other needs.  
  
“ How can I live if my \[socia",https://www.reddit.com/r/Renters/comments/1snedmm/rent_increases_outpace_la_seniors_social_security/,54,33,LA_publicpress,2026-04-16,rent increase,LEVEL_2_STRUGGLING
Renters,1scgqmy,"(Charleston, WV) mobile home somehow using 34,000 kWh of power in a year, landlord acting like that’s normal","We’ve lived here for two years. Our electric bill has been high the entire time, but we thought it was normal because mobile homes due tend to have slightly higher power bills due to poor insulation, etc. But this winter it’s skyrocketed. Our bills have been around $800 every month, and now our most",https://www.reddit.com/r/Renters/comments/1scgqmy/charleston_wv_mobile_home_somehow_using_34000_kwh/,42,62,caramelswirllll,2026-04-04,rent increase,LEVEL_1_AWARE
Renters,1sti19o,[Upstate New York] new owner raising rent and asking for pet fees,"The building was sold to a new owner about 2 weeks ago and I got a call 3 days ago asking for my ID/email so they could sent a lease over. Long story short they moved a family into the downstairs apartment who is loud at unreasonable times(until 1am playing music, hanging out in the hallways smoking",https://www.reddit.com/r/Renters/comments/1sti19o/upstate_new_york_new_owner_raising_rent_and/,30,42,VSGNotice,2026-04-23,rent increase,LEVEL_1_AWARE
Renters,1sipmtt,[CA] 1 1/2 months late on rent,"In March, I was notified by the new management company that took over last year that I was nearly two months behind on rent. This came as a surprise to me, so I asked for clarification. They informed me that my rent had increased in December from $2,860 to $2,945. I explained that I was never made a",https://www.reddit.com/r/Renters/comments/1sipmtt/ca_1_12_months_late_on_rent/,21,24,ADHDBarber,2026-04-11,rent increase,LEVEL_2_STRUGGLING
Renters,1s5sev2,[CA] Assured pets were ok - application declined several days later,"Found a great rental property (1000 sq ft, backyard, close to work), talked with the property manager over the phone and was repeatedly told that dogs were acceptable with an increased deposit. Toured the property, discussed the dogs with the owner and was again told dogs were acceptable. Applied, c",https://www.reddit.com/r/Renters/comments/1s5sev2/ca_assured_pets_were_ok_application_declined/,18,47,Loud_Employee8578,2026-03-28,rent increase,LEVEL_1_AWARE
Renters,1s9o3rc,How often to landlords violate the law? [WA],"Rant Warning:

I feel like I have incredibly bad luck, or maybe this is just more common than it should be, but 3 out of the 4 places I’ve lived since moving out have violated the law in some way.

The first landlord violated the Americans with Disabilities Act, and I ended up getting the federal go",https://www.reddit.com/r/Renters/comments/1s9o3rc/how_often_to_landlords_violate_the_law_wa/,14,34,LanceOLab,2026-04-01,rent increase,LEVEL_1_AWARE
Renters,1se54g6,(IA)landlord is installing IMON internet in all units.,"Moved here last summer,I like my apartment first time renter,I’m retired and sold my acreage,Received e-mail last week that as of 04/01/2027 all units (16) will have Imon 100mps fiber internet installed and rent will increase $60 to pay for it,can’t opt out.I currently have Verizon 5G with 300 mps f",https://www.reddit.com/r/Renters/comments/1se54g6/ialandlord_is_installing_imon_internet_in_all/,10,24,Curious_Instance_606,2026-04-06,rent increase,LEVEL_1_AWARE
Renters,1sdi3lv,[IN] Plumbing issue guidance needed badly,"Hello. I rent from an apartment complex with a shared water reservoir. I am one of three tennants located at the bottom of the building I am in which has three floors.

Over the year and a half that I have lived here I have came home from work to find my kitchen sink caked in food/waste. Less than a",https://www.reddit.com/r/Renters/comments/1sdi3lv/in_plumbing_issue_guidance_needed_badly/,8,13,SeriousGooseBumps,2026-04-05,rent increase,LEVEL_1_AWARE
Renters,1sfbth0,Parent Haven’t Been Paying Rent in the Last Two Years [NYC],"Our old landlord passed away two maybe three years ago and our building was sold to a new landlord in the last year. On Sunday we were served with papers stating to procure our leasing agreement, or the last 6 payments of rent within the next 10 days, if not within 90 days we will be getting evicted",https://www.reddit.com/r/Renters/comments/1sfbth0/parent_havent_been_paying_rent_in_the_last_two/,224,41,Asleep-Praline-5087,2026-04-07,eviction,LEVEL_1_AWARE
Renters,1svjps4,Landlord died. New owner. They want rent paid in person at the bank or via wire. [Ca],In California. Landlord died and his estate is now in probate. The administrator of the estate dropped off some papers and told my grandmother to sign them as a receipt. The documents say my grandmother has to pay rent either by money order or cashier’s check in person at a specific bank. Or she can,https://www.reddit.com/r/Renters/comments/1svjps4/landlord_died_new_owner_they_want_rent_paid_in/,112,79,LLour1,2026-04-25,eviction,LEVEL_1_AWARE
Renters,1savmws,Landlord trying to build a new house in our yard. Legal? (NC),"So the title pretty much sums it up. I am a tenant in a house where we have exclusive control and use of the premise, to include front/back yard. The landlord just notified us that they plan to build two new houses on the property with the construction being planned for a month from now. 

The only ",https://www.reddit.com/r/Renters/comments/1savmws/landlord_trying_to_build_a_new_house_in_our_yard/,101,184,Accurate-Koala-6853,2026-04-02,eviction,LEVEL_1_AWARE
Renters,1se9sbx,"Co-signed for my daughter (Central, Pa)","I already know it was a mistake, I co-signed and her rent was always paid on time by me (the guarantee I gave if she couldn't come up with the money) but she moved in some jerk and landlord was not happy about it.  She was told he needs to get out, she ignored.  Given a notice to quit, did not leave",https://www.reddit.com/r/Renters/comments/1se9sbx/cosigned_for_my_daughter_central_pa/,93,9,Miserable-Silver4010,2026-04-06,eviction,LEVEL_3_CRISIS
Renters,1soh2c0,[FL] HOA wants me to pay landlord's past due fees,"Question for u guys, my landlord isn't paying his hoa fees and I received a letter basically saying they want me to pay them the rent going forward..it is currently 4/17 and I assume by like 5/1'ish they will expect me to make the rent payment to them..my question is if they decide to evict me would",https://www.reddit.com/r/Renters/comments/1soh2c0/fl_hoa_wants_me_to_pay_landlords_past_due_fees/,62,81,Pantherkitty-,2026-04-17,eviction,LEVEL_1_AWARE
Renters,1sut83l,Can I evict an unauthorized occupant if my co-tenants (MIL/Husband) are the ones who let her in? (TX),"I am one of three primary leaseholders on a corporate rental (AMH) in Texas. The other two are my husband and my mother-in-law (MIL).

My stepdaughter (21) is living here but is **not** on the lease as an adult. She is on it as a minor, which she was when we moved in five years ago. Our corporate le",https://www.reddit.com/r/Renters/comments/1sut83l/can_i_evict_an_unauthorized_occupant_if_my/,44,33,Individual-Base-3911,2026-04-24,eviction,LEVEL_1_AWARE
Renters,1sqtpuf,(AZ) I can't find anyone to rent from because of past eviction.,"Everywhere I've spoken to says if it was within the last 7 years they won't even talk to me about renting. I make plenty of money, and other than that eviction I have a clean background without even so much as a misdemeanor. But I can't find anyone who will talk to me about renting. ",https://www.reddit.com/r/Renters/comments/1sqtpuf/az_i_cant_find_anyone_to_rent_from_because_of/,31,130,Kau_Shin,2026-04-20,eviction,LEVEL_1_AWARE
Renters,1sblzh3,[WI] Landlord rejecting payment in error and removing ability to pay in any other way but certified funds,"My roommate and I both use the portal to pay our half of the rent separately. We paid March 31st. On April 2nd, we were notified that her payment did not go through and that we are no longer allowed access to the portal. We are required to send certified funds using a very particular process, along ",https://www.reddit.com/r/Renters/comments/1sblzh3/wi_landlord_rejecting_payment_in_error_and/,33,31,icyhot13,2026-04-03,eviction,LEVEL_1_AWARE
Renters,1snb1c4,"""Not zoned as living space"" rug pull - [NY]","Hello all
I've been renting a ""two bedroom"" apartment now for a few years, in NY state, in a three story home. 

The second floor has one bedroom, and the third floor is finished to bedroom standards; has two closets, and multiple windows (there used to be skylights too but those were removed due to",https://www.reddit.com/r/Renters/comments/1snb1c4/not_zoned_as_living_space_rug_pull_ny/,29,59,Shiticism,2026-04-16,eviction,LEVEL_1_AWARE
Renters,1skupw9,17yr old on lease need advice [OH],"*UPDATE* 
We went into the lease office with written notice that he is a minor and he will no longer be on the contract and he is now officially off the lease! The landlord put it in writing and signed his official termination of Lease.  


my brother (17) and his now ex girlfriend (19) share an apa",https://www.reddit.com/r/Renters/comments/1skupw9/17yr_old_on_lease_need_advice_oh/,21,56,Renegadejeepster,2026-04-13,eviction,LEVEL_1_AWARE
Renters,1ss8vay,[nyc] sublet tenant looking to protect themself against aggressive tenant landlord. Please help.,"Long story long: last year I began subletting 2 rooms in an apt in Brooklyn from someone I thought was a friend (knew through work, didn’t know extent of their OCD). I asked to be on the lease when it was renewed but they gave me some runaround about not wanting to alert the landlord so they wouldn’",https://www.reddit.com/r/Renters/comments/1ss8vay/nyc_sublet_tenant_looking_to_protect_themself/,2,9,sunson90,2026-04-21,deposit impossible,LEVEL_3_CRISIS
Renters,1sle51t,(OR) Can a landlord force renters to use &amp; pay for his solar panels on the home?,"We've been casually looking at homes in our area to move into. Nothing too serious - we're already pretty happy where we're at, but just seeing what's out there.

We came across a decent 3 bed, 2 bath home just outside of our city. Price is a little steep, but for the space, it's not half bad.

Howe",https://www.reddit.com/r/Renters/comments/1sle51t/or_can_a_landlord_force_renters_to_use_pay_for/,73,137,TipProfessional880,2026-04-14,priced out,LEVEL_1_AWARE
Renters,1sgnwnf,[PA] raising prices mid-lease for amenities,"My building's management company just switched over in March. I moved in last September. With the previous company, the rent included the basement storage unit that had been assigned to our apartment. Haven't paid a dime in extra fees for the storage unit. Fast forward to literally 5 minutes ago and",https://www.reddit.com/r/Renters/comments/1sgnwnf/pa_raising_prices_midlease_for_amenities/,25,23,WasabiSpecial5733,2026-04-09,priced out,LEVEL_1_AWARE
Renters,1suy4s7,"My Apt is asking me to move cause the apt is no longer fit for living (New Albany, Indiana)",I moved in my apartment back in July. Its an older building but was in the perfect location for work and social. In august the upper units (I live in the middle) roof got a leak. The leak them weaken my ceiling and started leaking down my walls. I messaged my maintenance team because I explained the,https://www.reddit.com/r/Renters/comments/1suy4s7/my_apt_is_asking_me_to_move_cause_the_apt_is_no/,6,23,daydreaminkitten,2026-04-24,priced out,LEVEL_1_AWARE
Renters,1skq7ca,Landlord deducted repaint + carpet after saying “no penalty” - worth small claims? (PA),"Hey, need some advice.

I moved out of my apartment in PA and my landlord deducted:

	• 1/2 repaint fee

	• Carpet replacement

I didn’t cause any real damage, just normal wear (light wall scuffs, no carpet stains or burns). Apartment was occupied for 1.5 years.

Lease clauses:

Painting:

“Tenants ",https://www.reddit.com/r/Renters/comments/1skq7ca/landlord_deducted_repaint_carpet_after_saying_no/,6,23,Android0511,2026-04-13,priced out,LEVEL_1_AWARE
Renters,1s8qo9a,"Confusing utility bills from landlord [Seattle, WA]","Background info (tl:dr, my landlord(s) - idek how big the company is - is/are in Asia and is extremely unprofessional and, honestly, kind of sketchy.) I've had some weird communication with my landlord in the past, and their latest bills don't make much sense. For example, they didn't have a secure ",https://www.reddit.com/r/Renters/comments/1s8qo9a/confusing_utility_bills_from_landlord_seattle_wa/,3,10,FoldEffective2724,2026-03-31,priced out,LEVEL_1_AWARE
Renters,1sae7iw,House up for sale and breaking lease. (QLD),"Update: Thankyou everyone for your advice, Ive packed down and cleaned nearly all of the house within the last few days, I’m planning on moving earlier. Landlord hasn’t shown up to the house and hasn’t sent Anymore messages (I’ve ignored all his last messages). I have kept records of the messages an",https://www.reddit.com/r/Renters/comments/1sae7iw/house_up_for_sale_and_breaking_lease_qld/,4,6,Just_another_renter,2026-04-02,priced out,LEVEL_1_AWARE
Renters,1skq067,Old landlord sold to a company. What are my rights? [ID],"Took over a friend's 2bd/1ba apartment in May of 2024 from a private landlord. Old dude who managed all his properties himself. Honestly, not the best at maintaining but very understanding and personable and most importantly, cheap. Most of his properties were on the older side and he knew that.

We",https://www.reddit.com/r/Renters/comments/1skq067/old_landlord_sold_to_a_company_what_are_my_rights/,2,2,RichardPath_,2026-04-13,priced out,LEVEL_1_AWARE
Renters,1sn9vk2,[WI] Landlord has given property over to a management company,"Okay, so I've rented from this landlord for 8 years. He owns the property. And it's the only place he rents out. It's half of a duplex and he lived in the other side and he's getting really old. So he's going to a care facility, and he's given out the property to a rental agency. 

He's been very ca",https://www.reddit.com/r/Renters/comments/1sn9vk2/wi_landlord_has_given_property_over_to_a/,2,25,WIbigdog,2026-04-16,priced out,LEVEL_1_AWARE
Renters,1spzjjv,Apt Building sent email saying a submitted an application but I didn’t [MI],"I am looking for housing in Ann Arbor and was on the website for one building a few weeks ago. I was curious about one unit and the pricing, so I accidentally opened an application to try to find out more info. I didn’t input any information from what I recall aside from just my name and email and p",https://www.reddit.com/r/Renters/comments/1spzjjv/apt_building_sent_email_saying_a_submitted_an/,2,1,OkElderberry1668,2026-04-19,priced out,LEVEL_1_AWARE
Renters,1snn4kz,[OH]— Possible scam with apartment hunting?,"My partner and I have been searching for apartments for the past couple of months and we stumbled upon a listing on Facebook marketplace. It was listed as an apartment, but it was a duplex, and it was listed at $815/month for the entire unit. The price seemed unbelievably low for the location, how u",https://www.reddit.com/r/Renters/comments/1snn4kz/oh_possible_scam_with_apartment_hunting/,2,1,Frequent-Captain1030,2026-04-16,priced out,LEVEL_1_AWARE
