subreddit,post_id,title,selftext_snippet,url,score,num_comments,author,created_date,search_term,category
RealEstate,1s8wdu0,"About to sign with agent, neighbor may want to buy. Need some thoughts.","I know there are agents here, and anti-agent folks. I'm neither. We were about to sign a representation agreement, like today, and a neighbor heard about our sale from a friend and called last night saying she's looking to downsize and could she take a look before we list. So she's coming to take a ",https://www.reddit.com/r/RealEstate/comments/1s8wdu0/about_to_sign_with_agent_neighbor_may_want_to_buy/,39,132,Jackandahalfass,2026-03-31,priced out,LEVEL_1_AWARE
RealEstate,1sshgqt,Questions to ask listing agent when viewing a home that went back on the market after pending contract?,"I know the listing agent doesn’t have to answer everything but I’m wondering what questions we should at least prep to ask them when we go to see the home?

It fell out of contract at least 3 weeks after going under contract which makes me believe it had something to do with inspections / negotiatio",https://www.reddit.com/r/RealEstate/comments/1sshgqt/questions_to_ask_listing_agent_when_viewing_a/,30,51,vp0267,2026-04-22,priced out,LEVEL_1_AWARE
RealEstate,1so94ar,"When do sellers have to disclose material defects, vs claiming ignorance?","I think my question is ultimately: What constitutes a seller ""knowing"" that there is a serious issue with a home? 

I recently cancelled a sale for a home I was under contract on after a nightmare inspection. We had a structural engineer come out and confirm the findings, which is that the building ",https://www.reddit.com/r/RealEstate/comments/1so94ar/when_do_sellers_have_to_disclose_material_defects/,29,88,Antique-Signal-5071,2026-04-17,priced out,LEVEL_1_AWARE
povertyfinance,1sn9kjj,Want to buy a house? Get a boyfriend.,"I work 2 jobs, I'm a single mom and I'll never be able to buy a house. I just want a tiny.. 2 bedroom. Nothing fancy. Nothing crazy. Just a little house to live in peace. To not be bothered. I dont make enough. I will never make enough. Talked to a lender yesterday and his advice was to ""ask my pare",https://www.reddit.com/r/povertyfinance/comments/1sn9kjj/want_to_buy_a_house_get_a_boyfriend/,3200,221,FireFlyLy,2026-04-16,can't afford house,LEVEL_1_AWARE
povertyfinance,1sfudl1,Boyfriend Kicking Me Out,"Hi all, yesterday my(21f) boyfriend(22m) who i have been living with for a year and a half broke up with me. His reasoning being that I am causing him too much stress with my poor mental health (recently diagnosed with ADHD, anxiety, ptsd, depression). I don't know what to do because I can not affor",https://www.reddit.com/r/povertyfinance/comments/1sfudl1/boyfriend_kicking_me_out/,1383,612,throwaway104729183,2026-04-08,can't afford house,LEVEL_1_AWARE
povertyfinance,1sdnghm,Just showered at work,"Just showered at work because our water heater has been broken for atleast 2 month now. Showering in ice cold water or heating up pots of water sucks, it reminds me of when our lights and water would get shut off as a kid. Just paid rent all myself because my mom, who doesnt have a job, kicked her c",https://www.reddit.com/r/povertyfinance/comments/1sdnghm/just_showered_at_work/,237,61,SwitchEm0,2026-04-05,can't afford house,LEVEL_2_STRUGGLING
povertyfinance,1svgkf4,"For the first time, I can't pay rent, and I'm scared.","As the title says, I (age 22) cant pay rent. I also can't pay other bills, or even find a job or get commissions and frankly, I'm feeling really, really hopeless being about $2000 away from my partner and i affording to live and pay bills, so this may read as a vent (but please, please feel free to ",https://www.reddit.com/r/povertyfinance/comments/1svgkf4/for_the_first_time_i_cant_pay_rent_and_im_scared/,44,72,MistRioReign,2026-04-25,can't afford house,LEVEL_1_AWARE
povertyfinance,1slbodz,Finding a career,How do people find a career with growth possibilities and that actually pays enough to survive? I have no degree and not much worthwhile work experience. I spent 10 years in construction but due to injury I can no longer do what I used to. But also the industry I was in required \~70 hour weeks to b,https://www.reddit.com/r/povertyfinance/comments/1slbodz/finding_a_career/,28,62,AlternativeDragon,2026-04-14,can't afford house,LEVEL_3_CRISIS
povertyfinance,1sojgxm,Need advice for helping my mom,"Hi all! Im making this post because my mother is in a terrible financial situation and I need advice on how to help her and get her to financial independence, if possible.

My (26) mother (57) has been left in a pretty helpless place after recently divorcing my father, who was financially abusive to",https://www.reddit.com/r/povertyfinance/comments/1sojgxm/need_advice_for_helping_my_mom/,5,31,cosmicallyavg,2026-04-17,can't afford house,LEVEL_1_AWARE
povertyfinance,1soaxjw,I feel backed into a corner,"I have been carrying most of the financial burden in the household for a couple of months now. I ensure everyone in the house eats and put all I can towards rent, while pay my own bills. There are 2 other people in the household with one other person just recently joining us.       Person A: was ""co",https://www.reddit.com/r/povertyfinance/comments/1soaxjw/i_feel_backed_into_a_corner/,3,4,Proof_Bar_9985,2026-04-17,can't afford house,LEVEL_2_STRUGGLING
povertyfinance,1sfgusk,I just really don't know what to do at this point,I live alone in an apartment that has no insulation between my floor and the dirt crawlspace underneath. It was impossibly cold this winter and one of my electric bills ended up being about the same or a little more than my rent just with having things warm enough to keep the pipes from freezing. I ,https://www.reddit.com/r/povertyfinance/comments/1sfgusk/i_just_really_dont_know_what_to_do_at_this_point/,2,8,coconut-greek-yogurt,2026-04-07,can't afford house,LEVEL_2_STRUGGLING
povertyfinance,1st3zf9,Am I just fucked?,"£1046.57 income

£777.13 rent

£12.50 broadband

£10 phone bill

£50 debt repayment

£30 gas

£44 water 

£89 electric (need to get this reduced somehow)

Legit £33 left over. Take off the bare minimum of my travel to a medical appointment once a week (40 minute journey I can't afford to do so takes",https://www.reddit.com/r/povertyfinance/comments/1st3zf9/am_i_just_fucked/,4,14,Zealousideal_Bad7664,2026-04-22,can't afford house,LEVEL_2_STRUGGLING
povertyfinance,1ssrco3,A tough situation could snowball and I'm looking for advice,"I want to start this out by saying that I'm a massive overthinker with high anxiety so my brain always goes to the worst case scenario. Maybe I'm looking for some peace of mind with this post too.

So I'm 25. My husband and I lived in our own apartment together until closer to the end of our lease w",https://www.reddit.com/r/povertyfinance/comments/1ssrco3/a_tough_situation_could_snowball_and_im_looking/,1,14,Select_Situation2031,2026-04-22,can't afford house,LEVEL_3_CRISIS
povertyfinance,1suubw9,Finally got my credit score past 700 !!,,https://www.reddit.com/r/povertyfinance/comments/1suubw9/finally_got_my_credit_score_past_700/,808,22,ItchyMedics,2026-04-24,rent increase,LEVEL_1_AWARE
povertyfinance,1slddjo,"can’t afford to stay, can’t afford to leave","my rent has slowly increased to the point of no longer being able to afford it. its the number one sore on our budget, with groceries and car payments being the next. its a decent place in a desirable city, but the area was laughably terrible up until this year. theres no sunlight. its advertised as",https://www.reddit.com/r/povertyfinance/comments/1slddjo/cant_afford_to_stay_cant_afford_to_leave/,64,65,icannotbelieveit69,2026-04-14,rent increase,LEVEL_1_AWARE
povertyfinance,1suno34,"I have been poor my whole adult life until my mom died, how do I use what I inherited from her to secure my future as a disabled person in the US?","My financial advisor who manages the investment account I inherited from my Mom doesn’t seem to get it. I have had cancer, I have a family history (my mom died from it) of cancer, it is very likely I will have cancer again at some point. Additionally none of the women in my family have lived to reti",https://www.reddit.com/r/povertyfinance/comments/1suno34/i_have_been_poor_my_whole_adult_life_until_my_mom/,51,59,No-Maybe2840,2026-04-24,rent increase,LEVEL_1_AWARE
povertyfinance,1scmz6c,The damage is done I left my parents abusive house in college. Need advice on how to finish college financially etc.,"I’m 20F i’m basically I went through it with my family raised very religious, insular Pentecostal my religious upbringing was literally in a cult. let’s just say I started college 200 miles away from my parents house, and I decided that if I went back to their house or if I ever had to I would not m",https://www.reddit.com/r/povertyfinance/comments/1scmz6c/the_damage_is_done_i_left_my_parents_abusive/,44,39,ballerinanoir,2026-04-04,rent increase,LEVEL_1_AWARE
povertyfinance,1se77r1,SINKS—how are you doing?,"Hi all,

Just checking in. 10 years ago I was living on my own, I got lucky with very reasonable rent and landlord, and while I wasn’t making a ton of money I was actually able to survive with a little money left over. Unfortunately with cost of living increases and wages staying the same it’s becom",https://www.reddit.com/r/povertyfinance/comments/1se77r1/sinkshow_are_you_doing/,26,22,LoverOfTabbys,2026-04-06,rent increase,LEVEL_1_AWARE
povertyfinance,1smpszq,Rent increase,,https://www.reddit.com/r/povertyfinance/comments/1smpszq/rent_increase/,0,0,Ambitious_Worry_5496,2026-04-15,rent increase,LEVEL_2_STRUGGLING
povertyfinance,1se2uqp,"How would you rate my current financial situation, and what can I being doing better to maximize my earnings and savings?","Background

* I am 28 years old, single, and don't have any kids. I have no financial debts of any kind.
* I currently have a full-time retail sales job where I make roughly $1,500 every other week after taxes. My average monthly expenses including rent are around $1,800 a month.
* I have $37,000 in",https://www.reddit.com/r/povertyfinance/comments/1se2uqp/how_would_you_rate_my_current_financial_situation/,0,4,strongerthenbefore20,2026-04-06,rent increase,LEVEL_1_AWARE
povertyfinance,1sllqi2,Budget help,I need advice and to rant a little- I used to be ahead on my bills and have a little cushion not much just a little and no debt besides a car loan.   My pay hasn’t changed much - to be quite honest my expenses haven’t that much either it just seems to be the cost of living these days has become impo,https://www.reddit.com/r/povertyfinance/comments/1sllqi2/budget_help/,0,9,aroark1818,2026-04-14,rent increase,LEVEL_1_AWARE
povertyfinance,1soagf9,22 with way too much debt,"I am 22F.

i went into a crazy just life/job rant first (and also hardly described my debt lol) so scroll towards the bottom for “TLDR” summary of debt.

I’ve never really been great with money. during covid i was 16 and got all that unemployment money and blew it all except $3000 to put towards my ",https://www.reddit.com/r/povertyfinance/comments/1soagf9/22_with_way_too_much_debt/,0,36,GhostAmongTheMoss,2026-04-17,rent increase,LEVEL_1_AWARE
povertyfinance,1swlfuc,"My business apparently doesn't count as ""work""?","I'm in a bad situation. I currently live at home with family who act as harsh landlords ready to evict me almost anytime because I haven't paid a lot of money towards rent.

I currently run a small business. While I do make profit from time to time, the overall income is very low as I have not obtai",https://www.reddit.com/r/povertyfinance/comments/1swlfuc/my_business_apparently_doesnt_count_as_work/,0,52,Ok_Strike9189,2026-04-26,rent increase,LEVEL_1_AWARE
povertyfinance,1shparv,How to cope with poor parents,"My mom (57) is about to be homeless.

I grew up with poor, financially irresponsible parents. My dad owned some gas stations that he lost then became a truck driver. My mom was a stay at home mom. Growing up my parents were always behind on rent and bills and always fighting. They got a divorce when",https://www.reddit.com/r/povertyfinance/comments/1shparv/how_to_cope_with_poor_parents/,951,128,mk97xo,2026-04-10,eviction,LEVEL_3_CRISIS
povertyfinance,1srz2ad,Tired,"Living terribly, knowing I’m broke as hell ready to be evicted. I dunno just wanted to share. Something in me just wants to give up but I can’t. Can’t be a 🐱 well lock in one day but for now I’m chilling. Just wanted to share. I start work on the 1st tho for 20 at Amazon!",https://www.reddit.com/r/povertyfinance/comments/1srz2ad/tired/,748,98,BLCLVAmusic,2026-04-21,eviction,LEVEL_1_AWARE
povertyfinance,1snw0nb,Got evicted today sheriff came,I been battling this eviction for 10 months. Long story short I moved to California with me ex who left me here . I was already battling deep depression and her leaving plus my business failing broke the camel back . Today I was sleeping and the sheriff knocks on the door then precedes to open it . ,https://www.reddit.com/r/povertyfinance/comments/1snw0nb/got_evicted_today_sheriff_came/,325,96,piewoopadoop,2026-04-17,eviction,LEVEL_3_CRISIS
povertyfinance,1sdqshj,Starting to lose faith in ever getting a job.,"Within the span of a year I've: been laid off from my job (and no, I did not qualify for unemployment because it was a flex position), had my living situation change twice (I am ""technically"" homeless, it's a long story), and had a friend pass away. In a month from now, the place I'm at is inevitabl",https://www.reddit.com/r/povertyfinance/comments/1sdqshj/starting_to_lose_faith_in_ever_getting_a_job/,118,56,ThrowRAlikeylikey,2026-04-06,eviction,LEVEL_3_CRISIS
povertyfinance,1shca5a,i have a $1200 power bill i don’t know what to do,"Sorry for all the words I’m so stressed about this. 

My boyfriend and I moved recently and we had an outstanding balance with Duke Energy from our old apartment. Close to maybe $500, we were barely making our last apartment’s rent at the time so the power bill kept getting pushed away. We moved rec",https://www.reddit.com/r/povertyfinance/comments/1shca5a/i_have_a_1200_power_bill_i_dont_know_what_to_do/,91,220,meow-123456,2026-04-10,eviction,LEVEL_3_CRISIS
povertyfinance,1sai0w4,5k to avoid eviction with ~550 Credit Score,Last year I lost my Job and while looking for work I got 6 months behind on rent maxed my credit cards and now I am employed making \~700 a week.  Looking for a place/website where I can get financial help because I am now being threatened for eviction if I don't come up with the 5k before 4/24/26. ,https://www.reddit.com/r/povertyfinance/comments/1sai0w4/5k_to_avoid_eviction_with_550_credit_score/,43,32,Rude_Mongoose_664,2026-04-02,eviction,LEVEL_1_AWARE
povertyfinance,1swqj1z,About to be homeless because prior eviction,"I was seriously struggling 2 years ago, at the absolute bottom, no money, dead end job, eviction , homeless , no food. But things got a little better, making OK money, was able to start savings and get somewhere.

Right now my situation is I have to find a new place to live in the next 2 weeks but w",https://www.reddit.com/r/povertyfinance/comments/1swqj1z/about_to_be_homeless_because_prior_eviction/,16,17,BackgroundGene7510,2026-04-26,eviction,LEVEL_3_CRISIS
povertyfinance,1s9exdv,"42, unemployed and in bad health - Can my 401k help?","I'm 42, and due to major struggles with my mental health, I lost my job of 5 1/2 years, going on two months ago.  I'm applying like crazy when my brain lets me do more than stare blankly, but the only responses I'm getting are all scams.  My mental health continues to deteriorate, med change attempt",https://www.reddit.com/r/povertyfinance/comments/1s9exdv/42_unemployed_and_in_bad_health_can_my_401k_help/,9,45,EffortPrimary3638,2026-04-01,eviction,LEVEL_3_CRISIS
povertyfinance,1sr0rxp,Need a way to make money fast; epilepsy sucks,"Hi, recently I’ve been going through fits of seizures that have impacted my work. They seem to have figured out how to stop them but now I’m in the hole and need to make almost $1000 in the span of a week, otherwise my roommate and I will be evicted… I did manage to maintain my 2 jobs so I will be a",https://www.reddit.com/r/povertyfinance/comments/1sr0rxp/need_a_way_to_make_money_fast_epilepsy_sucks/,8,16,Round-Mycologist5861,2026-04-20,eviction,LEVEL_1_AWARE
povertyfinance,1sqlcvm,"Do I save for a car, or to move first? (Lease ending in 1 month)","Not sure if this goes here but hoping its okay to post. 

Basically, my lease will be ending at the end of next month (May) and due to circumstances it is extremely uncomfortable to continue living in my current place (harassment). I have a friend willing to help line up a job for me but its about a",https://www.reddit.com/r/povertyfinance/comments/1sqlcvm/do_i_save_for_a_car_or_to_move_first_lease_ending/,7,5,MarsupialFrequent629,2026-04-20,deposit impossible,LEVEL_1_AWARE
povertyfinance,1sd7817,Can't afford a wheelchair,"(Not sure how to tag this, it's definitely a vent but I am more than open to advice!)

I am currently a full-time manual wheelchair user due to a rare progressive neurological disorder - one that my corrupt slavic country does NOT recognize as something that would make me eligible for financial assi",https://www.reddit.com/r/povertyfinance/comments/1sd7817/cant_afford_a_wheelchair/,46,31,rip0tear,2026-04-05,housing crisis,LEVEL_2_STRUGGLING
povertyfinance,1sh5h00,"Mom’s spending is tanking our household finances after stepdad’s arrest, what steps am I missing?","I’m 26 and moved back in with my mom to help stabilize things after my stepdad was arrested on DV charges. She’s been struggling with the bills, and I’ve noticed the mortgage and utilities aren’t getting paid consistently. It seems like a lot of the money is going toward extra grocery runs and other",https://www.reddit.com/r/povertyfinance/comments/1sh5h00/moms_spending_is_tanking_our_household_finances/,23,15,Primary-Sorbet6325,2026-04-09,housing crisis,LEVEL_1_AWARE
povertyfinance,1sf7azs,just feeing so discouraged &amp; beaten down lately,"just needed to vent how incredibly, hopelessly, inescapably low &amp; demoralized I feel trying to stay afloat while getting hit with more expenses &amp; drowning in debt. it feels like every time I start to see a glimmer of light above my head, something grabs ahold of me and just plunges me even d",https://www.reddit.com/r/povertyfinance/comments/1sf7azs/just_feeing_so_discouraged_beaten_down_lately/,23,17,obviousanon1,2026-04-07,housing crisis,LEVEL_1_AWARE
povertyfinance,1s8ioyz,"Buy food now if you can, if you were saving this is what it was for","Yeah I don't post here, I chime in. A lot of people may think in a ""mean"" way maybe.

Life is hard and I've seen suffering most people haven't and hopefully will not in their life.

Anyways if you were waiting to buy beans or rice or anything shelf stable do it now, this is what you saved for.

Pric",https://www.reddit.com/r/povertyfinance/comments/1s8ioyz/buy_food_now_if_you_can_if_you_were_saving_this/,7930,158,Fit-Produce420,2026-03-31,priced out,LEVEL_1_AWARE
povertyfinance,1spfwys,Sleepovers and kids being mean,"I’m actually so livid right now, and downright sad.

My 14 year old has a super hard time making friends due to his adhd and autism. He’s been hanging out with a pair of kids for awhile, whom come from a lot of money and have huge houses. He’s been having sleepovers occasionally there with a few of ",https://www.reddit.com/r/povertyfinance/comments/1spfwys/sleepovers_and_kids_being_mean/,3652,472,tattedsparrowxo,2026-04-18,priced out,LEVEL_1_AWARE
povertyfinance,1suwtem,Am I the only one too ashamed to even meet with friends anymore?,"I feel ridiculous even typing this out, but I’m at the point where I’m turning down every single invitation because the shame is eating me alive.

I write a newsletter for a living. It’s a real job and I get paid (barely). But somehow that puts me in these weird circles where people way wealthier th",https://www.reddit.com/r/povertyfinance/comments/1suwtem/am_i_the_only_one_too_ashamed_to_even_meet_with/,1464,181,PithyCyborg,2026-04-24,priced out,LEVEL_1_AWARE
povertyfinance,1s95126,"As a high school Economics teacher, I just realized I would be worth more to the economy dead than alive.","Teaching Economics the other day, we were reviewing some methods of investment and the relative risks of each. Many people choose to park their retirement savings in market index funds, which have, on average over the past few decades, reported a \~4% rate of growth per year. This means that looked ",https://www.reddit.com/r/povertyfinance/comments/1s95126/as_a_high_school_economics_teacher_i_just/,478,120,asetupfortruth,2026-03-31,priced out,LEVEL_1_AWARE
povertyfinance,1se6gcq,Found out you can get a same-day dental cleaning at the dental school for $25 and I genuinely want to tell everyone I know,"I have been putting off going to the dentist for almost three years. I know, I know. But without insurance a basic cleaning at a regular office runs you anywhere from $100 to $200+ depending on where you live and that just wasn't happening. My teeth weren't in pain or anything so I kept moving it to",https://www.reddit.com/r/povertyfinance/comments/1se6gcq/found_out_you_can_get_a_sameday_dental_cleaning/,473,45,Frail_Axiom,2026-04-06,priced out,LEVEL_1_AWARE
povertyfinance,1s9aps6,Food Pantry Haul #1 – Estimated Value: $163.66,"So I've been lurking here for a while, and honestly, reading people say ""you don't have to be at rock bottom to use a food pantry"" was the thing that finally got me through the door. I wasn't waiting on someone to give me  ""permission"", per say, but it was really encouraging to see so many people (i",https://www.reddit.com/r/povertyfinance/comments/1s9aps6/food_pantry_haul_1_estimated_value_16366/,452,68,FoldedPaperHeart,2026-04-01,priced out,LEVEL_1_AWARE
povertyfinance,1snbb2v,How do people do this???,I just got a new job after moving into my first apartment as a fully solo independent adult (no roommates). It pays $22 an hour. I sat down and priced out a monthly budget for the bare minimum of what I would need to live comfortably in my tiny shoebox of a studio apartment. I have roughly $400 left,https://www.reddit.com/r/povertyfinance/comments/1snbb2v/how_do_people_do_this/,448,148,rising--dawn,2026-04-16,priced out,LEVEL_2_STRUGGLING
povertyfinance,1sky5du,60K Truck Is a Money Pit and I'm Drowning,I bought a 65K Ford Truck back in 2021 with the hopes to start a business. That business failed. Add to that a health issue that landed me in the hospital for a few days and I went in a financial downward spiral. I missed wages for a few months as I recovered physically and from feeling really depre,https://www.reddit.com/r/povertyfinance/comments/1sky5du/60k_truck_is_a_money_pit_and_im_drowning/,431,150,Mean-Payment5020,2026-04-14,priced out,LEVEL_1_AWARE
povertyfinance,1sf7qi7,"called to cancel my internet and accidentally ended up with a better plan for $20 less, been paying the loyalty tax for 3 years apparently","my internet bill crept up to $89 a month and i finally got fed up enough to actually call and say i was canceling. i had maybe $40 set aside to cover the gap while i figured out a new provider

the second i said cancel they transferred me to the ""retention team"" or whatever, i was half paying attent",https://www.reddit.com/r/povertyfinance/comments/1sf7qi7/called_to_cancel_my_internet_and_accidentally/,404,18,Best_Net7222,2026-04-07,priced out,LEVEL_1_AWARE
povertyfinance,1se74oo,Does anyone else do the mental math on literally everything to the point where it ruins the moment?,"I was at my cousin's birthday dinner last Saturday, the kind where someone picks a restaurant without checking if it's okay with everyone first and then you're just there, looking at a menu where the cheapest entree is $24 before tax and tip. I did the whole thing in my head before I even looked at ",https://www.reddit.com/r/povertyfinance/comments/1se74oo/does_anyone_else_do_the_mental_math_on_literally/,336,34,LobsterHungry4512,2026-04-06,priced out,LEVEL_1_AWARE
LateStageCapitalism,1s9qch8,A genuine question regarding wages vs cost of living,"Genuine question about wages vs cost of living

I keep seeing this debate everywhere: people say the cost of living keeps going up, so someone suggests raising the minimum wage. Then the counterargument is that raising wages will just make prices go up even more.

But here’s what I don’t understand ",https://www.reddit.com/r/LateStageCapitalism/comments/1s9qch8/a_genuine_question_regarding_wages_vs_cost_of/,17,16,This-Supermarket3082,2026-04-01,rent increase,LEVEL_1_AWARE
LateStageCapitalism,1sfsvt5,Landlords evicting tenants before law to prevent practice comes into force in England,,https://www.reddit.com/r/LateStageCapitalism/comments/1sfsvt5/landlords_evicting_tenants_before_law_to_prevent/,29,1,plain_handle,2026-04-08,eviction,LEVEL_1_AWARE
LateStageCapitalism,1skszm8,Housing crisis pending,"On a financial note.... This market is starting to look like 2007 again. If I'm a betting man... U take high housing market, high interest rates, high gas prices and a jacked up stock market... I'm willing to bet that this is pretty parallel or very close to it!!",https://www.reddit.com/r/LateStageCapitalism/comments/1skszm8/housing_crisis_pending/,3818,121,fire_asasyn,2026-04-13,housing crisis,LEVEL_1_AWARE
