subreddit,post_id,title,selftext_snippet,url,score,num_comments,author,created_date,search_term,category
LateStageCapitalism,1simloi,Y'all notice how capitalism is obsessed with forcing the working class to suffer for the luxury of the upper class? And any attempts to question it get shut down?,,https://www.reddit.com/r/LateStageCapitalism/comments/1simloi/yall_notice_how_capitalism_is_obsessed_with/,3149,9,Important-Cry4782,2026-04-11,housing crisis,LEVEL_1_AWARE
LateStageCapitalism,1sktyc6,How in the absolute fuck did my parents do this for years.,"I am a gen z’er in my early twenties my job is decent it has good benefits and the pay is slightly above average in my state but corporate America will eat you up and spit you out.

I genuinely ask my mom and dad “how in the fuck did yall work for corporations for years” and their response was “we h",https://www.reddit.com/r/LateStageCapitalism/comments/1sktyc6/how_in_the_absolute_fuck_did_my_parents_do_this/,839,86,Youcbah,2026-04-13,priced out,LEVEL_1_AWARE
LateStageCapitalism,1ssdp3l,The Costco Hotdog is a Rug Pull,"Bear with me a moment, and let me tell you about the Costco hotdog.

Everyone knows that the Costco hotdog is cheap. It's actually more expensive to buy the ingredients at Costco and make your own than it is to buy one from the food court. It's no secret that they lose money on the hotdogs, but for ",https://www.reddit.com/r/LateStageCapitalism/comments/1ssdp3l/the_costco_hotdog_is_a_rug_pull/,212,68,PrettyMuchMediocre,2026-04-22,priced out,LEVEL_1_AWARE
LateStageCapitalism,1svtxlz,"They're playing with our lives, literally.","US special forces soldier Gannon Ken Van Dyke was arrested on 23 April for allegedly using classified military intelligence to make prediction market bets on the January abduction of Venezuelan President Nicolas Maduro and his wife Cilia Flores.

Investigators say he had been “involved in the planni",https://www.reddit.com/r/LateStageCapitalism/comments/1svtxlz/theyre_playing_with_our_lives_literally/,119,5,mimi_molotov,2026-04-25,priced out,LEVEL_1_AWARE
LateStageCapitalism,1slsf3u,"Dvir faces 10 counts that include rape, attempted rape, an indecent act by force, multiple counts of indecent acts, attempted procurement for prostitution under aggravated circumstances, sexual harassment, providing false information, and destruction of evidence.","Prosecutors allege that Dvir, who primarily represented soldiers facing criminal proceedings in the military courts, carried out the acts over a period of years until his arrest, while exploiting what the indictment describes as sharp power gaps and the complainants’ severe distress.

The indictment",https://www.reddit.com/r/LateStageCapitalism/comments/1slsf3u/dvir_faces_10_counts_that_include_rape_attempted/,101,4,mimi_molotov,2026-04-14,priced out,LEVEL_1_AWARE
LateStageCapitalism,1s53ulo,"The Paraguay Scheme: Israel's secret plan to deport Gazans in the '70s - A new podcast series lifts the veil on the Mossad's failed attempt to expel 60,000 Palestinians soon after occupying the Gaza Strip. Almost six decades later, Israel's methods and objectives remain eerily similar.","On Sept. 9, 1969, around 20 Palestinians from the Gaza Strip boarded a plane at an airport in central Israel, believing they were bound for Brazil. They had signed up through an Israeli travel agency for a work-abroad program, with the promise of higher wages than they could find in Gaza, which Isra",https://www.reddit.com/r/LateStageCapitalism/comments/1s53ulo/the_paraguay_scheme_israels_secret_plan_to_deport/,82,3,Sun_fire_,2026-03-27,priced out,LEVEL_1_AWARE
LateStageCapitalism,1s75o18,"Digital price tags that can be changed at any moment. THANKS, Walmart!",Link [here](https://www.cnbc.com/2026/03/21/walmart-digital-price-tags-will-be-in-every-us-store-by-end-of-2026.html). ,https://www.reddit.com/r/LateStageCapitalism/comments/1s75o18/digital_price_tags_that_can_be_changed_at_any/,46,3,ansyhrrian,2026-03-29,priced out,LEVEL_1_AWARE
LateStageCapitalism,1sdhah0,Gasflation? Gas-shrinkflation? I can't believe there aren't mobs with pitchforks yet.,"Ok, so the US has had to deal with Covid's shock, the shock from Russia's war on Ukraine, crazy inflation, Trump's tariffs shock, even more inflation, Trump/Israel starting a war leading to ever rising gas prices, more inflation, likely recessions and depressions coming soon, and now on top of it al",https://www.reddit.com/r/LateStageCapitalism/comments/1sdhah0/gasflation_gasshrinkflation_i_cant_believe_there/,9,1,inochi-ino-key,2026-04-05,priced out,LEVEL_1_AWARE
LateStageCapitalism,1scxg80,AI workforce,"I think AI replacing human jobs is inevitable. There are situations where implementing AI makes perfect sense. However, if it were up to profit-driven employers, they would replace as many costly human employees as possible. I feel we may already be approaching this point: the S&amp;P 500 is high, p",https://www.reddit.com/r/LateStageCapitalism/comments/1scxg80/ai_workforce/,0,10,Alternative_Bus_7411,2026-04-05,priced out,LEVEL_1_AWARE
personalfinance,1spyaie,Cosigning student loans for child accepted to elite schools with high cost as a middle income family - What should we do?,"**Situation Overview:**

* Child accepted to several elite Liberal Art schools (very proud of her!)
* Provided some scholarships, but still substantial costs
* Top 2 schools are out of state, so no live at home options
* Future jobs relying heavily on geography to specific cities/locations 
* Qualif",https://www.reddit.com/r/personalfinance/comments/1spyaie/cosigning_student_loans_for_child_accepted_to/,214,794,Legitimate_Yak_9063,2026-04-19,can't afford house,LEVEL_1_AWARE
personalfinance,1sj64os,What Should I Do With My House Fund?,"I (mid 30s, M) have been saving up for a house for my whole adult life, and now that I have the downpayment...it's not happening. Everything I can afford has a problem I can't get over (usually a bad location or too many repairs), and the final nail in the coffin was using a rent vs. buy calculator ",https://www.reddit.com/r/personalfinance/comments/1sj64os/what_should_i_do_with_my_house_fund/,48,42,Typical_Importance65,2026-04-12,can't afford house,LEVEL_1_AWARE
personalfinance,1soij5w,Rent or buy after divorce,"40 year old with a toddler divorcing. Of course I regret not doing better at life but what to do now? Rent averages $2000 a month without utilities. Crappy house or condo $260000. Will not live with roommates because of child. $65000 income (not going to increase, was not working in recent years, bu",https://www.reddit.com/r/personalfinance/comments/1soij5w/rent_or_buy_after_divorce/,30,70,LingonberryNormal374,2026-04-17,can't afford house,LEVEL_2_STRUGGLING
personalfinance,1sn82sc,Looking for advice on where to even begin with budgeting and saving while living paycheck to paycheck - currently on Step 0 (PF Wiki),"Hello, I (32F) live in Washington state, USA in a smaller, more central WA city than Seattle. I have a partner (34M) and 2 children (9F and 5f) for whom I am owed, but rarely ever receive child support payments for. I work full time at a college, making $3,811 monthly before taxes and will be gettin",https://www.reddit.com/r/personalfinance/comments/1sn82sc/looking_for_advice_on_where_to_even_begin_with/,3,24,EmileeYoungWord,2026-04-16,can't afford house,LEVEL_2_STRUGGLING
personalfinance,1scters,"Planning to sell my condo later this year, invest or down payment?","A handful of years ago,  I had the fortune of getting the opportunity to buy my mother's condo that she was renting.  The previous owners were elderly and wanted the money to travel the world. They adored mother for being a hassle-free tenant and gave her an offer to purchase the condo list prove,  ",https://www.reddit.com/r/personalfinance/comments/1scters/planning_to_sell_my_condo_later_this_year_invest/,2,6,AzraelGrim,2026-04-04,can't afford house,LEVEL_1_AWARE
personalfinance,1sjudd9,"I can and want to buy a house, but I'm having a hard time deciding when.","31, 100k/year with potential for bonus. Expecting small raises per year, and a large raise within 3 years. Very secure job, and planning to stay potentially forever.

80k in a HYSA

100k in a 401k

Current Rent + Utilities = $1300 for a tiny apartment

Other Fixed Expenses (Food, groceries, Amazon, ",https://www.reddit.com/r/personalfinance/comments/1sjudd9/i_can_and_want_to_buy_a_house_but_im_having_a/,0,13,Bivolion13,2026-04-12,can't afford house,LEVEL_1_AWARE
personalfinance,1s62j4u,Need guidance on odd mortgage situation,"The beginning of 2024 I found out my parents were around 120k in cc debt that's not including SBA loan and I believe student loans for my mother's education. they however, owned their house free and clear their bills at the time we're unsustainable. I believe they were somewhere around $11,000 a mon",https://www.reddit.com/r/personalfinance/comments/1s62j4u/need_guidance_on_odd_mortgage_situation/,0,5,Eisenhart51,2026-03-28,can't afford house,LEVEL_1_AWARE
personalfinance,1sjrgfj,"25yo, have followed the flowchart my whole life until now, dilemma where to put my money. home improvement vs savings vs mortgage.","Hello. I am in a pickle and have lurked this forum since I was 15 but never posted.

I bought a house a little over a year ago. $265k purchase price, $225k mortgage, conventional 30 yr,  7.00%.

Seller hid the fact that this house has basement moisture issues. My inspector somehow missed it. Guess I",https://www.reddit.com/r/personalfinance/comments/1sjrgfj/25yo_have_followed_the_flowchart_my_whole_life/,0,16,thogzilla,2026-04-12,can't afford house,LEVEL_2_STRUGGLING
personalfinance,1srxxk9,Unique situation need advice; To live my life comfortably I only need 500/month. How to achieve easily?,500 a month covers utility. I live right behind my parents and plan to buy my own groceries but of course they'd still want me to eat dinner so I wouldn't go out of my way to spend on food if I couldn't afford it. House's mortgage is paid off. Thank you pawpaw and dad for finishing it up and setting,https://www.reddit.com/r/personalfinance/comments/1srxxk9/unique_situation_need_advice_to_live_my_life/,0,3,Difficult_Step9372,2026-04-21,can't afford house,LEVEL_1_AWARE
personalfinance,1sek7wy,How can I feasibly get out of my house?,"I am 26. I got my house back in 2024. took out a second loan with my lender to get a down payment. I live 12 hours from my family. I decided I was going to be the super rad adult with a home. 

fast forward to 2025, my partner lives with me and his kid. I'm managing the household while he takes care",https://www.reddit.com/r/personalfinance/comments/1sek7wy/how_can_i_feasibly_get_out_of_my_house/,0,29,ColorlessDragon9,2026-04-06,can't afford house,LEVEL_2_STRUGGLING
personalfinance,1sowvz0,Is it a dumb decision to sell house with 2.5% mortgage to move west and rent an apartment,"We bought a house in 2021 for a great price with a 2.5% mortgage and is 10% of our take home pay. We never really liked the house (wife hates it), but enjoyed the location (midwest town). We are increasingly becoming tired of being homeowners due to the time and money it takes for upkeep. Additional",https://www.reddit.com/r/personalfinance/comments/1sowvz0/is_it_a_dumb_decision_to_sell_house_with_25/,762,380,Visual_Code432,2026-04-18,rent increase,LEVEL_1_AWARE
personalfinance,1shc76z,Laid off and not sure what to do about money and housing come Fall,"31F, laid off at the end of Feb and want to avoid losing everything. I have $26k across my bank accounts. I have $60k in student loans ($35k federal, $25k private) and $20k in credit card debt. I have $8k in my roth IRA and $24k in my previous employer's 401k (I need to roll it over still). I owe $2",https://www.reddit.com/r/personalfinance/comments/1shc76z/laid_off_and_not_sure_what_to_do_about_money_and/,277,250,AccomplishedAlgae906,2026-04-10,rent increase,LEVEL_1_AWARE
personalfinance,1snp0dp,"33yo bringing in around $4,000/month","So, I bring in around 4,000/m after tax currently(about $3,000/m from my W2 job and about $1,000/m from DoorDash). I am looking to increase that to at least $5,000/m. I am contributing 6% to my 401k(85% S&amp;P 509 15% Bonds) at my job(50% match up to 6%). I also try to put $50/w in an individual br",https://www.reddit.com/r/personalfinance/comments/1snp0dp/33yo_bringing_in_around_4000month/,132,68,Fantastic-Bag3054,2026-04-16,rent increase,LEVEL_1_AWARE
personalfinance,1sfgyh0,Adjusting to new salary,"35M. I’ve been in some form of credit card debt (at times exceeding $50k - a cycle of transferring debt on different 0% interest balance transfers for X months) for about 8 years. 

My bank account has always revolved around $0 my entire adult life. 

I’ve worked the problem and over the last 2 year",https://www.reddit.com/r/personalfinance/comments/1sfgyh0/adjusting_to_new_salary/,77,25,Slainte1121,2026-04-07,rent increase,LEVEL_1_AWARE
personalfinance,1ssy8g8,Lost my job - Running retirement exercises for fun,"I lost my job as a corporate strategy director 3 weeks ago.  This is the type of profession where you work yourself out of a job.  I expect to work again, but the market where I live seems pretty dry at the moment so it freaks me out from a retirement perspective (because I'm not contributing).

Wit",https://www.reddit.com/r/personalfinance/comments/1ssy8g8/lost_my_job_running_retirement_exercises_for_fun/,16,9,Lazy-Relationship115,2026-04-22,rent increase,LEVEL_1_AWARE
personalfinance,1sgr4cc,How to balance savings goals and saving for retirement while also spending some money now?,"**TLDR:** Struggling to balance aggressive saving/investing with spending a little on life now. Have struggled with spending money for years.

I’m 36 (teacher) and my wife is 41 (school nurse). Household income is $158,700 in SoCal. We rent, are debt-free, and we’ll both get pensions; my wife should",https://www.reddit.com/r/personalfinance/comments/1sgr4cc/how_to_balance_savings_goals_and_saving_for/,11,31,FlyEaglesFly536,2026-04-09,rent increase,LEVEL_1_AWARE
personalfinance,1s7hpiy,Prenup/ financial advice - AUS,"Wanting some advice on where to start. 

My fiancé (31M) and I (32F) are planning to get married next year. We currently don’t/ have never lived together, but hoping to buy a house &amp; move in together later this year. Neither of us have kids, but planning in about 2-3 years. 

He has always rente",https://www.reddit.com/r/personalfinance/comments/1s7hpiy/prenup_financial_advice_aus/,8,2,Miserable_Thing_113,2026-03-30,rent increase,LEVEL_1_AWARE
personalfinance,1sk0kfm,"Making ~$750/week after tax, building emergency fund — what should I prioritize next?","I’m 32, currently making about $750/week after tax (\~$36k/year take-home).



I live alone in a studio apartment. My monthly expenses are roughly:



* Rent: $895
* Utilities + WiFi + phone: \~$200–250
* Groceries: $320/month ($80/week)





I don’t currently have a car payment.



I’m working on b",https://www.reddit.com/r/personalfinance/comments/1sk0kfm/making_750week_after_tax_building_emergency_fund/,6,10,Due_Bat1231,2026-04-13,rent increase,LEVEL_1_AWARE
personalfinance,1srq20l,Selling Inherited Condo - invest in stock or another Condo?,"Hello, 

Apologies in advance my financial literacy is very green. I am soon to sell a Condo in MA that I hoping to get atleast $400k from, I am looking to stay in the MA area and not sure if I should rent or look to buy another condo. Reasons for renting; I am just about 1 year into a serious relat",https://www.reddit.com/r/personalfinance/comments/1srq20l/selling_inherited_condo_invest_in_stock_or/,1,34,Key-Ad-8468,2026-04-21,rent increase,LEVEL_1_AWARE
personalfinance,1sj1wx8,Should I take a horrible loan to get outta my current situation,"First off some stats: 

I work at Sam’s Club and I make 19.38 an hour 

Current debt $6,242.13, $3,316 of which is credit cards debt spread out on 3 cards all of which are close to max $1600 in rent to my aunt who is currently trying to evict me because of it though I’ve been paying her $1000 every ",https://www.reddit.com/r/personalfinance/comments/1sj1wx8/should_i_take_a_horrible_loan_to_get_outta_my/,24,28,Cpt_kid1,2026-04-11,eviction,LEVEL_1_AWARE
personalfinance,1shq1kt,"My credit score is in the 720s, but my “tenant/resident score” is in the 660s. What can I do?","I’ve been working hard on my credit and I’ve gotten a pretty good one for having open student loan accounts and a minimum wage job I think!

However, a prospective landlord for my dream apartment used a service called “Transunion MyMove” that rated me at 662. He’s going to talk to his partner and se",https://www.reddit.com/r/personalfinance/comments/1shq1kt/my_credit_score_is_in_the_720s_but_my/,0,9,sharks_tbh,2026-04-10,eviction,LEVEL_3_CRISIS
personalfinance,1sqydxk,18 and looking for advice related to what's next for me.,"I am an 18 year old junior from the more northern part of Alabama and over the past 4 years have been struggling more and more to the point of nearly being homeless.

I've lived in poverty for years and haven't had much luck in getting myself anywhere. As of almost 3 months ago, I've been working at",https://www.reddit.com/r/personalfinance/comments/1sqydxk/18_and_looking_for_advice_related_to_whats_next/,0,15,Stock-Rip9715,2026-04-20,eviction,LEVEL_3_CRISIS
personalfinance,1sbfqbb,Wise says my transfer is paid out but won’t provide a trace ID — money still missing,"It has been a nightmare on the communication with wise customer service. I sent about $1,300 CAD via bank transfer from my wise CAD account to my Wealthsimple chequing account on March 25. Even though on transfer activity it showed ""successfully sent"", it never arrived. Wise requested me to provide ",https://www.reddit.com/r/personalfinance/comments/1sbfqbb/wise_says_my_transfer_is_paid_out_but_wont/,0,7,chaow10,2026-04-03,deposit impossible,LEVEL_1_AWARE
personalfinance,1s8bjyf,"Pay off student loans, invest more, or put a bigger down payment on a house?","Help please!! 

 Hi all.

Needing some advice on which route to take with funds (and having emotionally driven fear due to the state of the world).

MCOL area. Unfortunately, needing to buy a house at the absolute worst time (in my adult life) market wise. Recently became a single parent to a toddle",https://www.reddit.com/r/personalfinance/comments/1s8bjyf/pay_off_student_loans_invest_more_or_put_a_bigger/,7,18,BarScum,2026-03-30,outbid again,LEVEL_1_AWARE
personalfinance,1s88mrv,Convoluted question about a cash out refinance,"I’ll try to be concise as I can. I have owned several rental properties for more than 25 years. All of them have a lot of equity in them. During the housing crisis, three of the properties were refinanced by the mortgage company because I was always late on payments and it was a rescue program.  Wha",https://www.reddit.com/r/personalfinance/comments/1s88mrv/convoluted_question_about_a_cash_out_refinance/,4,4,modest_savant,2026-03-30,housing crisis,LEVEL_1_AWARE
personalfinance,1smnmwl,Sell house to buy house and retire,"I’ve been blessed enough to have a paid off house at 30. That being said, most if not all my net worth is now in the house. When it comes to retirement, I have a small 457, a small Roth, and some small investments in VOO and SPY. Not sure if I’m just in a mid-life crisis or not but I’m starting to r",https://www.reddit.com/r/personalfinance/comments/1smnmwl/sell_house_to_buy_house_and_retire/,0,10,Direct-Remote-,2026-04-15,housing crisis,LEVEL_1_AWARE
personalfinance,1s8hz5g,Future finance protection,"Ok so me and my partner have just bought a new home and we’re loving it but it’s made me consider more about what happens if our finances change (thinking any serious illnesses or unforeseen issues that might stop one or both of us from earning) as it’s now a 2-person income house.

I wondered reall",https://www.reddit.com/r/personalfinance/comments/1s8hz5g/future_finance_protection/,0,2,JBRDIT33,2026-03-31,housing crisis,LEVEL_1_AWARE
personalfinance,1supasl,"Low-Middle income couple in Denver, CO. How are we doing?","I (F20) currently work in education in Denver, CO USA. I average about 2,800$ a month gross working 30 hours a week, it varies as I make hourly and the school district has many non-duty days. I am currently on a path to graduate with my Bachelors in education in a semester or two, but I will not be ",https://www.reddit.com/r/personalfinance/comments/1supasl/lowmiddle_income_couple_in_denver_co_how_are_we/,0,18,TheSoloGamer,2026-04-24,housing crisis,LEVEL_1_AWARE
personalfinance,1su4069,what should I do with an extra 600-700 a month?,"I  just received a small promotion at work that will net about $600-$700 per month.For context I made 35,000 last year. With my old pay, I was already able to pay bills/save a bit each week. I have a 20 year old car that is still running but realistically there's gonna come a time when she dies. I'd",https://www.reddit.com/r/personalfinance/comments/1su4069/what_should_i_do_with_an_extra_600700_a_month/,0,9,Katisadogperson,2026-04-23,housing crisis,LEVEL_1_AWARE
personalfinance,1sjqroa,"We have equity, but how can we use it now? All of our money is tied up in housing.","TLDR: We own the house we live in and a rental that used to be our primary residence. We will move back into the rental in 4-5 years and sell the house we currently live in. How can we use our equity NOW to get us through the next 5 years? House poor to the max and scared of losing it. 

I feel like",https://www.reddit.com/r/personalfinance/comments/1sjqroa/we_have_equity_but_how_can_we_use_it_now_all_of/,0,48,decosunshine,2026-04-12,housing crisis,LEVEL_1_AWARE
personalfinance,1s7dsb1,"Got myself into a 84 month car loan of $42K, feeling financial pressure as I try to grow in life","I am a 23M resident of Florida for starters. In October, I mindlessly traded in my older vehicle for a 2025 Toyota Tacoma SR5 at a price of about 42,000. I am currently on a payment plan of a fixed 6% interest rate of 84 months - my monthly payment is $695.

Back then, I was working a manager job at",https://www.reddit.com/r/personalfinance/comments/1s7dsb1/got_myself_into_a_84_month_car_loan_of_42k/,657,225,Grubnation66,2026-03-29,priced out,LEVEL_1_AWARE
personalfinance,1svtove,"Advice wanted, my mortgage is insanely high","I live in a California suburb. Three years ago my husband and I divorced, and I bought him out of his share of our home (I did a cash out refi and unfortunately the interest rate was 6.625 at the time). My mortgage is now $3500 a month. My takehome pay each month is roughly $7800 (however this is a ",https://www.reddit.com/r/personalfinance/comments/1svtove/advice_wanted_my_mortgage_is_insanely_high/,274,173,ProfessorPizza,2026-04-25,priced out,LEVEL_2_STRUGGLING
personalfinance,1s91yvu,Using your HYSA for an emergency,"Many people here use a HYSA to store their emergency fund. But I'd like to talk about how you pull the money out if you actually have an emergency.

Usually online only banks have the highest rates. But let's say you have a $25k emergency (need a new roof, car suddenly dies, etc...) - you would just",https://www.reddit.com/r/personalfinance/comments/1s91yvu/using_your_hysa_for_an_emergency/,143,130,Celcius_87,2026-03-31,priced out,LEVEL_1_AWARE
personalfinance,1sg3v66,"Car declared total loss due to hail damage, best thing to do?","We own a 2021 Chevy Traverse, bought brand new with 0% financing (!) still owe about 12k on the loan. It has 91k miles on it. Got caught in a hail storm here in the Midwest and after insurance appraiser came out to inspect it, estimating 8-10k worth of damage, likely to go up when it hits a shop. In",https://www.reddit.com/r/personalfinance/comments/1sg3v66/car_declared_total_loss_due_to_hail_damage_best/,111,136,admjeffrey,2026-04-08,priced out,LEVEL_1_AWARE
personalfinance,1sjs7cl,Has anyone decreased retirement contributions in order to afford a house?,"Has anyone decreased their retirement contributions in order to afford a house?

Our financial situation:

* 33F and 41M
* no kids yet but trying
* \~10k/month take home
* I max out my 401k (24,500/year)
* Husband and I both max out Roth IRAs (15,000/year total)
* Husband just started a job with a p",https://www.reddit.com/r/personalfinance/comments/1sjs7cl/has_anyone_decreased_retirement_contributions_in/,57,114,Technical-Alps-8531,2026-04-12,priced out,LEVEL_2_STRUGGLING
personalfinance,1s9ljux,Our house needs major repairs. Is a HELOC a good idea?,"We bought an old farmhouse on 5 acres around 8 years ago. We bought it for 235k and currently owe around 180k. The home prices are going up and up in my area and our home has an estimate value of around 300k or more now.

The problem is we bought the house from a douchebag who flipped it and did shi",https://www.reddit.com/r/personalfinance/comments/1s9ljux/our_house_needs_major_repairs_is_a_heloc_a_good/,33,25,Wild-Blueberry-5259,2026-04-01,priced out,LEVEL_1_AWARE
personalfinance,1sbjcqc,Trad vs Roth 401k Insight,"Hi everyone! I was recently discussing the pros and cons of a trad vs Roth 401k with my friends, and wanted to ask for advice given my specific situation. For context, I've been maxing out both my Roth 401k (and Roth IRA) over the course of my entire career, and now I'm questioning if that approach ",https://www.reddit.com/r/personalfinance/comments/1sbjcqc/trad_vs_roth_401k_insight/,16,27,under570,2026-04-03,priced out,LEVEL_1_AWARE
