search_term,video_id,url,title,description_snippet,published_date,view_count,crisis_keywords,category
laid off tech 2025,F1K2h_u9v2g,https://www.youtube.com/watch?v=F1K2h_u9v2g,"Why 52,000 Employees Will Be Laid Off By Major U.S. Corporations From Amazon To Nike To Home Depot","Major U.S. corporations including Amazon, Nike, Home Depot, UPS and Dow have announced large-scale job cuts, with total ...",2026-01-31,39964,,LEVEL_1_AWARE
laid off tech 2025,m70b6OWuL0k,https://www.youtube.com/watch?v=m70b6OWuL0k,Laid Off After 4 Months as a Software Engineer,"In this video I talk about my experience getting laid off by CrowdStrike during their 5% mass layoffs last year, and provide a quick ...",2026-02-13,226530,,LEVEL_1_AWARE
laid off tech 2025,4T6hsatBdak,https://www.youtube.com/watch?v=4T6hsatBdak,&quot;Stop Thinking About Quitting – The Layoff Crisis Is Accelerating in 2026&quot;,"People are loosing their jobs due to AI takeover... should you quit your job?!! Buy here, pay here loans with super high interest are ...",2026-04-23,21590,,LEVEL_1_AWARE
laid off tech 2025,MsyRaHIDTC8,https://www.youtube.com/watch?v=MsyRaHIDTC8,Why Senior Developers are Being Laid Off in 2026,Get your FREE Ticket for the CodeToCEO Live Masterclass on March 29th here: http://workshop.codetoceo.com/ If you can build ...,2026-02-02,3900,,LEVEL_1_AWARE
laid off tech 2025,VlfpfttvatQ,https://www.youtube.com/watch?v=VlfpfttvatQ,"30,000 Oracle Employees About to Lose Their Jobs?","Oracle may lay off up to 30000 employees, nearly 20% of its entire workforce. AI and Careers for Men: https://www.aiupdate.ai ...",2026-02-02,65125,,LEVEL_1_AWARE
laid off tech 2025,Um4XnmMKau8,https://www.youtube.com/watch?v=Um4XnmMKau8,"He Got Laid Off From AI Company, Now He’s EXPOSING EVERYTHING (It’s SCARY)","He worked inside the AI industry — until he was suddenly laid off. Now he's speaking out. In this video, we break down what he ...",2026-02-23,88025,,LEVEL_1_AWARE
laid off tech 2025,4NSr9NEtufk,https://www.youtube.com/watch?v=4NSr9NEtufk,Mass Layoffs in Tech: I Survived Them for 25 Years—Until I Didn’t,"Mass layoffs are sweeping through the tech industry again. Over the last week alone, tens of thousands of engineers, designers, ...",2026-02-02,65795,,LEVEL_1_AWARE
laid off tech 2025,WxhqmxDW770,https://www.youtube.com/watch?v=WxhqmxDW770,I Got Laid Off From Block — My Second Layoff in Months | The Reality of Tech in 2026,I was laid off from Block yesterday — just weeks into the job. This is my second layoff in a matter of months after Microsoft. In this ...,2026-02-27,99307,,LEVEL_1_AWARE
laid off tech 2025,_HQtaQKVUlk,https://www.youtube.com/watch?v=_HQtaQKVUlk,"&quot;Everyone Is Getting Laid Off, Even In Tech...&quot; Enrollment For Computer Science Degrees Are Falling","Tiege Hanley: Get your first box 40% off (+ FREE gift), and 20% off for life, at https://tiege.com/morningshow Join the Bag Chasers ...",2026-02-17,69498,,LEVEL_1_AWARE
laid off tech 2025,CQfKt1xUoQs,https://www.youtube.com/watch?v=CQfKt1xUoQs,"50,000 Tech Layoffs in 2026 and They&#39;re Blaming AI",50000 tech layoffs in 2026 and the year's barely started. Oracle laid off 30000. Block laid off 4000. Meta announced 15000.,2026-03-16,6924,,LEVEL_1_AWARE
job search nightmare,dyPrNIDPF0s,https://www.youtube.com/watch?v=dyPrNIDPF0s,Job Hunting Is a Nightmare and RecruitingHell Has the Receipts,"reddit #recruiting #job Today we're diving into RecruitingHell, the subreddit where hiring managers, recruiters, and companies ...",2026-02-02,26,,LEVEL_1_AWARE
job search nightmare,OHsLYE2pjQU,https://www.youtube.com/watch?v=OHsLYE2pjQU,My Wife&#39;s Job Search Was a Nightmare - So I am Building PlatsAI,"My wife spent eight months job hunting in Sweden. Spreadsheets, cover letters from scratch, Arbetsförmedlingen, monthly ...",2026-04-07,9,,LEVEL_1_AWARE
job search nightmare,T2KLEGmGzBk,https://www.youtube.com/watch?v=T2KLEGmGzBk,Job Hunting &amp; Job Interviews Have Become A NIGHTMARE- Looking For Work Has Become A Game Of WIPEOUT,"Multiple interviews, take home assignments and you still Get GHOSTED. It's almost IMPOSSIBLE To Find a New Job! Buy my ...",2026-03-19,960,ghosted,LEVEL_2_STRUGGLING
job search nightmare,SmjD9GK7YQc,https://www.youtube.com/watch?v=SmjD9GK7YQc,The Job Market Just Got WORSE in 2026 (Here&#39;s Why),"The 2026 job market is officially cooked. In this video, we break down the brutal reality of trying to find work in 2026 — mass ...",2026-02-09,11644,,LEVEL_1_AWARE
job search nightmare,SYE03i670fc,https://www.youtube.com/watch?v=SYE03i670fc,Job Hunting in 2026 is a Nightmare 💀 #shorts #Qwyse,Stop wasting time on manual applications. The Qwyse autofill is a literal cheat code for 2026. Check it out at: qwyse.com ...,2026-04-14,45,,LEVEL_1_AWARE
job search nightmare,9R2Y2CGLRn8,https://www.youtube.com/watch?v=9R2Y2CGLRn8,Blacklisted for a Misdemeanor? My Job Search Nightmare #shorts,"Former journalist facing job rejections due to a past misdemeanor. Background checks reveal the charge, leading to ...",2026-02-17,5,,LEVEL_1_AWARE
job search nightmare,Y4HY24W-8ak,https://www.youtube.com/watch?v=Y4HY24W-8ak,From Job Hunt to Nightmare | The Wrong Call Story,What was supposed to be a simple job search turned into a life-changing nightmare… In this emotional and suspense-filled ...,2026-04-15,24,,LEVEL_1_AWARE
job search nightmare,DBorhwXLCVA,https://www.youtube.com/watch?v=DBorhwXLCVA,AI vs Human Hiring: My Job Search Nightmare #shorts,"Tired of AI gatekeepers? Discover how relying on bots leads to missed talent. Human eyes on your resume get results, while ...",2026-03-27,967,,LEVEL_1_AWARE
hundreds of applications no response,NojBL_hQNq4,https://www.youtube.com/watch?v=NojBL_hQNq4,How To Find a Job in 2026 (Using AI the Smart Way),"Struggling to get a job? Sending applications with no response? In this FREE live webinar, I'll show you how to land a job faster ...",2026-04-26,137,no response,LEVEL_2_STRUGGLING
hundreds of applications no response,ItXtnwgpD4c,https://www.youtube.com/watch?v=ItXtnwgpD4c,Fix Instagram Network Not Working Problem | Fix Instagram Loading Problem ,"Fix Instagram Network Not Working Problem | Fix Instagram Loading Problem Hey Guys, ✓ Are you facing Instagram network ...",2026-04-25,28253,,LEVEL_1_AWARE
hundreds of applications no response,H35fo-gkZ8E,https://www.youtube.com/watch?v=H35fo-gkZ8E,Fix Instagram Network Not Working Problem | Fix Instagram Loading Problem,Fix Instagram Network Not Working Problem | Fix Instagram Loading Problem Are you facing network issues on Instagram?,2026-04-25,17940,,LEVEL_1_AWARE
hundreds of applications no response,Hg6bbZ-QQwo,https://www.youtube.com/watch?v=Hg6bbZ-QQwo,"50 Job Applications --No Replies... Get FREE Help (Training, Mentors, Cash)","50 Job Applications --No Replies... Get FREE Help (Training, Mentors, Cash)",2026-03-22,681,,LEVEL_1_AWARE
hundreds of applications no response,SOoM6U3mNsw,https://www.youtube.com/watch?v=SOoM6U3mNsw,"Hundreds of applications, almost no replies 😮‍💨 #Shorts","Everyone says the same thing right now, hundreds of applications, almost no replies. Breeze Apply matches your resume ...",2026-04-18,136,hundreds of applications,LEVEL_2_STRUGGLING
hundreds of applications no response,ncv9SDkbQ74,https://www.youtube.com/watch?v=ncv9SDkbQ74,"Hundreds of applications, almost no replies 😮💨 #Shorts","Hundreds of applications, almost no replies. This short shows the exact pain job seekers keep talking about, ATS mismatch, ...",2026-04-14,96,hundreds of applications,LEVEL_2_STRUGGLING
can't find job,WqbBZh2SpEo,https://www.youtube.com/watch?v=WqbBZh2SpEo,The Real Reason GenZ Can&#39;t Find Jobs,FURTHER READING The Long-Term Decline of the U.S. Job Ladder https://www.nber.org/papers/w34981 Rising Young Worker ...,2026-04-24,14011,,LEVEL_1_AWARE
can't find job,15NkGTGS_xI,https://www.youtube.com/watch?v=15NkGTGS_xI,The Real Reason You CAN’T FIND A JOB ANYMORE ,Start the FREE Intro Courses with CourseCareers NOW! https://coursecareers.com/a/MarkSavant The job market is flooded.,2026-04-14,4489,,LEVEL_1_AWARE
can't find job,HuiRygpauzw,https://www.youtube.com/watch?v=HuiRygpauzw,&quot;I Can&#39;t Find a Job After 18 Months of Being Laid Off...&quot; Man Laid Off Says His Wife Works 2 Jobs 😔,"Tiege Hanley: Get your first box 40% off (+ FREE gift), and 20% off for life, at https://tiege.com/antondaniels Join the Bag Chasers ...",2026-03-21,38399,,LEVEL_1_AWARE
can't find job,oLZGbAqpBLc,https://www.youtube.com/watch?v=oLZGbAqpBLc,"&quot;Since DEI Ended, I Can&#39;t Find A Job&quot; — A Generation Of Women With No Options Left","Learn how I get clients, hire workers, and keep the profit (full system here): https://buymeacoffee.com/jaytbf/e/484734.",2026-03-26,8047,,LEVEL_1_AWARE
can't find job,3R9qaiNshZo,https://www.youtube.com/watch?v=3R9qaiNshZo,"&quot;Majority of Gen Z Is Unemployed...&quot; Woman Says They Can&#39;t Find Jobs, Face Layoffs, or Get Fired 🤔","Tiege Hanley: Get your first box 40% off (+ FREE gift), and 20% off for life, at https://tiege.com/antondaniels Join the Bag Chasers ...",2026-02-05,70810,,LEVEL_1_AWARE
laid off and struggling,AKlf8EjqVOc,https://www.youtube.com/watch?v=AKlf8EjqVOc,Getting Laid Off Can Ruin Your Career,"In response to the recent influx of LinkedIn posts by people who've recently experienced layoffs, I tell my own story of when I was ...",2026-03-18,13150,,LEVEL_1_AWARE
laid off and struggling,Z8N5N1kYo6w,https://www.youtube.com/watch?v=Z8N5N1kYo6w,I&#39;ve Seen How Companies Decide Who Gets Laid Off First,"How do companies decide who gets laid off? The layoff decision process is more calculated than most employees realize, and ...",2026-04-11,189470,,LEVEL_1_AWARE
laid off and struggling,zkcFVKSd7JM,https://www.youtube.com/watch?v=zkcFVKSd7JM,DO NOT QUIT Your Job! Layoffs Are Getting WORSE in 2026,2nd Channel @ZacV2 Compilation Channel @TheZacRiosShow My TikTok https://www.tiktok.com/@zacrios Chapters 0:00 ...,2026-04-14,659358,,LEVEL_1_AWARE
laid off and struggling,Uu57q4ekIWo,https://www.youtube.com/watch?v=Uu57q4ekIWo,"Man says he&#39;s been laid off for more than 18 months in high-level position in tech, can&#39;t find work","Tiege Hanley: Get your first box 40% off (+ FREE gift), and 20% off for life, at https://tiege.com/antondaniels Join the Bag Chasers ...",2026-03-21,213534,,LEVEL_1_AWARE
laid off and struggling,FbSu7yB0VB8,https://www.youtube.com/watch?v=FbSu7yB0VB8,100 Days After My Layoff as an Engineer… The Truth,What happens after a Big Tech layoff… when the noise fades and you're left alone with your thoughts? In this deeply personal and ...,2026-04-04,121675,,LEVEL_1_AWARE
laid off and struggling,KNiGjyU2ye8,https://www.youtube.com/watch?v=KNiGjyU2ye8,I Got Laid Off After 10+ Years in HR,"I never thought I'd be making this video… but here we are. After working in human resources for over 10+ years, I got laid off.",2026-04-18,23909,,LEVEL_1_AWARE
laid off and struggling,s7iU_WJgesQ,https://www.youtube.com/watch?v=s7iU_WJgesQ,This Is Why Older Workers Are Getting LAID OFF &amp; Can&#39;t Retire,2nd Channel @ZacV2 Compilation Channel @TheZacRiosShow My TikTok https://www.tiktok.com/@zacrios Chapters 00:00 ...,2026-02-22,356552,,LEVEL_1_AWARE
laid off and struggling,GzrAnDhydq8,https://www.youtube.com/watch?v=GzrAnDhydq8,Day in the Life of a Laid Off Big Tech Engineer,"Hello world In this video, I share a day in the life of a laid-off Big Tech software engineer navigating what I like to call ...",2026-03-12,38972,,LEVEL_1_AWARE
unemployment running out,yxx7Hr4W1fM,https://www.youtube.com/watch?v=yxx7Hr4W1fM,The Unemployment Rate For College Grads Is INSANE,Recent college graduates are suffering from a high unemployment rate as AI technology slashes jobs. Ana Kasparian discusses ...,2026-04-26,43813,,LEVEL_1_AWARE
unemployment running out,v2NKif9dvVY,https://www.youtube.com/watch?v=v2NKif9dvVY,"Amazon Just OBLITERATED Remote Work For 350,000 People","The office isn't dead yet, but millions of workers are already acting like it is. From coffee badging to quiet quitting, the fight over ...",2026-04-23,392398,,LEVEL_1_AWARE
unemployment running out,bMMzoqiBgs8,https://www.youtube.com/watch?v=bMMzoqiBgs8,Watters: They are getting DESPERATE,"Fox News host Jesse Watters argues that Iran is in a dire situation due to hyperinflation, mass unemployment and the continued ...",2026-04-25,801929,,LEVEL_1_AWARE
unemployment running out,aRLxcx79OvE,https://www.youtube.com/watch?v=aRLxcx79OvE,bUt ThAt&#39;s PeOpLeS ReTiReMeNT!,Use code HOWMONEYWORKS33 to get 33% off your first 6 months of Cape ...,2026-04-26,381760,6 months,LEVEL_1_AWARE
unemployment running out,wpBfUl4e6Wc,https://www.youtube.com/watch?v=wpBfUl4e6Wc,Gun Laws Work. The Math Proves It | Shots Fired At White House Correspondents&#39; Dinner,In this episode: ○ A Secret Service agent shot at the Correspondents' Dinner — and the lie that the system worked ○ Cole Tomas ...,2026-04-27,45865,,LEVEL_1_AWARE
job market is broken,RSr2sOL7w_M,https://www.youtube.com/watch?v=RSr2sOL7w_M,The Job Market Just BROKE.,Free Newsletter: https://armandcuret.substack.com/ Download Federal Resume Examples here: ...,2026-04-21,7385,,LEVEL_1_AWARE
job market is broken,JX5joQpAoys,https://www.youtube.com/watch?v=JX5joQpAoys,The Job Market Is Officially Broken,Need a resume/cover letter? Check out my templates! https://joshuafluke.store/ Join the community!,2026-02-19,78863,,LEVEL_1_AWARE
job market is broken,9UZySu94NG8,https://www.youtube.com/watch?v=9UZySu94NG8,The Job Market Is Broken in 2026 – Why No One Is Getting Hired,"The job market feels broken right now. Companies say they're hiring, but millions of people are sending out resumes and getting ...",2026-02-28,2153,,LEVEL_1_AWARE
job market is broken,zIr0Qvd219o,https://www.youtube.com/watch?v=zIr0Qvd219o,The Degree is Dead. Why America STOPPED Hiring,"Harvard MBAs can't find jobs. Nearly 1 in 5 graduates is unemployed, and the reason has nothing to do with intelligence, effort, ...",2026-04-10,300611,,LEVEL_1_AWARE
job market is broken,MFzuybsykKI,https://www.youtube.com/watch?v=MFzuybsykKI,The Job Market is Officially Broken in 2026,"The job market feels upside down right now. People are sending out hundreds of applications, going through long interview ...",2026-03-23,5355,hundreds of applications,LEVEL_2_STRUGGLING
overqualified unemployed,LPLp0NWkhrU,https://www.youtube.com/watch?v=LPLp0NWkhrU,When Being Too Qualified Costs You Everything Financially,This story exposes a brutal personal_finance trap where overqualification leads to unemployment and financial collapse. Watch to ...,2026-04-21,1,,LEVEL_1_AWARE
overqualified unemployed,bdWzXAzzqYA,https://www.youtube.com/watch?v=bdWzXAzzqYA,The New &quot;Unemployable&quot; Class,Take control and protect your files! Sign up to Proton Drive for FREE! https://proton.me/howmoneyworks Sign up for our FREE ...,2026-01-31,578178,,LEVEL_1_AWARE
overqualified unemployed,6U-8PQsEw4E,https://www.youtube.com/watch?v=6U-8PQsEw4E,Nearly one in five workers in Singapore overqualified for their jobs: MOM study,"According to a study by the Manpower Ministry, nearly one in five workers in Singapore is considered overqualified for their jobs ...",2026-04-14,12501,overqualified,LEVEL_2_STRUGGLING
overqualified unemployed,24klouT1_5U,https://www.youtube.com/watch?v=24klouT1_5U,When Being Too Qualified Costs You Everything Financially,This story exposes a brutal personal_finance trap where overqualification leads to unemployment and financial collapse. Watch to ...,2026-04-21,142,,LEVEL_1_AWARE
overqualified unemployed,2Be3LiOac7U,https://www.youtube.com/watch?v=2Be3LiOac7U,Overqualified and Overlooked: The Reality of PhD Unemployment,"More people than ever are earning PhDs… but fewer are finding stable jobs. So what's really going wrong? In this video, we break ...",2026-03-27,214,overqualified,LEVEL_2_STRUGGLING
overqualified unemployed,7AXvH1GBXYg,https://www.youtube.com/watch?v=7AXvH1GBXYg,Degrees but No Jobs: Why Being Educated Isn’t Enough Anymore.The Silent struggle Unemployment  2026।,"What happens when you do everything ""right""—get the degree, pass the exams, and follow the rules—but the doors to a career ...",2026-03-08,208,,LEVEL_1_AWARE
overqualified unemployed,m1YbZ2jDPkc,https://www.youtube.com/watch?v=m1YbZ2jDPkc,What “Overqualified” Really Means,"Unemployed. Send Wine. A faceless luxury satire on career clarity, composure, and reinvention. Today's reminder: Sometimes ...",2026-04-12,56,overqualified,LEVEL_2_STRUGGLING
desperate for job,tqfT31rvOtI,https://www.youtube.com/watch?v=tqfT31rvOtI,Elon Musk Pulls DESPERATE Stunt To Spin Job Losses From AI Takeover,Elon Musk desperately continues to try to spin job losses for Americans to be a good thing as AI takes over more areas with claims ...,2026-04-26,15477,,LEVEL_1_AWARE
desperate for job,rXEUGj_9Y7o,https://www.youtube.com/watch?v=rXEUGj_9Y7o,10 &#39;Boring&#39; Jobs That Secretly Pay $35+ an Hour And Are Desperate for Workers,"From actuaries to information security analysts, these 10 ""boring"" jobs pay $35 an hour or more and are actively hiring, making ...",2026-04-02,8,,LEVEL_1_AWARE
desperate for job,e9emQfY3LSI,https://www.youtube.com/watch?v=e9emQfY3LSI,Top 8 Trade Jobs DESPERATE for Workers in 2026,Learn how to build INCOME on YouTube (under 4 hrs/week): https://go.shanehummus.com/zach Access Free Intro Courses by ...,2026-04-16,5199,,LEVEL_1_AWARE
laid off what now,SDYRrDe7b3Y,https://www.youtube.com/watch?v=SDYRrDe7b3Y,He Got Laid Off... Now He Makes $250K/Year From Goodwill Trash,Thanks so much to @HairyTornado for having me!,2026-04-25,4621,,LEVEL_1_AWARE
laid off what now,XWlUEebIpEs,https://www.youtube.com/watch?v=XWlUEebIpEs,I Got Laid Off at 32… Now What?,"Last week, I was laid off from my “big girl” job at 32. I've never been fired. Never been laid off. And honestly… I didn't see it coming ...",2026-02-27,609,,LEVEL_1_AWARE
laid off what now,t9GtojsahBc,https://www.youtube.com/watch?v=t9GtojsahBc,Tech workers feeling the strain as industry layoffs skyrocket,"Mounting layoffs across the tech industry are leaving tens of thousands of workers without many options, and the increasingly ...",2026-04-25,115243,,LEVEL_1_AWARE
laid off what now,q6S7EQjCTfo,https://www.youtube.com/watch?v=q6S7EQjCTfo,Jack Dorsey Just Laid Off Half His Workforce In A Single Day,Jack Dorsey just cut 4000 jobs at Block — nearly half the company — and said the business is strong. Then he said the quiet part ...,2026-02-27,51768,,LEVEL_1_AWARE
laid off what now,MGhn_r8-YMQ,https://www.youtube.com/watch?v=MGhn_r8-YMQ,I Got Laid Off From My Tech Job So Now I&#39;m a Full Time YouTuber,"I got laid off from my six-figure tech job a year ago, and after 11 months of unemployment, I've made a decision that might sound ...",2026-01-27,34079,,LEVEL_1_AWARE
