search_term,video_id,url,title,description_snippet,published_date,view_count,crisis_keywords,category,notes
subscription audit,_vus1DhEWiw,https://www.youtube.com/watch?v=_vus1DhEWiw,Your Bank Statement is Bleeding $400 a Month,"Explores the ""Subscription Purge Protocol"" and the brutal math of food delivery markup. Sonya provides step-by-step tips for ...",2026-03-21,70,,LEVEL_1_AWARE,
subscription audit,8BJrifr7Ocw,https://www.youtube.com/watch?v=8BJrifr7Ocw,The Subscription Trap: Why You Will Own Nothing by 2030,"In this video, we dive deep into the rapid rise of the ""Subscription Economy"" and the global transition to ""Everything-as-a-Service"" ...",2026-03-31,122,,LEVEL_1_AWARE,
canceling subscriptions,uFtOLdKrqYw,https://www.youtube.com/watch?v=uFtOLdKrqYw,I’m Canceling All My Subscriptions… Oh Wait 😳,Join this channel to get access to perks: https://www.youtube.com/channel/UCkoujZQZatbqy4KGcgjpVxQ/join Support the Shawn ...,2026-03-11,1611049,,LEVEL_1_AWARE,
canceling subscriptions,M4xv9ImpBWw,https://www.youtube.com/watch?v=M4xv9ImpBWw,I Tried To Build My Own Cloud And Cancel EVERY Subscription,"I really recommend you try self hosting Something, take a look at all the cool things you can do and see if something looks ...",2026-02-07,1588049,,LEVEL_1_AWARE,
canceling subscriptions,9eppTdN1b0o,https://www.youtube.com/watch?v=9eppTdN1b0o,Why I CANCELLED My ChatGPT Subscription 💔,,2026-03-02,793224,,LEVEL_1_AWARE,
canceling subscriptions,bDzn2rGlKZs,https://www.youtube.com/watch?v=bDzn2rGlKZs,if breaking up was like canceling subscriptions #shorts,,2026-03-27,1930637,,LEVEL_1_AWARE,
canceling subscriptions,oZmaokfR-70,https://www.youtube.com/watch?v=oZmaokfR-70,Why Canceling Subscriptions Is Impossible (It&#39;s Not an Accident),"You've been there. You try to cancel a subscription and suddenly you need to call during business hours, navigate seven phone ...",2026-02-02,699,,LEVEL_1_AWARE,
canceling subscriptions,AtgCcMjtqF0,https://www.youtube.com/watch?v=AtgCcMjtqF0,I Spent a Year Replacing My Subscriptions. Here’s How.,Be kind to yourself this year. Go to my sponsor https://zocdoc.com/dammitjeff and find the awesome care you deserve for FREE| ...,2026-02-28,631719,,LEVEL_1_AWARE,
canceling subscriptions,VxOsB0vvEBI,https://www.youtube.com/watch?v=VxOsB0vvEBI,How to CANCEL HIGGSFIELD SUBSCRIPTION (Step by Step),This video provides a straightforward guide on how to cancel your Higgsfield subscription. Whether you're looking to switch ...,2026-03-14,934,,LEVEL_1_AWARE,
canceling subscriptions,EFle5Uf1AGo,https://www.youtube.com/watch?v=EFle5Uf1AGo,SUBSCRIPTIONS ARE KEEPING YOU POOR!,David Bach says many people underestimate how much they spend on subscriptions. He suggests canceling unused services ...,2026-03-13,74079,,LEVEL_1_AWARE,
canceling subscriptions,ham1g7OEqN4,https://www.youtube.com/watch?v=ham1g7OEqN4,We&#39;re CANCELING everything! The anti-subscription movement.,Try Rocket Money for FREE or unlock more features with premium at: https://RocketMoney.com/alicecappelle ✨This video is ...,2026-03-29,69155,,LEVEL_1_AWARE,
canceling subscriptions,W1H9WX7x8pw,https://www.youtube.com/watch?v=W1H9WX7x8pw,When you cancel a subscription,Follow me on: Twitch - https://www.twitch.tv/lenarrio Gaming Channel - https://www.youtube.com/@lenarrio1 Instagram: ...,2026-03-13,96984,,LEVEL_1_AWARE,
canceling subscriptions,jRcqJkW44Lc,https://www.youtube.com/watch?v=jRcqJkW44Lc,Subscriptions Are Getting Out of Control,"Go to https://brilliant.org/coldfusion/ and get 30 days free and 20% off the annual Premium subscription, giving you unlimited daily ...",2026-01-31,601060,out of control,LEVEL_2_FRUSTRATED,
canceling subscriptions,S8Qlp6RkdRc,https://www.youtube.com/watch?v=S8Qlp6RkdRc,How to Cancel FUBO TV Subscription,"Cancel your FUBO TV subscription quickly and easily in 2026. In this tutorial, I'll show you how to cancel Fubo on iPhone, Android ...",2026-02-01,3390,,LEVEL_1_AWARE,
canceling subscriptions,3YG4ovY9ffM,https://www.youtube.com/watch?v=3YG4ovY9ffM,How To Cancel Subscription from iPhone (2026),"In this video you will learn how to manage, cancel or renew an app subscription from your iPhone. Buy Me A Coffee ...",2026-01-26,508,,LEVEL_1_AWARE,
canceling subscriptions,7aNewd5zNSU,https://www.youtube.com/watch?v=7aNewd5zNSU,Why Activists Want You to Cancel ChatGPT,People are canceling their ChatGPT subscriptions. A wider movement wants to break free from US tech giants altogether. Why?,2026-02-20,29612,,LEVEL_1_AWARE,
canceling subscriptions,1hEzJyktV8E,https://www.youtube.com/watch?v=1hEzJyktV8E,How to Cancel Subscriptions on Bank of America App 2026 (Manage and Cancel Subscriptions),"How to Cancel Subscriptions on Bank of America App 2026 (Manage and Cancel Subscriptions) how to find recurring charges, ...",2026-02-26,108,,LEVEL_1_AWARE,
subscription burnout,Zg7xov8R1io,https://www.youtube.com/watch?v=Zg7xov8R1io,Subscription Burnout,"Enjoy, like, comment, share, join, and subscribe. Thanks for watching, links below. **LINKS** HELP SUPPORT MY CHANNEL ...",2026-03-09,525,,LEVEL_1_AWARE,
subscription burnout,KCxkuuy7nsU,https://www.youtube.com/watch?v=KCxkuuy7nsU,How Subscription Models Hack Your Brain (The Hidden Psychology Draining Your Money &amp; Focus),"What if your monthly subscriptions are designed to control your behavior? In this video, we break down how modern subscription ...",2026-04-12,8,,LEVEL_1_AWARE,
subscription burnout,lyNRqlaDK6Y,https://www.youtube.com/watch?v=lyNRqlaDK6Y,The Subscription Burnout Crisis: Why Customers Are Cancelling Everything (And What Comes Next),The subscription model was supposed to be the future of business. Predictable revenue. Higher LTV. Stronger customer ...,2026-03-25,56,,LEVEL_1_AWARE,
subscription burnout,pmqTgyPZdto,https://www.youtube.com/watch?v=pmqTgyPZdto,"If I Started From 0 Subscribers in 2026, This Is What I Would Do to Get 1 Million",Get free access to our vault of PDF summaries for every YouTube video here: https://believe.evancarmichael.com/the-vault ...,2026-04-08,44108,,LEVEL_1_AWARE,
subscription burnout,e6Gj-bCUlkw,https://www.youtube.com/watch?v=e6Gj-bCUlkw,Jill on Money Radio Show: Feeling Real Burnout and Worried After a Late Start,Email Us a Question: https://www.jillonmoney.com/contact Subscribe to Jill on Money LIVE: ...,2026-02-20,1208,,LEVEL_1_AWARE,
subscription burnout,QqlmUg-HNNc,https://www.youtube.com/watch?v=QqlmUg-HNNc,"Bumble Founder Whitney Wolfe Herd: Billionaire, Burnout &amp; Redefining Success",To Watch The Show: https://www.youtube.com/@TheSkinnyConfidential To connect with Lauryn Bosstick: ...,2026-04-06,49333,,LEVEL_1_AWARE,
subscription burnout,rrSeKPGRGUw,https://www.youtube.com/watch?v=rrSeKPGRGUw,what unlimited claude access actually does #ai #realtalks,"This video discusses the potential downsides of upgrading to a higher-tier Anthropic Claude subscription, specifically the Claude ...",2026-03-29,10461,,LEVEL_1_AWARE,
subscription burnout,Q-4uH7MHm8U,https://www.youtube.com/watch?v=Q-4uH7MHm8U,Why the PS3’s Online Was Free (Then Became Paid),Remember when Sony made online multiplayer totally free on the PS3 and made Xbox look greedy? What caused them to ...,2026-01-31,975134,,LEVEL_1_AWARE,
subscription burnout,1zCQVacfiBo,https://www.youtube.com/watch?v=1zCQVacfiBo,The Cure for Modern Burnout: The Psychology of &quot;Peak Experiences&quot;,"If you are feeling the crushing weight of modern burnout, the answer might lie in a ""Peak Experience."" When we expose ourselves ...",2026-03-30,5450,,LEVEL_1_AWARE,
subscription burnout,L8NWTvKKTc8,https://www.youtube.com/watch?v=L8NWTvKKTc8,Best of Vantaa Car Meet - Pure Burnout Chaos [Muscle Cars | Burnouts off 2025],SUBSCRIBE TO MY CHANNEL ⊳ https://www.youtube.com/channel/UC9Dpq_5t3_BaU2yWzGamTfw?sub_confirmation=1 ...,2026-01-14,1637,,LEVEL_1_AWARE,
subscription burnout,guTezvZSbGM,https://www.youtube.com/watch?v=guTezvZSbGM,8 Signs Your BURNOUT Has Gone Deeper Than Tiredness — and Where the Real Healing Begins,Support Us on Patreon — and Be Part of This New Beginning https://bit.ly/4s2MA7r If this channel has ever spoken to your ...,2026-04-05,1538,,LEVEL_1_AWARE,
subscription burnout,zsPUtKHkFEc,https://www.youtube.com/watch?v=zsPUtKHkFEc,The Need to Follow Through on Goals to Replenish From Stress and Burnout,"In this episode I welcome back Husband, Father, former Executive for large houses of worship, Award Winning Speaker, Author of ...",2026-04-06,2,,LEVEL_1_AWARE,
subscription burnout,rEnPft0W3i8,https://www.youtube.com/watch?v=rEnPft0W3i8,"Secrets to Building a Profitable, Sellable Business as a Mom without the Burnout with Leslie Hassler",Hook Point : Many moms don't build businesses — they build jobs they can't step away from. What if your business could be ...,2026-01-20,1458,,LEVEL_1_AWARE,
subscription burnout,LZBY-t3k0nw,https://www.youtube.com/watch?v=LZBY-t3k0nw,Autistic Burnout vs Depression: Why They’re Often Confused,"Hi there, I'm Elena! I was diagnosed with autism at 25, and ever since, I've been piecing my life together. My videos are a space ...",2026-01-21,3438,,LEVEL_1_AWARE,
subscription burnout,WLIWJkzKMRY,https://www.youtube.com/watch?v=WLIWJkzKMRY,Subscriptions are a SCAM. 🤡,"The loop is real. One day you own your life, the next you're just renting it back from a corporate GM. This is exactly why I built ...",2026-02-20,161,,LEVEL_1_AWARE,
subscription trap,bGo-n-fQ3Tk,https://www.youtube.com/watch?v=bGo-n-fQ3Tk,The $2.5 Billion &quot;SUBSCRIPTION TRAP&quot; | How to Get Your Money Back (2026),"The FTC just handed consumers a massive win. If you've been trapped in an Amazon Prime subscription or ""ghost"" billing, you ...",2026-02-19,3563,,LEVEL_1_AWARE,
subscription trap,8AKn-zJMIwY,https://www.youtube.com/watch?v=8AKn-zJMIwY,Why Owning Nothing Is So Expensive,"Subscription services exist for nearly everything consumers buy. Many, like Netflix or Spotify, start out affordable, but the cost adds ...",2026-01-24,3192183,,LEVEL_1_AWARE,
subscription trap,uxJ6rC5xu_s,https://www.youtube.com/watch?v=uxJ6rC5xu_s,"The Subscription Trap: Why Owning Nothing Will Cost You $182,000",The elite prediction that you will own nothing by 2030 is no longer a conspiracy theory; it is a calculated corporate reality designed ...,2026-03-21,3,,LEVEL_1_AWARE,
subscription trap,SxxT__lwaD4,https://www.youtube.com/watch?v=SxxT__lwaD4,Escaping John Deere&#39;s Subscription Trap,Contact me here: https://6thgenfarmer.com/pages/contact 6th Gen Farmer Store: https://6thgenfarmer.com/collections/all Check ...,2026-04-05,45343,,LEVEL_1_AWARE,
subscription trap,WE_ZSMMH2XQ,https://www.youtube.com/watch?v=WE_ZSMMH2XQ,The Subscription Trap: Why Small Monthly Payments Keep You Broke,"You don't feel irresponsible with money. You don't buy luxury. You don't make “big mistakes.” And yet, somehow, your finances ...",2026-01-31,35,,LEVEL_1_AWARE,
subscription trap,6hMPA8JI9kY,https://www.youtube.com/watch?v=6hMPA8JI9kY,The Subscription Trap  Why You Own Nothing and Are Always Broke,"You make decent money… so why does your account keep hitting empty before payday? In this video, we break down The ...",2026-03-23,29,,LEVEL_1_AWARE,
subscription trap,61m-ZvYg--Q,https://www.youtube.com/watch?v=61m-ZvYg--Q,Why 2026 Chartplotters Are a SCAM (The &#39;Subscription&#39; Trap),This box costs $4500. It has a quad-core processor and a retina screen. And it is the most dangerous piece of equipment on your ...,2026-01-20,27582,,LEVEL_1_AWARE,
subscription trap,z0WI-kHsDlY,https://www.youtube.com/watch?v=z0WI-kHsDlY,The Subscription Trap: How Canada Became a Nation of Renters,"You don't own your music. You don't own your car. You don't own your home. In Canada, we have moved from an economy of ...",2026-02-04,6790,,LEVEL_1_AWARE,
subscription trap,0VEEhvPEO_g,https://www.youtube.com/watch?v=0VEEhvPEO_g,The Subscription Trap That’s Quietly Making Everyone Poor,"It's not just one bill — it's all of them together. Streaming, apps, memberships, “free trials,” and auto-renewals are quietly draining ...",2026-01-27,1540,,LEVEL_1_AWARE,
subscription trap,LnerYa9SdU8,https://www.youtube.com/watch?v=LnerYa9SdU8,Koriderm Time Reverse Cream Review: The Subscription Trap Behind the Ads (2026),Check Current Price on Amazon: https://amzn.to/3Ogtdcg Bookmark & Use for ANY Amazon Purchase (Supports Channel): ...,2026-04-13,0,,LEVEL_1_AWARE,
subscription trap,8BJrifr7Ocw,https://www.youtube.com/watch?v=8BJrifr7Ocw,The Subscription Trap: Why You Will Own Nothing by 2030,"In this video, we dive deep into the rapid rise of the ""Subscription Economy"" and the global transition to ""Everything-as-a-Service"" ...",2026-03-31,122,,LEVEL_1_AWARE,
subscription trap,FyRg43Paq54,https://www.youtube.com/watch?v=FyRg43Paq54,Finelo Explained 🚨 Legit Education or Subscription Trap?,Finelo Review 2026 ⚠️ Legit Trading Platform or Hidden Trap? Finelo is being promoted as a beginner-friendly trading platform ...,2026-03-19,11,,LEVEL_1_AWARE,
subscription trap,DrQvjNcu3oc,https://www.youtube.com/watch?v=DrQvjNcu3oc,Why You Don&#39;t Own Anything Anymore (The Subscription Trap) #chillfinancialfuture,Community: / @chillfinancialfuture -- The Subscription Trap: Why You Don't Own Anything Anymore --- Why does it feel like you ...,2026-02-03,4,,LEVEL_1_AWARE,
subscription trap,4q4FDmCqnJg,https://www.youtube.com/watch?v=4q4FDmCqnJg,Why You Don&#39;t Own Anything Anymore (The Subscription Trap),Community: https://www.youtube.com/channel/UCyPM2GKrhFnQG4o-YtEuCFg/join ‎Follow the Chill Financial Historian channel ...,2026-02-01,9759,,LEVEL_1_AWARE,
subscription trap,v-yPB-Vs_ag,https://www.youtube.com/watch?v=v-yPB-Vs_ag,The Subscription Trap Most People Ignore,"Subscriptions have become a normal part of modern life. Streaming platforms, apps, software, and digital services often charge ...",2026-03-26,6,,LEVEL_1_AWARE,
subscriptions out of control,jRcqJkW44Lc,https://www.youtube.com/watch?v=jRcqJkW44Lc,Subscriptions Are Getting Out of Control,"Go to https://brilliant.org/coldfusion/ and get 30 days free and 20% off the annual Premium subscription, giving you unlimited daily ...",2026-01-31,601060,out of control,LEVEL_2_FRUSTRATED,
subscriptions out of control,8AKn-zJMIwY,https://www.youtube.com/watch?v=8AKn-zJMIwY,Why Owning Nothing Is So Expensive,"Subscription services exist for nearly everything consumers buy. Many, like Netflix or Spotify, start out affordable, but the cost adds ...",2026-01-24,3192183,,LEVEL_1_AWARE,
subscriptions out of control,E_kJqwfDsZU,https://www.youtube.com/watch?v=E_kJqwfDsZU,SUBSCRIPTIONS ARE OUT OF CONTROL IN 2026!,Subscriptions are getting out control with every service being put behind a paywall. People Feel trapped into this consumerism ...,2026-01-20,1412,out of control,LEVEL_2_FRUSTRATED,
subscriptions out of control,wQWMmU_dPIU,https://www.youtube.com/watch?v=wQWMmU_dPIU,Trump’s HEALTH COLLAPSES as WAR gets OUT OF CONTROL!!!!,MeidasTouch host Ben Meiselas reports on Donald Trump's health crashing faster by the day and Meiselas interviews Democratic ...,2026-03-29,1438946,out of control,LEVEL_2_FRUSTRATED,
subscriptions out of control,UL-jRD-o9Ng,https://www.youtube.com/watch?v=UL-jRD-o9Ng,How Subscriptions Are Getting Out Of Control!?,"What happens when the product you paid for stops working unless you pay again? BMW, Mercedes, Audi, Tesla, HP, Adobe, ...",2026-03-09,4,out of control,LEVEL_2_FRUSTRATED,
subscriptions out of control,frwmwXTAcFw,https://www.youtube.com/watch?v=frwmwXTAcFw,Subscriptions Are Getting Out of Control,"AppKatz.com - never any subscriptions, software you buy, software you own #SmallBusiness #WebsiteTips #AppKatz ...",2026-03-17,80,out of control,LEVEL_2_FRUSTRATED,
subscriptions out of control,D7CKQj00LkQ,https://www.youtube.com/watch?v=D7CKQj00LkQ,ESCALATION OUT OF CONTROL As US Embassies BURN,Krystal and Saagar discuss US embassies burning. Trita Parsi: https://x.com/tparsi?s=20 Sign up for a PREMIUM Breaking Points ...,2026-03-03,925990,out of control,LEVEL_2_FRUSTRATED,
subscriptions out of control,K3OrP96K9fY,https://www.youtube.com/watch?v=K3OrP96K9fY,"This AI Music Tool Might Change Everything… No Subscription, No Cloud?",Offline AI music generation (no cloud required) Watch Next ➤ https://youtu.be/S3ifVPkxYC0 ...,2026-04-12,1786,,LEVEL_1_AWARE,
subscriptions out of control,eMO9BOKK8G8,https://www.youtube.com/watch?v=eMO9BOKK8G8,Ads Are Everywhere and Getting Out Of Control in 2026!,"Ads are everywhere now — social media, streaming platforms, even paid subscriptions. TikTok shows ads every few scrolls, ...",2026-02-02,414,out of control,LEVEL_2_FRUSTRATED,
subscriptions out of control,Wicd1VOik8o,https://www.youtube.com/watch?v=Wicd1VOik8o,How I Reduced My OpenClaw API Spending by 90% (Claude Subscription Setup),Docs used: https://docs.openclaw.ai/providers/anthropic.,2026-02-12,19860,,LEVEL_1_AWARE,
subscriptions out of control,2yVwhwm-_Bs,https://www.youtube.com/watch?v=2yVwhwm-_Bs,MY BANK ACCOUNT IS CRYING... 💳🏦My funeral has a free trial!🤣,MY BANK ACCOUNT IS CRYING...My funeral has a free trial! Subscriptions are out of control! I checked my bank statement ...,2026-04-07,1387,out of control,LEVEL_2_FRUSTRATED,
subscriptions out of control,j0da1ZftUIo,https://www.youtube.com/watch?v=j0da1ZftUIo,Top AI Safety Exec LOSES CONTROL Of AI Bot,Krystal and Saagar discuss a top AI safety exec losing control of an AI bot. ControlAI: https://controlai.com/about Sign up for a ...,2026-02-24,240768,,LEVEL_1_AWARE,
subscriptions out of control,X5aK6TthlFQ,https://www.youtube.com/watch?v=X5aK6TthlFQ,"I switched from 93 software subscriptions to 1 ai app, you probably should too",Business software built for you: https://try.fillout.com/zite-ai I replaced 93 different tools with one powerful solution and in this video ...,2026-02-25,472,,LEVEL_1_AWARE,
subscriptions out of control,CuqI7CkiazE,https://www.youtube.com/watch?v=CuqI7CkiazE,“Own Nothing and Be Happy” Subscription Culture is OUT OF CONTROL,Subscriptions used to be a cool option so that people can has access to certain services and sometimes products. Nowadays it ...,2026-03-05,189,out of control,LEVEL_2_FRUSTRATED,
subscriptions out of control,quZ4ERHYWlQ,https://www.youtube.com/watch?v=quZ4ERHYWlQ,Subscription Services are out of control,Welcome to 2025 where owning things is a thing of the past. Subscription services rule the world and it seems like things are only ...,2026-01-24,249,out of control,LEVEL_2_FRUSTRATED,
