subreddit,post_id,title,selftext_snippet,url,score,num_comments,author,created_date,search_term,category
povertyfinance,1rsnhwl,I feel like I’ve ruined my life,"I’ve been out of a job since January. The first month I was okay but in the second month things really started to hit me mentally. I’ve been searching for a job since January and nothing really came up. 

So, I started doing gig work which included food and package delivery(think Amazon flex). Last ",https://www.reddit.com/r/povertyfinance/comments/1rsnhwl/i_feel_like_ive_ruined_my_life/,74,40,striving4success,2026-03-13,working poor,LEVEL_1_AWARE
povertyfinance,1rl6f3z,A healthier DIY alternative from-scratch to instant ramen.,"A lot people eat instant ramen because it can be cheap (although many actually are not that cheap) and easy to make (especially if its in a ""cup"" form - just add hot water).   But there are a lot of downsides.   And a lot of people do some work to supplement it with proteins or veggies (which is goo",https://www.reddit.com/r/povertyfinance/comments/1rl6f3z/a_healthier_diy_alternative_fromscratch_to/,44,13,palefire123,2026-03-04,working poor,LEVEL_1_AWARE
povertyfinance,1rjzmhx,Can I go to the food bank?,"I’m really just trying not to feel guilty about this and know if I’m making a selfish decision. On paper I have a good 9-5. I live in Upstate New York and make 20 ish dollars an hour after taxes. However, my job has zero benefits. I don’t even get sick pay, and I’m sick often. I’m in the process of ",https://www.reddit.com/r/povertyfinance/comments/1rjzmhx/can_i_go_to_the_food_bank/,44,60,mercurycutie,2026-03-03,working poor,LEVEL_1_AWARE
povertyfinance,1reo4da,"""You need to make better choices""","I can't even count how many times I've heard this, whether directed towards me or generalized about the overall population of people in poverty. I'm an example of someone who made the right choices over and over and STILL ended up in poverty, proof that you can do everything right and still end up s",https://www.reddit.com/r/povertyfinance/comments/1reo4da/you_need_to_make_better_choices/,31,16,SoftCookie1,2026-02-25,working poor,LEVEL_2_STRUGGLING
povertyfinance,1rf412p,Best ways to save money fast online?,"I’m trying to reset my money habits in 2026 and update my knowledge around both saving money and making money. The last couple of years went by so fast, and I feel like a lot of the old personal finance advice doesn’t even work the same way anymore with prices, subscriptions, AI tools, side hustles,",https://www.reddit.com/r/povertyfinance/comments/1rf412p/best_ways_to_save_money_fast_online/,220,27,mfdspeech,2026-02-26,side hustle required,LEVEL_2_STRUGGLING
povertyfinance,1rtomjo,How we lifted ourselves out of poverty,"For context I am 25M, from a third world country, youngest in the family of four.

When we separated from our joint family due to my mother and my grandmother not getting along together, life got really tough for us.

While we were together, all of our expenses came out of my grandfather's shop. He ",https://www.reddit.com/r/povertyfinance/comments/1rtomjo/how_we_lifted_ourselves_out_of_poverty/,46,15,ajeeb_gandu,2026-03-14,side hustle required,LEVEL_3_CRISIS
povertyfinance,1ru0byi,Working several side hustle but still struggling. Any advice that actually helped you?,"This year I’ve been doing so many side hustles just trying to survive. I’m working hard to put food on the table, pay bills, and even trying to save a little for a family trip.

But honestly, I’m exhausted. It feels like no matter how hard I work it’s never enough, and I will never have enough money",https://www.reddit.com/r/povertyfinance/comments/1ru0byi/working_several_side_hustle_but_still_struggling/,22,39,Fantastic_Ball7285,2026-03-14,side hustle required,LEVEL_2_STRUGGLING
povertyfinance,1rvdy5r,Feeling stuck in debt and tired,"Sometimes I feel like I'm just treading water financially. It has just been the usual cycle; I go to work, the bills come in, I pay what I can, and the rest just waits for the next month. Credit cards, a 40K loan I’m still struggling to repay,, and a couple late utility bills. And I just can’t seem ",https://www.reddit.com/r/povertyfinance/comments/1rvdy5r/feeling_stuck_in_debt_and_tired/,1,9,DazzlingJob9473,2026-03-16,side hustle required,LEVEL_2_STRUGGLING
povertyfinance,1ra6mv1,Is buying a trailer a reasonable alternative to renting an apartment?,"Here's the situation: I currently work two hours away from where I live with my wife and three kids. For the past four years, I've had a one-bedroom apartment near the town where I work, and I pay around $1000 a month for rent and utilities. Though I only work in the office three days a week and spe",https://www.reddit.com/r/povertyfinance/comments/1ra6mv1/is_buying_a_trailer_a_reasonable_alternative_to/,0,58,PresidentofTigers,2026-02-20,side hustle required,LEVEL_2_STRUGGLING
povertyfinance,1rv3g3a,How do I make some money as a near adult,"This may seem like a weird question - but please read.

(F17) really need money as I am tired of constantly asking my parents for money, and soon they will stop giving me any at all (understandingly).

However, they REFUSE to allow me to get a job due to studies, and opting for me to use my savings ",https://www.reddit.com/r/povertyfinance/comments/1rv3g3a/how_do_i_make_some_money_as_a_near_adult/,0,3,Yellow_Lissy,2026-03-16,side hustle required,LEVEL_2_STRUGGLING
povertyfinance,1rttnlm,Can’t believe where I am now.,"I grew up in a single-mother household of 2 boys. My mom made $7.25/hr our whole life. She carried so much debt to make sure we still enjoyed some activities. I never thought I’d have financial stability.

I’m 27 now and it’s starting to hit me that everything is okay. I just realized I have about $",https://www.reddit.com/r/povertyfinance/comments/1rttnlm/cant_believe_where_i_am_now/,467,25,negligibleoffense,2026-03-14,three jobs,LEVEL_1_AWARE
povertyfinance,1rp0tzf,Finally broke the cycle after 3 years of struggle!!,"Just wanted to share something that happened last week that still doesn't feel real. I've been lurking here for ages and seeing everyone's wins has kept me going through some really dark times.

Three years ago I was sleeping in my car and showering at Planet Fitness because I couldn't afford rent a",https://www.reddit.com/r/povertyfinance/comments/1rp0tzf/finally_broke_the_cycle_after_3_years_of_struggle/,234,22,Legitimate_Suit5959,2026-03-09,three jobs,LEVEL_1_AWARE
povertyfinance,1rydmp8,I have lost all hope,"The biggest lie we’re told is that “anyone can start and build a career if they’re capable.” The issue isn’t capability, it’s that the jobs just aren’t there, or they require experience you can’t get without already having a job.

I'm stuck. I’m working on my feet all day for under 20/hour, destroyi",https://www.reddit.com/r/povertyfinance/comments/1rydmp8/i_have_lost_all_hope/,204,397,No-Computer8994,2026-03-19,three jobs,LEVEL_1_AWARE
povertyfinance,1rj59q9,My Suicide Attempt Ruined My Life &amp; Now I Have Over $5000 in Debt. What Can I Do?,"First off, I'd like to preface this by saying that I understand that I have made a lot of mistakes throughout my scenario and, while I understand it comes from a good place, I do not need to be reminded. I'm looking for any advice that I can get please. I am also generally a very mentally unwell per",https://www.reddit.com/r/povertyfinance/comments/1rj59q9/my_suicide_attempt_ruined_my_life_now_i_have_over/,138,39,drfreemanss,2026-03-02,three jobs,LEVEL_1_AWARE
povertyfinance,1rjy27c,25m hopeless loser. Where can I go from here?,"I regret everything.

I'm still not financially independent. I went to college and finished my computer science bachelor's in May 2023. I had a handful of projects, and I did three internships before my junior year. I was ambitious, I made do with what I had. I never got any assessments or phone scr",https://www.reddit.com/r/povertyfinance/comments/1rjy27c/25m_hopeless_loser_where_can_i_go_from_here/,103,98,ReviewSea1611,2026-03-03,three jobs,LEVEL_2_STRUGGLING
povertyfinance,1rjzujc,I need wisdom teeth removed and braces. I have no dental insurance and I'm broke.,"I'm in deep shit here. I've learned that I need my wisdom teeth removed and braces in order to correct an open bite. I heard this from an orthadontist and an oralfacial surgeon (he's knowledgeble about TMJ, which I've struggled with in the past and suspected was the cause of my symptoms. I saw him f",https://www.reddit.com/r/povertyfinance/comments/1rjzujc/i_need_wisdom_teeth_removed_and_braces_i_have_no/,86,64,insane677,2026-03-03,three jobs,LEVEL_1_AWARE
povertyfinance,1rgo04b,"Goodbye, credit card debt!","Long story short, I (21M) got into nearly $11,000 of credit card debt at 19 years old. I maxed out all three of my credit cards, and my credit score was sitting around 550. I was dealing with a new bipolar disorder diagnosis and left my job to pursue school and my internship full-time when I realize",https://www.reddit.com/r/povertyfinance/comments/1rgo04b/goodbye_credit_card_debt/,53,17,oshacut1e,2026-02-27,three jobs,LEVEL_2_STRUGGLING
povertyfinance,1rxgtln,got my final paycheck withheld for 3 weeks after being let go. heres what actually worked,"so this happened to me back in january and i still think about it a lot because i never thought id actually get my money back.

i was let go from a warehouse job, pretty abrupt, they said it was budget cuts. fine whatever. but then my final paycheck just never came. i waited a week thinking maybe it",https://www.reddit.com/r/povertyfinance/comments/1rxgtln/got_my_final_paycheck_withheld_for_3_weeks_after/,32,10,GlizzyGilbert69,2026-03-18,three jobs,LEVEL_1_AWARE
povertyfinance,1rmo916,Payday Advance Trap - Advice needed,"I am the sole breadwinner for my family.  I work one full time and 2 part time jobs.  About 4 months ago, I had an unexpected financial emergency and borrowed from one the money apps (name your poison, Dave, Brigit, etc.).  So now, 4 months later, I am now paying back the loans on my payday, which s",https://www.reddit.com/r/povertyfinance/comments/1rmo916/payday_advance_trap_advice_needed/,15,36,mrspottertru,2026-03-06,inflation eating paycheck,LEVEL_2_STRUGGLING
povertyfinance,1rvyrhv,getting paid and still feeling broke is messing with my head,"i get my paycheck and for like 2 seconds i feel relief. then rent hits. then bills. then groceries. and suddenly i’m back to checking my balance like… ok so what was the point

it’s not like i’m buying crazy stuff either. it’s basics. plus those random charges that always show up when you’re not rea",https://www.reddit.com/r/povertyfinance/comments/1rvyrhv/getting_paid_and_still_feeling_broke_is_messing/,1,11,Gullible-Tale9114,2026-03-17,inflation eating paycheck,LEVEL_1_AWARE
povertyfinance,1rf1lsd,I saw a recent post where someone was financially devastated by vet bills. I wanted to share some general advice.,"I didn’t give this advice in that thread because they had already spent the money, and she didn’t need people piling on with hindsight advice.

But I did want to share some advice about pet ownership.

I believe pet ownership is something most people deserve, even on a low income. But sometimes that",https://www.reddit.com/r/povertyfinance/comments/1rf1lsd/i_saw_a_recent_post_where_someone_was_financially/,1937,344,Oxjrnine,2026-02-26,no savings,LEVEL_1_AWARE
povertyfinance,1rpvuhv,Student loans absolutely ruined my life,Im 31 years old almost a year out of grad school and have around $300k in student loans most of them private with Sallie Mae. I regret going to college so much and I only took out private loans to go to grad school because my bachelors degree was useless since I was pressured by my parents to go to ,https://www.reddit.com/r/povertyfinance/comments/1rpvuhv/student_loans_absolutely_ruined_my_life/,1111,255,brokeboii94,2026-03-10,no savings,LEVEL_1_AWARE
povertyfinance,1rsoatz,Reminder: grocery &amp; food delivery services are often 20% - 50% more expensive than shopping yourself,"Delivery services prey on those who can least afford them. The linked article focuses specifically on Instacart, who uses algorithmic pricing models to raise prices depending on who you are. One Instacart customer got charged $7.01 for a box of cereal; another Instacart customer at the exact same ti",https://www.reddit.com/r/povertyfinance/comments/1rsoatz/reminder_grocery_food_delivery_services_are_often/,832,104,GigabitISDN,2026-03-13,no savings,LEVEL_1_AWARE
povertyfinance,1rrzhm5,Grocery bills are strangling us,"I feel guilty complaining when we're doing better than some, but our grocery bill (which used to hover between $300 and $400 each month, has been $500 for the past four months no matter what I do. I hate seeing a hundred dollar savings deficit every month, but I don't see any more places to cut.

We",https://www.reddit.com/r/povertyfinance/comments/1rrzhm5/grocery_bills_are_strangling_us/,814,386,Wise_Athlete_7731,2026-03-12,no savings,LEVEL_1_AWARE
povertyfinance,1rnowfr,"Budget tip: Get extra food not directly from pantries, but from their own recipients, when they give it away soon afterwards","Keep your food budgets low by happily accepting the mass amounts of unwanted food given away by the actual pantry recipients!

I've noticed in my area recently, that folks will post on FB Buy Nothing/Free Item sites with massive hauls of food they want picked up ASAP, FCFS. They usually don't show/s",https://www.reddit.com/r/povertyfinance/comments/1rnowfr/budget_tip_get_extra_food_not_directly_from/,649,96,knuds1b,2026-03-07,no savings,LEVEL_1_AWARE
povertyfinance,1rwp1rz,I’m gonna be homeless soon,"I graduated from a top university 2 years ago. I dragged myself through college with very minimal support, it wasn't easy, I was honestly never supposed to make it that far in the first place. Completed internships and developed myself professionally. I've since applied to 600+ jobs. Upskilled endle",https://www.reddit.com/r/povertyfinance/comments/1rwp1rz/im_gonna_be_homeless_soon/,600,100,EntireAd7424,2026-03-17,no savings,LEVEL_1_AWARE
povertyfinance,1rrtg1m,How do I prevent becoming my mom’s only financial support,"Advice please anything helps!!

My mom is 37 and had me as a teen. My dad is a deadbeat. Ever since then she’s developed bipolar disorder and struggles horribly in life.

I’m 18 and a senior in high school and I’m looking for a job but I’m afraid for what that might mean.

My grandparents house all ",https://www.reddit.com/r/povertyfinance/comments/1rrtg1m/how_do_i_prevent_becoming_my_moms_only_financial/,397,150,Primary_Rub6470,2026-03-12,no savings,LEVEL_1_AWARE
LateStageCapitalism,1rpj7dg,"The truth about money, and why you never have enough.","Until quite recently (last week, to be exact), I thought banks were mediators, for lack of a better term. I deposit $1,000, they lend it to someone else, charge higher interest on the loan than what they pay me on the deposit, and the difference is their profit and business model. Cool. Except that ",https://www.reddit.com/r/LateStageCapitalism/comments/1rpj7dg/the_truth_about_money_and_why_you_never_have/,568,15,lowercaseguy99,2026-03-09,paycheck to paycheck,LEVEL_1_AWARE
LateStageCapitalism,1rk7oi2,"No. Things are not ""becoming better"" in Iraq. Stop falling for the same Propaganda for the 40th year in a row","I am seeing a stronger push than ever to reinvent and white wash the history of the US's barbaric invasion of Iraq and its' consequences in effort to justify war with Iran with the execuse of ""Iraq is becoming better"" , so I thought to help you all parce through the lies with these basic facts comin",https://www.reddit.com/r/LateStageCapitalism/comments/1rk7oi2/no_things_are_not_becoming_better_in_iraq_stop/,622,10,FixFederal7887,2026-03-03,wages not keeping up,LEVEL_1_AWARE
LateStageCapitalism,1raecsz,Class consciousness does nothing to address alienation,I just wanted to articulate a problem I don't hear many people talk about. Maybe I'm not looking in the right places but I do keep up to date with most leftist spaces and arguments. The problem I am referring to is the social isolation and alienation that occurs when you are poor. You could have all,https://www.reddit.com/r/LateStageCapitalism/comments/1raecsz/class_consciousness_does_nothing_to_address/,59,19,oldassnastymask,2026-02-20,working poor,LEVEL_1_AWARE
LateStageCapitalism,1rgbsrt,Capitalism takes away your Will of live,"I am going through a depressive condition recently and I believe it has to do with immutable issues of my future (which has to do with immutable issues of society).

See, I say I’m an expert bum, I hate working, I hate the social obligation (even because if I don’t do it, I starve or live in poverty",https://www.reddit.com/r/LateStageCapitalism/comments/1rgbsrt/capitalism_takes_away_your_will_of_live/,20,7,IntrovertBastard,2026-02-27,working poor,LEVEL_1_AWARE
LateStageCapitalism,1rdnxl2,"Ohioans testify before the Ohio Senate Judiciary Committee against SB87, which expands Ohio's ethnic intimidation law, raises felony penalties tied to protests, &amp; codifies the IHRA definition of antisemitism into statute. SB87 is part of broader push to censor criticism of Israel.","# Skip to 26:52 for the beginning of testimonies.

* [Testimonies against SB87 (only a portion participated in-person)](https://ohiosenate.gov/committees/judiciary/legislation/sb87)

**Full text of the bill:**

[**https://search-prod.lis.state.oh.us/api/v2/general\_assembly\_136/legislation/sb87/00\",https://www.reddit.com/r/LateStageCapitalism/comments/1rdnxl2/ohioans_testify_before_the_ohio_senate_judiciary/,9,4,_II_I_I__I__I_I_II_,2026-02-24,working poor,LEVEL_1_AWARE
LateStageCapitalism,1rbk1ay,Rupert lowe is the uk's version of trump,"It is incredible how easily and quickly the masses appear to have been swayed by a video of some rich pon'cè on a farm pretending to be a normal person.

This scumbag was born in a private school and worked at three of the biggest bank institutions in central london atleast one of which cost the tax",https://www.reddit.com/r/LateStageCapitalism/comments/1rbk1ay/rupert_lowe_is_the_uks_version_of_trump/,1,3,Dumgolem,2026-02-22,working poor,LEVEL_1_AWARE
LateStageCapitalism,1rhlx2a,Overtime is a giant scam.,"To keep it simple, OT is not worth it. The premise behind it feels so dystopian to me now. I drank the kool-aid of hustle culture and realized I was trading time for money at the expense of my mental and physical health. Overtime checks should be doubled instead of time and a half and also tax free.",https://www.reddit.com/r/LateStageCapitalism/comments/1rhlx2a/overtime_is_a_giant_scam/,60,9,RagieWagieInACagie,2026-02-28,side hustle required,LEVEL_1_AWARE
LateStageCapitalism,1rlj0at,Everything is an ad. Everyone is an 'influencer.' I’m so tired of the engagement-farming dystopia,"Does anyone else feel like the internet just… died?

Every single interaction, every comment, every post—it’s all being harvested. We aren’t users anymore; we’re just data points in some massive feedback loop designed to keep us staring at a screen until we’re just numb enough to buy something.

I’m",https://www.reddit.com/r/LateStageCapitalism/comments/1rlj0at/everything_is_an_ad_everyone_is_an_influencer_im/,3,1,tarantulapillin,2026-03-05,no savings,LEVEL_1_AWARE
jobs,1r9w9u4,Can a job refuse to honor the terms on my offer letter?,"Just got my first paycheck which said $17/hr. My offer letter said $18/hr and that is what I was told verbally. Talked with payroll. They're refusing to honor the rate as all the ""internal paperwork"" says $17/hr and that's what upper management signed for. Now they're telling me if I want to keep my",https://www.reddit.com/r/jobs/comments/1r9w9u4/can_a_job_refuse_to_honor_the_terms_on_my_offer/,366,64,Catholic_Unraveled,2026-02-20,paycheck to paycheck,LEVEL_1_AWARE
jobs,1rxfxhj,Let go from another job within a year,"I was let go from another company within a year of being let go from a company I was at for 6 years. I'm struggling to find work. I have a lot of Mechanical Engineering experience, but no degree and have done a lot of Manufacturing using XRF equipment. The job hunt is going poorly and I don't know w",https://www.reddit.com/r/jobs/comments/1rxfxhj/let_go_from_another_job_within_a_year/,231,85,CurlyFry1890,2026-03-18,paycheck to paycheck,LEVEL_1_AWARE
jobs,1rrqoo3,I feel like I was lied to..,"I had been searching for work since back in December. I admit, I was desperate to get hired.  My bills were stacking up,  and I was frightened that I was about to lose everything. So, I finally got hired 3 weeks ago. I was referred to by a friend. They claimed this place was a great opportunity. Now",https://www.reddit.com/r/jobs/comments/1rrqoo3/i_feel_like_i_was_lied_to/,79,44,Caesar-Sister1960,2026-03-12,paycheck to paycheck,LEVEL_1_AWARE
jobs,1rs2cd1,I got fired from a contract with no official termination letter or pay.,"In February, I was let go from my contract job after 2 months of work and no pay due to ""Performance reasons"". I wasn't informed I was fired and spent 2 days calling random contacts from the company until I finally reached someone who then called me back later to explain i had been terminated due th",https://www.reddit.com/r/jobs/comments/1rs2cd1/i_got_fired_from_a_contract_with_no_official/,32,19,No_Gene2287,2026-03-12,paycheck to paycheck,LEVEL_1_AWARE
jobs,1rvhsi9,Boss blames me for not getting paid on time.,"I live in PA in the US. I started a job as an hourly worker at a local small company almost two months ago and never got paid. A couple weeks ago, I texted the boss on her number because she's always been good at replying back, but suddenly crickets. I tried again a few days later and she finally go",https://www.reddit.com/r/jobs/comments/1rvhsi9/boss_blames_me_for_not_getting_paid_on_time/,28,50,SoftCookie1,2026-03-16,paycheck to paycheck,LEVEL_1_AWARE
jobs,1rk3b64,Ranking the jobs I've had as a 23-year-old girl just trying to survive burnout and a ridiculous rent spike.,"I feel like I've lived 10 different lives since graduating high school. If you are currently crying in your car before a shift, just know I've been there. Here is the definitive ranking of every job I've taken to keep the lightstray.

1. Chain Coffee Shop Barista (2/10): I had to wake up at 4:00am. ",https://www.reddit.com/r/jobs/comments/1rk3b64/ranking_the_jobs_ive_had_as_a_23yearold_girl_just/,20,9,Serious-Notice-204,2026-03-03,paycheck to paycheck,LEVEL_1_AWARE
jobs,1rr1nhm,Unsure of next move to make - what would you do?,"Hi! 

I received a job offer this week and I am excited about the role and organization, however I do not know if I can or \*should\* accept due to it being a much lower salary than I currently make.

I am currently an Executive Assistant  at a non-profit and the job I have been offered is also for ",https://www.reddit.com/r/jobs/comments/1rr1nhm/unsure_of_next_move_to_make_what_would_you_do/,7,42,Accidentallyclingy,2026-03-11,paycheck to paycheck,LEVEL_1_AWARE
jobs,1rml8u6,Unfair wage confiscation,"So I was recently working for an Auto Glass company in Michigan and I made a mistake and accidentally hit a wall backing out of the garage in a Customer’s work van. Now the damages were not extreme. It was literally a little bit of paint damage with a minor dent. So the guy ends up letting me go, wh",https://www.reddit.com/r/jobs/comments/1rml8u6/unfair_wage_confiscation/,7,15,risengrind74,2026-03-06,paycheck to paycheck,LEVEL_1_AWARE
jobs,1rtnn9t,Beware of this houston MedSpa *illegal withholding*,"# Avoid working a this Houston MedSpa *illegal practices*

I am posting this because this place is constantly hiring and has a high turnover and if you can save yourself the drama please do. I worked at **Bare Necessities in Houston** both locations and my boss is illegally withholding my final payc",https://www.reddit.com/r/jobs/comments/1rtnn9t/beware_of_this_houston_medspa_illegal_withholding/,4,0,Glum-Ad-3624,2026-03-14,paycheck to paycheck,LEVEL_1_AWARE
jobs,1ruwbcf,Wanting to leave my job,"Hi there so ive been wanting to leave my job for a while now work as a shift lead at a fast food place and i am just tired of it.

Its gotten so bad that ive lost 15-20lbs just from stress and i dread going to work its a job i used to enjoy but im getting part time hours now and as a single parent t",https://www.reddit.com/r/jobs/comments/1ruwbcf/wanting_to_leave_my_job/,5,1,Big_Consideration268,2026-03-15,can't afford food,LEVEL_1_AWARE
jobs,1rk42qt,Job for disabled homeless,I'm currently physically and mentally disabled and not able to work a full-time job. I have a master's in biotech and management and really want to work since I'm currently homeless and most places that supposedly help the homeless have made me worse. I know I can work but realistically I can only d,https://www.reddit.com/r/jobs/comments/1rk42qt/job_for_disabled_homeless/,6,8,Competitive_Green_23,2026-03-03,can't afford food,LEVEL_1_AWARE
jobs,1rpm8t0,Disabled but divorcing job advice,"Hi
I don't have the means to move out but currently I am a 47 yr old female with 3 kids 16, 14 and 10. My spouse decided a year ago that she is .. switching teams. Current 19 yrs married. 10 yrs in my ""husband"" came out and then transitioned but we maintained our relationship but created a lot of tr",https://www.reddit.com/r/jobs/comments/1rpm8t0/disabled_but_divorcing_job_advice/,4,3,Impressive-Fall184,2026-03-09,can't afford food,LEVEL_1_AWARE
