subreddit,post_id,title,selftext_snippet,url,score,num_comments,author,created_date,search_term,category
antiwork,1rssdp5,Trump’s shutdown now hurting workers with 'paycheck-to-paycheck' jobs,,https://www.reddit.com/r/antiwork/comments/1rssdp5/trumps_shutdown_now_hurting_workers_with/,2060,38,InsaneSnow45,2026-03-13,paycheck to paycheck,LEVEL_1_AWARE
antiwork,1rxazj6,Luxury retail is collapsing and somehow it’s “our fault”…?,"I work for a well-known luxury clothing brand, and things have been going downhill for the past few months and it’s only getting worse.

Sales are extremely low. Most days, barely any customers even walk into the store. On top of that, the company is clearly struggling, they’re closing stores, cutti",https://www.reddit.com/r/antiwork/comments/1rxazj6/luxury_retail_is_collapsing_and_somehow_its_our/,1111,117,Substantial_Half3731,2026-03-18,paycheck to paycheck,LEVEL_1_AWARE
antiwork,1rcybaw,My boss is at the casino while the shop is $110k in debt.,"I’ve been at this small computer shop for about 1.5 years. Everything went to hell when the manager and head tech quit. Now there are just 3 of us running the entire repairs, customer service, refurbishing.

Paychecks have been late every single time—usually 3-5 days, but once it was 10 days late.

",https://www.reddit.com/r/antiwork/comments/1rcybaw/my_boss_is_at_the_casino_while_the_shop_is_110k/,1087,150,Prestigious-Quit-951,2026-02-23,paycheck to paycheck,LEVEL_1_AWARE
antiwork,1rpwlxx,“The working class has to stop the war”: US workers denounce war with Iran,"&gt;Ten days into the illegal US-Israeli war against Iran, opposition continues to be widespread among workers in the United States. A Quinnipiac poll released Monday found that 53 percent of registered voters oppose the war, and 74 percent opposed sending ground troops into Iran, which Trump is rep",https://www.reddit.com/r/antiwork/comments/1rpwlxx/the_working_class_has_to_stop_the_war_us_workers/,963,23,Spirited_Classic_826,2026-03-10,paycheck to paycheck,LEVEL_1_AWARE
antiwork,1rh81si,UAW tries to contain anger as Stellantis workers denied profit sharing checks,"&gt;Workers at Stellantis reacted with fury to the formal announcement by Stellantis this week that the company would not issue profit sharing checks this year due to reported negative earnings in 2025, the first time this has happened since 2011. After years of concessions and substandard pay raise",https://www.reddit.com/r/antiwork/comments/1rh81si/uaw_tries_to_contain_anger_as_stellantis_workers/,864,57,Spirited_Classic_826,2026-02-28,paycheck to paycheck,LEVEL_2_STRUGGLING
antiwork,1rqipt2,Am I getting laid off tomorrow?,"I started the job 3 months ago in a very high performing role. They took 6 months to fill the role and put me through a gauntlet to get it. They also have never laid anyone off and rarely fire poeple unless you are a complete train wreck.

Its a very cold environment and I've had multiple layoffs in",https://www.reddit.com/r/antiwork/comments/1rqipt2/am_i_getting_laid_off_tomorrow/,265,122,Hot_Lead_7335,2026-03-10,paycheck to paycheck,LEVEL_1_AWARE
antiwork,1rwdfyk,I HATE going to work mon-fri and then being a reservist on the weekends,"I basically have 6 days off a month I feel like I have no private life, no time off, I’m burnt out and I need to keep them both or I’ll be out in the street; I work hourly in healthcare over 40 hours and I STILL struggle with debt, not even because I was able to treat myself to something nice, becau",https://www.reddit.com/r/antiwork/comments/1rwdfyk/i_hate_going_to_work_monfri_and_then_being_a/,115,28,Cute-but-unstable-af,2026-03-17,paycheck to paycheck,LEVEL_1_AWARE
antiwork,1r9941f,Pitiful raise yet again!,"TL:DR - Another year, another perfect review, another basic 3% raise. According to my bootlicker boss, I'm lucky. 

Let's start chronologically: 

My bootlicker of a boss got hired in September and asked me about the biggest problem in our department. He was notified that it was poor pay. We were al",https://www.reddit.com/r/antiwork/comments/1r9941f/pitiful_raise_yet_again/,88,55,TheJOEisAWESOME,2026-02-19,paycheck to paycheck,LEVEL_2_STRUGGLING
antiwork,1rf8knm,"New job, same feelings","Quit my old abusive job back in October and was free for a glorious four months. I felt like an entirely new person and it was wonderful having actual control over my life. Sure, I wasn't bringing in a paycheck, but the freedom was blissful.

Now I landed a job and started this week, and I will full",https://www.reddit.com/r/antiwork/comments/1rf8knm/new_job_same_feelings/,81,7,ProfessorGluttony,2026-02-26,paycheck to paycheck,LEVEL_1_AWARE
antiwork,1rcqwg3,Blurb for a house cleaning job,I can’t work for you if I don’t have insurance??,https://www.reddit.com/r/antiwork/comments/1rcqwg3/blurb_for_a_house_cleaning_job/,69,27,quinzelconner,2026-02-23,paycheck to paycheck,LEVEL_1_AWARE
antiwork,1rsujbu,I am at the point where I tempted to shoplift to be able to provide the basic necessities to my daughter,"obviously I'm not going to, because the last thing I need a criminal record, but I am struggling. I make ""too much"" for SNAP, TANF or low income housing benefits. my daughter's biological father is in jail for assaulting a minor child, so child support is off the table until who knows when. I work a",https://www.reddit.com/r/antiwork/comments/1rsujbu/i_am_at_the_point_where_i_tempted_to_shoplift_to/,635,92,True_One7607,2026-03-13,can't afford food,LEVEL_1_AWARE
antiwork,1rm57mm,"I've been harassed at 3 different jobs. HR, Police report and endless comments.","I've been harassed at my last three jobs. When I was 21 and working retail, my boss, 28M, would use any excuse to get me into the office alone with him. He would make a lot of weird comments and tried to give me gifts, which were against company policy. Tbh, I don't remember the details; my brain bl",https://www.reddit.com/r/antiwork/comments/1rm57mm/ive_been_harassed_at_3_different_jobs_hr_police/,198,55,ssouxxie,2026-03-06,can't afford food,LEVEL_2_STRUGGLING
antiwork,1rqmgxy,How can I do nothing in my life?,"Hi, I'm done, I'm tired to partecipate into this madness: Work 8 hours per day, mistreated, for the rest of your life, for what? A wage that can't even afford/rent you a house and sufficient healthcate? I'm sick of this, fuck it! So I want to ask:

- How to actually possess a house
- How to actually",https://www.reddit.com/r/antiwork/comments/1rqmgxy/how_can_i_do_nothing_in_my_life/,45,45,Everlasting_Noumena,2026-03-11,can't afford food,LEVEL_1_AWARE
antiwork,1rqwxoa,Can anyone help me with being fired?,I was fired from fedex bc I called HR to report my trainer harassing me daily about my non-christian beliefs. (Same dude said his daughter could be raped at 10 and he would FORCE her to have the baby and raise it herself... something tells me he copied that line from the rotting corpse previously ca,https://www.reddit.com/r/antiwork/comments/1rqwxoa/can_anyone_help_me_with_being_fired/,0,17,femboyfucker999,2026-03-11,can't afford food,LEVEL_1_AWARE
antiwork,1rrsvbs,"Some bankruptcy attorneys file cases they know will fail, collect $4,000 from people who are already broke, and move on to the next one. The data is public and nobody checks.","Bankruptcy is supposed to be a safety net. You're drowning in debt, you can't make it work, so you go to an attorney, pay a retainer, and file for protection. The court puts a plan together, your creditors get what they can, and you get a fresh start. That's how it's supposed to work.

Here's how it",https://www.reddit.com/r/antiwork/comments/1rrsvbs/some_bankruptcy_attorneys_file_cases_they_know/,1375,106,ilikemath9999,2026-03-12,wages not keeping up,LEVEL_2_STRUGGLING
antiwork,1rvar6t,"Immigrant workers launch strike at JBS meatpacking plant in Greeley, Colorado","&gt;On Monday, 3,800 workers are set to strike at the JBS beef processing plant in Greeley, Colorado. The walkout would be the largest strike in the US meatpacking industry since the bitter 1985–1986 Hormel strike.

&gt;The strike is another sign of the rising class struggle in the United States. Th",https://www.reddit.com/r/antiwork/comments/1rvar6t/immigrant_workers_launch_strike_at_jbs/,220,2,Spirited_Classic_826,2026-03-16,wages not keeping up,LEVEL_1_AWARE
antiwork,1s0to0g,just quit my job the day before my manager goes on holiday,"i’ve only done 3 shifts at a small minimum wage retail job and honestly it was awful. no uniform yet, hardly any training, manager made me cry on my third shift and wrote me up for messaging her about something very urgent bc it was 20 mins outside her work hours. she printed out my messages, made m",https://www.reddit.com/r/antiwork/comments/1s0to0g/just_quit_my_job_the_day_before_my_manager_goes/,226,61,mostaffectionately,2026-03-22,wages not keeping up,LEVEL_1_AWARE
antiwork,1rqtfn0,"Henry Ford Genesys walkout enters 6th month, as Corewell Health nurses vote on strike action","&gt;The 750 Henry Ford Genesys Hospital nurses and case workers, who have been on strike in Grand Blanc, Michigan for six months, are under intense pressure by management, the Teamsters apparatus and government mediators to end their fight. This is happening as 10,000 Corewell Health nurses across M",https://www.reddit.com/r/antiwork/comments/1rqtfn0/henry_ford_genesys_walkout_enters_6th_month_as/,46,0,Spirited_Classic_826,2026-03-11,wages not keeping up,LEVEL_1_AWARE
antiwork,1rf48l0,Ok not sure if this is the place to post this as it's not job specific but.....,"I keep seeing this ad for a company named (I think) DePop? Basic premise of the ad is a girl tells her friend that she can't hang out this weekend because she's broke. Her friend tells her to try this app/website called DePop(?) so she can sell some stuff, thus giving her the money to hang out with ",https://www.reddit.com/r/antiwork/comments/1rf48l0/ok_not_sure_if_this_is_the_place_to_post_this_as/,42,24,MikeyFX,2026-02-26,wages not keeping up,LEVEL_1_AWARE
antiwork,1rmy0eo,Working and living in the United States sucks (Vent or something idk),"I don't usually make posts, I tend to keep things fairly private but I'm sort of at my wits end and just want to speak my mind, even if no one hears me. 

I was terminated from my most recent job yesterday morning. The reason for it is due to an outburst I had while working where I got physical with",https://www.reddit.com/r/antiwork/comments/1rmy0eo/working_and_living_in_the_united_states_sucks/,29,3,MrProman47,2026-03-06,wages not keeping up,LEVEL_3_CRISIS
antiwork,1rgcufb,I am already exhausted with work at the age of 21. Need some tips to help me or just a space to vent.,As the title says I’m exhausted of working already at the age of 21. I’ve been working since I was 16 years old. At first I believed in “hustle culture” now I despise it. Why do we have to hustle for basic human needs? Who asked for this system? Who agreed to it? The people in power set us up to jus,https://www.reddit.com/r/antiwork/comments/1rgcufb/i_am_already_exhausted_with_work_at_the_age_of_21/,19,13,PrinceBleu,2026-02-27,wages not keeping up,LEVEL_1_AWARE
antiwork,1rvfeqa,My company doesn’t have a company credit card,"This is super weird. And the more I keep thinking about it the weirder it gets…

I do building maintenance for a small chain of veterinary offices. It is family owned. The main owner is a retired 90 year old Vet who lives many states away for most of year, but his daughter and her husband who are wo",https://www.reddit.com/r/antiwork/comments/1rvfeqa/my_company_doesnt_have_a_company_credit_card/,13,56,AgitatedOriginal3374,2026-03-16,wages not keeping up,LEVEL_1_AWARE
antiwork,1rh7kk5,"Sweet, sweet vindication/celebrating a small win at an absolute dumpster fire of an organization","Im a video editor/producer that predominantly works at a studio just outside of Austin. They recently shifted from photo only to social video and, finally, event/podcast video productions—which is when I was brought in to build a team/manage it. Why? Because, to quote what they said when they contac",https://www.reddit.com/r/antiwork/comments/1rh7kk5/sweet_sweet_vindicationcelebrating_a_small_win_at/,11,0,VentsOnVentsOnVenti,2026-02-28,wages not keeping up,LEVEL_1_AWARE
antiwork,1ryht1m,Had a conversation with my grandma about the ultra-rich (+ side rambling I did later on while writing this),"I had a convo with my grandma today about the ultra-rich. I love her very much but I think she is completely misunderstood about this. Overall it was a civil conversation, and our disagreements have never resulted in hard feelings.

**Essentially**: I believe the top 0.00002% (or whatever the exact ",https://www.reddit.com/r/antiwork/comments/1ryht1m/had_a_conversation_with_my_grandma_about_the/,3,12,verbatiism,2026-03-19,wages not keeping up,LEVEL_2_STRUGGLING
antiwork,1rwywnn,Famous people who promoted the 4-hrs workday,"*‘’If the ordinary wage-earner worked four hours a day, there would be enough for everybody, and no unemployment— assuming a certain very moderate amount of sensible organisation. This idea shocks the well-to-do, because they are convinced that the poor would not know how to use so much leisure.’’* ",https://www.reddit.com/r/antiwork/comments/1rwywnn/famous_people_who_promoted_the_4hrs_workday/,3510,94,Shepherd_of_Ideas,2026-03-18,working poor,LEVEL_1_AWARE
antiwork,1rt8jtb,5 years ago I was fired after calling out the CEO and now I found out the workers have successfully unionized!! Feeling vindicated ☺️,"Crumbs and Whiskers Cat Cafe. Check their ig comments for people roasting the CEO for trying to union bust 💯 

I worked at the LA location around 2020-2021. We were all cat lovers that initially accepted the minimum wage pay because of our love and compassion for animals. This is obviously not actua",https://www.reddit.com/r/antiwork/comments/1rt8jtb/5_years_ago_i_was_fired_after_calling_out_the_ceo/,2429,9,amjm907,2026-03-13,working poor,LEVEL_1_AWARE
antiwork,1rapkdm,I'm 50 with nothing and no hope,"Workin 45 hours a week now (they just cut our overtime - we used to work 58 hours a week, and we've been told we will be cut to 40, ultimately), $23/hr, 2 kids, single income. Rent $700/mo, the usual bills. Not making it, some credit card and student loan debt, no savings. Had to stop saving for ret",https://www.reddit.com/r/antiwork/comments/1rapkdm/im_50_with_nothing_and_no_hope/,982,243,pinky_-dinky,2026-02-21,working poor,LEVEL_1_AWARE
antiwork,1rjcwb6,"All of society is built on the idea that there must be poor people doing the work so the rich people can run things and create, and that really upsets me.","On March 4th, 1858 James Hammond gave a speech to the senate on the ""mudsill theory"" in support of slavery. Hammond argued that every stable and refined civilization requires a ""mudsill"" to support the rest of the structure. He claimed that society requires a class of people to perform drudge work a",https://www.reddit.com/r/antiwork/comments/1rjcwb6/all_of_society_is_built_on_the_idea_that_there/,609,39,tandyman234,2026-03-02,working poor,LEVEL_1_AWARE
antiwork,1rcr1cc,Found this attached to my paystub,"The GM nepotized his son (as well as his daughter and her bf)  but apparently he was a massive asshole and everyone hated him. His son was being a massive asshole to one of the other sales managers and the GM overheard and told him to stop. His son apparently actually said ""You want some, old man!?""",https://www.reddit.com/r/antiwork/comments/1rcr1cc/found_this_attached_to_my_paystub/,427,89,Tat25Guy,2026-02-23,working poor,LEVEL_1_AWARE
antiwork,1rl9kf5,Last week I quit a very well-paid job with nothing lined up after only two months...,"I started a new job last December, and I quit last week.

This was a completly new industry for me and the pay was great so I decide to take the job.

The situation became unbearable for me. I had never received so much negative feedback in the first month of a job, and from my perspective, it event",https://www.reddit.com/r/antiwork/comments/1rl9kf5/last_week_i_quit_a_very_wellpaid_job_with_nothing/,358,45,NatSurvivor,2026-03-05,working poor,LEVEL_1_AWARE
antiwork,1rh3f4m,Probably getting a paddlin' for attitude on Monday. Oopsies.,"The incident happened just before noon on Friday.

After already going late to lunch because a shipment arrived right at the start of lunch time and not wanting the poor dude stuck waiting for an hour, I unloaded the truck.

Soon as the truck was unloaded, some guys materialized from around the corn",https://www.reddit.com/r/antiwork/comments/1rh3f4m/probably_getting_a_paddlin_for_attitude_on_monday/,155,13,EnigmaGuy,2026-02-28,working poor,LEVEL_1_AWARE
antiwork,1rvmu92,My Boss is writing me up for not working unpaid so can any job hoppers experienced in bullshittery give some advice?,"

**Update at bottom bc fml I guess.**

So my boss, in her weird aging mean girl style, has decided to write me up for letting documents sit on my desk (they're digital and I emailed them) while I'm off (unpaid days ofc) like the lazy worker I am or whatever. She cannot fathom paperwork that isn't a",https://www.reddit.com/r/antiwork/comments/1rvmu92/my_boss_is_writing_me_up_for_not_working_unpaid/,159,15,Wench-of-2Many-Hats,2026-03-16,working poor,LEVEL_1_AWARE
antiwork,1rpamdl,Constantly shamed by parents and compared to their rich friends' kids,"How do you cope with this? Everyday I'm shamed by my parents for not being like their friends' kids who are millionaire doctors or somehow started millionaire businesses at the age of 20 or some other fantastical success story like that.

I have multiple degrees and 900+ job apps later I get nothing",https://www.reddit.com/r/antiwork/comments/1rpamdl/constantly_shamed_by_parents_and_compared_to/,43,38,ActualThrowaway7856,2026-03-09,working poor,LEVEL_1_AWARE
antiwork,1rf8e9h,"I hate ""hustle culture"" and how society values productiveness above all else.","I don't advocate for doing nothing. I see the need for everyone to do something useful for society, somebody has to produce the food, clothes and what not that is the foundation of society. 

But I hate how work is seen as the end all be all that there is to life, and how you are seen as being more ",https://www.reddit.com/r/antiwork/comments/1rf8e9h/i_hate_hustle_culture_and_how_society_values/,569,42,Ready_Amoeba5401,2026-02-26,side hustle required,LEVEL_2_STRUGGLING
antiwork,1rzs27j,"Passed for promotion because upper management thinks I'm weak, yet they have no problem scheduling me by myself and expecting me to do managerial duties","I work front desk at a hotel.

So basically, my manager went on vacation for a few weeks. He's a decent guy as far as managers go. (Low bar, yeah.) In his absence, the owner came in to do things like payroll and schedule.

Things went to shit within 2 days because what a surprise, the owner has no i",https://www.reddit.com/r/antiwork/comments/1rzs27j/passed_for_promotion_because_upper_management/,508,28,mochamoc,2026-03-21,side hustle required,LEVEL_1_AWARE
antiwork,1ryvr8t,How To Coast Trough Corporate Office Jungle Life Without Getting Drowned In Uncompensated Extra Work And Actually Use Any Free Time For Yourself,"TL;DR: Avoid corporate death trap by acting professionally ""busy"". 

SITREP

Corporate office environment is a jungle with suits. There are monkeys, hyenas, lions, gazelles, snakes, vermins and so on. You can be backstabbed, framed, gaslighted or thrown under a bus at any given moment. If you are no",https://www.reddit.com/r/antiwork/comments/1ryvr8t/how_to_coast_trough_corporate_office_jungle_life/,33,16,RockNRollNBluesNJazz,2026-03-20,side hustle required,LEVEL_1_AWARE
antiwork,1rxaj6u,Return-to-office mandates secret agenda,"I’ve noticed frequent return-to-office discussions in both mainstream media and online chatter since late 2025 and at some point I was like, what the heck is going on?

To give you some context, I’ve been working remotely since the 2020 events. Since then, I’ve become somewhat of a quiet advocate fo",https://www.reddit.com/r/antiwork/comments/1rxaj6u/returntooffice_mandates_secret_agenda/,29,18,volendoesresumes,2026-03-18,side hustle required,LEVEL_2_STRUGGLING
antiwork,1rjtlb8,Making the most of my time,"Hello fellow antiworkians. I started my first corporate job this year and I find myself sitting at a desk with lots of time on my hands. I’m meeting my deadlines, have seemingly good relationships building with coworkers/managers, and am staying involved in a committee. 

Besides reading and scrolli",https://www.reddit.com/r/antiwork/comments/1rjtlb8/making_the_most_of_my_time/,9,8,redhotsummerday,2026-03-03,side hustle required,LEVEL_2_STRUGGLING
antiwork,1rgpi98,"Boss calls me for unpaid help “as a friend”, after laying me off at Christmas… Sorry, but NOPE!","In December, I was laid off from a small family business. I’d been there four years. Mr. Boss hoped to hire me back “when business picks up”. *Maybe*.   

I told him it was cool to reach out to me, but was clear I wouldn’t be waiting around. 

I started a new job this week. It’s going incredibly wel",https://www.reddit.com/r/antiwork/comments/1rgpi98/boss_calls_me_for_unpaid_help_as_a_friend_after/,10399,448,auntiechrist23,2026-02-27,three jobs,LEVEL_1_AWARE
antiwork,1ry1onn,Ford worker Gregory Knopf killed at Sharonville Transmission Plant in Ohio,"&gt;Gregory Knopf, a 64-year-old worker at Ford Motor Company’s Sharonville Transmission Plant in Ohio, was killed on Monday, March 16, after a press machine activated while undergoing routine maintenance and pinned him against equipment. First responders freed Knopf and transported him to Bethesda ",https://www.reddit.com/r/antiwork/comments/1ry1onn/ford_worker_gregory_knopf_killed_at_sharonville/,1851,92,Spirited_Classic_826,2026-03-19,three jobs,LEVEL_1_AWARE
antiwork,1r8m3ys,"Boss made everyone come back to office to ""rebuild culture."" It's been 3 weeks and he works from home every Friday.","I can't make this up.

We were fully remote for 2 years. Everything worked fine. Our team hit every target, clients were happy, turnover was low. Then in January our director sends this long email about how ""in-person collaboration is essential for innovation"" and ""we need to rebuild our team cultur",https://www.reddit.com/r/antiwork/comments/1r8m3ys/boss_made_everyone_come_back_to_office_to_rebuild/,1436,63,techiee_,2026-02-18,three jobs,LEVEL_1_AWARE
antiwork,1rukq83,Im so tired of working for nothing,"I went to college got a degree and i cant land a job over $15/hr which we all know isnt a livable wage, and i do pet sits on the side

People will play dumb and act like this is normal. People cant even get decent health insurance here, kids are being shot at schools, i know a girl working THREE JOB",https://www.reddit.com/r/antiwork/comments/1rukq83/im_so_tired_of_working_for_nothing/,1080,101,pussiepotpie,2026-03-15,three jobs,LEVEL_2_STRUGGLING
antiwork,1ryvpmp,"25,000 Kaiser healthcare workers carry out one-day strike in defense of mental healthcare","&gt;On Wednesday, 2,400 mental health professionals from the National Union of Healthcare Workers (NUHW) carried out a one-day strike. They were joined by 23,000 registered nurses from the California Nurses Association, who participated in a sympathy strike. The NUHW members were also supported by o",https://www.reddit.com/r/antiwork/comments/1ryvpmp/25000_kaiser_healthcare_workers_carry_out_oneday/,388,1,Spirited_Classic_826,2026-03-20,three jobs,LEVEL_1_AWARE
antiwork,1rcibtg,"24F, first corporate job, 5 months in and already dreading work. Is this normal?","I’m 24, female, and I just finished my studies. I’ve been working my first corporate job for about 5 months now.

I’m introverted and a bit shy, but I genuinely try my best to talk to people and be social. When I first started, I was pretty quiet. I was new, trying to learn everything, and just focu",https://www.reddit.com/r/antiwork/comments/1rcibtg/24f_first_corporate_job_5_months_in_and_already/,343,63,Kind_Conference9417,2026-02-23,three jobs,LEVEL_1_AWARE
antiwork,1rzqaxr,My latest pet peeve with management is this fascination with repeatedly asking the same questions,"I swear I have never had this happen to me to the degree it has at my last few jobs over the past three years.

It always goes the same way. The C-suite asks a technical question they don’t understand and have boxed themselves into a corner believing they have the answer to. I answer honestly to pre",https://www.reddit.com/r/antiwork/comments/1rzqaxr/my_latest_pet_peeve_with_management_is_this/,237,36,VentsOnVentsOnVenti,2026-03-21,three jobs,LEVEL_1_AWARE
antiwork,1rslpww,Ex boss refuses to offboard me,"I resigned from a job back in January. Long story short , I came to terms after about three years of therapy that it was a toxic environment that noone was willing to fix. Sooo I came back from a burnout break and gave notice. After about a week everything had been ""cleaned up"" on my end and submitt",https://www.reddit.com/r/antiwork/comments/1rslpww/ex_boss_refuses_to_offboard_me/,221,62,Pandy_45,2026-03-13,three jobs,LEVEL_1_AWARE
antiwork,1rrfq3s,"on unemployment expectedly, but at a very inconvenient time.","Credit card debt piling slowly but interest is catching on. It’s becoming a tug of war between checking and credit card. I put lesser bills on credit card but rent payments through checking.

Though I was looking for a job I had a couple losses in the family and some other crap that kind of put me o",https://www.reddit.com/r/antiwork/comments/1rrfq3s/on_unemployment_expectedly_but_at_a_very/,36,12,xXx_TheSenate_xXx,2026-03-11,inflation eating paycheck,LEVEL_2_STRUGGLING
