subreddit,post_id,title,selftext_snippet,url,score,num_comments,author,created_date,search_term,category
jobs,1rluyqa,I’m going to lose it,"I have applied to at least 200 jobs since 2023.

I understand this market sucks but as a 2022 college graduate I am now 25 and have not been able to get an entry level job into the industry I am trying to break into. I have tried every copywriting/ publishing/ even communications and marketing role ",https://www.reddit.com/r/jobs/comments/1rluyqa/im_going_to_lose_it/,103,70,Daliflowers46,2026-03-05,wages not keeping up,LEVEL_1_AWARE
jobs,1rs4b6b,I feel like getting laid off has made my resume effectively dead.,"I’ve been in the industry I’m in for 8 years now, doing freelance and working for companies. I’ve been doing this since I was in high school. However, it is in the marketing field and while I was getting my degree AI was invented and then improved to the point where a lot of the jobs I was intereste",https://www.reddit.com/r/jobs/comments/1rs4b6b/i_feel_like_getting_laid_off_has_made_my_resume/,35,17,Certain_Spring_1624,2026-03-12,wages not keeping up,LEVEL_1_AWARE
jobs,1rewdkb,Jobs that can at least pay a living wage?,"I’ve hit a huge slump after working as an operator at an OTC manufacturing plant. My last place took some medical issues I was struggling with and used them to fire me right before I was going to be having surgery to take care of them. I live in NC, so basically as long as they word it right in the ",https://www.reddit.com/r/jobs/comments/1rewdkb/jobs_that_can_at_least_pay_a_living_wage/,4,14,bigtiddyhimbo,2026-02-25,wages not keeping up,LEVEL_1_AWARE
jobs,1roeway,Imposter syndrome before I even start my new job,"I'm 25, from the UK, and I've just landed my first corporate job through an internal application. Full-time and salaried when I've only ever worked part-time on min wage. 

To give a bit of background on myself, I've been working part-time in a small, pretty run-down taxi office of a much larger org",https://www.reddit.com/r/jobs/comments/1roeway/imposter_syndrome_before_i_even_start_my_new_job/,2,1,Lifewank,2026-03-08,wages not keeping up,LEVEL_1_AWARE
jobs,1rwphif,hey guys any advice for him? for a friend.,"Okay so I'm looking for advice since I'm feeling 50/50 &amp; have no clue what to do next.

I have a job right now but the commute &amp; pay is overwhelming to say the least.

I live in a small town which doesn't open up a ton of opportunities so finding jobs is super irritating to deal with especia",https://www.reddit.com/r/jobs/comments/1rwphif/hey_guys_any_advice_for_him_for_a_friend/,1,2,Altruistic_Low_363,2026-03-17,wages not keeping up,LEVEL_1_AWARE
jobs,1rsz686,When does career ambitions become flying too close to the sun?,"I'm working an alright job. It is above minimum wage, we get an hour-long lunch break, and there doesn't seem to be any disastrous managerial/coworker issues, and the work is relatively simple and generally not overwhelming, so my brain isn't fried. I also don't have to talk to the general public. I",https://www.reddit.com/r/jobs/comments/1rsz686/when_does_career_ambitions_become_flying_too/,1,1,Blank_Browser,2026-03-13,wages not keeping up,LEVEL_1_AWARE
jobs,1r918q1,"The WEF says 92 million jobs will be displaced by 2030. If you’re over 40 and job searching, you’re probably misdiagnosing your unemployment — and it’s costing you months.","**TL;DR:** WEF projects 92M jobs displaced by 2030. Most 40+ layoffs in 2026 are structural (job eliminated permanently), not frictional (temporary gap). Creative destruction research (2025 Nobel Prize) shows a 10-15 year gap before new employment structures stabilize. Sending resumes to structurall",https://www.reddit.com/r/jobs/comments/1r918q1/the_wef_says_92_million_jobs_will_be_displaced_by/,0,10,Lucky7088,2026-02-19,wages not keeping up,LEVEL_1_AWARE
jobs,1rjpokk,"I have one of those ""Do nothing jobs"" and I've been talked to about not doing anything.","I'm basically a backup backup helper in account management. It's hourly, in office, so I'm getting paid (poorly) for the time I spend with my ass in a chair instead of my actual skills or output. I have been assigned a few reports that I can get through quickly due to some automations I've set up, a",https://www.reddit.com/r/jobs/comments/1rjpokk/i_have_one_of_those_do_nothing_jobs_and_ive_been/,2003,185,Grizzly_Berry,2026-03-03,working poor,LEVEL_1_AWARE
jobs,1rodjp0,"parent of teens, please do not fill out job apps for your child","especially not at the store in front of the other employees. 

listen, i know you want your kid to get a job and you feel like you need to hold their hand, but you’re not helping them by filling out the forms for them. when a parent comes in with their kid to ask about a job, i always hand the appli",https://www.reddit.com/r/jobs/comments/1rodjp0/parent_of_teens_please_do_not_fill_out_job_apps/,581,140,aleam_,2026-03-08,working poor,LEVEL_1_AWARE
jobs,1rn9wyu,LAYOFFS at my job,"The company i work for had an emergency required meeting yesterday. They announced due to decrease in profits, they had to layoff 20% of the entire staff and people remaining in upper management roles would get a 10% pay REDUCTION and all other salaried employees would get a 5% pay reduction. I can'",https://www.reddit.com/r/jobs/comments/1rn9wyu/layoffs_at_my_job/,104,37,Zestyclose-Lie-681,2026-03-07,working poor,LEVEL_1_AWARE
jobs,1rqxlle,Diabolical References,"One of my close friends was let go from his job for not getting along with one of the managers. During his exit interview they comforted him saying it will work out somewhere else and to use them as a reference if needed.

Poor guy ended up trusting them and interviewed at 3 other stores using them ",https://www.reddit.com/r/jobs/comments/1rqxlle/diabolical_references/,67,38,LocksmithLeft3778,2026-03-11,working poor,LEVEL_1_AWARE
jobs,1rwzely,Boss goes on a 5 week business trip and vacation after mid level colleague “quit”. I’ve had enough and want to quit.,"For context I started working for this company six months ago. This is my first full time job since graduation.

A mid level colleague was hired two weeks after me and had manager duties. Despite him having experience longer than I have lived he was complete shit in the job and was completely unreli",https://www.reddit.com/r/jobs/comments/1rwzely/boss_goes_on_a_5_week_business_trip_and_vacation/,14,21,jemappellelara,2026-03-18,working poor,LEVEL_1_AWARE
jobs,1rskf2e,"I don't have any merit as to getting employed, and it's my fault.","I had a detrimental relationship with my parents for almost all of my childhood and adolescence, and I was kicked out at age 20 from my mother's place. I wasn't prepared at the time, too immature, too traumatised, too naive, and too insecure to represent myself in society, living and making money on",https://www.reddit.com/r/jobs/comments/1rskf2e/i_dont_have_any_merit_as_to_getting_employed_and/,5,5,GenevieveCostello,2026-03-13,working poor,LEVEL_1_AWARE
jobs,1rp04oz,"Nine Interviews, 30 Minutes Each, Five Days","Note: I am currently employed but need a new position for a variety of reasons. Been seeking since January. I am incredibly fortunate to have been talked to numerous times but the most recent has me a little irritated. 

Found a position I'm excited for, the range is where it needs to be from a sala",https://www.reddit.com/r/jobs/comments/1rp04oz/nine_interviews_30_minutes_each_five_days/,5,2,alexbgoode84,2026-03-09,working poor,LEVEL_1_AWARE
jobs,1rbrdgd,Awesome Interviews - then they reposted the job listing,"Recently I started looking for new roles and development that I believe my current organization lacks.

To my luck and surprise, I have gotten reasonable responses and not in an unreasonable time frame. Really helping my self-esteem and validation of my efforts and hard work. 

Have had two intervie",https://www.reddit.com/r/jobs/comments/1rbrdgd/awesome_interviews_then_they_reposted_the_job/,6,6,alexbgoode84,2026-02-22,working poor,LEVEL_1_AWARE
jobs,1rgphkn,"Everyone talks about a ""skills gap"" in hiring. I think it's actually a filtering gap. Here's what I mean.","Every time there's a conversation about why hiring is hard right now, someone brings up the ""skills gap."" Companies can't find qualified people. Workers don't have the right training. We need more bootcamps, more certifications, more credentials.

I've been on both sides of hiring for over a decade ",https://www.reddit.com/r/jobs/comments/1rgphkn/everyone_talks_about_a_skills_gap_in_hiring_i/,97,41,Upbeat_Dream7600,2026-02-27,side hustle required,LEVEL_1_AWARE
jobs,1rljmsu,Would you rather? (Advice edition),"Hi Frens, need advice on this decision. Would love to hear thoughts for thoes in sales (25 y/o)…

Was laid off 6 months ago from massive Saas company. Been a real struggle to find a job. Finally getting closer…

SDR role 55base + 10k commish remote role where there is minimal growth and slow sales c",https://www.reddit.com/r/jobs/comments/1rljmsu/would_you_rather_advice_edition/,14,3,Homiemoker,2026-03-05,side hustle required,LEVEL_2_STRUGGLING
jobs,1rjys35,Internships only available for students. Need experience for entry level jobs.,"I’ve been jobhunting as a recent graduate. Many of the jobs available are asking for multiple years of experience, which I don’t have, not to mention all the opportunities I am looking for come in the form of internships (side note: the jobs available are also more corporate job.) Unfortunately, man",https://www.reddit.com/r/jobs/comments/1rjys35/internships_only_available_for_students_need/,5,1,Maleficent_Falcon784,2026-03-03,side hustle required,LEVEL_1_AWARE
jobs,1rvlyvv,Thought I nailed interview process and wasn’t even given the courtesy of a non-automated email. Done with job searching now,"I was able to secure an interview through a connection 2 weeks ago as being a 22 year old with only 1 professional job prior is brutal in this market so that really helped. But anyway I had my first interview with the recruiter, heard back in an hour they wanted to move me on. 2 days later met with ",https://www.reddit.com/r/jobs/comments/1rvlyvv/thought_i_nailed_interview_process_and_wasnt_even/,3,3,Parking-Selection-27,2026-03-16,side hustle required,LEVEL_1_AWARE
jobs,1rydc3p,Side Hustle Experience,"**Side Hustle Experience**

I know everyone has different experiences, so please don’t think that I am in any way speaking for anyone else other than myself. I just thought I’d share my experiences with these hustles to prepare and warn people before they dive into them themselves.

Hope this is hel",https://www.reddit.com/r/jobs/comments/1rydc3p/side_hustle_experience/,3,3,Financial-Jump-6408,2026-03-19,side hustle required,LEVEL_2_STRUGGLING
jobs,1rqu067,Taking a pay cut to avoid a layoff that may or may not happen,"I'm looking for another job because my company has conducted two major rounds of layoffs in two years (I was spared each time). I'm now the only person left in my function.

I was looking at jobs at my current salary or slightly higher. Jobs in my field are very hard to come by and the ones that are",https://www.reddit.com/r/jobs/comments/1rqu067/taking_a_pay_cut_to_avoid_a_layoff_that_may_or/,3,7,grumpyITAdmin,2026-03-11,side hustle required,LEVEL_1_AWARE
jobs,1rqyz99,Whats a good job to have when getting a MechE degree,"Hey it's me again, sorta been thinking and weighing my options for my future again
But mostly thinking about which path should I go for.

On one hand I want a good paying job on the other I want a job that won't require me doing mega math and having me rely on a note book I'll have to take to work w",https://www.reddit.com/r/jobs/comments/1rqyz99/whats_a_good_job_to_have_when_getting_a_meche/,2,13,qwpdmb,2026-03-11,side hustle required,LEVEL_1_AWARE
jobs,1rstouc,Don’t know what to do,Sold my business at a loss I’m in Los Angeles ca 20 years old no high school degree. I do have a side hustle that’s giving me $800 a month but honestly I don’t even know what to do any tips? I feel like a failure lol,https://www.reddit.com/r/jobs/comments/1rstouc/dont_know_what_to_do/,2,2,Complex-Ingenuity337,2026-03-13,side hustle required,LEVEL_2_STRUGGLING
jobs,1rbjbg0,Should I leave my job after only a few months?,"I started working a new job 3 months ago after being laid off last year. I was unemployed for while but took the job even though it was in a different city and paid less than my old job. The plan was to work until I found something better 

The week before I started the job, I felt immense guilt abo",https://www.reddit.com/r/jobs/comments/1rbjbg0/should_i_leave_my_job_after_only_a_few_months/,2,8,Pieces-in-Time,2026-02-22,side hustle required,LEVEL_1_AWARE
jobs,1ruwvzn,How to deal with my micromanaging supervisor,"for context:  I'm six months in and I am in an office environment.  This is my first professional job so I am required to be trained by the direct supervisor.

  
At first it was ok, but two months i've been having problems.  I still need to cc her on every email, and I have to ask before I send an ",https://www.reddit.com/r/jobs/comments/1ruwvzn/how_to_deal_with_my_micromanaging_supervisor/,1,14,noondog15,2026-03-15,side hustle required,LEVEL_1_AWARE
jobs,1rd3cz2,for 3 days I knew I was being fired because my boss is an idiot on Teams,I worked for a tech company that had an intense round of layoffs every three months from the time I started in 2022 until a new CEO took over last year. Ever few months it was like the most intense game of capitalist squid games and I managed to keep my job everytime amid panic attacks and unceremon,https://www.reddit.com/r/jobs/comments/1rd3cz2/for_3_days_i_knew_i_was_being_fired_because_my/,2131,184,HauntofhighAFtower,2026-02-23,three jobs,LEVEL_1_AWARE
jobs,1rmlobq,I feel terrible. My boss found out I was interviewing elsewhere.,"I messed up big time this week. I’ve been working the same position for two years because my school schedule wouldn’t allow the time for a promotion job. Recently, the stress has been eating away at me. I got a $3 raise last year though. My bosses love(d) me because I’m genuinely a hard worker. I’ve",https://www.reddit.com/r/jobs/comments/1rmlobq/i_feel_terrible_my_boss_found_out_i_was/,487,364,caroline_xplr,2026-03-06,three jobs,LEVEL_1_AWARE
jobs,1rbtmxi,"""We're looking for someone who can hit the ground running"" is corporate speak for ""we refuse to train anyone and will be annoyed when you have questions""","Had three interviews this month where the hiring manager used this exact phrase. One role had been vacant for 8 months. Another had a 60% turnover rate (found out later on Glassdoor)  
If your role is so specialized that no human can learn it without already knowing it - maybe the problem isn't the ",https://www.reddit.com/r/jobs/comments/1rbtmxi/were_looking_for_someone_who_can_hit_the_ground/,205,6,greatdane511,2026-02-22,three jobs,LEVEL_1_AWARE
jobs,1rms7n8,After three months I finally landed job offer and today it was rescinded.,"This last three months have been a rollercoaster of emotions and I finally had a job offer come in from a big employer in the state last week, did everything on my end and got a call this morning saying it has been withdrawn. I’m still processing and I guess this is more to vent and get through than",https://www.reddit.com/r/jobs/comments/1rms7n8/after_three_months_i_finally_landed_job_offer_and/,195,35,Scharmberg,2026-03-06,three jobs,LEVEL_1_AWARE
jobs,1rs9zek,My upcoming resignation is going to cause a problem… and I’m not sure how to feel about it,"My boss recently assigned me to an upcoming enterprise project as a (SME). The goal is to take a process that currently exists only within my department and scale it across the entire company. It’s a major initiative that will likely run well into 2027.



The complication: I’m planning to submit my",https://www.reddit.com/r/jobs/comments/1rs9zek/my_upcoming_resignation_is_going_to_cause_a/,152,160,Redguard13,2026-03-12,three jobs,LEVEL_1_AWARE
jobs,1rfjxkt,Why do all jobs seem to be ran my greedy or incompetent people?,"Like what is happening? I used to be a school teacher, and the crap they literally have us doing is complete nonsense. “Make class hard, not everyone should have an A in your class.” Then Timmy’s mom complains that Timmy has a B, “just give him an A.” Like ??????? What.

Worked at retail and restaur",https://www.reddit.com/r/jobs/comments/1rfjxkt/why_do_all_jobs_seem_to_be_ran_my_greedy_or/,134,41,Sylviaxciarre,2026-02-26,three jobs,LEVEL_1_AWARE
jobs,1rqx5wp,Applying to jobs is basically a second full-time job and nobody talks about it,"I didn't realise how exhausting job hunting was until I actually started doing it.

People say ""just apply to more jobs"" like it takes 20 minutes. But first you have to find roles that actually fit — which means digging through LinkedIn, Indeed, Naukri, company career pages, half of which are outdat",https://www.reddit.com/r/jobs/comments/1rqx5wp/applying_to_jobs_is_basically_a_second_fulltime/,98,27,FlimsyDevelopment444,2026-03-11,three jobs,LEVEL_1_AWARE
jobs,1rlos6z,"After a month and a half unemployed, I found a new job","Quick back story: I was poached from a previous job by my most recent employer for more money. I jumped ship and it became obvious immediately I had fucked up. It was a culture of fear, disrespect, and denigration from the chief engineer. I defended myself from these attacks and as a result I believ",https://www.reddit.com/r/jobs/comments/1rlos6z/after_a_month_and_a_half_unemployed_i_found_a_new/,46,2,LonelyMountain_,2026-03-05,three jobs,LEVEL_1_AWARE
jobs,1rzawwx,"Joblessness is one of the worst things that can happen to someone, please plan your life","I was jobless for the first time last year and it was mind breaking. After 6 months of search, i started at this new company. It was a very small company with just 3 devs, but i just needed a floor to stop my fall. 

At work, the person  i was working with, kept lying about me to the heads of the co",https://www.reddit.com/r/jobs/comments/1rzawwx/joblessness_is_one_of_the_worst_things_that_can/,1342,113,PuzzleheadedTune1366,2026-03-20,no savings,LEVEL_1_AWARE
jobs,1rdomj8,7 interviews in 2 weeks. Here's what DID and DID NOT work for me.,"I've been in a weird stage of life where I'm sort of job hopping and sort of trying to go out on my on and start my own stuff. This basically has just turned into me being forced to job hop, land short term contracts, and freelance (even if I pay contractors below me).

While that's not really the p",https://www.reddit.com/r/jobs/comments/1rdomj8/7_interviews_in_2_weeks_heres_what_did_and_did/,890,25,Postmortal_Pop,2026-02-24,no savings,LEVEL_1_AWARE
jobs,1rok1xp,My company has gotten so bad people are quitting without another job lined up.,"…in this job market. I know 2 people in the last month who have left $120,000 + on the table and quit without having another job. 

Return to office 4 days a week was implemented last Fall and we thought that would be the worst of it. Everything has gotten so toxic and there’s 0 work/life balance. I",https://www.reddit.com/r/jobs/comments/1rok1xp/my_company_has_gotten_so_bad_people_are_quitting/,540,58,Ge0903,2026-03-08,no savings,LEVEL_1_AWARE
jobs,1r9y383,I’m in a cycle where I change jobs every 6 months and I don’t know what to do,"What the title says, my resume currently shows I worked at a tech company for 2 years, then did a contract project for a company for 3 months, then worked somewhere for 6 months, and now I want to leave my current job after only nearly 6 months. I’m aware my resume isn’t that attractive as I’ve only",https://www.reddit.com/r/jobs/comments/1r9y383/im_in_a_cycle_where_i_change_jobs_every_6_months/,104,13,lilaclover36,2026-02-20,no savings,LEVEL_1_AWARE
jobs,1rjmtdo,Should I stay or should I go?,"Been with this company for almost 5 years. Used to be happy. Now I’m not. 

I’m no longer motivated. Each night I dread going to work the next day. 

It’s affected my attitude at work a bit. I used to be proactive. Now I do the bare minimum. 

Boss noticed that and started nit picking on every small",https://www.reddit.com/r/jobs/comments/1rjmtdo/should_i_stay_or_should_i_go/,92,29,idktbhfamlmao,2026-03-03,no savings,LEVEL_1_AWARE
jobs,1rgq2iw,LinkedIn Sucks,Can LinkedIn get their shit together? I clicked on the jobs list it said I’d be a top applicant for and I get a list of this nonsense.  How it it so easy to post bullshit on LinkedIn? Why pay for premium if this is the bullshit you’re going to get?,https://www.reddit.com/r/jobs/comments/1rgq2iw/linkedin_sucks/,78,21,Twindaddy2019,2026-02-27,no savings,LEVEL_1_AWARE
jobs,1rqsf2d,I don't know what to do at this point...,"
*I want to add that my wife literally left to stay with her parents over this situation. While I fully recognize that I had a great opportunity, taking it would have meant moving to another state, away from my wife, who is carrying my one and only unborn son.

Moving to Georgia was never part of ou",https://www.reddit.com/r/jobs/comments/1rqsf2d/i_dont_know_what_to_do_at_this_point/,54,92,ChampionshipFlimsy,2026-03-11,no savings,LEVEL_1_AWARE
jobs,1rqyx0v,Is my company about to replace me?,"I started this job about 4 months ago after being unemployed for almost a year.

The hiring process was intense, multiple interviews, a take-home test, and a final panel interview. They told me they were looking for someone long-term and that the role had been open for months.

So far, I think I’ve ",https://www.reddit.com/r/jobs/comments/1rqyx0v/is_my_company_about_to_replace_me/,44,45,ell-chan,2026-03-11,no savings,LEVEL_1_AWARE
Economy,1rwaywp,Zero Federal Tax if you earn under $46k? Thoughts on the 2026 Tax Bill?,"Saw the new Working Americans Tax Cut Act"" proposal and wanted to get your take.
The basics:
Under $46,000 income? $0 Federal Income Tax.
Married? Limit is $92,000.
How? Funded by a 5% surtax on millionaires.
It’s meant to cover the cost of living so people aren't taxed on survival money. Obviously,",https://www.reddit.com/r/economy/comments/1rwaywp/zero_federal_tax_if_you_earn_under_46k_thoughts/,53,77,Lumpy_Attempt_6280,2026-03-17,paycheck to paycheck,LEVEL_1_AWARE
Economy,1rl03hn,Jobs report preview,"The NFP Report will be out this coming Friday morning.  This is the labor report that estimates the number of jobs gained and the unemployment rate.  Our concern is the number of jobs, which we get an inkling of by watching Payroll Tax Receipts as reported by the U.S. Treasury in their “bank account",https://www.reddit.com/r/economy/comments/1rl03hn/jobs_report_preview/,1,0,Advanced_Wall_3373,2026-03-04,paycheck to paycheck,LEVEL_1_AWARE
Economy,1rtgtf8,"Will Starbucks Baristas nationwide quit en masse, and head to NYC?","https://preview.redd.it/7e8j61n9vzog1.jpg?width=1500&amp;format=pjpg&amp;auto=webp&amp;s=7d787dcb97c0b4ec92e8f923b6ca4560a4f93b93

***Photo above*** *– Hollywood’s take on what working at a NYC coffee shop is like.*  
  
Pop quiz – what’s the starting wage for a Starbucks barista? $15. It that highe",https://www.reddit.com/r/economy/comments/1rtgtf8/will_starbucks_baristas_nationwide_quit_en_masse/,0,7,baltimore-aureole,2026-03-14,paycheck to paycheck,LEVEL_1_AWARE
Economy,1rzoyzp,Massachusetts sees $4.2 billion lost as residents flee tax increases. NY governor Hochul calls her states migrating residents “un-patriotic.”,"https://preview.redd.it/mb0ry4reudqg1.jpg?width=1200&amp;format=pjpg&amp;auto=webp&amp;s=2b1139a2c4f916a152202e69bba5b30d2fab39d3

***Photo above*** *– Governor Hochul says NY residents have a patriotic duty to remain and pay a 14% income tax rate. She says plan B could be to ""go down to Palm Beach ",https://www.reddit.com/r/economy/comments/1rzoyzp/massachusetts_sees_42_billion_lost_as_residents/,0,9,baltimore-aureole,2026-03-21,paycheck to paycheck,LEVEL_1_AWARE
Economy,1rgfvtl,Someone please prove me wrong about my AI doomsday scenario: The AI Tragedy of the Commons,"For the last two years, my biggest worry about AI wasn't AGI or some science fiction dystopia, but simply that massive layoffs of white collar workers are not just a loss of workers, but, more importantly, a loss of consumers. The entire global economy, and particularly in America, is a consumerist ",https://www.reddit.com/r/economy/comments/1rgfvtl/someone_please_prove_me_wrong_about_my_ai/,22,29,TwelfieSpecial,2026-02-27,can't afford food,LEVEL_2_STRUGGLING
Economy,1ryv7zz,Wall Street sounds alarm that Trump may be leading US to economic catastrophe: report,"

No matter how you look at it, the country is coming apart at the seams. The job market is cratering , inflation creeping up inexorably, wage growth nearing record lows, mortgage rates putting home ownership out of reach, the price of food taking gigantic daily leaps --not to mention healthcare bei",https://www.reddit.com/r/economy/comments/1ryv7zz/wall_street_sounds_alarm_that_trump_may_be/,969,129,PrincipleTemporary65,2026-03-20,wages not keeping up,LEVEL_1_AWARE
Economy,1rm5ulw,I spent months trying to find the economic circuit breaker for AI disruption. I don't think one exists,"I want to be wrong about this. I'm an independent researcher from New Orleans with no institutional affiliation and no funding, and I got completely consumed by a question I couldn't shake: if AI capability is genuinely compounding the way the data suggests, what does that do to the economy mechanic",https://www.reddit.com/r/economy/comments/1rm5ulw/i_spent_months_trying_to_find_the_economic/,12,14,Dismal_Fee,2026-03-06,wages not keeping up,LEVEL_1_AWARE
