subreddit,post_id,title,selftext_snippet,url,score,num_comments,author,created_date,search_term,category
antiwork,1rxs4dj,"Apparently some customer(s) found my jacket offensive, so I'm no longer allowed to wear it.","Sorry, this is just too ridiculous for me NOT to share.

I work a temporary job in retail, and I have a lot of Chinese customers approaching me to ask for stuff. Normal, right? They tend to ask me stuff in Mandarin. Also understandable.

Problem is that I failed my Chinese and can barely understand ",https://www.reddit.com/r/antiwork/comments/1rxs4dj/apparently_some_customers_found_my_jacket/,1695,211,emmodii,2026-03-19,no savings,LEVEL_1_AWARE
antiwork,1rdqp4g,Having to fake interest at work is killing me,"I'm one of those fellas that gets to work, does what needs to be done, and at 6PM I'm off the computer. I don't care about work, I don't talk about work unless prompted, and of course I'm 100% in favour of reducing work hours to 5-6 hours per day MAX.

But lately work became this being that not only",https://www.reddit.com/r/antiwork/comments/1rdqp4g/having_to_fake_interest_at_work_is_killing_me/,897,67,dk1988,2026-02-24,no savings,LEVEL_1_AWARE
antiwork,1ra7uvn,My boss was unjustly terminated and I WANT TO SCREAM,"Just venting to the ether, my boss who has been at our company for over 50 years was just terminated without a separation package. This is a man who everyone loved and he treated everyone fair. He was the person who also found me and offered me my job which has changed mine and my families lives for",https://www.reddit.com/r/antiwork/comments/1ra7uvn/my_boss_was_unjustly_terminated_and_i_want_to/,737,98,VSauce3000,2026-02-20,no savings,LEVEL_1_AWARE
antiwork,1r9yluw,Your company didn’t lay you off because of a “downturn.” They permanently eliminated your position and called it a restructuring. Here’s what the data actually shows.,"I keep seeing people on here saying they were laid off and their company is “still hiring” or “just restructured.” People are confused because the economy isn’t in a recession in the traditional sense but the jobs are gone.

So here’s what’s actually happening.

The WEF’s Future of Jobs Report 2025 ",https://www.reddit.com/r/antiwork/comments/1r9yluw/your_company_didnt_lay_you_off_because_of_a/,387,32,Lucky7088,2026-02-20,no savings,LEVEL_1_AWARE
WorkReform,1rtjx4f,"Billionaires have convinced Americans they have the ""Best Healthcare in the World"".",,https://www.reddit.com/r/WorkReform/comments/1rtjx4f/billionaires_have_convinced_americans_they_have/,9804,131,zzill6,2026-03-14,paycheck to paycheck,LEVEL_1_AWARE
WorkReform,1rtrivi,It sure is messed up,"This is what the society has come to that an elderly person has to do this job to make ends meet. I mean given the economic state and corporate greed, it is even difficult for the most qualified people to find jobs and everyone is just either grinding their ass at work for that paycheck or just look",https://www.reddit.com/r/WorkReform/comments/1rtrivi/it_sure_is_messed_up/,3007,169,IndividualDoughnut96,2026-03-14,paycheck to paycheck,LEVEL_1_AWARE
WorkReform,1rdu09c,What’s the worst case of company corruption you’ve ever witnessed?,"I work in avionics for 4 years. Always stayed late always glowing reviews. I was responsible for the workload of 4 people and not only always finished on time but was the one responsible for acquiring 4 million in contract renegotiations/acquisitions with our Canadian clients.

I was laid off two we",https://www.reddit.com/r/WorkReform/comments/1rdu09c/whats_the_worst_case_of_company_corruption_youve/,128,16,robo_monkey0715,2026-02-24,paycheck to paycheck,LEVEL_1_AWARE
WorkReform,1rsce1g,A brief reminder,"You have the right to live your life without constantly providing value to a shareholder. You are more than your productivity. You are a human being who deserves to live without anxiety about the next paycheck, doctor bill, meal, layoff, or inconvenience that could send you to an early grave. We don",https://www.reddit.com/r/WorkReform/comments/1rsce1g/a_brief_reminder/,62,3,Socialecontheory,2026-03-12,paycheck to paycheck,LEVEL_1_AWARE
WorkReform,1rw9pxg,My job is overreaching,"So the change box at my job was short $80 and no one knows how . 

My boss now wants to deduct $20 from everyone’s paycheck to compensate. 

I feel like this is extremely unfair and not my responsibility and I don’t wanna speak out cause my boss is genuinely a bitch. 

She believes we are all her sl",https://www.reddit.com/r/WorkReform/comments/1rw9pxg/my_job_is_overreaching/,40,6,One_Recipe6680,2026-03-17,paycheck to paycheck,LEVEL_1_AWARE
WorkReform,1rwxke3,Las Vegas hospice work environment for elderly is horrible,"I worked in hospice for the elderly, the way the CNAs and owners of the homes treat people sickens me. Half these people live in roach/mice infested dirty homes filled with clutter, reeks of diapers unchanged, pissed of CNAs not paid enough, and I’ve had cases where clients admitted they were afraid",https://www.reddit.com/r/WorkReform/comments/1rwxke3/las_vegas_hospice_work_environment_for_elderly_is/,26,7,Sea_Report_7566,2026-03-18,wages not keeping up,LEVEL_1_AWARE
WorkReform,1rfbwu1,50 years of trickle down...,,https://www.reddit.com/r/WorkReform/comments/1rfbwu1/50_years_of_trickle_down/,6890,58,zzill6,2026-02-26,working poor,LEVEL_1_AWARE
WorkReform,1rcna5y,PSA: 5 mistakes that will get your ADA accommodation request denied (and how to avoid them),"With so many companies forcing RTO right now, it's extremely important to know your rights under the ADA and how you can use them to your advantage against the elite. I work adjacent to this space and wanted to share the most common mistakes I'm seeing:

1. Framing it as a preference instead of a di",https://www.reddit.com/r/WorkReform/comments/1rcna5y/psa_5_mistakes_that_will_get_your_ada/,141,5,Kellifetching,2026-02-23,working poor,LEVEL_1_AWARE
WorkReform,1re1ysw,Microsoft's 3-day RTO went live yesterday for 52K employees,"Yesterday, Microsoft forced 52,000 Washington workers back to the office three days a week. It begs the question, how can we fight back?

They're counting on you not knowing how.

If you have a disability like anxiety, depression, PTSD, chronic pain, or anything that limits your ability to work norm",https://www.reddit.com/r/WorkReform/comments/1re1ysw/microsofts_3day_rto_went_live_yesterday_for_52k/,811,97,Kellifetching,2026-02-24,three jobs,LEVEL_1_AWARE
WorkReform,1rz8k0z,"Recruiter asked my salary, then offered $6 less and expected me to thank him","A recruiter rang me whilst I was in the shop; I could hear the anger in his voice. He asked if I was open to considering new opportunities and began to pitch a job vacancy.  
I asked about three main things: the location, the type of contract and the salary. He avoided giving a specific figure and s",https://www.reddit.com/r/WorkReform/comments/1rz8k0z/recruiter_asked_my_salary_then_offered_6_less_and/,442,34,Due-Library7374,2026-03-20,three jobs,LEVEL_1_AWARE
WorkReform,1rqnipj,"Can we talk about how ""communication skills"" in job postings actually means ""do your manager's job for them""","Every single job listing says ""strong communication skills required"" like its some baseline checkbox. But what they actually mean is wildly different from place to place and nobody ever defines it.

At my last job ""communication skills"" meant proactively updating your manager because he refused to c",https://www.reddit.com/r/WorkReform/comments/1rqnipj/can_we_talk_about_how_communication_skills_in_job/,194,14,Jackrain04,2026-03-11,three jobs,LEVEL_1_AWARE
WorkReform,1rxcf5w,Boss Said All He Needed To,"I work as a warranty admin at a car dealership, just started last August. Pretty much making sure the company gets paid for all the warranty work we do. I had a co-worker that just ghosted us and quit. Supposedly they found a better opportunity, but sounds more like they were fed up here. I’ve been ",https://www.reddit.com/r/WorkReform/comments/1rxcf5w/boss_said_all_he_needed_to/,60,48,tryingto-blendin,2026-03-18,three jobs,LEVEL_1_AWARE
WorkReform,1rheqs2,Working 30+ hours a week for free and not being trained — am I being exploited?,"I've been doing an unpaid internship for three weeks now, six days a week, at least five hours a day. I'm not officially registered, and I haven't received a cent.

There's another intern, also unpaid. What's the difference? She's actually being trained—she learns sauces, techniques, ingredients, an",https://www.reddit.com/r/WorkReform/comments/1rheqs2/working_30_hours_a_week_for_free_and_not_being/,48,15,Ceating-new-me,2026-02-28,three jobs,LEVEL_1_AWARE
WorkReform,1rgq44c,UK Green Party is starting to take out the trash. “We defeated the parties of billionaire donors.”,"I didn’t grow up wanting to be a politician. I’m a plumber. And two weeks ago, during all this, I also qualified as a plasterer. Because even in chaos, even under pressure, I get things done. I am no different to every single person here in this constituency. I work hard. That’s what we do. Except t",https://www.reddit.com/r/WorkReform/comments/1rgq44c/uk_green_party_is_starting_to_take_out_the_trash/,587,7,kevinmrr,2026-02-27,no savings,LEVEL_1_AWARE
WorkReform,1rgd3lb,Company asked for free work disguised as an assignment,"I’m not sure if I’m overreacting or if this is just the new normal. I applied for a role that listed a salary range of $75k-$95k. First two interviews were standard. Recruiter screen, then hiring manager. Both conversations were normal, nothing weird. After the second call they said they’d like me t",https://www.reddit.com/r/WorkReform/comments/1rgd3lb/company_asked_for_free_work_disguised_as_an/,348,46,Weary-Hair-316,2026-02-27,no savings,LEVEL_1_AWARE
WorkReform,1rk54l9,"Why aren't workers united, I see more infighting and middle managers making jobs hell for coworkers and underlings. Doing the bidding of execs to get more productivity with less headcount. Why arent fellow wage earners protecting coworkers and direct reports? Crabs in a barrel, pulling wagies down.","The powers and incentives are so screwed. On the news you see 99.9% of the effort companies use to drive wages and human labour down to $0.01 an hour.

You see this in H1-B abuse replacing US citizens for 50% wages. AI electrical compute is the next big deflation to wages.
Pay $0.01 per hour in elec",https://www.reddit.com/r/WorkReform/comments/1rk54l9/why_arent_workers_united_i_see_more_infighting/,136,18,Zestyclose-Lock2022,2026-03-03,no savings,LEVEL_1_AWARE
WorkReform,1rxtbnz,Can someone help me understand why an employer tries to force hard working employees to quit?,"Ive been working home health for 4 years now. This year I have been having daily case loads of 10+ people a day, at first I thought it was due to staffing shortage exempt no one else is getting loaded up as much as I am except one other person. There are nurses working part time for my company that ",https://www.reddit.com/r/WorkReform/comments/1rxtbnz/can_someone_help_me_understand_why_an_employer/,53,15,mikmikismikmik,2026-03-19,no savings,LEVEL_1_AWARE
WorkReform,1rj3f8w,"Why does the gov't have a bogus caveat tied to its paid parental leave ""benefit""?",The paid parental leave currently offered to the federal workforce became available to federal employees under Trump in 2019. The government considers this paid parental leave program a benefit because the employee can use it as a substitute for unpaid FMLA and continue to be paid and receive benefi,https://www.reddit.com/r/WorkReform/comments/1rj3f8w/why_does_the_govt_have_a_bogus_caveat_tied_to_its/,43,9,WhereztheBleepnLight,2026-03-02,no savings,LEVEL_1_AWARE
povertyfinance,1rmmqox,Another example refuting the saying “money can’t buy happiness”,"Me and my husband saw the writing on the wall and fled Texas a few years ago to come to New England. We had to take out loans, but it was a now or never situation. We knew if we didn’t leave when we could then we’d be stuck in Texas, and being a visibly queer couple we feared for our safety in the f",https://www.reddit.com/r/povertyfinance/comments/1rmmqox/another_example_refuting_the_saying_money_cant/,1380,78,Doctorspiper,2026-03-06,paycheck to paycheck,LEVEL_1_AWARE
povertyfinance,1rz2308,"I just got my first bank account, and I work at Starbucks for 15 an hour. What do you wish you were told when you got your bank account?","Like I said, I just opened my first bank account. It's a regular checking account and I don't have credit (and god, I do not want a credit card.) I don't know exactly how much my paychecks at Starbucks are yet since I haven't gotten my first paycheck, but I know I make 15.25 an hour and usually work",https://www.reddit.com/r/povertyfinance/comments/1rz2308/i_just_got_my_first_bank_account_and_i_work_at/,645,209,sedentaryangel,2026-03-20,paycheck to paycheck,LEVEL_1_AWARE
povertyfinance,1rmst20,who has experienced Bitterflation?,i know i have,https://www.reddit.com/r/povertyfinance/comments/1rmst20/who_has_experienced_bitterflation/,429,111,teenagedirtbagiam,2026-03-06,paycheck to paycheck,LEVEL_1_AWARE
povertyfinance,1rbl8wa,How old are you and how much do you have saved up?,"How old are you, and how much do you have saved up? I'm almost 28, and I barely have a couple of hundred dollars to my name. I barely make above minimum wage. I'm desperately trying to find a new job. I have a $1,400 dental debt. I read somewhere that the majority of us Americans don't have any savi",https://www.reddit.com/r/povertyfinance/comments/1rbl8wa/how_old_are_you_and_how_much_do_you_have_saved_up/,322,623,tanuki_22,2026-02-22,paycheck to paycheck,LEVEL_2_STRUGGLING
povertyfinance,1rsznyo,How on earth can I transition out of poverty?????,"Greetings, all. Basically the title.

I (45m) reside in Montana and I am struggling incredibly hard financially, and I know a lot of others are out there as well, who are in the same boat.

I am just super frustrated and upset because I can't seem to catch up or get any money saved up at all, period",https://www.reddit.com/r/povertyfinance/comments/1rsznyo/how_on_earth_can_i_transition_out_of_poverty/,233,199,Derpy_paws,2026-03-13,paycheck to paycheck,LEVEL_2_STRUGGLING
povertyfinance,1s0erly,drinking water before meals to save money,"I'm trying as much as I can to stretch the money I have left for as long as I can before my paycheck hits, and I discovered that drinking a full bottle of water before a meal keeps you fuller for longer, I can only afford to have rice and beans at the moment so making that stretch with my water hack",https://www.reddit.com/r/povertyfinance/comments/1s0erly/drinking_water_before_meals_to_save_money/,212,44,breanne0_0,2026-03-22,paycheck to paycheck,LEVEL_1_AWARE
povertyfinance,1rto8of,Help on extreme temporary food budgeting/recipes (~$20 for 4 weeks),Finally moving into my own apartment the 16th from a basically homeless shelter/transitional center that was beyond crooked!  It took all my money but im here.  Landlord let me move in with only some of the 3 months rent so my next check will be finishing that off.  This has been quite the struggle.,https://www.reddit.com/r/povertyfinance/comments/1rto8of/help_on_extreme_temporary_food_budgetingrecipes/,195,167,Xxitl,2026-03-14,paycheck to paycheck,LEVEL_1_AWARE
povertyfinance,1rlqo8y,Getting paid weekly is better then biweekly,"Just curious if anyone has different opinions. This is my first time getting a job that pays weekly and it has done wonders for how I manage money. Mentally I don’t feel the need to splurge or treat myself as much because money comes in every week. And even though the paychecks are smaller, I feel l",https://www.reddit.com/r/povertyfinance/comments/1rlqo8y/getting_paid_weekly_is_better_then_biweekly/,176,97,Amazondriver23,2026-03-05,paycheck to paycheck,LEVEL_1_AWARE
povertyfinance,1rzwx0c,Hot take on using credit cards,"I see a lot of people posting on here about not using credit cards at all and only spending what you have in a bank account and I just thought I’d put it out there that I do it differently. 

For context, my income is variable. I have several food service jobs and I fluctuate between light seasons a",https://www.reddit.com/r/povertyfinance/comments/1rzwx0c/hot_take_on_using_credit_cards/,155,67,Competitive-Load6424,2026-03-21,paycheck to paycheck,LEVEL_2_STRUGGLING
povertyfinance,1rum87p,I'm 76 and feeling like a failure.,"I've worked since I was 16, put myself through college and grad school, started my own social service niche job at 45, which provided me with a decent income of 80k+ for 25 years. But I was an idiot. I never saved. I never went on vacations. I never took time off. I never invested. It never felt I h",https://www.reddit.com/r/povertyfinance/comments/1rum87p/im_76_and_feeling_like_a_failure/,2054,167,Designer-File-1755,2026-03-15,can't afford food,LEVEL_1_AWARE
povertyfinance,1rsrdnb,I am at the point where I tempted to shoplift to be able to provide the basic necessities to my daughter,"obviously I'm not going to, because the last thing I need a criminal record, but I am struggling. I make ""too much"" for SNAP, TANF or low income housing benefits. my daughter's biological father is in jail for assaulting a minor child, so child support is off the table until who knows when. I work a",https://www.reddit.com/r/povertyfinance/comments/1rsrdnb/i_am_at_the_point_where_i_tempted_to_shoplift_to/,1102,124,True_One7607,2026-03-13,can't afford food,LEVEL_1_AWARE
povertyfinance,1r9gbyp,Buy hummus instead of meat. Same protein but way cheaper. I encourage everyone to find more meat substitutes.,"I've been doing this for months now without realizing how important it is, but when I crave protein &amp; can't afford meat, I'll buy a little tub of hummus for $2-3 at Walmart. A pack of chicken runs $6-7 so if you want protein but can't afford it, hummus or peanut butter is fine. I'm not vegetaria",https://www.reddit.com/r/povertyfinance/comments/1r9gbyp/buy_hummus_instead_of_meat_same_protein_but_way/,608,247,BigClitMcphee,2026-02-19,can't afford food,LEVEL_1_AWARE
povertyfinance,1rrleuf,How do people survive with kids?,"I’m looking for advice or any encouragement. I’m an RN of 12 years, pay is decent. My bills are outrageous and daycare tops them all. Im single with 5 kids. I work 3-4 12 hour shifts a week. Toddlers daycare 2400/month, younger boys after care 1000/month. 50/day for teacher to pick up/drop off kids ",https://www.reddit.com/r/povertyfinance/comments/1rrleuf/how_do_people_survive_with_kids/,476,237,Ok-Ostrich-9939,2026-03-12,can't afford food,LEVEL_1_AWARE
povertyfinance,1s10en2,"Is it wrong to utilize the food bank, so you can buy other things (not food)?","I'm struggling with this.  

The way I run my budget is, I pay all my bills first, then buy all necessities like gasoline, groceries, prescriptions, etc.

I don't buy any ""extras"" until I know the necessities are covered.

So, technically...I *CAN* afford food...but not much else.

Would it be moral",https://www.reddit.com/r/povertyfinance/comments/1s10en2/is_it_wrong_to_utilize_the_food_bank_so_you_can/,124,61,joliefille1980,2026-03-22,can't afford food,LEVEL_1_AWARE
povertyfinance,1rs7rjm,"Unemployed (31m), zero income, can't get a ""real"" job right now, struggling to pay off debts. Best advice?","I'll try and keep this post as succinct as possible. I (31m, Washington State) was laid off last August, collected unemployment until it ran out and have been unemployed since then. I've also been struggling mental health wise which made job searching that much more difficult. I work in the trades a",https://www.reddit.com/r/povertyfinance/comments/1rs7rjm/unemployed_31m_zero_income_cant_get_a_real_job/,22,33,carlew,2026-03-12,can't afford food,LEVEL_2_STRUGGLING
povertyfinance,1r97nwd,My tax refund is spent before I got it,"So I filed my taxes earlier this month. I didn't want to go to file my taxes to find out some filed my taxes and took my refund and I desperately need the money. I have already got my state refund and on Monday, I should get my federal. But that money has already been spent before I even got it. I n",https://www.reddit.com/r/povertyfinance/comments/1r97nwd/my_tax_refund_is_spent_before_i_got_it/,19,19,TailoredGoblin99,2026-02-19,can't afford food,LEVEL_1_AWARE
povertyfinance,1ri2pzg,I need help understanding what I need to do to be able to move without becoming homeless again.,"Hey ya'll. If there is a better place to have posted this lmk. There's a lot of poverty related trauma I have and I don't feel this fits a middle class sub at all, though I am not any long abjectly in poverty. For the important info: I'm 26, single, I live in rural GA, and I make 17/hr. I work 24 ho",https://www.reddit.com/r/povertyfinance/comments/1ri2pzg/i_need_help_understanding_what_i_need_to_do_to_be/,17,32,Own_Average_5940,2026-03-01,wages not keeping up,LEVEL_1_AWARE
povertyfinance,1rnnget,I need a little guidance,"Hello all... I figured this would be a good place for me to ask for guidance / advice? This is going to be long and I apologize in advance, I just want to give a very clear picture.

I'm currently trying to figure out how to get a hold of my finances. I recently moved out of my parents house, was do",https://www.reddit.com/r/povertyfinance/comments/1rnnget/i_need_a_little_guidance/,2,8,puppiedogg,2026-03-07,wages not keeping up,LEVEL_1_AWARE
povertyfinance,1rojkat,what **reAAlly** happens when you stop paying student loans??,has anyone actually had mohela or navient feder@l or private (former sallie mae) escalate for non-payment in any recent timing? or past few years? I feel like between administration and state of economy like how many of these vendors are actually escalating to a debt collector that pursues it other ,https://www.reddit.com/r/povertyfinance/comments/1rojkat/what_reaally_happens_when_you_stop_paying_student/,0,16,siren8904,2026-03-08,wages not keeping up,LEVEL_1_AWARE
povertyfinance,1reofsa,"26, neurodivergent, can’t drive (PTSD), no transportation. I feel completely stuck","I’m 26(f) and I feel more stuck than I ever have in my life.

I’ve been trying for a long time to find some kind of sustainable online work, and I keep hitting walls. Transcription barely exists anymore or pays almost nothing. Virtual assistant work feels like it’s being replaced by AI or requires y",https://www.reddit.com/r/povertyfinance/comments/1reofsa/26_neurodivergent_cant_drive_ptsd_no/,0,38,Euphoric-Angle2904,2026-02-25,wages not keeping up,LEVEL_2_STRUGGLING
povertyfinance,1rukkif,Just bought my first box of Kleenex tissues......,"I grew up battling homelessness as a kid on and off for numerous years throughout my childhood due to my mother's mental illness. When we would get sick we used toliet tissue to wipe our noses, we never had kleenex at home unfortunately. I asked my mother why and she said ""its to expensive"". I remem",https://www.reddit.com/r/povertyfinance/comments/1rukkif/just_bought_my_first_box_of_kleenex_tissues/,1532,74,PhatPanda69699,2026-03-15,working poor,LEVEL_1_AWARE
povertyfinance,1rox910,broke and depressed and tired of people acting like those aren't connected,"The depression makes it hard to work. Can't work as much means less money. Less money means more stress. More stress makes the depression worse. Less able to work. Round and round and round. And the solution, the thing that could maybe help break the cycle, costs money I don't have because of the cy",https://www.reddit.com/r/povertyfinance/comments/1rox910/broke_and_depressed_and_tired_of_people_acting/,577,54,Ok_Detail_3987,2026-03-09,working poor,LEVEL_1_AWARE
povertyfinance,1rw69te,mental health care low income is basically nonexistent,"i make $28k a year which is too much for medicaid but not enough to actually afford anything
therapy is $120-150 per session here, even if i could afford one session i cant afford weekly which is what you need for it to work
sliding scale places all have 6+ month waitlists or they ask for proof of i",https://www.reddit.com/r/povertyfinance/comments/1rw69te/mental_health_care_low_income_is_basically/,468,130,ritik_bhai,2026-03-17,working poor,LEVEL_1_AWARE
povertyfinance,1rpic9k,"So tired of never having a ""proper"" vacation, and having it thrown at my face constantly","So.. I've mucked up a lot in my life, I guess. Currently seeing a career coach in hopes they can help. 

And one caveat, I don't know if I'd meet the bar for ""really impoverished"" here, but I sure feel like it. I live in a mediocre rust belt town, I rent a private room, use what I've heard nurses ca",https://www.reddit.com/r/povertyfinance/comments/1rpic9k/so_tired_of_never_having_a_proper_vacation_and/,175,50,neverfakemaplesyrup,2026-03-09,working poor,LEVEL_2_STRUGGLING
povertyfinance,1rgnrg9,What am I even working for?,"I don’t want to hear it gets better it’s been 20 years shut up.

I’m so tired of working for nothing. Working for barely any pay to sustain myself or live a good life. If this is what the rest of my life holds I keep wondering why bother. I’m exhausted being poor is exhausting. What is the point of ",https://www.reddit.com/r/povertyfinance/comments/1rgnrg9/what_am_i_even_working_for/,85,50,BoredBatWoman22,2026-02-27,working poor,LEVEL_1_AWARE
