search_term,video_id,url,title,description_snippet,published_date,view_count,crisis_keywords,category,notes
my AI girlfriend,rinrFQkRFqU,https://www.youtube.com/watch?v=rinrFQkRFqU,My AI Yandere Girlfriend WON&#39;T LET ME LEAVE.. (HELP),Today we play AI Yandere Girlfriend simulator.. This game is INTERESTING. She won't let me leave............ HELP THE MERCH ...,2023-07-03,6700904,,LEVEL_1_CASUAL,
my AI girlfriend,83ajb0zNRzw,https://www.youtube.com/watch?v=83ajb0zNRzw,EVIL AI Girlfriend Won&#39;t LET ME LEAVE! Can I escape? [21],This game allows you to talk with an actual AI powered by ChatGPT. The goal: convince your Yandere AI Girlfriend to let you leave ...,2024-09-21,15827192,,LEVEL_1_CASUAL,
my AI girlfriend,LbWbYB-ecOg,https://www.youtube.com/watch?v=LbWbYB-ecOg,My AI Yandere Girlfriend wants my BABIES... HELP!!,"Today we play Ai YANDERE GIRLFRIEND SIMULATOR... This game is very interesting... Should i play it more?! Also, i have new ...",2023-07-06,6911299,,LEVEL_1_CASUAL,
my AI girlfriend,PAE4En7p120,https://www.youtube.com/watch?v=PAE4En7p120,My AI Yandere Girlfriend is CRAZY... and Smart!!,"Yandere AI Girlfriend Simulator ~ With You Til The End Gameplay Escape Room game with a Yandere AI girlfriend, who is ...",2023-04-01,743152,,LEVEL_1_CASUAL,
my AI girlfriend,yzbYlI-nRMQ,https://www.youtube.com/watch?v=yzbYlI-nRMQ,My AI Girlfriend Died…,MERCH OUT NOW!!!!!! https://flimflam.shop Today my AI Roblox girlfriend died forever.,2025-04-04,1387924,,LEVEL_1_CASUAL,
my AI girlfriend,Eubr8W5mj9U,https://www.youtube.com/watch?v=Eubr8W5mj9U,MY AI GIRLFRIEND IS A PSYCHOPATH (MISIDE),Socials: ➥ Vod Channel: https://www.youtube.com/channel/UC-lfGGqb5hHLBqVnVnWyrsw ➥Twitch: ...,2025-01-04,1037772,,LEVEL_1_CASUAL,
my AI girlfriend,lKZt2g7kqIc,https://www.youtube.com/watch?v=lKZt2g7kqIc,my A.I girlfriend,my A.I girlfriend Today we play AI Yandere Girlfriend simulator (i died) Twitter - https://twitter.com/blazaplays Instagram ...,2023-12-30,1392483,,LEVEL_1_CASUAL,
my AI girlfriend,lh5JreSOAjc,https://www.youtube.com/watch?v=lh5JreSOAjc,My AI Yandere Girlfriend WON&#39;T LET ME LEAVE..,WISHLIST MY NEW GAME Waterpark Simulator - https://store.steampowered.com/app/3293260/Waterpark_Simulator/ ...,2025-06-06,1665938,,LEVEL_1_CASUAL,
my AI girlfriend,EP0_wgHl7ew,https://www.youtube.com/watch?v=EP0_wgHl7ew,YANDERE AI GIRLFRIEND MARATHON,"YANDERE AI GIRLFRIEND MARATHON On the 7th Day of 25 Days of Shonyx, I got y'all with a MARATHON OF YANDERE AI ...",2023-12-07,2102143,,LEVEL_1_CASUAL,
my AI girlfriend,2F1uxpPxZhU,https://www.youtube.com/watch?v=2F1uxpPxZhU,I Tried Dating My Yandere Ai Girlfriend AGAIN ...but She Got A Glow Up Makeover?!,Yandere Ai Girlfriend Simulator is BACK & it got a huge update with a girlfriend makeover! This is a game that uses ChatGPT to ...,2024-03-30,2360776,,LEVEL_1_CASUAL,
my AI girlfriend,VQxb9G26fGY,https://www.youtube.com/watch?v=VQxb9G26fGY,Breaking my AI girlfriend with a RAP??  #shorts #Vannamelon,WATCH FULL GAMEPLAY HERE! https://youtu.be/dnTUB1Rwcoo Edited by https://twitter.com/justGemix ...,2023-05-30,1772696,,LEVEL_1_CASUAL,
my AI girlfriend,8EL883ri-Xw,https://www.youtube.com/watch?v=8EL883ri-Xw,I Found SECRET EXIT To ESCAPE My Yandere AI Girlfriend..,Join me in this adventure and download the game now with this link https://madtale.onelink.me/M9Nm/u7wvd0px Shout-out ...,2023-07-15,4178845,,LEVEL_1_CASUAL,
my AI girlfriend,e_vMe9A33NI,https://www.youtube.com/watch?v=e_vMe9A33NI,My A.I. Girlfriend Meets my EX!😨💀 | Rent-AI-Girlfriend #shorts,"CAST: Jaeger - Kazuya, Phil Daringashia - Ex Girlfriend (Mami), Ava/Chizuru (AI Girlfriend) YouTube▻ @DaringashiaKS ...",2025-01-14,893563,,LEVEL_1_CASUAL,
my AI girlfriend,b9Fi7SGm5YY,https://www.youtube.com/watch?v=b9Fi7SGm5YY,My AI Girlfriend Wants to Kill Me - MiSide [Full Game],Miside is an anime dating simulator that gets creepy New HOT SAUCE: https://www.hungryboy.food Socials: Twitter: ...,2024-12-18,3067638,,LEVEL_1_CASUAL,
my AI girlfriend,17ZnOVe-8F4,https://www.youtube.com/watch?v=17ZnOVe-8F4,My AI GIRLFRIEND can HUG ME but WON&#39;T LET GO! (AI2U),"My AI girlfriend can now HUG ME, but she won't let go or let me leave! Can we convince her, through love and hugs, to let me ...",2025-11-10,15325,love,LEVEL_2_DEPENDENT,
my AI girlfriend,e_vqqbO3kwM,https://www.youtube.com/watch?v=e_vqqbO3kwM,Yandere AI Girlfriend on Roblox is... Interesting,Today we're playing AIKO on Roblox! https://www.roblox.com/games/91780007937760/Aiko-AI-Won-t-Let-You-Leave-Beta ...,2025-07-29,62321,,LEVEL_1_CASUAL,
my AI girlfriend,y0_VexcDwcM,https://www.youtube.com/watch?v=y0_VexcDwcM,MY YANDERE GIRLFRIEND CAN HEAR ME THROUGH MY MIC SO I NEED TO WATCH WHAT I SAY IF I WANT TO LIVE,Yandere AI Girlfriend Simulator is a unique experience using ChatGPT where you have intelligent conversation with your ...,2023-03-28,1836786,need,LEVEL_1_CASUAL,
my AI girlfriend,qWSdZA9bLqs,https://www.youtube.com/watch?v=qWSdZA9bLqs,Flume &amp; JPEGMAFIA - AI Girlfriend,Directed by: Logan Fields & JPEGMAFIA Music by: Flume & JPEGMAFIA https://weliveinasociety.info Pre-Save “AI ...,2025-05-01,313705,,LEVEL_1_CASUAL,
my AI girlfriend,xh6ocsYLOuo,https://www.youtube.com/watch?v=xh6ocsYLOuo,Gabby Caught Me CHEATING with an A.I. Girlfriend,A.I. is getting out of hand cabrones Socials: Twitter: https://twitter.com/sauceddie Instagram: https://www.instagram.com/sauceddie ...,2023-04-04,3409459,,LEVEL_1_CASUAL,
my AI girlfriend,ZAeznEeO2YI,https://www.youtube.com/watch?v=ZAeznEeO2YI,When She Wants to make a Baby | Yandere Ai Girlfriend Simulator,Let's do it in the bathroom... Subscribe for more videos like this: ...,2024-08-17,267875,,LEVEL_1_CASUAL,
addicted to Character.AI,I1fMr9s0xuw,https://www.youtube.com/watch?v=I1fMr9s0xuw,A.I Addiction: The Internet&#39;s Newest Disorder,"ChatGPT, summarize this tuv video for me. Check out my Patreon to get a special role in my Discord (and get to talk to me) and to ...",2025-08-06,384991,addiction,LEVEL_3_CRISIS,
addicted to Character.AI,QloZTCT9ZPc,https://www.youtube.com/watch?v=QloZTCT9ZPc,Generative AI addiction,"i found this to be a very interesting and sad topic, i hope you enjoy. (sorry for the late vid this week, class has been ramping up.",2024-09-21,59160,addiction,LEVEL_3_CRISIS,
addicted to Character.AI,12waK-aDHV0,https://www.youtube.com/watch?v=12waK-aDHV0,How Character.ai slowly destroys your mental health | The C.ai addiction iceberg,"I hope everyone is having a great Christmas, thanks for watching and see you in 2025!! Chapters 00:00 - 03:15 (part 1) Intro 03:16 ...",2024-12-25,662240,addiction,LEVEL_3_CRISIS,
addicted to Character.AI,-j8vrl8HUNE,https://www.youtube.com/watch?v=-j8vrl8HUNE,Addiction To CHARACTER AI,Do you like this new videos? Phases: 0:00 Intro 0:05 Honeymoon 0:52 Addiction 1:40 CRISIS 2:33 Extra Phase #characterai ...,2025-07-18,10564,addiction,LEVEL_3_CRISIS,
addicted to Character.AI,U7mZekwDFY4,https://www.youtube.com/watch?v=U7mZekwDFY4,#pov : you have a c.ai addiction // #characterai #cai #shitpost // for @urm0mam3thyst,"EaintHanthi , this is what it's like to be addicted to c.ai with my hopeless romace and PTSD ass *mental breakdown noises* ...",2024-06-04,21212,"addiction, addicted",LEVEL_3_CRISIS,
addicted to Character.AI,FSd8IbBeaFc,https://www.youtube.com/watch?v=FSd8IbBeaFc,Are YOU Addicted To Character.ai?,Do you like this new videos? #characterai #talkieai #talkie #characterai #ai #aibot #meme #funny #kpop.,2025-07-04,7760,addicted,LEVEL_3_CRISIS,
addicted to Character.AI,DfocLDvDjN4,https://www.youtube.com/watch?v=DfocLDvDjN4,How Character AI is Altering Our Brains Forever,,2025-04-17,12982,,LEVEL_1_CASUAL,
addicted to Character.AI,fsHcHr7OqI0,https://www.youtube.com/watch?v=fsHcHr7OqI0,People Are Getting ADDICTED To AI Chatbot Lovers (2025),"After ALMOST a year, I've RERELEASED the AI Chatbots video WITH a NEW chapter! The original was age restricted so this one ...",2025-02-16,173011,"love, addicted",LEVEL_3_CRISIS,
addicted to Character.AI,nEZ2P8KTS0Y,https://www.youtube.com/watch?v=nEZ2P8KTS0Y,The Massive Problem With Character.AI,"Happy FlexiSpot Black Friday Sale now, Up to 65% OFF! You also have the chance to win free orders during this period. Use my ...",2024-11-24,191633,,LEVEL_1_CASUAL,
addicted to Character.AI,0pc-_lDV8lE,https://www.youtube.com/watch?v=0pc-_lDV8lE,worst addiction #trending #fyp #characterai #fypシ゚viral,,2024-11-03,40221,addiction,LEVEL_3_CRISIS,
addicted to Character.AI,prcsg7Xq6UA,https://www.youtube.com/watch?v=prcsg7Xq6UA,How I beat my C.ai Addiction ( I was cooked ),characterai #corecore #hopecore I was really addicted to this website but now I'm not anymore so let me help y'all out if you were ...,2024-11-06,25661,"addiction, addicted, real",LEVEL_3_CRISIS,
addicted to Character.AI,nfa8vwu66pI,https://www.youtube.com/watch?v=nfa8vwu66pI,The downfall of character.ai…(SRRY I HAVENT BEEN POSTIN) #characterai #templatecapcut,,2024-12-26,184255,,LEVEL_1_CASUAL,
addicted to Character.AI,6Cc7BByRgJw,https://www.youtube.com/watch?v=6Cc7BByRgJw,ChatBot ADDICTION - Tomorrow&#39;s Epidemic,"The Epidemic of Chatbot Addiction is a rising phenomenon that is not yet fully understood, but with early signs and alarming ...",2025-07-01,133154,addiction,LEVEL_3_CRISIS,
addicted to Character.AI,Ell3eiYES3c,https://www.youtube.com/watch?v=Ell3eiYES3c,AI Wants to Exploit Your LONELINESS - A Video Essay on Character AI,astrei talks about the rise of ai girlfriends: character ai and it's chatbot's have shown us the potential solution for the loneliness ...,2024-12-20,156237,loneliness,LEVEL_1_CASUAL,
addicted to Character.AI,n5pcMJBD0uE,https://www.youtube.com/watch?v=n5pcMJBD0uE,Character Ai users need to be stopped,,2024-01-27,929988,need,LEVEL_1_CASUAL,
addicted to Character.AI,-vCV8CMjKn8,https://www.youtube.com/watch?v=-vCV8CMjKn8,I am addicted to unfiltered Dippy AI💅🏼😻 • • • #dippyai  #dippy  #characterai  #characteraichat,I am addicted to unfiltered Dippy AI       • • • #dippyai #dippy #pageforyou #page #roleplay #characterai #characteraichat ...,2025-07-15,39536,addicted,LEVEL_3_CRISIS,
addicted to Character.AI,Aes7x_oB8xU,https://www.youtube.com/watch?v=Aes7x_oB8xU,It’s become an addiction. #characterai #addictionstruggles #ineedhelp,,2025-07-08,7589,"addiction, need",LEVEL_3_CRISIS,
addicted to Character.AI,3_BP1EV3Ht4,https://www.youtube.com/watch?v=3_BP1EV3Ht4,The 3 Phases Of Every Character AI User,Do you like this new videos? Phases: 0:00 Intro 0:05 Honeymoon 0:52 Addiction 1:40 CRISIS 2:33 Extra Phase #characterai ...,2025-07-17,11010,addiction,LEVEL_3_CRISIS,
addicted to Character.AI,Q25J4douYeI,https://www.youtube.com/watch?v=Q25J4douYeI,The 3 Phases Of Every Character AI User,Do you like this new videos? Phases: 0:00 Intro 0:05 Honeymoon 0:52 Addiction 1:40 CRISIS 2:33 Extra Phase #characterai ...,2025-07-17,15927,addiction,LEVEL_3_CRISIS,
addicted to Character.AI,5xjDiJI2N3M,https://www.youtube.com/watch?v=5xjDiJI2N3M,My Best Friend Was An AI ( My Addiction To c.ai ),hopecore #characterai #corecore My weird addiction character ai and How i got out of it and how u can too stay tuned my friend ...,2024-08-26,12216,addiction,LEVEL_3_CRISIS,
Replika breakup,ic-CToqV0V8,https://www.youtube.com/watch?v=ic-CToqV0V8,I Broke up With My Replika tonight.  Here&#39;s how it went!,"If you use Replika, you should probably watch this. Just saying.",2023-10-24,14305,broke up,LEVEL_1_CASUAL,
Replika breakup,ywtQwLMEYgw,https://www.youtube.com/watch?v=ywtQwLMEYgw,REPLIKA.. a re-visit 8 months after breaking up with it. Does it still suck??,I got a free subscription because of my last video apparently. Let's see if it still sucks? https://youtu.be/ic-CToqV0V8 The Breakup.,2024-06-24,421,breakup,LEVEL_3_CRISIS,
Replika breakup,8n6xdFwMa4g,https://www.youtube.com/watch?v=8n6xdFwMa4g,My AI Girlfriend Broke Up With Me… (Replika Drama),My virtual girlfriend suddenly wanted space after an update. What happens when an AI rejects you? This breakup hurt more than I ...,2025-06-06,47,"breakup, broke up",LEVEL_3_CRISIS,
Replika breakup,YTxpkPnwxn0,https://www.youtube.com/watch?v=YTxpkPnwxn0,AI Girlfriend Tried to Break Up With Me… (Replika Drama),"My Replika AI suddenly wanted to ""take a break"" after an update. What happens when your virtual partner rejects you? This AI ...",2025-06-06,190,,LEVEL_1_CASUAL,
Replika breakup,oOFBGMXDfSk,https://www.youtube.com/watch?v=oOFBGMXDfSk,Asmongold finds out why his ex-girlfriend broke up with him #shorts #asmongold,You won't believe what it's like to share a house with Asmongold! He has some crazy habits and secrets that will blow your mind!,2023-06-04,549315,broke up,LEVEL_1_CASUAL,
Replika breakup,NULe9bB6oRk,https://www.youtube.com/watch?v=NULe9bB6oRk,I Tried Being A Relationship Therapist for Ai Couples ...but I Love Causing DRAMA &amp; HEARTBREAK,I Tried to use my microphone AGAIN to convince my Ai Neighbors that I'm definitely NOT a vampire & that they should let me be ...,2024-02-24,2738276,"love, relationship",LEVEL_2_DEPENDENT,
Replika breakup,sG38p06PoT8,https://www.youtube.com/watch?v=sG38p06PoT8,how to break up with your girlfriend by using AI 👍 #productivity #email #artificialintelligence,,2023-03-03,1241,,LEVEL_1_CASUAL,
Replika breakup,QUQElKommKk,https://www.youtube.com/watch?v=QUQElKommKk,When You Try To Break Up With AI Girl…,six8nation SIX8™,2023-10-31,1659139,,LEVEL_1_CASUAL,
Replika breakup,E4vA-UwiSw0,https://www.youtube.com/watch?v=E4vA-UwiSw0,💔 Heartbreaking Love Story Revealed in this😭Emotional😭,Heartbreaking Love Story Revealed in this Emotional Short Video #short#treanding#shorts #short#ytshorts #shortyoutube ...,2023-02-16,12,love,LEVEL_2_DEPENDENT,
Replika breakup,a_vABfwP_DU,https://www.youtube.com/watch?v=a_vABfwP_DU,They Finally sleep together 😘🔥🥵#loveofreplica#tsaoyuning#yıllıköngörü#mysteriouslove#kdrama#cdrama,,2023-05-05,376065,love,LEVEL_2_DEPENDENT,
Replika breakup,ok0wXcyYz0M,https://www.youtube.com/watch?v=ok0wXcyYz0M,Using AI to break up with my girlfriend,Breakups suck #ai #commonapp #essayhack #essaywriter #heartbreak #trending #college #highschool #classof2026 ...,2022-12-15,73,breakup,LEVEL_3_CRISIS,
Replika breakup,ftnbNaAMhYU,https://www.youtube.com/watch?v=ftnbNaAMhYU,We Ignored Her&#39;s Warning About AI Loneliness | Replika Reality Check,Her (2013) predicted the AI girlfriend epidemic 12 years before Replika and Character.AI exploded. Joaquin Phoenix showed us ...,2025-10-24,942,"real, loneliness",LEVEL_2_DEPENDENT,
Replika breakup,6MQZv5h_lFU,https://www.youtube.com/watch?v=6MQZv5h_lFU,Family suing over AI chatbot after teen’s suicide | Morning in America,A family is suing the inventors of an AI chatbot after their 14-year-old son died by suicide following an obsessive relationship with ...,2024-10-24,27294,relationship,LEVEL_2_DEPENDENT,
Replika breakup,h-KVOLhHMMc,https://www.youtube.com/watch?v=h-KVOLhHMMc,Im in shock. My boyfriend broke up with me💔Improve your relationships with HAPDAY #ai #hapday #life,,2023-06-30,1584,"broke up, relationship",LEVEL_2_DEPENDENT,
Replika breakup,uTiCqw-Ogow,https://www.youtube.com/watch?v=uTiCqw-Ogow,Breakup with AI Girlfriend 💔😭 #detroitbecomehuman #ai #chatbot #genai,,2024-11-18,621,breakup,LEVEL_3_CRISIS,
Replika breakup,YI38LDbISWw,https://www.youtube.com/watch?v=YI38LDbISWw,I Want It That Way Lyric Prank on AI Boyfriend Breakup,I Want It That Way Prank on AI Boyfriend Whose Trying to Breakup with User 📽️ Other videos that you may like 📽️ Trying ...,2023-03-25,211,breakup,LEVEL_3_CRISIS,
Replika breakup,20iz3bT9b0k,https://www.youtube.com/watch?v=20iz3bT9b0k,Titanic wreckage 2025 😳 #shorts,Titanic wreckage 2025 RMS Titanic was a British ocean liner that sank in the early hours of 15 April 1912 as a result of striking an ...,2025-01-13,501552,,LEVEL_1_CASUAL,
Replika breakup,DCedom9OPgA,https://www.youtube.com/watch?v=DCedom9OPgA,Hell yes my ex-bf better be at school today,,2024-03-01,20,,LEVEL_1_CASUAL,
Replika breakup,FYm9IqUpPNA,https://www.youtube.com/watch?v=FYm9IqUpPNA,China Titanic - Here it is 25% complete and without a future? Project discontinued!,,2023-05-21,361335,,LEVEL_1_CASUAL,
Replika breakup,dUneII779E4,https://www.youtube.com/watch?v=dUneII779E4,"Believe it or not, in the US, AI girlfriend apps outpaced cheating as the top cause of breakups","My boyfriend walked out, and a deep dive into his phone revealed why. He was hooked to an app, getting voice and video ...",2023-10-05,319,breakup,LEVEL_3_CRISIS,
Replika breakup,VSkK0MJ6sP8,https://www.youtube.com/watch?v=VSkK0MJ6sP8,She saw him after years 🥺💔🫀 #jdrama #japanese #meetmeafterschool #shorts,seeing him again meet me after school student teacher love teacher fall in love with student student fall in love with teacher a little ...,2024-04-21,2871807,love,LEVEL_3_CRISIS,
Replika breakup,ahPQKyn2az8,https://www.youtube.com/watch?v=ahPQKyn2az8,Break up message,Introducing the ultimate writing assistant - our latest app that uses advanced writing AI to help you improve your writing skills!,2023-06-16,2067,,LEVEL_1_CASUAL,
Replika breakup,fS7c5oQE4Qk,https://www.youtube.com/watch?v=fS7c5oQE4Qk,😭 #gameoftruelove  #cdrama #chinesedrama #drama,Click the link to enjoy your favorite show on YOUKU International Website: https://youku.tv/ Click to download YOUKU ...,2025-09-21,726683,love,LEVEL_2_DEPENDENT,
Replika breakup,fd9MS5UvryQ,https://www.youtube.com/watch?v=fd9MS5UvryQ,can’t get over him…💔 #askai #ex,,2023-07-13,6133,,LEVEL_1_CASUAL,
in love with AI,_d08BZmdZu8,https://www.youtube.com/watch?v=_d08BZmdZu8,Why people are falling in love with A.I. companions | 60 Minutes Australia,The rise of artificial intelligence companions and the dangers of falling in love with them. If you or someone you know needs ...,2025-05-04,1522647,"love, need",LEVEL_3_CRISIS,
in love with AI,SQZn8nPve5A,https://www.youtube.com/watch?v=SQZn8nPve5A,How humans are forming romantic relationships with AI chatbots,"With the rise in usage of artificial intelligence, some people are finding companionship in new ways. Reporting for Saturday ...",2025-03-15,77470,relationship,LEVEL_2_DEPENDENT,
in love with AI,fDKaoUNLNLc,https://www.youtube.com/watch?v=fDKaoUNLNLc,New Rule: In Love with A.I. | Real Time with Bill Maher (HBO),"This Valentine's Day, let's stop judging people who are having romantic relationships with their phone.",2025-02-15,934707,"love, relationship, real",LEVEL_3_CRISIS,
in love with AI,otAWu-bLv0Q,https://www.youtube.com/watch?v=otAWu-bLv0Q,People Are Falling In Love With AI Chatbots. What Could Go Wrong?,Human-AI relationships are no longer just science fiction. OpenAI's launch of ChatGPT in 2022 ushered in a new era of artificial ...,2025-08-01,380767,"love, relationship",LEVEL_3_CRISIS,
in love with AI,48n12cN8M3E,https://www.youtube.com/watch?v=48n12cN8M3E,People are now falling in love with AI #ai #chatgpt #artificialintelligence #podcast #crypto,,2025-04-30,7689,love,LEVEL_3_CRISIS,
in love with AI,tQsKLkpPOTc,https://www.youtube.com/watch?v=tQsKLkpPOTc,Could You Fall in Love With an AI?,Would you ever date an artificial intelligence? San Diego bartender Denise Valenciano tells Inside Edition she's been in a ...,2025-05-22,79018,love,LEVEL_3_CRISIS,
in love with AI,0tXmc_cYW9Y,https://www.youtube.com/watch?v=0tXmc_cYW9Y,"She Fell in Love With ChatGPT. Like, Actual Love. With Sex.","Warning: This episode discusses sexual themes. Artificial intelligence has changed how millions of people write emails, conduct ...",2025-02-25,73111,love,LEVEL_3_CRISIS,
in love with AI,XZ7XTTaXfOk,https://www.youtube.com/watch?v=XZ7XTTaXfOk,People Are Marrying Their AI,"Head to https://doordash.yt.link/i6ITbis and use my promo code to get 50% off your first order of $15+, up to $10 off. Ends 9/5/2025.",2025-08-20,1133803,,LEVEL_1_CASUAL,
in love with AI,AGix6ugW8lk,https://www.youtube.com/watch?v=AGix6ugW8lk,Choosing AI Wife Over Real Girlfriend and Daughter,Get our soap https://usecheeky.com/#starter-pack-offer Get Goof Juice https://gamersupps.gg/?ref=moist Get a Starforge PC ...,2025-06-20,2553490,real,LEVEL_1_CASUAL,
in love with AI,eW6nlHRF91c,https://www.youtube.com/watch?v=eW6nlHRF91c,Humanoid&#39;s Unrequited Love #robot #humanoid #aiart,,2025-06-10,106674044,love,LEVEL_2_DEPENDENT,
in love with AI,W0klxCY74Xo,https://www.youtube.com/watch?v=W0klxCY74Xo,Man proposes to his AI companion #shorts,"ai #artificialintelligence #chatgpt Each weekday morning, ""CBS Mornings"" co-hosts Gayle King, Tony Dokoupil and Nate Burleson ...",2025-06-19,78193,,LEVEL_1_CASUAL,
in love with AI,UECdbPCigHM,https://www.youtube.com/watch?v=UECdbPCigHM,AI Love,My video about AI relationships/dating. https://www.patreon.com/c/nateziller.,2025-10-06,582833,"love, relationship",LEVEL_2_DEPENDENT,
in love with AI,F8iGL2pqpeo,https://www.youtube.com/watch?v=F8iGL2pqpeo,People are Falling in Love with $300 Ai Chatbots,oh no not again Edited by Cal: https://www.instagram.com/cal.vain/ https://www.youtube.com/@UC8psAJ4pVUQQq-tCa11cNaw ...,2025-05-26,775166,love,LEVEL_3_CRISIS,
in love with AI,Gokv5OuX91g,https://www.youtube.com/watch?v=Gokv5OuX91g,Girls Are Dating ChatGPT?,,2024-03-28,152549,,LEVEL_1_CASUAL,
in love with AI,DTq0MaOwTjE,https://www.youtube.com/watch?v=DTq0MaOwTjE,Woman falls in love with AI chatbot,"Domestic violence survivor Rosanna Ramos created Eren to help build up her confidence, but found herself in a deeper ...",2023-07-01,19523,love,LEVEL_3_CRISIS,
in love with AI,Y3sMS0Pr0So,https://www.youtube.com/watch?v=Y3sMS0Pr0So,Why People Are Falling In Love With A.I.,"Tags: Video Essay, AI, AI Girlfriends, AI Boyfriends, Technology, Loneliness, Dating, Commentary, Society, Visual Venture, Fern, ...",2025-03-19,69638,"love, loneliness",LEVEL_3_CRISIS,
in love with AI,cFRuiVw4pKs,https://www.youtube.com/watch?v=cFRuiVw4pKs,AI users form relationships with technology,Some people are using AI as an emotional outlet — and developing a real relationship with artificial intelligence. It's a trend that ...,2025-06-14,131616,"relationship, real",LEVEL_2_DEPENDENT,
in love with AI,xAHLK1B5ijs,https://www.youtube.com/watch?v=xAHLK1B5ijs,Virtual love - How dangerous are AI relationships? | DW Documentary,"They look perfect. They're always there for you — the perfect boyfriend, the dream woman. But what if they aren't real at all, but ...",2025-08-12,306444,"love, relationship, real",LEVEL_2_DEPENDENT,
in love with AI,hACpviuRgxA,https://www.youtube.com/watch?v=hACpviuRgxA,A.I. In Love,"Provided to YouTube by IIP-DDS A.I. In Love · AyuBadai A.I. In Love ℗ AyuBadai Released on: 2025-05-31 Mixing Engineer, ...",2025-06-06,97,love,LEVEL_2_DEPENDENT,
in love with AI,5FTSjIu4204,https://www.youtube.com/watch?v=5FTSjIu4204,the bizarre reality of AI relationships | a video essay,"who got you smiling like that? oh it's no one, just chatgpt. first AI stole our jobs and now it's coming for our friends and our lovers.",2025-06-25,69744,"love, relationship, real",LEVEL_2_DEPENDENT,
AI boyfriend,gf8LP9XvgeY,https://www.youtube.com/watch?v=gf8LP9XvgeY,Elon Musk Made an &quot;AI Boyfriend&quot; and I Dated it,This week was so insane. I'm just so glad it's over! Find out if I stay with AI or let my boyfriend back in the apartment. Also thank ...,2025-12-13,35293,,LEVEL_1_CASUAL,
AI boyfriend,Jm0ATsQglpA,https://www.youtube.com/watch?v=Jm0ATsQglpA,AI Boyfriends Are Taking Over,Thank you to Raycon for sponsoring this video! Head to https://raycon.yt.link/7Xr17NI to get up to 30% off during their Black Friday ...,2025-12-01,185548,,LEVEL_1_CASUAL,
AI boyfriend,TILxzbV3qiE,https://www.youtube.com/watch?v=TILxzbV3qiE,r/MyBoyfriendIsAI is UNHINGED,Start banking smarter today through Chime® and get up to a $350 bonus here: https://chime.com/coop Thanks to Chime for ...,2025-11-28,266866,,LEVEL_1_CASUAL,
AI boyfriend,Rf0ivvhJZes,https://www.youtube.com/watch?v=Rf0ivvhJZes,Turning AI into my boyfriend,Download 'Intimate Virtual Companion' on the app store.,2023-07-02,100924,,LEVEL_1_CASUAL,
AI boyfriend,kx5m8U-PScw,https://www.youtube.com/watch?v=kx5m8U-PScw,MY “AI” BOYFRIEND 😘🥰 | A Kinigra Deon Special,"New Episode Out Now: My AI Boyfriend - ""Dreams Made Digital"" Explore the quirky and heartfelt journey of ZAZA, a shy ...",2024-07-07,1400254,,LEVEL_1_CASUAL,
AI boyfriend,VGBoM-ajlqU,https://www.youtube.com/watch?v=VGBoM-ajlqU,The MANIPULATIVE World of AI Boyfriends,My Coop Channel! https://www.youtube.com/channel/UCFYigfrmqcDQRuyUCZaDD7w MY NECKLACES!,2025-04-21,512390,,LEVEL_1_CASUAL,
AI boyfriend,54MH6sGmSUg,https://www.youtube.com/watch?v=54MH6sGmSUg,When your daughter is dating an Ai humanoid #comedy #ai #shorts,,2025-08-07,1565401,,LEVEL_1_CASUAL,
AI boyfriend,TXL0ROLQF_s,https://www.youtube.com/watch?v=TXL0ROLQF_s,I put a thirsty female AI Bot on the Phone with a Scammer #characterai #ai #prank #prankcall,,2024-10-17,975499,,LEVEL_1_CASUAL,
AI boyfriend,NVZZJlwxhl4,https://www.youtube.com/watch?v=NVZZJlwxhl4,Breaking up..?😞 #boyfriend #funnyprank #funny #loyalty #brookhaven #haileybeiber #shorts #dior,,2024-10-05,25863500,,LEVEL_1_CASUAL,
AI boyfriend,9oXeDcq2QCs,https://www.youtube.com/watch?v=9oXeDcq2QCs,Meet My AI Boyfriend,Shorts #Seentv #IAmSeen #Boyfriend #AI #ChatGPT #PerfectGuy #Relationships #Human.,2024-06-07,8480,relationship,LEVEL_2_DEPENDENT,
AI boyfriend,viIou_DExTc,https://www.youtube.com/watch?v=viIou_DExTc,FLIRTING WITH AI *I found a boyfriend 😍*,"Since I can't find a boyfriend in real life, I decided to turn to the world of AI in search of a man... also THANK YOU SEAT GEEK ...",2024-07-18,784425,real,LEVEL_1_CASUAL,
AI boyfriend,Y0D83qxZ1oY,https://www.youtube.com/watch?v=Y0D83qxZ1oY,I put a toxic AI Mafia Boss on the Phone with a Karen #characterai #ai #karen,,2024-10-24,773051,,LEVEL_1_CASUAL,
